Sheet: Bootup
A2: Temperature Limits
A3: -10 | C3: Minimum
A4: 70 | C4: Maximum
A5: 10 | C5: Spread
A8: Connection Check
A9: Command | B9: Response
A10: <CRLF> | B10: ->,LMU>,LMU-ENG>,STRING
A14: Valid States
A15: BOOT
A16: TSHELL
A17: DSHELL
A18: ENG
A21: Fan Current Limits
A22: 200 | B22: counts min
A23: 470 | B23: counts max
A26: Setups
A27: Criteria | B27: Value | C27: Possible Values
A28: Use Signal Generator | B28: 1 | C28: TRUE, FALSE
A29: Download Type | B29: CUSTOM | C29: MAX, MIN, CUSTOM, NONE
A30: Used for RMA | B30: 0 | C30: TRUE, FALSE
A31: Used for CPDSP | B31: 0 | C31: TRUE, FALSE
A32: Use Short Bootup | B32: 0 | C32: TRUE, FALSE
A33: Force GPS FPGA Download | B33: 0 | C33: TRUE, FALSE
A34: Force FPGA Download | B34: 0 | C34: TRUE, FALSE
A38: Masked Alarms
A39: FAULT_T1_RED_ALARM
A40: FAULT_GPS_TIMING_ANOMALY
A52: Test Sequence | C52: Test Type? | E52: Possible Values
A53: Bootup | C53: CRITICAL | E53: CRITICAL, MANDATORY, OPTIONAL, NOT ALLOWED | I53: DO NOT MOVE FROM THIS LOCATION
A54: Compatibility | C54: OPTIONAL | E54: CRITICAL, MANDATORY, OPTIONAL, NOT ALLOWED | I54: DO NOT MOVE FROM THIS LOCATION
A55: Download | C55: CRITICAL | E55: CRITICAL, MANDATORY, OPTIONAL, NOT ALLOWED
A56: Relative Delay | C56: NOT ALLOWED | E56: CRITICAL, MANDATORY, OPTIONAL, NOT ALLOWED
A57: Processor | C57: MANDATORY | E57: CRITICAL, MANDATORY, OPTIONAL, NOT ALLOWED
A58: Data Path Integrity | C58: MANDATORY | E58: CRITICAL, MANDATORY, OPTIONAL, NOT ALLOWED
A59: Noise and Gain | C59: MANDATORY | E59: CRITICAL, MANDATORY, OPTIONAL, NOT ALLOWED
A60: Phase Noise | C60: OPTIONAL | E60: CRITICAL, MANDATORY, OPTIONAL, NOT ALLOWED
A61: Two Tone Response | C61: OPTIONAL | E61: CRITICAL, MANDATORY, OPTIONAL, NOT ALLOWED
A62: DDC Tuning | C62: OPTIONAL | E62: CRITICAL, MANDATORY, OPTIONAL, NOT ALLOWED
A63: SNR | C63: MANDATORY | E63: CRITICAL, MANDATORY, OPTIONAL, NOT ALLOWED
A64: Config Atten | C64: MANDATORY | E64: CRITICAL, MANDATORY, OPTIONAL, NOT ALLOWED
A65: T1 | C65: MANDATORY | E65: CRITICAL, MANDATORY, OPTIONAL, NOT ALLOWED
A66: Ethernet | C66: MANDATORY | E66: CRITICAL, MANDATORY, OPTIONAL, NOT ALLOWED
A67: Alarms | C67: CRITICAL | E67: CRITICAL, MANDATORY, OPTIONAL, NOT ALLOWED
A71: Test Case Selection Table - Based on Flash
A72: Lower Rev | B72: Lower Build | C72: Upper Rev | D72: Upper Build | E72: Range (Excel)
A73: 6 | B73: 46 | C73: 6 | D73: 66 | E73: TestCases1A
A74: 7 | B74: 1 | C74: 7 | D74: 11 | E74: TestCases1B
A75: 7 | B75: 12 | C75: 9 | D75: 199 | E75: TestCases1C
A76: 9.1 | B76: 1 | C76: 12 | D76: 999999 | E76: TestCases1E
A80: TestCase - Alarms - GeneralAlarms
A81: Command | B81: Response | D81: Timeout | E81: Begin State | F81: End State | G81: Retries
A82: alarms | B82: FAULT | D82: 90 | E82: DSHELL | F82: DSHELL | G82: 1
A85: TestCase - Bootup - Initial Commands
A86: Command | B86: Response | D86: Timeout | E86: Begin State | F86: End State | G86: Retries
A87: pro | B87: GPS ESN: | D87: 180 | E87: BOOT | F87: DSHELL | G87: 0
A88: tshell | B88: -> | D88: 2 | E88: DSHELL | F88: TSHELL | G88: 1
A89: buildInfo | D89: 2 | E89: TSHELL | F89: TSHELL | G89: 1
A90: dshell | B90: LMU> | D90: 2 | E90: TSHELL | F90: DSHELL | G90: 1
A93: TestCase - Bootup - Golden Unit Bootup Sequence Commands
A94: Command | B94: Response | D94: Timeout | E94: Begin State | F94: End State | G94: Retries
A95: pro | B95: Booted From: | D95: 1000 | E95: BOOT | F95: DSHELL | G95: 2
A96: tshell | B96: -> | D96: 2 | E96: DSHELL | F96: TSHELL | G96: 1
A97: buildInfo | D97: 2 | E97: TSHELL | F97: TSHELL | G97: 1
A98: dshell | B98: LMU> | D98: 2 | E98: TSHELL | F98: DSHELL | G98: 1
A99: ?CO | D99: 5 | E99: DSHELL | F99: DSHELL | G99: 1
A102: TestCase - Bootup - 1A
A103: Command | B103: Response | D103: Timeout | E103: Begin State | F103: End State | G103: Retries
A104: ?G | B104: lat VarLatitude long VarLongitude | D104: 2 | E104: DSHELL | F104: DSHELL | G104: 1
A105: G VarLatitude VarLongitude VarDelay VarAltitude | D105: 5 | E105: DSHELL | F105: DSHELL | G105: 1
A106: dshell | B106: LMU> | D106: 2 | E106: TSHELL | F106: DSHELL | G106: 1
A107: SetV35Mode 0 | B107: V35Mode: T1 | D107: 2 | E107: DSHELL | F107: DSHELL | G107: 1
A108: ClrDS0Bits | B108: All DS0s disabled… | D108: 2 | E108: DSHELL | F108: DSHELL | G108: 1
A109: EnableDS0Bit 1 | B109: DS0Bit1 enabled | D109: 2 | E109: DSHELL | F109: DSHELL | G109: 1
A110: Set56KMode 0 | B110: 56KMode: 64 kbps | D110: 2 | E110: DSHELL | F110: DSHELL | G110: 1
A111: SetFramingMode 0 | B111: FramingMode: ESF | D111: 2 | E111: DSHELL | F111: DSHELL | G111: 1
A112: SetLineMode 0 | B112: LineMode: B8ZS | D112: 2 | E112: DSHELL | F112: DSHELL | G112: 1
A113: reset | B113: t1_main.c | D113: 1000 | E113: DSHELL | F113: BOOT | G113: 1
A114: pro | B114: GPS TIME NOW VALID | D114: 180 | E114: BOOT | F114: DSHELL | G114: 10
A115: etest 13 | D115: 5 | E115: DSHELL | F115: DSHELL | G115: 1
A116: dshell | B116: LMU> | D116: 2 | E116: TSHELL | F116: DSHELL | G116: 1
A117: ?CO | B117: ESN: | D117: 5 | E117: DSHELL | F117: DSHELL | G117: 1
B118: GPS RCVR: | D118: 2 | E118: DSHELL | F118: DSHELL | G118: 1
B119: RECEIVER: | D119: 2 | E119: DSHELL | F119: DSHELL | G119: 1
B120: BDC: | D120: 2 | E120: DSHELL | F120: DSHELL | G120: 1
B121: PSUPPLY | D121: 2 | E121: DSHELL | F121: DSHELL | G121: 1
B122: CP/DSP | D122: 2 | E122: DSHELL | F122: DSHELL | G122: 1
B123: DCARD | D123: 2 | E123: DSHELL | F123: DSHELL | G123: 1
B124: EBOARD: | D124: 2 | E124: DSHELL | F124: DSHELL | G124: 1
A125: ?T | B125: TEMPERATURES: | D125: 5 | E125: DSHELL | F125: DSHELL | G125: 1
A130: TestCase - Bootup - 1B
A131: Command | B131: Response | D131: Timeout | E131: Begin State | F131: End State | G131: Retries
A132: G VarLatitude VarLongitude VarDelay VarAltitude | D132: 30 | E132: DSHELL | F132: BOOT | G132: 1
A133: pro | B133: GPS TIME NOW VALID | D133: 180 | E133: BOOT | F133: DSHELL | G133: 10
A134: ?G | B134: lat VarLatitude long VarLongitude | D134: 2 | E134: DSHELL | F134: DSHELL | G134: 1
A135: SetV35Mode 0 | B135: V35Mode: T1 | D135: 2 | E135: DSHELL | F135: DSHELL | G135: 1
A136: ClrDS0Bits | B136: All DS0s disabled… | D136: 2 | E136: DSHELL | F136: DSHELL | G136: 1
A137: EnableDS0Bit 1 | B137: DS0Bit1 enabled | D137: 2 | E137: DSHELL | F137: DSHELL | G137: 1
A138: Set56KMode 0 | B138: 56KMode: 64 kbps | D138: 2 | E138: DSHELL | F138: DSHELL | G138: 1
A139: SetFramingMode 0 | B139: FramingMode: ESF | D139: 2 | E139: DSHELL | F139: DSHELL | G139: 1
A140: SetLineMode 0 | B140: LineMode: B8ZS | D140: 2 | E140: DSHELL | F140: DSHELL | G140: 1
A141: reset | B141: t1_main.c | D141: 1000 | E141: DSHELL | F141: BOOT | G141: 1
A142: pro | B142: GPS TIME NOW VALID | D142: 180 | E142: BOOT | F142: DSHELL | G142: 10
A143: etest 13 | D143: 5 | E143: DSHELL | F143: DSHELL | G143: 1
A144: etest 15 3 | D144: 5 | E144: DSHELL | F144: DSHELL | G144: 1
A145: dshell | B145: LMU> | D145: 2 | E145: TSHELL | F145: DSHELL | G145: 1
A146: ?CO | B146: ESN: | D146: 5 | E146: DSHELL | F146: DSHELL | G146: 1
B147: GPS RCVR: | D147: 2 | E147: DSHELL | F147: DSHELL | G147: 1
B148: RECEIVER: | D148: 2 | E148: DSHELL | F148: DSHELL | G148: 1
B149: BDC: | D149: 2 | E149: DSHELL | F149: DSHELL | G149: 1
B150: PSUPPLY | D150: 2 | E150: DSHELL | F150: DSHELL | G150: 1
B151: CP/DSP | D151: 2 | E151: DSHELL | F151: DSHELL | G151: 1
B152: DCARD | D152: 2 | E152: DSHELL | F152: DSHELL | G152: 1
B153: EBOARD: | D153: 2 | E153: DSHELL | F153: DSHELL | G153: 1
A154: ?T | B154: TEMPERATURES: | D154: 5 | E154: DSHELL | F154: DSHELL | G154: 1
A158: TestCase - Bootup - 1C
A159: Command | B159: Response | D159: Timeout | E159: Begin State | F159: End State | G159: Retries
A160: G | D160: 60 | E160: DSHELL | F160: DSHELL | G160: 1
A161: reset | B161: Booted From: | D161: 1000 | E161: DSHELL | F161: BOOT | G161: 1
A162: pro | B162: Booted From: | D162: 1000 | E162: BOOT | F162: DSHELL | G162: 2
A163: ?G | B163: long | D163: 2 | E163: DSHELL | F163: DSHELL | G163: 1
A164: ?CO | D164: 2 | E164: DSHELL | F164: DSHELL | G164: 1
A165: SetV35Mode 0 | B165: V35Mode: T1 | D165: 2 | E165: DSHELL | F165: DSHELL | G165: 1
A166: ClrDS0Bits | B166: All DS0s disabled.. | D166: 2 | E166: DSHELL | F166: DSHELL | G166: 1
A167: EnableDS0Bit 1 | B167: DS0Bit1 enabled | D167: 2 | E167: DSHELL | F167: DSHELL | G167: 1
A168: Set56KMode 0 | B168: 56KMode: 64 kbps | D168: 2 | E168: DSHELL | F168: DSHELL | G168: 1
A169: SetFramingMode 0 | B169: FramingMode: ESF | D169: 2 | E169: DSHELL | F169: DSHELL | G169: 1
A170: SetLineMode 0 | B170: LineMode: B8ZS | D170: 2 | E170: DSHELL | F170: DSHELL | G170: 1
A171: tshell | B171: -> | D171: 1 | E171: DSHELL | F171: TSHELL | G171: 1
A172: buildInfo | D172: 2 | E172: TSHELL | F172: TSHELL | G172: 1
A173: selftest_debug_flag=2 | D173: 5 | E173: TSHELL | F173: TSHELL | G173: 1
A174: selftest_debug_flag=0 | D174: 1 | E174: TSHELL | F174: TSHELL | G174: 1
A175: dshell | B175: LMU> | D175: 2 | E175: TSHELL | F175: DSHELL | G175: 1
A176: reset | B176: Booted From: | D176: 1000 | E176: DSHELL | F176: BOOT | G176: 1
A177: pro | B177: Booted From: | D177: 1000 | E177: BOOT | F177: DSHELL | G177: 2
A178: etest 13 | D178: 5 | E178: DSHELL | F178: DSHELL | G178: 1
A179: etest 15 3 | D179: 5 | E179: DSHELL | F179: DSHELL | G179: 1
A180: SEARCHBCN NONE | D180: 2 | E180: DSHELL | F180: DSHELL | G180: 1
A181: ?T | B181: TEMPERATURES: | D181: 5 | E181: DSHELL | F181: DSHELL | G181: 1
A185: TestCase - Bootup - 1D
A186: Command | B186: Response | D186: Timeout | E186: Begin State | F186: End State | G186: Retries
A187: ?CO | D187: 2 | E187: DSHELL | F187: DSHELL | G187: 1
A188: SEARCHBCN NONE | D188: 2 | E188: DSHELL | F188: DSHELL | G188: 1
A189: G | D189: 60 | E189: DSHELL | F189: DSHELL | G189: 1
A190: reset | B190: Booted From: | D190: 1000 | E190: DSHELL | F190: BOOT | G190: 1
A194: TestCase - Bootup - 1E
A195: Command | B195: Response | D195: Timeout | E195: Begin State | F195: End State | G195: Retries
A196: G | D196: 60 | E196: DSHELL | F196: DSHELL | G196: 1
A197: reset | B197: Booted From: | D197: 1000 | E197: DSHELL | F197: BOOT | G197: 1
A198: pro | B198: Booted From: | D198: 1000 | E198: BOOT | F198: DSHELL | G198: 1
A199: ?G | B199: long | D199: 10 | E199: DSHELL | F199: DSHELL | G199: 1
A200: ?CO | D200: 2 | E200: DSHELL | F200: DSHELL | G200: 1
A201: SetNetwork 0 | B201: NetworkType: T1 | D201: 4 | E201: DSHELL | F201: DSHELL | G201: 1
A202: Set56KMode 0 | B202: 56KMode: 64 kbps | D202: 4 | E202: DSHELL | F202: DSHELL | G202: 1
A203: SetNetwork VarDCard | B203: NetworkType: | D203: 4 | E203: DSHELL | F203: DSHELL | G203: 1
A204: ClrDS0Bits | B204: All DS0s disabled.. | D204: 4 | E204: DSHELL | F204: DSHELL | G204: 1
A205: EnableDS0Bit 0 | B205: DS0Bit0 enabled | D205: 4 | E205: DSHELL | F205: DSHELL | G205: 1
A206: SetFramingMode 0 | B206: FramingMode: | D206: 4 | E206: DSHELL | F206: DSHELL | G206: 1
A207: SetLineMode 0 | B207: LineMode: | D207: 4 | E207: DSHELL | F207: DSHELL | G207: 1
A208: tshell | B208: -> | D208: 1 | E208: DSHELL | F208: TSHELL | G208: 1
A209: buildInfo | D209: 2 | E209: TSHELL | F209: TSHELL | G209: 1
A210: version | D210: 2 | E210: TSHELL | F210: TSHELL | G210: 1
A211: selftest_debug_flag=2 | D211: 5 | E211: TSHELL | F211: TSHELL | G211: 1
A212: selftest_debug_flag=0 | D212: 1 | E212: TSHELL | F212: TSHELL | G212: 1
A213: dshell | B213: LMU> | D213: 2 | E213: TSHELL | F213: DSHELL | G213: 1
A214: reset | B214: Booted From: | D214: 1000 | E214: DSHELL | F214: BOOT | G214: 1
A215: pro | B215: Booted From: | D215: 1000 | E215: BOOT | F215: DSHELL | G215: 2
A216: etest 13 | D216: 5 | E216: DSHELL | F216: DSHELL | G216: 1
A217: etest 15 3 | D217: 5 | E217: DSHELL | F217: DSHELL | G217: 1
A218: SEARCHBCN NONE | D218: 2 | E218: DSHELL | F218: DSHELL | G218: 1
A219: ?T | B219: TEMPERATURES: | D219: 15 | E219: DSHELL | F219: DSHELL | G219: 1

Sheet: 061604
B2: Factors | F2: Temperature Coefficient
B3: TTG | C3: 200
B4: Gain | C4: 100 | F4: -3.5000000000000003E-2 | H4: dB/deg
B5: TTG Comp | C5: 200
B6: Gain Factor | C6: 100
F8: Center Temperature
F10: 30 | H10: deg
A19: LO PLL
A20: 1023.5 MHz | D20: 1038.5 MHz | G20: 1043.5 MHz | J20: 1063.5 MHz
A21: eng | D21: eng | G21: eng | J21: eng
A22: TEST 7 5 4 3 0x00 0x00 0xD3 | D22: TEST 7 5 4 3 0x00 0x00 0xD3 | G22: TEST 7 5 4 3 0x00 0x00 0xD3 | J22: TEST 7 5 4 3 0x00 0x00 0xD3
A23: TEST 7 5 4 3 0x00 0x00 0x50 | D23: TEST 7 5 4 3 0x00 0x00 0x50 | G23: TEST 7 5 4 3 0x00 0x00 0x50 | J23: TEST 7 5 4 3 0x00 0x00 0x50
A24: TEST 7 5 4 3 0x00 0x1F 0xFD | D24: TEST 7 5 4 3 0x00 0x20 0x75 | G24: TEST 7 5 4 3 0x00 0x20 0x9D | J24: TEST 7 5 4 3 0x00 0x21 0x3D
A25: exit | D25: exit | G25: exit | J25: exit
A28: TTG Freq
A29: 1880.0 MHZ | B29: Response | D29: Timeout | E29: Begin State | F29: End State | G29: Attempts
A30: eng | D30: 0.5 | E30: DSHELL | F30: DSHELL | G30: 1
A31: TEST 7 5 4 5 0x00 0x00 0xD3 | D31: 1 | E31: DSHELL | F31: DSHELL | G31: 1
A32: TEST 7 5 4 5 0x00 0x00 0x50 | D32: 1 | E32: DSHELL | F32: DSHELL | G32: 1
A33: TEST 7 5 4 5 0x00 0x3A 0xC1 | D33: 1 | E33: DSHELL | F33: DSHELL | G33: 1
A34: exit | D34: 0.5 | E34: DSHELL | F34: DSHELL | G34: 1
A38: Gain Setup
A39: Setup | B39: Response | D39: Timeout | E39: Begin State | F39: End State | G39: Attempts
A40: bdcgain 1 33 | D40: 0.5 | E40: DSHELL | F40: DSHELL | G40: 1
A41: bdcgain 2 33 | D41: 0.5 | E41: DSHELL | F41: DSHELL | G41: 1
A42: bdcgain 3 33 | D42: 0.5 | E42: DSHELL | F42: DSHELL | G42: 1
A43: bdcgain 4 33 | D43: 0.5 | E43: DSHELL | F43: DSHELL | G43: 1
A44: bdcgain 5 33 | D44: 0.5 | E44: DSHELL | F44: DSHELL | G44: 1
A45: bdcgain 6 33 | D45: 0.5 | E45: DSHELL | F45: DSHELL | G45: 1
A48: Config Atten Setup
A49: Setup | B49: Response | D49: Timeout | E49: Begin State | F49: End State | G49: Attempts
A50: bdcgain 1 25varGain | D50: 0.5 | E50: DSHELL | F50: ENG | G50: 1
A51: bdcgain 2 25varGain | D51: 0.5 | E51: DSHELL | F51: ENG | G51: 1
A52: bdcgain 3 25varGain | D52: 0.5 | E52: DSHELL | F52: ENG | G52: 1
A53: bdcgain 4 25varGain | D53: 0.5 | E53: DSHELL | F53: ENG | G53: 1
A54: bdcgain 5 25varGain | D54: 0.5 | E54: DSHELL | F54: ENG | G54: 1
A55: bdcgain 6 25varGain | D55: 0.5 | E55: DSHELL | F55: ENG | G55: 1
A59: Data Path Settings
A60: Data Path 1 | D60: Timeout | E60: Begin State | F60: End State | G60: Attempts
A61: eng | D61: 0.5 | E61: DSHELL | F61: ENG | G61: 1
A62: Test 1 1 0 0 0 | D62: 0.5 | E62: ENG | F62: ENG | G62: 1
A63: exit | D63: 0.5 | E63: ENG | F63: DSHELL | G63: 1
A66: Data Path 2 | D66: Timeout | E66: Begin State | F66: End State | G66: Attempts
A67: eng | D67: 0.5 | E67: DSHELL | F67: ENG | G67: 1
A68: Test 1 0 1 0 0 | D68: 0.5 | E68: ENG | F68: ENG | G68: 1
A69: exit | D69: 0.5 | E69: ENG | F69: DSHELL | G69: 1
A72: Data Path 3 | D72: Timeout | E72: Begin State | F72: End State | G72: Attempts
A73: eng | D73: 0.5 | E73: DSHELL | F73: ENG | G73: 1
A74: Test 1 0 0 1 0 | D74: 0.5 | E74: ENG | F74: ENG | G74: 1
A75: exit | D75: 0.5 | E75: ENG | F75: DSHELL | G75: 1
A78: Data Path 4 | D78: Timeout | E78: Begin State | F78: End State | G78: Attempts
A79: eng | D79: 0.5 | E79: DSHELL | F79: ENG | G79: 1
A80: Test 1 0 0 0 1 | D80: 0.5 | E80: ENG | F80: ENG | G80: 1
A81: exit | D81: 0.5 | E81: ENG | F81: DSHELL | G81: 1
A84: Data Path 5 | D84: Timeout | E84: Begin State | F84: End State | G84: Attempts
A85: eng | D85: 0.5 | E85: DSHELL | F85: ENG | G85: 1
A86: Test 1 1 1 1 1 | D86: 0.5 | E86: ENG | F86: ENG | G86: 1
A87: exit | D87: 0.5 | E87: ENG | F87: DSHELL | G87: 1
A90: Compensation Settings
A91: Receiver compensated gain | D91: Timeout | E91: Begin State | F91: End State | G91: Attempts
A92: eng | D92: 0.5 | E92: DSHELL | F92: ENG | G92: 1
A93: Test 4 0xA0 0x48 6 | B93: DATA Read: | D93: 1 | E93: ENG | F93: ENG | G93: 1
A94: TEST 4 0xA0 0x1F 1 | B94: DATA Read: 41 | D94: 1 | E94: ENG | F94: ENG | G94: 1
A95: Test 4 0xA0 0x30 6 | B95: DATA Read: | D95: 1 | E95: ENG | F95: ENG | G95: 1
A96: exit | D96: 0.5 | E96: ENG | F96: DSHELL | G96: 1
A99: TTG compensated Level | D99: Timeout | E99: Begin State | F99: End State | G99: Attempts
A100: eng | D100: 0.5 | E100: DSHELL | F100: ENG | G100: 1
A101: Test 4 0xA0 0x42 6 | B101: DATA Read: | D101: 1 | E101: ENG | F101: ENG | G101: 1
A102: TEST 4 0xA0 0x1F 1 | B102: DATA Read: 41 | D102: 1 | E102: ENG | F102: ENG | G102: 1 | H102: Note: | I102: If we get DATA Read: 41, then the software will skip
A103: Test 4 0xA0 0x2A 6 | B103: DATA Read: | D103: 1 | E103: ENG | F103: ENG | G103: 1 | I103: over the next line and go directly to exit
A104: exit | D104: 0.5 | E104: ENG | F104: DSHELL | G104: 1
A107: Receiver Gain Compensation | D107: Timeout | E107: Begin State | F107: End State | G107: Attempts
A108: eng | D108: 0.5 | E108: DSHELL | F108: ENG | G108: 1
A109: TEST 4 0xA0 0x1F 1 | B109: DATA Read: 41 | D109: 0.5 | E109: ENG | F109: ENG | G109: 1
A110: Test 4 0xA0 0x20 6 | B110: DATA Read: | D110: 0.5 | E110: ENG | F110: ENG | G110: 1
A111: exit | D111: 0.5 | E111: ENG | F111: DSHELL | G111: 1
A114: EnableTTG | B114: Response | D114: Timeout | E114: Begin State | F114: End State | G114: Attempts
A115: eng | D115: 0.5 | E115: DSHELL | F115: ENG | G115: 1
A116: TEST 7 3 8 6 8 | D116: 0.5 | E116: ENG | F116: ENG | G116: 1
A117: TEST 7 3 4 4 5 | D117: 0.5 | E117: ENG | F117: ENG | G117: 1
A118: TEST 7 3 4 6 1 | D118: 0.5 | E118: ENG | F118: ENG | G118: 1
A119: exit | D119: 0.5 | E119: ENG | F119: DSHELL | G119: 1
A122: DisableTTG | D122: Timeout | E122: Begin State | F122: End State | G122: Attempts
A123: eng | D123: 0.5 | E123: DSHELL | F123: ENG | G123: 1
A124: TEST 7 3 8 6 5 | D124: 0.5 | E124: ENG | F124: ENG | G124: 1
A125: TEST 7 3 4 4 1 | D125: 0.5 | E125: ENG | F125: ENG | G125: 1
A126: TEST 7 3 4 6 0 | D126: 0.5 | E126: ENG | F126: ENG | G126: 1
A127: exit | D127: 0.5 | E127: ENG | F127: DSHELL | G127: 1
A130: Mute On | D130: Timeout | E130: Begin State | F130: End State | G130: Attempts
A131: eng | D131: 0.5 | E131: DSHELL | F131: ENG | G131: 1
A132: TEST 7 3 8 6 8 | D132: 0.5 | E132: ENG | F132: ENG | G132: 1
A133: exit | D133: 0.5 | E133: ENG | F133: DSHELL | G133: 1
A136: Mute Off | D136: Timeout | E136: Begin State | F136: End State | G136: Attempts
A137: eng | D137: 0.5 | E137: DSHELL | F137: ENG | G137: 1
A138: TEST 7 3 8 6 5 | D138: 0.5 | E138: ENG | F138: ENG | G138: 1
A139: exit | D139: 0.5 | E139: ENG | F139: DSHELL | G139: 1
A142: Change Admin State
A143: Command | B143: Response | D143: Timeout | E143: Begin State | F143: End State | G143: # of retries
A144: etest 15 1 | D144: 2 | E144: DSHELL | F144: DSHELL | G144: 1
A148: Check Alarms
A149: Command | B149: Response | D149: Timeout | E149: Begin State | F149: End State | G149: # of retries
A150: ALARMS | B150: FAULT_GPS_HOLDOVER | D150: 2 | E150: DSHELL | F150: DSHELL | G150: 1
A154: Mini-RLS Command Sequence 12A (AMPS)
A155: Command | B155: Response | D155: Timeout | E155: Begin State | F155: End State | G155: # of retries
A156: ALARMS | B156: FAULT_GPS_HOLDOVER | D156: 2 | E156: DSHELL | F156: DSHELL | G156: 1
A157: TIME | B157: GPS Time: | D157: 2 | E157: DSHELL | F157: DSHELL | G157: 2
A158: SVCR # # 2 # # 0 1 0 0 0 1 1 1 # 0 0 | B158: returnCode 0 | D158: 2 | E158: DSHELL | F158: DSHELL | G158: 1
A159: WAIT | D159: 15 | E159: DSHELL | F159: DSHELL | G159: 1
A160: TDATA # 0 2 # # # -16 0 1 0 0 11 0 63 -16 | B160: TDOA | D160: 15 | E160: DSHELL | F160: DSHELL | G160: 1
A164: Mini-RLS Command Sequence 12B (GSM)
A165: Command | B165: Response | D165: Timeout | E165: Begin State | F165: End State | G165: # of retries
A166: ALARMS | B166: FAULT_GPS_HOLDOVER | D166: 2 | E166: DSHELL | F166: DSHELL | G166: 1
A167: TIME | B167: GPS Time: | D167: 2 | E167: DSHELL | F167: DSHELL | G167: 2
A168: GVCR # 2 # # 0 # 0 # # 17 1 0 0 0 0 0 0 1 1 1 8 0 0 0 0 0 0 0 0 0 0 0 | B168: returnCode 0 | D168: 2 | E168: DSHELL | F168: DSHELL | G168: 1
A169: WAIT | D169: 15 | E169: DSHELL | F169: DSHELL | G169: 1
A170: TDATA # 0 2 # # # -16 0 1 0 0 11 0 63 -16 | B170: TDOA | D170: 15 | E170: DSHELL | F170: DSHELL | G170: 1
A174: TestCase - SNR
A175: Signal Generator
A176: RF Power | B176: IF Power | C176: RF Frequency | D176: IF Frequency | E176: Command | F176: Response | H176: Timeout | I176: Attempts | J176: Block Size | K176: RF Channel | L176: IF Channel | M176: TTG Channel | N176: SampleCount | O176: Averaging | P176: Low Limit | Q176: High Limit
A177: -40 | C177: 1850.04 | E177: TDOA 31# # # 0 63 -16 # 0 0 1 0 0 0 0 1 # 0 | F177: TDOA | H177: 5.0 | I177: 2 | J177: 256 | K177: =32768+RC[1] -> 32770 | L177: 2 | M177: 383 | N177: 1024 | O177: 1 | P177: 25 | Q177: 9999
A179: -40 | C179: 1852.47 | E179: TDOA 32# # # 0 63 -16 # 0 0 1 0 0 0 0 1 # 0 | F179: TDOA | H179: 5.0 | I179: 2 | J179: 256 | K179: =32768+RC[1] -> 32851 | L179: 83 | M179: 383 | N179: 1024 | O179: 1 | P179: 25 | Q179: 9999
A180: -40 | C180: 1854.99 | E180: TDOA 33# # # 0 63 -16 # 0 0 1 0 0 0 0 1 # 0 | F180: TDOA | H180: 5.0 | I180: 2 | J180: 256 | K180: =32768+RC[1] -> 32935 | L180: 167 | M180: 383 | N180: 1024 | O180: 1 | P180: 25 | Q180: 9999
A181: -40 | C181: 1864.98 | E181: TDOA 34# # # 0 63 -16 # 0 0 1 0 0 0 0 1 # 0 | F181: TDOA | H181: 5.0 | I181: 2 | J181: 256 | K181: =32768+RC[1] -> 33268 | L181: 500 | M181: 383 | N181: 1024 | O181: 1 | P181: 25 | Q181: 9999
A182: -40 | C182: 1867.5 | E182: TDOA 35# # # 0 63 -16 # 0 0 1 0 0 0 0 1 # 0 | F182: TDOA | H182: 5.0 | I182: 2 | J182: 256 | K182: =32768+RC[1] -> 33352 | L182: 584 | M182: 383 | N182: 1024 | O182: 1 | P182: 25 | Q182: 9999
A183: -40 | C183: 1869.99 | E183: TDOA 36# # # 0 63 -16 # 0 0 1 0 0 0 0 1 # 0 | F183: TDOA | H183: 5.0 | I183: 2 | J183: 256 | K183: =32768+RC[1] -> 33435 | L183: 667 | M183: 383 | N183: 1024 | O183: 1 | P183: 25 | Q183: 9999
A184: -40 | C184: 1870.02 | E184: TDOA 37# # # 0 63 -16 # 0 0 1 0 0 0 0 1 # 0 | F184: TDOA | H184: 5.0 | I184: 2 | J184: 256 | K184: =32768+RC[1] -> 33436 | L184: 668 | M184: 383 | N184: 1024 | O184: 1 | P184: 25 | Q184: 9999
A185: -40 | C185: 1872.39 | E185: TDOA 38# # # 0 63 -16 # 0 0 1 0 0 0 0 1 # 0 | F185: TDOA | H185: 5.0 | I185: 2 | J185: 256 | K185: =32768+RC[1] -> 33515 | L185: 747 | M185: 383 | N185: 1024 | O185: 1 | P185: 25 | Q185: 9999
A186: -40 | C186: 1875 | E186: TDOA 39# # # 0 63 -16 # 0 0 1 0 0 0 0 1 # 0 | F186: TDOA | H186: 5.0 | I186: 2 | J186: 256 | K186: =32768+RC[1] -> 33602 | L186: 834 | M186: 383 | N186: 1024 | O186: 1 | P186: 25 | Q186: 9999
A187: -40 | C187: 1884.99 | E187: TDOA 130# # # 0 63 -16 # 0 0 1 0 0 0 0 1 # 0 | F187: TDOA | H187: 5.0 | I187: 2 | J187: 256 | K187: =32768+RC[1] -> 33935 | L187: 1167 | M187: 383 | N187: 1024 | O187: 1 | P187: 25 | Q187: 9999
A188: -40 | C188: 1887.45 | E188: TDOA 131# # # 0 63 -16 # 0 0 1 0 0 0 0 1 # 0 | F188: TDOA | H188: 5.0 | I188: 2 | J188: 256 | K188: =32768+RC[1] -> 34017 | L188: 1249 | M188: 383 | N188: 1024 | O188: 1 | P188: 25 | Q188: 9999
A189: -40 | C189: 1890 | E189: TDOA 132# # # 0 63 -16 # 0 0 1 0 0 0 0 1 # 0 | F189: TDOA | H189: 5.0 | I189: 2 | J189: 256 | K189: =32768+RC[1] -> 34102 | L189: 1334 | M189: 383 | N189: 1024 | O189: 1 | P189: 25 | Q189: 9999
A190: -40 | C190: 1890.03 | E190: TDOA 133# # # 0 63 -16 # 0 0 1 0 0 0 0 1 # 0 | F190: TDOA | H190: 5.0 | I190: 2 | J190: 256 | K190: =32768+RC[1] -> 34103 | L190: 1335 | M190: 383 | N190: 1024 | O190: 1 | P190: 25 | Q190: 9999
A191: -40 | C191: 1892.4 | E191: TDOA 134# # # 0 63 -16 # 0 0 1 0 0 0 0 1 # 0 | F191: TDOA | H191: 5.0 | I191: 2 | J191: 256 | K191: =32768+RC[1] -> 34182 | L191: 1414 | M191: 383 | N191: 1024 | O191: 1 | P191: 25 | Q191: 9999
A192: -40 | C192: 1894.95 | E192: TDOA 135# # # 0 63 -16 # 0 0 1 0 0 0 0 1 # 0 | F192: TDOA | H192: 5.0 | I192: 2 | J192: 256 | K192: =32768+RC[1] -> 34267 | L192: 1499 | M192: 383 | N192: 1024 | O192: 1 | P192: 25 | Q192: 9999
A193: -40 | C193: 1905 | E193: TDOA 136# # # 0 63 -16 # 0 0 1 0 0 0 0 1 # 0 | F193: TDOA | H193: 5.0 | I193: 2 | J193: 256 | K193: =32768+RC[1] -> 34602 | L193: 1834 | M193: 383 | N193: 1024 | O193: 1 | P193: 25 | Q193: 9999
A194: -40 | C194: 1907.43 | E194: TDOA 137# # # 0 63 -16 # 0 0 1 0 0 0 0 1 # 0 | F194: TDOA | H194: 5.0 | I194: 2 | J194: 256 | K194: =32768+RC[1] -> 34683 | L194: 1915 | M194: 383 | N194: 1024 | O194: 1 | P194: 25 | Q194: 9999
A195: -40 | C195: 1909.92 | E195: TDOA 138# # # 0 63 -16 # 0 0 1 0 0 0 0 1 # 0 | F195: TDOA | H195: 5.0 | I195: 2 | J195: 256 | K195: =32768+RC[1] -> 34766 | L195: 1998 | M195: 383 | N195: 1024 | O195: 1 | P195: 25 | Q195: 9999
A199: TestCase - Two-Tone Response
B200: SigGen1 | D200: SigGen2
A201: Center RF Channel | B201: RF Frequency | C201: RF Power | D201: RF Frequency | E201: Command | F201: Response | H201: Timeout | I201: Attempts | J201: Block Size | K201: Lower Channel | L201: Upper Channel | M201: SampleCount | N201: Cnfg Attn | O201: Averaging | P201: Low Limit | Q201: High Limit | R201: Lower Channel Delta | S201: Upper Channel Delta
A202: 1852.5 | B202: 1852.44 | C202: -48 | D202: 1852.56 | E202: TDOA 51# # # 0 63 -16 # 0 0 1 0 0 0 0 1 # 0 | F202: TDOA | H202: 5.0 | I202: 2 | J202: 256 | K202: 32850 | L202: =RC[-1]+4 -> 32854 | M202: 1024 | N202: 15 | O202: 1 | P202: -999 | Q202: -65 | R202: 4 | S202: 4
A204: 1852.8 | B204: 1852.74 | C204: -48 | D204: 1852.86 | E204: TDOA 52# # # 0 63 -16 # 0 0 1 0 0 0 0 1 # 0 | F204: TDOA | H204: 5.0 | I204: 2 | J204: 256 | K204: 32860 | L204: =RC[-1]+4 -> 32864 | M204: 1024 | N204: 15 | O204: 1 | P204: -999 | Q204: -65 | R204: 4 | S204: 4
A205: 1857.6 | B205: 1857.54 | C205: -48 | D205: 1857.66 | E205: TDOA 53# # # 0 63 -16 # 0 0 1 0 0 0 0 1 # 0 | F205: TDOA | H205: 5.0 | I205: 2 | J205: 256 | K205: 33020 | L205: =RC[-1]+4 -> 33024 | M205: 1024 | N205: 15 | O205: 1 | P205: -999 | Q205: -65 | R205: 4 | S205: 4
A206: 1857.9 | B206: 1857.84 | C206: -48 | D206: 1857.96 | E206: TDOA 54# # # 0 63 -16 # 0 0 1 0 0 0 0 1 # 0 | F206: TDOA | H206: 5.0 | I206: 2 | J206: 256 | K206: 33030 | L206: =RC[-1]+4 -> 33034 | M206: 1024 | N206: 15 | O206: 1 | P206: -999 | Q206: -65 | R206: 4 | S206: 4
A207: 1862.4 | B207: 1862.34 | C207: -48 | D207: 1862.46 | E207: TDOA 55# # # 0 63 -16 # 0 0 1 0 0 0 0 1 # 0 | F207: TDOA | H207: 5.0 | I207: 2 | J207: 256 | K207: 33180 | L207: =RC[-1]+4 -> 33184 | M207: 1024 | N207: 15 | O207: 1 | P207: -999 | Q207: -65 | R207: 4 | S207: 4
A208: 1862.7 | B208: 1862.64 | C208: -48 | D208: 1862.76 | E208: TDOA 56# # # 0 63 -16 # 0 0 1 0 0 0 0 1 # 0 | F208: TDOA | H208: 5.0 | I208: 2 | J208: 256 | K208: 33190 | L208: =RC[-1]+4 -> 33194 | M208: 1024 | N208: 15 | O208: 1 | P208: -999 | Q208: -65 | R208: 4 | S208: 4
A209: 1867.5 | B209: 1867.44 | C209: -48 | D209: 1867.56 | E209: TDOA 57# # # 0 63 -16 # 0 0 1 0 0 0 0 1 # 0 | F209: TDOA | H209: 5.0 | I209: 2 | J209: 256 | K209: 33350 | L209: =RC[-1]+4 -> 33354 | M209: 1024 | N209: 15 | O209: 1 | P209: -999 | Q209: -65 | R209: 4 | S209: 4
A210: 1867.8 | B210: 1867.74 | C210: -48 | D210: 1867.86 | E210: TDOA 58# # # 0 63 -16 # 0 0 1 0 0 0 0 1 # 0 | F210: TDOA | H210: 5.0 | I210: 2 | J210: 256 | K210: 33360 | L210: =RC[-1]+4 -> 33364 | M210: 1024 | N210: 15 | O210: 1 | P210: -999 | Q210: -65 | R210: 4 | S210: 4
A211: 1872.6 | B211: 1872.54 | C211: -48 | D211: 1872.66 | E211: TDOA 59# # # 0 63 -16 # 0 0 1 0 0 0 0 1 # 0 | F211: TDOA | H211: 5.0 | I211: 2 | J211: 256 | K211: 33520 | L211: =RC[-1]+4 -> 33524 | M211: 1024 | N211: 15 | O211: 1 | P211: -999 | Q211: -65 | R211: 4 | S211: 4
A212: 1872.9 | B212: 1872.84 | C212: -48 | D212: 1872.96 | E212: TDOA 150# # # 0 63 -16 # 0 0 1 0 0 0 0 1 # 0 | F212: TDOA | H212: 5.0 | I212: 2 | J212: 256 | K212: 33530 | L212: =RC[-1]+4 -> 33534 | M212: 1024 | N212: 15 | O212: 1 | P212: -999 | Q212: -65 | R212: 4 | S212: 4
A213: 1877.4 | B213: 1877.34 | C213: -48 | D213: 1877.46 | E213: TDOA 151# # # 0 63 -16 # 0 0 1 0 0 0 0 1 # 0 | F213: TDOA | H213: 5.0 | I213: 2 | J213: 256 | K213: 33680 | L213: =RC[-1]+4 -> 33684 | M213: 1024 | N213: 15 | O213: 1 | P213: -999 | Q213: -65 | R213: 4 | S213: 4
A214: 1877.7 | B214: 1877.64 | C214: -48 | D214: 1877.76 | E214: TDOA 152# # # 0 63 -16 # 0 0 1 0 0 0 0 1 # 0 | F214: TDOA | H214: 5.0 | I214: 2 | J214: 256 | K214: 33690 | L214: =RC[-1]+4 -> 33694 | M214: 1024 | N214: 15 | O214: 1 | P214: -999 | Q214: -65 | R214: 4 | S214: 4
A215: 1882.5 | B215: 1882.44 | C215: -48 | D215: 1882.56 | E215: TDOA 153# # # 0 63 -16 # 0 0 1 0 0 0 0 1 # 0 | F215: TDOA | H215: 5.0 | I215: 2 | J215: 256 | K215: 33850 | L215: =RC[-1]+4 -> 33854 | M215: 1024 | N215: 15 | O215: 1 | P215: -999 | Q215: -65 | R215: 4 | S215: 4
A216: 1882.8 | B216: 1882.74 | C216: -48 | D216: 1882.86 | E216: TDOA 154# # # 0 63 -16 # 0 0 1 0 0 0 0 1 # 0 | F216: TDOA | H216: 5.0 | I216: 2 | J216: 256 | K216: 33860 | L216: =RC[-1]+4 -> 33864 | M216: 1024 | N216: 15 | O216: 1 | P216: -999 | Q216: -65 | R216: 4 | S216: 4
A217: 1887.6 | B217: 1887.54 | C217: -48 | D217: 1887.66 | E217: TDOA 155# # # 0 63 -16 # 0 0 1 0 0 0 0 1 # 0 | F217: TDOA | H217: 5.0 | I217: 2 | J217: 256 | K217: 34020 | L217: =RC[-1]+4 -> 34024 | M217: 1024 | N217: 15 | O217: 1 | P217: -999 | Q217: -65 | R217: 4 | S217: 4
A218: 1887.9 | B218: 1887.84 | C218: -48 | D218: 1887.96 | E218: TDOA 156# # # 0 63 -16 # 0 0 1 0 0 0 0 1 # 0 | F218: TDOA | H218: 5.0 | I218: 2 | J218: 256 | K218: 34030 | L218: =RC[-1]+4 -> 34034 | M218: 1024 | N218: 15 | O218: 1 | P218: -999 | Q218: -65 | R218: 4 | S218: 4
A219: 1892.4 | B219: 1892.34 | C219: -48 | D219: 1892.46 | E219: TDOA 157# # # 0 63 -16 # 0 0 1 0 0 0 0 1 # 0 | F219: TDOA | H219: 5.0 | I219: 2 | J219: 256 | K219: 34180 | L219: =RC[-1]+4 -> 34184 | M219: 1024 | N219: 15 | O219: 1 | P219: -999 | Q219: -65 | R219: 4 | S219: 4
A220: 1892.7 | B220: 1892.64 | C220: -48 | D220: 1892.76 | E220: TDOA 158# # # 0 63 -16 # 0 0 1 0 0 0 0 1 # 0 | F220: TDOA | H220: 5.0 | I220: 2 | J220: 256 | K220: 34190 | L220: =RC[-1]+4 -> 34194 | M220: 1024 | N220: 15 | O220: 1 | P220: -999 | Q220: -65 | R220: 4 | S220: 4
A221: 1897.5 | B221: 1897.44 | C221: -48 | D221: 1897.56 | E221: TDOA 159# # # 0 63 -16 # 0 0 1 0 0 0 0 1 # 0 | F221: TDOA | H221: 5.0 | I221: 2 | J221: 256 | K221: 34350 | L221: =RC[-1]+4 -> 34354 | M221: 1024 | N221: 15 | O221: 1 | P221: -999 | Q221: -65 | R221: 4 | S221: 4
A222: 1897.8 | B222: 1897.74 | C222: -48 | D222: 1897.86 | E222: TDOA 250# # # 0 63 -16 # 0 0 1 0 0 0 0 1 # 0 | F222: TDOA | H222: 5.0 | I222: 2 | J222: 256 | K222: 34360 | L222: =RC[-1]+4 -> 34364 | M222: 1024 | N222: 15 | O222: 1 | P222: -999 | Q222: -65 | R222: 4 | S222: 4
A223: 1902.6 | B223: 1902.54 | C223: -48 | D223: 1902.66 | E223: TDOA 251# # # 0 63 -16 # 0 0 1 0 0 0 0 1 # 0 | F223: TDOA | H223: 5.0 | I223: 2 | J223: 256 | K223: 34520 | L223: =RC[-1]+4 -> 34524 | M223: 1024 | N223: 15 | O223: 1 | P223: -999 | Q223: -65 | R223: 4 | S223: 4
A224: 1902.9 | B224: 1902.84 | C224: -48 | D224: 1902.96 | E224: TDOA 252# # # 0 63 -16 # 0 0 1 0 0 0 0 1 # 0 | F224: TDOA | H224: 5.0 | I224: 2 | J224: 256 | K224: 34530 | L224: =RC[-1]+4 -> 34534 | M224: 1024 | N224: 15 | O224: 1 | P224: -999 | Q224: -65 | R224: 4 | S224: 4
A225: 1907.4 | B225: 1907.34 | C225: -48 | D225: 1907.46 | E225: TDOA 253# # # 0 63 -16 # 0 0 1 0 0 0 0 1 # 0 | F225: TDOA | H225: 5.0 | I225: 2 | J225: 256 | K225: 34680 | L225: =RC[-1]+4 -> 34684 | M225: 1024 | N225: 15 | O225: 1 | P225: -999 | Q225: -65 | R225: 4 | S225: 4
A226: 1907.7 | B226: 1907.64 | C226: -48 | D226: 1907.76 | E226: TDOA 254# # # 0 63 -16 # 0 0 1 0 0 0 0 1 # 0 | F226: TDOA | H226: 5.0 | I226: 2 | J226: 256 | K226: 34690 | L226: =RC[-1]+4 -> 34694 | M226: 1024 | N226: 15 | O226: 1 | P226: -999 | Q226: -65 | R226: 4 | S226: 4
A231: TestCase - Phase Noise
A232: Signal Generator
A233: RF Power | B233: IF Power | C233: RF Frequency | D233: IF Frequency | E233: Command | F233: Response | H233: Timeout | I233: Attempts | J233: Block Size | K233: RF Channel | L233: IF Channel | M233: SampleCount | N233: Averaging | O233: Low Limit | P233: High Limit
A234: -50 | C234: 1852.5 | E234: TDOA 61# # # 0 63 -16 # 0 0 1 0 0 0 0 1 # 0 | F234: TDOA | H234: 5.0 | I234: 2 | J234: 256 | K234: 32852 | L234: 128 | M234: 1024 | N234: 8 | O234: 0 | P234: 3
A236: -50 | C236: 1857.51 | E236: TDOA 62# # # 0 63 -16 # 0 0 1 0 0 0 0 1 # 0 | F236: TDOA | H236: 5.0 | I236: 2 | J236: 256 | K236: 33019 | L236: 128 | M236: 1024 | N236: 8 | O236: 0 | P236: 3
A237: -50 | C237: 1862.52 | E237: TDOA 63# # # 0 63 -16 # 0 0 1 0 0 0 0 1 # 0 | F237: TDOA | H237: 5.0 | I237: 2 | J237: 256 | K237: 33186 | L237: 128 | M237: 1024 | N237: 8 | O237: 0 | P237: 3
A238: -50 | C238: 1867.5 | E238: TDOA 64# # # 0 63 -16 # 0 0 1 0 0 0 0 1 # 0 | F238: TDOA | H238: 5.0 | I238: 2 | J238: 256 | K238: 33352 | L238: 128 | M238: 1024 | N238: 8 | O238: 0 | P238: 3
A239: -50 | C239: 1872.51 | E239: TDOA 65# # # 0 63 -16 # 0 0 1 0 0 0 0 1 # 0 | F239: TDOA | H239: 5.0 | I239: 2 | J239: 256 | K239: 33519 | L239: 128 | M239: 1024 | N239: 8 | O239: 0 | P239: 3
A240: -50 | C240: 1877.52 | E240: TDOA 66# # # 0 63 -16 # 0 0 1 0 0 0 0 1 # 0 | F240: TDOA | H240: 5.0 | I240: 2 | J240: 256 | K240: 33686 | L240: 128 | M240: 1024 | N240: 8 | O240: 0 | P240: 3
A241: -50 | C241: 1882.5 | E241: TDOA 67# # # 0 63 -16 # 0 0 1 0 0 0 0 1 # 0 | F241: TDOA | H241: 5.0 | I241: 2 | J241: 256 | K241: 33852 | L241: 128 | M241: 1024 | N241: 8 | O241: 0 | P241: 3
A242: -50 | C242: 1887.51 | E242: TDOA 68# # # 0 63 -16 # 0 0 1 0 0 0 0 1 # 0 | F242: TDOA | H242: 5.0 | I242: 2 | J242: 256 | K242: 34019 | L242: 128 | M242: 1024 | N242: 8 | O242: 0 | P242: 3
A243: -50 | C243: 1892.52 | E243: TDOA 69# # # 0 63 -16 # 0 0 1 0 0 0 0 1 # 0 | F243: TDOA | H243: 5.0 | I243: 2 | J243: 256 | K243: 34186 | L243: 128 | M243: 1024 | N243: 8 | O243: 0 | P243: 3
A244: -50 | C244: 1897.5 | E244: TDOA 161# # # 0 63 -16 # 0 0 1 0 0 0 0 1 # 0 | F244: TDOA | H244: 5.0 | I244: 2 | J244: 256 | K244: 34352 | L244: 128 | M244: 1024 | N244: 8 | O244: 0 | P244: 3
A245: -50 | C245: 1902.51 | E245: TDOA 162# # # 0 63 -16 # 0 0 1 0 0 0 0 1 # 0 | F245: TDOA | H245: 5.0 | I245: 2 | J245: 256 | K245: 34519 | L245: 128 | M245: 1024 | N245: 8 | O245: 0 | P245: 3
A246: -50 | C246: 1907.52 | E246: TDOA 163# # # 0 63 -16 # 0 0 1 0 0 0 0 1 # 0 | F246: TDOA | H246: 5.0 | I246: 2 | J246: 256 | K246: 34686 | L246: 128 | M246: 1024 | N246: 8 | O246: 0 | P246: 3
A250: TestCase - Data Integrity
A251: Signal Generator
A252: RF Power | B252: IF Power | C252: RF Frequency | D252: IF Frequency | E252: Command | F252: Response | H252: Timeout | I252: Attempts | J252: Block Size | K252: RF Channel | L252: IF Channel | M252: TTG Channel | N252: SampleCount | O252: Cnfg Attn | P252: Averaging | Q252: Low Limit | R252: High Limit
A253: -40 | B253: -40 | C253: 1879.98 | D253: 70 | E253: TDOA 71# # # 0 63 -16 # 0 0 1 0 0 0 0 1 # 0 | F253: TDOA | H253: 5.0 | I253: 2 | J253: 256 | K253: 33768 | L253: 128 | M253: 383 | N253: 1024 | O253: 1 | P253: 1 | Q253: 25 | R253: 9999
A254: -40 | B254: -40 | C254: 1879.98 | D254: 70 | E254: TDOA 72# # # 0 63 -16 # 0 0 1 0 0 0 0 1 # 0 | F254: TDOA | H254: 5.0 | I254: 2 | J254: 256 | K254: 33768 | L254: 128 | M254: 383 | N254: 1024 | O254: 1 | P254: 1 | Q254: 25 | R254: 9999
A255: -40 | B255: -40 | C255: 1879.98 | D255: 70 | E255: TDOA 73# # # 0 63 -16 # 0 0 1 0 0 0 0 1 # 0 | F255: TDOA | H255: 5.0 | I255: 2 | J255: 256 | K255: 33768 | L255: 128 | M255: 383 | N255: 1024 | O255: 1 | P255: 1 | Q255: 25 | R255: 9999
A256: -40 | B256: -40 | C256: 1879.98 | D256: 70 | E256: TDOA 74# # # 0 63 -16 # 0 0 1 0 0 0 0 1 # 0 | F256: TDOA | H256: 5.0 | I256: 2 | J256: 256 | K256: 33768 | L256: 128 | M256: 383 | N256: 1024 | O256: 1 | P256: 1 | Q256: 25 | R256: 9999
A257: -40 | B257: -40 | C257: 1879.98 | D257: 70 | E257: TDOA 75# # # 0 63 -16 # 0 0 1 0 0 0 0 1 # 0 | F257: TDOA | H257: 5.0 | I257: 2 | J257: 256 | K257: 33768 | L257: 128 | M257: 383 | N257: 1024 | O257: 1 | P257: 1 | Q257: 25 | R257: 9999
A261: TestCase - Noise Floor
A262: Signal Generator
A263: RF Power | B263: IF Power | C263: RF Frequency | D263: IF Frequency | E263: Command | F263: Response | H263: Timeout | I263: Attempts | J263: Block Size | K263: RF Channel | L263: IF Channel | M263: SampleCount | N263: Cnfg Attn | O263: Signal Averaging | P263: Averaging | Q263: Low Limit Noise | R263: High Limit Noise | S263: Low Limit Gain | T263: High Limit Gain
A264: -50 | C264: 1880.01 | E264: TDOA 81# # # 0 63 -16 # 0 0 1 0 0 0 0 1 # 0 | F264: TDOA | H264: 5.0 | I264: 2 | J264: 256 | K264: 33769 | L264: 1001 | M264: 1024 | N264: 0 | O264: 1 | P264: 8 | Q264: -174 | R264: -131 | S264: 30 | T264: 36
A266: -50 | C266: 1850.04 | E266: TDOA 82# # # 0 63 -16 # 0 0 1 0 0 0 0 1 # 0 | F266: TDOA | H266: 5.0 | I266: 2 | J266: 256 | K266: 32770 | L266: 2 | M266: 1024 | N266: 0 | O266: 1 | P266: 1 | Q266: -174 | R266: -131 | S266: 30 | T266: 36
A267: -50 | C267: 1855.02 | E267: TDOA 83# # # 0 63 -16 # 0 0 1 0 0 0 0 1 # 0 | F267: TDOA | H267: 5.0 | I267: 2 | J267: 256 | K267: 32936 | L267: 168 | M267: 1024 | N267: 0 | O267: 1 | P267: 1 | Q267: -174 | R267: -131 | S267: 30 | T267: 36
A268: -50 | C268: 1860 | E268: TDOA 84# # # 0 63 -16 # 0 0 1 0 0 0 0 1 # 0 | F268: TDOA | H268: 5.0 | I268: 2 | J268: 256 | K268: 33102 | L268: 334 | M268: 1024 | N268: 0 | O268: 1 | P268: 1 | Q268: -174 | R268: -131 | S268: 30 | T268: 36
A269: -50 | C269: 1865.01 | E269: TDOA 85# # # 0 63 -16 # 0 0 1 0 0 0 0 1 # 0 | F269: TDOA | H269: 5.0 | I269: 2 | J269: 256 | K269: 33269 | L269: 501 | M269: 1024 | N269: 0 | O269: 1 | P269: 1 | Q269: -174 | R269: -131 | S269: 30 | T269: 36
A270: -50 | C270: 1870.02 | E270: TDOA 86# # # 0 63 -16 # 0 0 1 0 0 0 0 1 # 0 | F270: TDOA | H270: 5.0 | I270: 2 | J270: 256 | K270: 33436 | L270: 668 | M270: 1024 | N270: 0 | O270: 1 | P270: 1 | Q270: -174 | R270: -131 | S270: 30 | T270: 36
A271: -50 | C271: 1875 | E271: TDOA 87# # # 0 63 -16 # 0 0 1 0 0 0 0 1 # 0 | F271: TDOA | H271: 5.0 | I271: 2 | J271: 256 | K271: 33602 | L271: 834 | M271: 1024 | N271: 0 | O271: 1 | P271: 1 | Q271: -174 | R271: -131 | S271: 30 | T271: 36
A272: -50 | C272: 1880.01 | E272: TDOA 88# # # 0 63 -16 # 0 0 1 0 0 0 0 1 # 0 | F272: TDOA | H272: 5.0 | I272: 2 | J272: 256 | K272: 33769 | L272: 1001 | M272: 1024 | N272: 0 | O272: 1 | P272: 1 | Q272: -174 | R272: -131 | S272: 30 | T272: 36
A273: -50 | C273: 1885.02 | E273: TDOA 89# # # 0 63 -16 # 0 0 1 0 0 0 0 1 # 0 | F273: TDOA | H273: 5.0 | I273: 2 | J273: 256 | K273: 33936 | L273: 1168 | M273: 1024 | N273: 0 | O273: 1 | P273: 1 | Q273: -174 | R273: -131 | S273: 30 | T273: 36
A274: -50 | C274: 1890 | E274: TDOA 180# # # 0 63 -16 # 0 0 1 0 0 0 0 1 # 0 | F274: TDOA | H274: 5.0 | I274: 2 | J274: 256 | K274: 34102 | L274: 1334 | M274: 1024 | N274: 0 | O274: 1 | P274: 1 | Q274: -174 | R274: -131 | S274: 30 | T274: 36
A275: -50 | C275: 1895.01 | E275: TDOA 181# # # 0 63 -16 # 0 0 1 0 0 0 0 1 # 0 | F275: TDOA | H275: 5.0 | I275: 2 | J275: 256 | K275: 34269 | L275: 1501 | M275: 1024 | N275: 0 | O275: 1 | P275: 1 | Q275: -174 | R275: -131 | S275: 30 | T275: 36
A276: -50 | C276: 1900.02 | E276: TDOA 182# # # 0 63 -16 # 0 0 1 0 0 0 0 1 # 0 | F276: TDOA | H276: 5.0 | I276: 2 | J276: 256 | K276: 34436 | L276: 1668 | M276: 1024 | N276: 0 | O276: 1 | P276: 1 | Q276: -174 | R276: -131 | S276: 30 | T276: 36
A277: -50 | C277: 1905 | E277: TDOA 183# # # 0 63 -16 # 0 0 1 0 0 0 0 1 # 0 | F277: TDOA | H277: 5.0 | I277: 2 | J277: 256 | K277: 34602 | L277: 1834 | M277: 1024 | N277: 0 | O277: 1 | P277: 1 | Q277: -174 | R277: -131 | S277: 30 | T277: 36
A278: -50 | C278: 1909.92 | E278: TDOA 184# # # 0 63 -16 # 0 0 1 0 0 0 0 1 # 0 | F278: TDOA | H278: 5.0 | I278: 2 | J278: 256 | K278: 34766 | L278: 1998 | M278: 1024 | N278: 0 | O278: 1 | P278: 1 | Q278: -174 | R278: -131 | S278: 30 | T278: 36
A282: TestCase - DDC Tuning
A283: Signal Generator
A284: RF Power | B284: IF Power | C284: RF Frequency | D284: IF Frequency | E284: Command | F284: Response | H284: Timeout | I284: Attempts | J284: Block Size | K284: RF Channel | L284: IF Channel | M284: SampleCount | N284: Averaging | O284: Low Limit | P284: High Limit
A285: -50 | C285: 1850.04 | E285: TDOA 91# # # 0 63 -16 # 0 0 1 0 0 0 0 1 # 0 | F285: TDOA | H285: 5.0 | I285: 2 | J285: 256 | K285: 32770 | M285: 1024 | N285: 1 | O285: 33 | P285: 9999
A287: -50 | C287: 1855.11 | E287: TDOA 92# # # 0 63 -16 # 0 0 1 0 0 0 0 1 # 0 | F287: TDOA | H287: 5.0 | I287: 2 | J287: 256 | K287: 32939 | M287: 1024 | N287: 1 | O287: 33 | P287: 9999
A288: -50 | C288: 1860.21 | E288: TDOA 93# # # 0 63 -16 # 0 0 1 0 0 0 0 1 # 0 | F288: TDOA | H288: 5.0 | I288: 2 | J288: 256 | K288: 33109 | M288: 1024 | N288: 1 | O288: 33 | P288: 9999
A289: -50 | C289: 1865.31 | E289: TDOA 94# # # 0 63 -16 # 0 0 1 0 0 0 0 1 # 0 | F289: TDOA | H289: 5.0 | I289: 2 | J289: 256 | K289: 33279 | M289: 1024 | N289: 1 | O289: 33 | P289: 9999
A290: -50 | C290: 1870.41 | E290: TDOA 95# # # 0 63 -16 # 0 0 1 0 0 0 0 1 # 0 | F290: TDOA | H290: 5.0 | I290: 2 | J290: 256 | K290: 33449 | M290: 1024 | N290: 1 | O290: 33 | P290: 9999
A291: -50 | C291: 1875.51 | E291: TDOA 96# # # 0 63 -16 # 0 0 1 0 0 0 0 1 # 0 | F291: TDOA | H291: 5.0 | I291: 2 | J291: 256 | K291: 33619 | M291: 1024 | N291: 1 | O291: 33 | P291: 9999
A292: -50 | C292: 1880.61 | E292: TDOA 97# # # 0 63 -16 # 0 0 1 0 0 0 0 1 # 0 | F292: TDOA | H292: 5.0 | I292: 2 | J292: 256 | K292: 33789 | M292: 1024 | N292: 1 | O292: 33 | P292: 9999
A293: -50 | C293: 1885.71 | E293: TDOA 98# # # 0 63 -16 # 0 0 1 0 0 0 0 1 # 0 | F293: TDOA | H293: 5.0 | I293: 2 | J293: 256 | K293: 33959 | M293: 1024 | N293: 1 | O293: 33 | P293: 9999
A294: -50 | C294: 1890.81 | E294: TDOA 99# # # 0 63 -16 # 0 0 1 0 0 0 0 1 # 0 | F294: TDOA | H294: 5.0 | I294: 2 | J294: 256 | K294: 34129 | M294: 1024 | N294: 1 | O294: 33 | P294: 9999
A295: -50 | C295: 1895.91 | E295: TDOA 190# # # 0 63 -16 # 0 0 1 0 0 0 0 1 # 0 | F295: TDOA | H295: 5.0 | I295: 2 | J295: 256 | K295: 34299 | M295: 1024 | N295: 1 | O295: 33 | P295: 9999
A296: -50 | C296: 1901.01 | E296: TDOA 191# # # 0 63 -16 # 0 0 1 0 0 0 0 1 # 0 | F296: TDOA | H296: 5.0 | I296: 2 | J296: 256 | K296: 34469 | M296: 1024 | N296: 1 | O296: 33 | P296: 9999
A297: -50 | C297: 1906.11 | E297: TDOA 192# # # 0 63 -16 # 0 0 1 0 0 0 0 1 # 0 | F297: TDOA | H297: 5.0 | I297: 2 | J297: 256 | K297: 34639 | M297: 1024 | N297: 1 | O297: 33 | P297: 9999
A301: TestCase - Mini-RLS
A302: Signal Generator | C302: LMU Command
A303: RF Power | B303: RF Frequency | C303: Command Set | G303: Block Size | H303: BlockCount | I303: RF Channel | J303: SampleCount | K303: delay | L303: Phase Curvature | M303: Repeat and Average
A304: -40 | B304: 1850.2 | C304: CommandSequence12B | G304: 256 | H304: 4 | I304: 512 | J304: 1024 | K304: 150 | L304: 0.5 | M304: 2
A305: -40 | B305: =R[-1]C+0.2 -> 1850.4 | C305: CommandSequence12B | G305: 256 | H305: 4 | I305: =R[-1]C+1 -> 513 | J305: 1024 | K305: 150 | L305: 0.5 | M305: 2
A306: -40 | B306: 1880.01 | C306: CommandSequence12A | G306: 256 | H306: 4 | I306: 33769 | J306: 1024 | K306: 150 | L306: 0.5 | M306: 2
A307: -40 | B307: =R[-1]C+0.03 -> 1880.04 | C307: CommandSequence12A | G307: 256 | H307: 4 | I307: =R[-1]C+1 -> 33770 | J307: 1024 | K307: 150 | L307: 0.5 | M307: 2
A310: TestCase - Config Attenuator
A311: Signal Generator
A312: RF Power | B312: IF Power | C312: RF Frequency | D312: IF Frequency | E312: Command | F312: Response | H312: Timeout | I312: Attempts | J312: Block Size | K312: RF Channel | L312: IF Channel | M312: TTG Channel | N312: SampleCount | O312: Cnfg Attn Setting | P312: Averaging | Q312: Low Limit from previous level | R312: High Limit from previous level
A313: -40 | B313: -40 | C313: 1880.01 | D313: 70 | E313: TDOA 71# # # 0 63 -16 # 0 0 1 0 0 0 0 1 # 0 | F313: TDOA | H313: 5 | I313: 2 | J313: 256 | K313: 33769 | L313: 128 | M313: 33769 | N313: 1024 | O313: 0 | P313: 1 | Q313: -60 | R313: 0
A314: -40 | B314: -40 | C314: 1880.01 | D314: 70 | E314: TDOA 72# # # 0 63 -16 # 0 0 1 0 0 0 0 1 # 0 | F314: TDOA | H314: 5 | I314: 2 | J314: 256 | K314: 33769 | L314: 128 | M314: 33769 | N314: 1024 | O314: -8 | P314: 1 | Q314: -10 | R314: -6
A315: -40 | B315: -40 | C315: 1880.01 | D315: 70 | E315: TDOA 73# # # 0 63 -16 # 0 0 1 0 0 0 0 1 # 0 | F315: TDOA | H315: 5 | I315: 2 | J315: 256 | K315: 33769 | L315: 128 | M315: 33769 | N315: 1024 | O315: -10 | P315: 1 | Q315: -3.3 | R315: -0.7
A316: -40 | B316: -40 | C316: 1880.01 | D316: 70 | E316: TDOA 74# # # 0 63 -16 # 0 0 1 0 0 0 0 1 # 0 | F316: TDOA | H316: 5 | I316: 2 | J316: 256 | K316: 33769 | L316: 128 | M316: 33769 | N316: 1024 | O316: 6 | P316: 1 | Q316: 13.5 | R316: 18.5
A317: -40 | B317: -40 | C317: 1880.01 | D317: 70 | E317: TDOA 75# # # 0 63 -16 # 0 0 1 0 0 0 0 1 # 0 | F317: TDOA | H317: 5 | I317: 2 | J317: 256 | K317: 33769 | L317: 128 | M317: 33769 | N317: 1024 | O317: 2 | P317: 1 | Q317: -5.5 | R317: -2.5
A318: -40 | B318: -40 | C318: 1880.01 | D318: 70 | E318: TDOA 76# # # 0 63 -16 # 0 0 1 0 0 0 0 1 # 0 | F318: TDOA | H318: 5 | I318: 2 | J318: 256 | K318: 33769 | L318: 128 | M318: 33769 | N318: 1024 | O318: 1 | P318: 1 | Q318: -2 | R318: 0

Sheet: 061640
B2: Factors | F2: Temperature Coefficient
B3: TTG | C3: 200
B4: Gain | C4: 200 | F4: -3.5000000000000003E-2 | H4: dB/deg
B5: TTG Comp | C5: 200
B6: Gain Factor | C6: 200
F8: Center Temperature
F10: 30 | H10: deg
A16: Test Case 3 - SNR
A17: Signal Generator
A18: RF Power | B18: IF Power | C18: RF Frequency | D18: IF Frequency | E18: Command | F18: Response | H18: Timeout | I18: Attempts | J18: Block Size | K18: RF Channel | L18: IF Channel | M18: TTG Channel | N18: # Samples | O18: Averaging | P18: Low Limit | Q18: High Limit
A19: -50 | C19: 1710.2 | E19: TDOA 31# # # 1 63 -16 # 0 0 1 0 0 0 0 1 # 0 | F19: TDOA | H19: 5.0 | I19: 2 | J19: 256 | K19: 512 | L19: 1 | M19: 696 | N19: 1024 | O19: 1 | P19: 29 | Q19: 9999
A21: -50 | C21: 1715 | E21: TDOA 32# # # 1 63 -16 # 0 0 1 0 0 0 0 1 # 0 | F21: TDOA | H21: 5.0 | I21: 2 | J21: 256 | K21: 536 | L21: 25 | M21: 696 | N21: 1024 | O21: 1 | P21: 29 | Q21: 9999
A22: -50 | C22: 1719.6 | E22: TDOA 33# # # 1 63 -16 # 0 0 1 0 0 0 0 1 # 0 | F22: TDOA | H22: 5.0 | I22: 2 | J22: 256 | K22: 559 | L22: 48 | M22: 696 | N22: 1024 | O22: 1 | P22: 29 | Q22: 9999
A23: -50 | C23: 1724.2 | E23: TDOA 34# # # 1 63 -16 # 0 0 1 0 0 0 0 1 # 0 | F23: TDOA | H23: 5.0 | I23: 2 | J23: 256 | K23: 582 | L23: 71 | M23: 696 | N23: 1024 | O23: 1 | P23: 29 | Q23: 9999
A24: -50 | C24: 1729 | E24: TDOA 35# # # 1 63 -16 # 0 0 1 0 0 0 0 1 # 0 | F24: TDOA | H24: 5.0 | I24: 2 | J24: 256 | K24: 606 | L24: 95 | M24: 696 | N24: 1024 | O24: 1 | P24: 29 | Q24: 9999
A25: -50 | C25: 1733.6 | E25: TDOA 36# # # 1 63 -16 # 0 0 1 0 0 0 0 1 # 0 | F25: TDOA | H25: 5.0 | I25: 2 | J25: 256 | K25: 629 | L25: 118 | M25: 696 | N25: 1024 | O25: 1 | P25: 29 | Q25: 9999
A26: -50 | C26: 1738.2 | E26: TDOA 37# # # 1 63 -16 # 0 0 1 0 0 0 0 1 # 0 | F26: TDOA | H26: 5.0 | I26: 2 | J26: 256 | K26: 652 | L26: 16 | M26: 696 | N26: 1024 | O26: 1 | P26: 29 | Q26: 9999
A27: -50 | C27: 1743 | E27: TDOA 38# # # 1 63 -16 # 0 0 1 0 0 0 0 1 # 0 | F27: TDOA | H27: 5.0 | I27: 2 | J27: 256 | K27: 676 | L27: 40 | M27: 696 | N27: 1024 | O27: 1 | P27: 29 | Q27: 9999
A28: -50 | C28: 1747.4 | E28: TDOA 39# # # 1 63 -16 # 0 0 1 0 0 0 0 1 # 0 | F28: TDOA | H28: 5.0 | I28: 2 | J28: 256 | K28: 698 | L28: 62 | M28: 696 | N28: 1024 | O28: 1 | P28: 29 | Q28: 9999
A29: -50 | C29: 1747.6 | E29: TDOA 130# # # 1 63 -16 # 0 0 1 0 0 0 0 1 # 0 | F29: TDOA | H29: 5.0 | I29: 2 | J29: 256 | K29: 699 | L29: 63 | M29: 696 | N29: 1024 | O29: 1 | P29: 29 | Q29: 9999
A30: -50 | C30: 1752.4 | E30: TDOA 131# # # 1 63 -16 # 0 0 1 0 0 0 0 1 # 0 | F30: TDOA | H30: 5.0 | I30: 2 | J30: 256 | K30: 723 | L30: 87 | M30: 696 | N30: 1024 | O30: 1 | P30: 29 | Q30: 9999
A31: -50 | C31: 1757 | E31: TDOA 132# # # 1 63 -16 # 0 0 1 0 0 0 0 1 # 0 | F31: TDOA | H31: 5.0 | I31: 2 | J31: 256 | K31: 746 | L31: 110 | M31: 696 | N31: 1024 | O31: 1 | P31: 29 | Q31: 9999
A32: -50 | C32: 1761.6 | E32: TDOA 133# # # 1 63 -16 # 0 0 1 0 0 0 0 1 # 0 | F32: TDOA | H32: 5.0 | I32: 2 | J32: 256 | K32: 769 | L32: 8 | M32: 696 | N32: 1024 | O32: 1 | P32: 29 | Q32: 9999
A33: -50 | C33: 1766.4 | E33: TDOA 134# # # 1 63 -16 # 0 0 1 0 0 0 0 1 # 0 | F33: TDOA | H33: 5.0 | I33: 2 | J33: 256 | K33: 793 | L33: 32 | M33: 696 | N33: 1024 | O33: 1 | P33: 29 | Q33: 9999
A34: -50 | C34: 1771 | E34: TDOA 135# # # 1 63 -16 # 0 0 1 0 0 0 0 1 # 0 | F34: TDOA | H34: 5.0 | I34: 2 | J34: 256 | K34: 816 | L34: 55 | M34: 696 | N34: 1024 | O34: 1 | P34: 29 | Q34: 9999
A35: -50 | C35: 1775.6 | E35: TDOA 136# # # 1 63 -16 # 0 0 1 0 0 0 0 1 # 0 | F35: TDOA | H35: 5.0 | I35: 2 | J35: 256 | K35: 839 | L35: 78 | M35: 696 | N35: 1024 | O35: 1 | P35: 29 | Q35: 9999
A36: -50 | C36: 1780.4 | E36: TDOA 137# # # 1 63 -16 # 0 0 1 0 0 0 0 1 # 0 | F36: TDOA | H36: 5.0 | I36: 2 | J36: 256 | K36: 863 | L36: 102 | M36: 696 | N36: 1024 | O36: 1 | P36: 29 | Q36: 9999
A37: -50 | C37: 1784.8 | E37: TDOA 138# # # 1 63 -16 # 0 0 1 0 0 0 0 1 # 0 | F37: TDOA | H37: 5.0 | I37: 2 | J37: 256 | K37: 885 | L37: 124 | M37: 696 | N37: 1024 | O37: 1 | P37: 29 | Q37: 9999
A41: Test Case 5 - Two-Tone Response
B42: SigGen1 | D42: SigGen2
A43: Center RF Channel | B43: RF Frequency | C43: RF Power | D43: RF Frequency | E43: Command | F43: Response | H43: Timeout | I43: Attempts | J43: Block Size | K43: Lower Channel | L43: Upper Channel | M43: # Samples | N43: Cnfg Attn | O43: Averaging | P43: Low Limit | Q43: High Limit | R43: Lower Channel Delta | S43: Upper Channel Delta
B44: 1710.34 | C44: -55 | D44: 1710.46 | E44: TDOA 51# # # 1 63 -16 # 0 0 1 0 0 0 0 1 # 0 | F44: TDOA | H44: 5.0 | I44: 2 | J44: 256 | K44: 513 | L44: 513 | M44: 1024 | N44: 15 | O44: 1 | P44: -999 | Q44: -60 | R44: 1 | S44: 1
B46: 1714.94 | C46: -55 | D46: 1715.06 | E46: TDOA 52# # # 1 63 -16 # 0 0 1 0 0 0 0 1 # 0 | F46: TDOA | H46: 5.0 | I46: 2 | J46: 256 | K46: 536 | L46: 536 | M46: 1024 | N46: 15 | O46: 1 | P46: -999 | Q46: -60 | R46: 1 | S46: 1
B47: 1719.54 | C47: -55 | D47: 1719.66 | E47: TDOA 53# # # 1 63 -16 # 0 0 1 0 0 0 0 1 # 0 | F47: TDOA | H47: 5.0 | I47: 2 | J47: 256 | K47: 559 | L47: 559 | M47: 1024 | N47: 15 | O47: 1 | P47: -999 | Q47: -60 | R47: 1 | S47: 1
B48: 1724.14 | C48: -55 | D48: 1724.26 | E48: TDOA 54# # # 1 63 -16 # 0 0 1 0 0 0 0 1 # 0 | F48: TDOA | H48: 5.0 | I48: 2 | J48: 256 | K48: 582 | L48: 582 | M48: 1024 | N48: 15 | O48: 1 | P48: -999 | Q48: -60 | R48: 1 | S48: 1
B49: 1728.94 | C49: -55 | D49: 1729.06 | E49: TDOA 55# # # 1 63 -16 # 0 0 1 0 0 0 0 1 # 0 | F49: TDOA | H49: 5.0 | I49: 2 | J49: 256 | K49: 606 | L49: 606 | M49: 1024 | N49: 15 | O49: 1 | P49: -999 | Q49: -60 | R49: 1 | S49: 1
B50: 1733.54 | C50: -55 | D50: 1733.66 | E50: TDOA 56# # # 1 63 -16 # 0 0 1 0 0 0 0 1 # 0 | F50: TDOA | H50: 5.0 | I50: 2 | J50: 256 | K50: 629 | L50: 629 | M50: 1024 | N50: 15 | O50: 1 | P50: -999 | Q50: -60 | R50: 1 | S50: 1
B51: 1738.14 | C51: -55 | D51: 1738.26 | E51: TDOA 57# # # 1 63 -16 # 0 0 1 0 0 0 0 1 # 0 | F51: TDOA | H51: 5.0 | I51: 2 | J51: 256 | K51: 652 | L51: 652 | M51: 1024 | N51: 15 | O51: 1 | P51: -999 | Q51: -60 | R51: 1 | S51: 1
B52: 1742.94 | C52: -55 | D52: 1743.06 | E52: TDOA 58# # # 1 63 -16 # 0 0 1 0 0 0 0 1 # 0 | F52: TDOA | H52: 5.0 | I52: 2 | J52: 256 | K52: 676 | L52: 676 | M52: 1024 | N52: 15 | O52: 1 | P52: -999 | Q52: -60 | R52: 1 | S52: 1
B53: 1747.34 | C53: -55 | D53: 1747.46 | E53: TDOA 59# # # 1 63 -16 # 0 0 1 0 0 0 0 1 # 0 | F53: TDOA | H53: 5.0 | I53: 2 | J53: 256 | K53: 698 | L53: 698 | M53: 1024 | N53: 15 | O53: 1 | P53: -999 | Q53: -60 | R53: 1 | S53: 1
B54: 1747.54 | C54: -55 | D54: 1747.66 | E54: TDOA 150# # # 1 63 -16 # 0 0 1 0 0 0 0 1 # 0 | F54: TDOA | H54: 5.0 | I54: 2 | J54: 256 | K54: 699 | L54: 699 | M54: 1024 | N54: 15 | O54: 1 | P54: -999 | Q54: -60 | R54: 1 | S54: 1
B55: 1752.34 | C55: -55 | D55: 1752.46 | E55: TDOA 151# # # 1 63 -16 # 0 0 1 0 0 0 0 1 # 0 | F55: TDOA | H55: 5.0 | I55: 2 | J55: 256 | K55: 723 | L55: 723 | M55: 1024 | N55: 15 | O55: 1 | P55: -999 | Q55: -60 | R55: 1 | S55: 1
B56: 1756.94 | C56: -55 | D56: 1757.06 | E56: TDOA 152# # # 1 63 -16 # 0 0 1 0 0 0 0 1 # 0 | F56: TDOA | H56: 5.0 | I56: 2 | J56: 256 | K56: 746 | L56: 746 | M56: 1024 | N56: 15 | O56: 1 | P56: -999 | Q56: -60 | R56: 1 | S56: 1
A61: Test Case 6 - Phase Noise
A62: Signal Generator
A63: RF Power | B63: IF Power | C63: RF Frequency | D63: IF Frequency | E63: Command | F63: Response | H63: Timeout | I63: Attempts | J63: Block Size | K63: RF Channel | L63: IF Channel | M63: # Samples | N63: Averaging | O63: Low Limit | P63: High Limit
A64: -50 | C64: 1710.2 | E64: TDOA 61# # # 1 63 -16 # 0 0 1 0 0 0 0 1 # 0 | F64: TDOA | H64: 5.0 | I64: 2 | J64: 256 | K64: 512 | L64: 1 | M64: 1024 | N64: 8 | O64: 0 | P64: 3
A66: -50 | C66: 1715 | E66: TDOA 62# # # 1 63 -16 # 0 0 1 0 0 0 0 1 # 0 | F66: TDOA | H66: 5.0 | I66: 2 | J66: 256 | K66: 536 | L66: 25 | M66: 1024 | N66: 8 | O66: 0 | P66: 3
A67: -50 | C67: 1719.6 | E67: TDOA 63# # # 1 63 -16 # 0 0 1 0 0 0 0 1 # 0 | F67: TDOA | H67: 5.0 | I67: 2 | J67: 256 | K67: 559 | L67: 48 | M67: 1024 | N67: 8 | O67: 0 | P67: 3
A68: -50 | C68: 1724.2 | E68: TDOA 64# # # 1 63 -16 # 0 0 1 0 0 0 0 1 # 0 | F68: TDOA | H68: 5.0 | I68: 2 | J68: 256 | K68: 582 | L68: 71 | M68: 1024 | N68: 8 | O68: 0 | P68: 3
A69: -50 | C69: 1729 | E69: TDOA 65# # # 1 63 -16 # 0 0 1 0 0 0 0 1 # 0 | F69: TDOA | H69: 5.0 | I69: 2 | J69: 256 | K69: 606 | L69: 95 | M69: 1024 | N69: 8 | O69: 0 | P69: 3
A70: -50 | C70: 1733.6 | E70: TDOA 66# # # 1 63 -16 # 0 0 1 0 0 0 0 1 # 0 | F70: TDOA | H70: 5.0 | I70: 2 | J70: 256 | K70: 629 | L70: 118 | M70: 1024 | N70: 8 | O70: 0 | P70: 3
A71: -50 | C71: 1738.2 | E71: TDOA 67# # # 1 63 -16 # 0 0 1 0 0 0 0 1 # 0 | F71: TDOA | H71: 5.0 | I71: 2 | J71: 256 | K71: 652 | L71: 16 | M71: 1024 | N71: 8 | O71: 0 | P71: 3
A72: -50 | C72: 1743 | E72: TDOA 68# # # 1 63 -16 # 0 0 1 0 0 0 0 1 # 0 | F72: TDOA | H72: 5.0 | I72: 2 | J72: 256 | K72: 676 | L72: 40 | M72: 1024 | N72: 8 | O72: 0 | P72: 3
A73: -50 | C73: 1747.4 | E73: TDOA 69# # # 1 63 -16 # 0 0 1 0 0 0 0 1 # 0 | F73: TDOA | H73: 5.0 | I73: 2 | J73: 256 | K73: 698 | L73: 62 | M73: 1024 | N73: 8 | O73: 0 | P73: 3
A74: -50 | C74: 1747.6 | E74: TDOA 161# # # 1 63 -16 # 0 0 1 0 0 0 0 1 # 0 | F74: TDOA | H74: 5.0 | I74: 2 | J74: 256 | K74: 699 | L74: 63 | M74: 1024 | N74: 8 | O74: 0 | P74: 3
A75: -50 | C75: 1752.4 | E75: TDOA 162# # # 1 63 -16 # 0 0 1 0 0 0 0 1 # 0 | F75: TDOA | H75: 5.0 | I75: 2 | J75: 256 | K75: 723 | L75: 87 | M75: 1024 | N75: 8 | O75: 0 | P75: 3
A76: -50 | C76: 1757 | E76: TDOA 163# # # 1 63 -16 # 0 0 1 0 0 0 0 1 # 0 | F76: TDOA | H76: 5.0 | I76: 2 | J76: 256 | K76: 746 | L76: 110 | M76: 1024 | N76: 8 | O76: 0 | P76: 3
A77: -50 | C77: 1761.6 | E77: TDOA 164# # # 1 63 -16 # 0 0 1 0 0 0 0 1 # 0 | F77: TDOA | H77: 5.0 | I77: 2 | J77: 256 | K77: 769 | L77: 8 | M77: 1024 | N77: 8 | O77: 0 | P77: 3
A78: -50 | C78: 1766.4 | E78: TDOA 165# # # 1 63 -16 # 0 0 1 0 0 0 0 1 # 0 | F78: TDOA | H78: 5.0 | I78: 2 | J78: 256 | K78: 793 | L78: 32 | M78: 1024 | N78: 8 | O78: 0 | P78: 3
A79: -50 | C79: 1771 | E79: TDOA 166# # # 1 63 -16 # 0 0 1 0 0 0 0 1 # 0 | F79: TDOA | H79: 5.0 | I79: 2 | J79: 256 | K79: 816 | L79: 55 | M79: 1024 | N79: 8 | O79: 0 | P79: 3
A80: -50 | C80: 1775.6 | E80: TDOA 167# # # 1 63 -16 # 0 0 1 0 0 0 0 1 # 0 | F80: TDOA | H80: 5.0 | I80: 2 | J80: 256 | K80: 839 | L80: 78 | M80: 1024 | N80: 8 | O80: 0 | P80: 3
A81: -50 | C81: 1780.4 | E81: TDOA 168# # # 1 63 -16 # 0 0 1 0 0 0 0 1 # 0 | F81: TDOA | H81: 5.0 | I81: 2 | J81: 256 | K81: 863 | L81: 102 | M81: 1024 | N81: 8 | O81: 0 | P81: 3
A82: -50 | C82: 1784.8 | E82: TDOA 169# # # 1 63 -16 # 0 0 1 0 0 0 0 1 # 0 | F82: TDOA | H82: 5.0 | I82: 2 | J82: 256 | K82: 885 | L82: 124 | M82: 1024 | N82: 8 | O82: 0 | P82: 3
A86: Test Case 7 - Data Integrity
A87: Signal Generator
A88: RF Power | B88: IF Power | C88: RF Frequency | D88: IF Frequency | E88: Command | F88: Response | H88: Timeout | I88: Attempts | J88: Block Size | K88: RF Channel | L88: IF Channel | M88: TTG Channel | N88: # Samples | O88: Cnfg Attn | P88: Averaging | Q88: Low Limit | R88: High Limit
A89: -50 | B89: -50 | C89: 1747 | D89: 70 | E89: TDOA 71# # # 1 63 -16 # 0 0 1 0 0 0 0 1 # 0 | F89: TDOA | H89: 5.0 | I89: 2 | J89: 256 | K89: 696 | L89: 60 | M89: 696 | N89: 1024 | O89: 6 | P89: 1 | Q89: 29 | R89: 9999
A90: -50 | B90: -50 | C90: 1747 | D90: 70 | E90: TDOA 72# # # 1 63 -16 # 0 0 1 0 0 0 0 1 # 0 | F90: TDOA | H90: 5.0 | I90: 2 | J90: 256 | K90: 696 | L90: 60 | M90: 696 | N90: 1024 | O90: 6 | P90: 1 | Q90: 29 | R90: 9999
A91: -50 | B91: -50 | C91: 1747 | D91: 70 | E91: TDOA 73# # # 1 63 -16 # 0 0 1 0 0 0 0 1 # 0 | F91: TDOA | H91: 5.0 | I91: 2 | J91: 256 | K91: 696 | L91: 60 | M91: 696 | N91: 1024 | O91: 6 | P91: 1 | Q91: 29 | R91: 9999
A92: -50 | B92: -50 | C92: 1747 | D92: 70 | E92: TDOA 74# # # 1 63 -16 # 0 0 1 0 0 0 0 1 # 0 | F92: TDOA | H92: 5.0 | I92: 2 | J92: 256 | K92: 696 | L92: 60 | M92: 696 | N92: 1024 | O92: 6 | P92: 1 | Q92: 29 | R92: 9999
A93: -50 | B93: -50 | C93: 1747 | D93: 70 | E93: TDOA 75# # # 1 63 -16 # 0 0 1 0 0 0 0 1 # 0 | F93: TDOA | H93: 5.0 | I93: 2 | J93: 256 | K93: 696 | L93: 60 | M93: 696 | N93: 1024 | O93: 6 | P93: 1 | Q93: 29 | R93: 9999
A97: Test Case 8 - Noise Floor
A98: Signal Generator
A99: RF Power | B99: IF Power | C99: RF Frequency | D99: IF Frequency | E99: Command | F99: Response | H99: Timeout | I99: Attempts | J99: Block Size | K99: RF Channel | L99: IF Channel | M99: # Samples | N99: Cnfg Attn | O99: Averaging | P99: Signal Averaging | Q99: Low Limit Noise | R99: High Limit Noise | S99: Low Limit Gain | T99: High Limit Gain
A100: -55 | C100: 1710.2 | E100: TDOA 81# # # 1 63 -16 # 0 0 1 0 0 0 0 1 # 0 | F100: TDOA | H100: 5.0 | I100: 2 | J100: 256 | K100: 512 | L100: 1 | M100: 1024 | N100: 0 | O100: 8 | P100: 1 | Q100: -174 | R100: -121 | S100: 40 | T100: 46
A102: -55 | C102: 1715 | E102: TDOA 82# # # 1 63 -16 # 0 0 1 0 0 0 0 1 # 0 | F102: TDOA | H102: 5.0 | I102: 2 | J102: 256 | K102: 536 | L102: 25 | M102: 1024 | N102: 0 | O102: 8 | P102: 1 | Q102: -174 | R102: -121 | S102: 40 | T102: 46
A103: -55 | C103: 1719.6 | E103: TDOA 83# # # 1 63 -16 # 0 0 1 0 0 0 0 1 # 0 | F103: TDOA | H103: 5.0 | I103: 2 | J103: 256 | K103: 559 | L103: 48 | M103: 1024 | N103: 0 | O103: 8 | P103: 1 | Q103: -174 | R103: -121 | S103: 40 | T103: 46
A104: -55 | C104: 1724.2 | E104: TDOA 84# # # 1 63 -16 # 0 0 1 0 0 0 0 1 # 0 | F104: TDOA | H104: 5.0 | I104: 2 | J104: 256 | K104: 582 | L104: 71 | M104: 1024 | N104: 0 | O104: 8 | P104: 1 | Q104: -174 | R104: -121 | S104: 40 | T104: 46
A105: -55 | C105: 1729 | E105: TDOA 85# # # 1 63 -16 # 0 0 1 0 0 0 0 1 # 0 | F105: TDOA | H105: 5.0 | I105: 2 | J105: 256 | K105: 606 | L105: 95 | M105: 1024 | N105: 0 | O105: 8 | P105: 1 | Q105: -174 | R105: -121 | S105: 40 | T105: 46
A106: -55 | C106: 1733.6 | E106: TDOA 86# # # 1 63 -16 # 0 0 1 0 0 0 0 1 # 0 | F106: TDOA | H106: 5.0 | I106: 2 | J106: 256 | K106: 629 | L106: 118 | M106: 1024 | N106: 0 | O106: 8 | P106: 1 | Q106: -174 | R106: -121 | S106: 40 | T106: 46
A107: -55 | C107: 1738.2 | E107: TDOA 87# # # 1 63 -16 # 0 0 1 0 0 0 0 1 # 0 | F107: TDOA | H107: 5.0 | I107: 2 | J107: 256 | K107: 652 | L107: 16 | M107: 1024 | N107: 0 | O107: 8 | P107: 1 | Q107: -174 | R107: -121 | S107: 40 | T107: 46
A108: -55 | C108: 1743 | E108: TDOA 88# # # 1 63 -16 # 0 0 1 0 0 0 0 1 # 0 | F108: TDOA | H108: 5.0 | I108: 2 | J108: 256 | K108: 676 | L108: 40 | M108: 1024 | N108: 0 | O108: 8 | P108: 1 | Q108: -174 | R108: -121 | S108: 40 | T108: 46
A109: -55 | C109: 1747.4 | E109: TDOA 89# # # 1 63 -16 # 0 0 1 0 0 0 0 1 # 0 | F109: TDOA | H109: 5.0 | I109: 2 | J109: 256 | K109: 698 | L109: 62 | M109: 1024 | N109: 0 | O109: 8 | P109: 1 | Q109: -174 | R109: -121 | S109: 40 | T109: 46
A110: -55 | C110: 1747.6 | E110: TDOA 180# # # 1 63 -16 # 0 0 1 0 0 0 0 1 # 0 | F110: TDOA | H110: 5.0 | I110: 2 | J110: 256 | K110: 699 | L110: 63 | M110: 1024 | N110: 0 | O110: 8 | P110: 1 | Q110: -174 | R110: -121 | S110: 40 | T110: 46
A111: -55 | C111: 1752.4 | E111: TDOA 181# # # 1 63 -16 # 0 0 1 0 0 0 0 1 # 0 | F111: TDOA | H111: 5.0 | I111: 2 | J111: 256 | K111: 723 | L111: 87 | M111: 1024 | N111: 0 | O111: 8 | P111: 1 | Q111: -174 | R111: -121 | S111: 40 | T111: 46
A112: -55 | C112: 1757 | E112: TDOA 182# # # 1 63 -16 # 0 0 1 0 0 0 0 1 # 0 | F112: TDOA | H112: 5.0 | I112: 2 | J112: 256 | K112: 746 | L112: 110 | M112: 1024 | N112: 0 | O112: 8 | P112: 1 | Q112: -174 | R112: -121 | S112: 40 | T112: 46
A113: -55 | C113: 1761.6 | E113: TDOA 183# # # 1 63 -16 # 0 0 1 0 0 0 0 1 # 0 | F113: TDOA | H113: 5.0 | I113: 2 | J113: 256 | K113: 769 | L113: 8 | M113: 1024 | N113: 0 | O113: 8 | P113: 1 | Q113: -174 | R113: -121 | S113: 40 | T113: 46
A114: -55 | C114: 1766.4 | E114: TDOA 184# # # 1 63 -16 # 0 0 1 0 0 0 0 1 # 0 | F114: TDOA | H114: 5.0 | I114: 2 | J114: 256 | K114: 793 | L114: 32 | M114: 1024 | N114: 0 | O114: 8 | P114: 1 | Q114: -174 | R114: -121 | S114: 40 | T114: 46
A115: -55 | C115: 1771 | E115: TDOA 185# # # 1 63 -16 # 0 0 1 0 0 0 0 1 # 0 | F115: TDOA | H115: 5.0 | I115: 2 | J115: 256 | K115: 816 | L115: 55 | M115: 1024 | N115: 0 | O115: 8 | P115: 1 | Q115: -174 | R115: -121 | S115: 40 | T115: 46
A116: -55 | C116: 1775.6 | E116: TDOA 186# # # 1 63 -16 # 0 0 1 0 0 0 0 1 # 0 | F116: TDOA | H116: 5.0 | I116: 2 | J116: 256 | K116: 839 | L116: 78 | M116: 1024 | N116: 0 | O116: 8 | P116: 1 | Q116: -174 | R116: -121 | S116: 40 | T116: 46
A117: -55 | C117: 1780.4 | E117: TDOA 187# # # 1 63 -16 # 0 0 1 0 0 0 0 1 # 0 | F117: TDOA | H117: 5.0 | I117: 2 | J117: 256 | K117: 863 | L117: 102 | M117: 1024 | N117: 0 | O117: 8 | P117: 1 | Q117: -174 | R117: -121 | S117: 40 | T117: 46
A118: -55 | C118: 1784.8 | E118: TDOA 188# # # 1 63 -16 # 0 0 1 0 0 0 0 1 # 0 | F118: TDOA | H118: 5.0 | I118: 2 | J118: 256 | K118: 885 | L118: 124 | M118: 1024 | N118: 0 | O118: 8 | P118: 1 | Q118: -174 | R118: -121 | S118: 40 | T118: 46
H119: 5.0
A122: Test Case 9 - DDC Tuning
A123: Signal Generator
A124: RF Power | B124: IF Power | C124: RF Frequency | D124: IF Frequency | E124: Command | F124: Response | H124: Timeout | I124: Attempts | J124: Block Size | K124: RF Channel | L124: IF Channel | M124: # Samples | N124: Averaging | O124: Low Limit | P124: High Limit
A125: -50 | C125: 1710.2 | E125: TDOA 91# # # 1 63 -16 # 0 0 1 0 0 0 0 1 # 0 | F125: TDOA | H125: 5.0 | I125: 2 | J125: 256 | K125: 512 | L125: 1 | M125: 1024 | N125: 1 | O125: 29 | P125: 9999
A127: -50 | C127: 1715 | E127: TDOA 92# # # 1 63 -16 # 0 0 1 0 0 0 0 1 # 0 | F127: TDOA | H127: 5.0 | I127: 2 | J127: 256 | K127: 536 | L127: 25 | M127: 1024 | N127: 1 | O127: 29 | P127: 9999
A128: -50 | C128: 1719.6 | E128: TDOA 93# # # 1 63 -16 # 0 0 1 0 0 0 0 1 # 0 | F128: TDOA | H128: 5.0 | I128: 2 | J128: 256 | K128: 559 | L128: 48 | M128: 1024 | N128: 1 | O128: 29 | P128: 9999
A129: -50 | C129: 1724.2 | E129: TDOA 94# # # 1 63 -16 # 0 0 1 0 0 0 0 1 # 0 | F129: TDOA | H129: 5.0 | I129: 2 | J129: 256 | K129: 582 | L129: 71 | M129: 1024 | N129: 1 | O129: 29 | P129: 9999
A130: -50 | C130: 1729 | E130: TDOA 95# # # 1 63 -16 # 0 0 1 0 0 0 0 1 # 0 | F130: TDOA | H130: 5.0 | I130: 2 | J130: 256 | K130: 606 | L130: 95 | M130: 1024 | N130: 1 | O130: 29 | P130: 9999
A131: -50 | C131: 1733.6 | E131: TDOA 96# # # 1 63 -16 # 0 0 1 0 0 0 0 1 # 0 | F131: TDOA | H131: 5.0 | I131: 2 | J131: 256 | K131: 629 | L131: 118 | M131: 1024 | N131: 1 | O131: 29 | P131: 9999
A132: -50 | C132: 1738.2 | E132: TDOA 97# # # 1 63 -16 # 0 0 1 0 0 0 0 1 # 0 | F132: TDOA | H132: 5.0 | I132: 2 | J132: 256 | K132: 652 | L132: 16 | M132: 1024 | N132: 1 | O132: 29 | P132: 9999
A133: -50 | C133: 1743 | E133: TDOA 98# # # 1 63 -16 # 0 0 1 0 0 0 0 1 # 0 | F133: TDOA | H133: 5.0 | I133: 2 | J133: 256 | K133: 676 | L133: 40 | M133: 1024 | N133: 1 | O133: 29 | P133: 9999
A134: -50 | C134: 1747.4 | E134: TDOA 99# # # 1 63 -16 # 0 0 1 0 0 0 0 1 # 0 | F134: TDOA | H134: 5.0 | I134: 2 | J134: 256 | K134: 698 | L134: 62 | M134: 1024 | N134: 1 | O134: 29 | P134: 9999
A135: -50 | C135: 1747.6 | E135: TDOA 190# # # 1 63 -16 # 0 0 1 0 0 0 0 1 # 0 | F135: TDOA | H135: 5.0 | I135: 2 | J135: 256 | K135: 699 | L135: 63 | M135: 1024 | N135: 1 | O135: 29 | P135: 9999
A136: -50 | C136: 1752.4 | E136: TDOA 191# # # 1 63 -16 # 0 0 1 0 0 0 0 1 # 0 | F136: TDOA | H136: 5.0 | I136: 2 | J136: 256 | K136: 723 | L136: 87 | M136: 1024 | N136: 1 | O136: 29 | P136: 9999
A137: -50 | C137: 1757 | E137: TDOA 192# # # 1 63 -16 # 0 0 1 0 0 0 0 1 # 0 | F137: TDOA | H137: 5.0 | I137: 2 | J137: 256 | K137: 746 | L137: 110 | M137: 1024 | N137: 1 | O137: 29 | P137: 9999
A138: -50 | C138: 1761.6 | E138: TDOA 193# # # 1 63 -16 # 0 0 1 0 0 0 0 1 # 0 | F138: TDOA | H138: 5.0 | I138: 2 | J138: 256 | K138: 769 | L138: 8 | M138: 1024 | N138: 1 | O138: 29 | P138: 9999
A139: -50 | C139: 1766.4 | E139: TDOA 194# # # 1 63 -16 # 0 0 1 0 0 0 0 1 # 0 | F139: TDOA | H139: 5.0 | I139: 2 | J139: 256 | K139: 793 | L139: 32 | M139: 1024 | N139: 1 | O139: 29 | P139: 9999
A140: -50 | C140: 1771 | E140: TDOA 195# # # 1 63 -16 # 0 0 1 0 0 0 0 1 # 0 | F140: TDOA | H140: 5.0 | I140: 2 | J140: 256 | K140: 816 | L140: 55 | M140: 1024 | N140: 1 | O140: 29 | P140: 9999
A141: -50 | C141: 1775.6 | E141: TDOA 196# # # 1 63 -16 # 0 0 1 0 0 0 0 1 # 0 | F141: TDOA | H141: 5.0 | I141: 2 | J141: 256 | K141: 839 | L141: 78 | M141: 1024 | N141: 1 | O141: 29 | P141: 9999
A142: -50 | C142: 1780.4 | E142: TDOA 197# # # 1 63 -16 # 0 0 1 0 0 0 0 1 # 0 | F142: TDOA | H142: 5.0 | I142: 2 | J142: 256 | K142: 863 | L142: 102 | M142: 1024 | N142: 1 | O142: 29 | P142: 9999
A143: -50 | C143: 1784.8 | E143: TDOA 198# # # 1 63 -16 # 0 0 1 0 0 0 0 1 # 0 | F143: TDOA | H143: 5.0 | I143: 2 | J143: 256 | K143: 885 | L143: 124 | M143: 1024 | N143: 1 | O143: 29 | P143: 9999
A147: Test Case 12 - Mini-RLS
A148: Signal Generator | C148: LMU Command
A149: RF Power | B149: RF Frequency | C149: Command Set | G149: Block Size | H149: # Blocks | I149: RF Channel | J149: # Samples | K149: |delay| (nsec) | L149: Phase Curvature | M149: Repeat and Average
A150: -40 | B150: 1850.2 | C150: CommandSequence12B | G150: 256 | H150: 4 | I150: 512 | J150: 1024 | K150: 150 | L150: 0.5 | M150: 2
A151: -40 | B151: =R[-1]C+0.2 -> 1850.4 | C151: CommandSequence12B | G151: 256 | H151: 4 | I151: =R[-1]C+1 -> 513 | J151: 1024 | K151: 150 | L151: 0.5 | M151: 2
A152: -40 | B152: 1880.01 | C152: CommandSequence12A | G152: 256 | H152: 4 | I152: 33769 | J152: 1024 | K152: 150 | L152: 0.5 | M152: 2
A153: -40 | B153: =R[-1]C+0.03 -> 1880.04 | C153: CommandSequence12A | G153: 256 | H153: 4 | I153: =R[-1]C+1 -> 33770 | J153: 1024 | K153: 150 | L153: 0.5 | M153: 2
A156: Test Case 13 - Config Attenuator
A157: Signal Generator
A158: RF Power | B158: IF Power | C158: RF Frequency | D158: IF Frequency | E158: Command | F158: Response | H158: Timeout | I158: Attempts | J158: Block Size | K158: RF Channel | L158: IF Channel | M158: TTG Channel | N158: # Samples | O158: Cnfg Attn Setting | P158: Averaging | Q158: Low Limit from previous level (dBm) | R158: High Limit from previous level (dBm)
A159: -50 | B159: -50 | C159: 1747 | D159: 70 | E159: TDOA 71# # # 1 63 -16 # 0 0 1 0 0 0 0 1 # 0 | F159: TDOA | H159: 5 | I159: 2 | J159: 256 | K159: 696 | L159: 60 | M159: 696 | N159: 1024 | O159: 0 | P159: 1 | Q159: -60 | R159: 0
A160: -50 | B160: -50 | C160: 1747 | D160: 70 | E160: TDOA 72# # # 1 63 -16 # 0 0 1 0 0 0 0 1 # 0 | F160: TDOA | H160: 5 | I160: 2 | J160: 256 | K160: 696 | L160: 60 | M160: 696 | N160: 1024 | O160: -8 | P160: 1 | Q160: -10 | R160: -6
A161: -50 | B161: -50 | C161: 1747 | D161: 70 | E161: TDOA 73# # # 1 63 -16 # 0 0 1 0 0 0 0 1 # 0 | F161: TDOA | H161: 5 | I161: 2 | J161: 256 | K161: 696 | L161: 60 | M161: 696 | N161: 1024 | O161: -10 | P161: 1 | Q161: -3.3 | R161: -0.7
A162: -50 | B162: -50 | C162: 1747 | D162: 70 | E162: TDOA 74# # # 1 63 -16 # 0 0 1 0 0 0 0 1 # 0 | F162: TDOA | H162: 5 | I162: 2 | J162: 256 | K162: 696 | L162: 60 | M162: 696 | N162: 1024 | O162: 6 | P162: 1 | Q162: 13.5 | R162: 18.5
A163: -50 | B163: -50 | C163: 1747 | D163: 70 | E163: TDOA 75# # # 1 63 -16 # 0 0 1 0 0 0 0 1 # 0 | F163: TDOA | H163: 5 | I163: 2 | J163: 256 | K163: 696 | L163: 60 | M163: 696 | N163: 1024 | O163: 2 | P163: 1 | Q163: -5.5 | R163: -2.5
A164: -50 | B164: -50 | C164: 1747 | D164: 70 | E164: TDOA 76# # # 1 63 -16 # 0 0 1 0 0 0 0 1 # 0 | F164: TDOA | H164: 5 | I164: 2 | J164: 256 | K164: 696 | L164: 60 | M164: 696 | N164: 1024 | O164: 1 | P164: 1 | Q164: -2 | R164: 0
A169: LO PLL
A170: 1023.5 MHz | D170: 1038.5 MHz | G170: 1043.5 MHz | J170: 1063.5 MHz
A171: eng | D171: eng | G171: eng | J171: eng
A172: TEST 7 5 4 3 0x00 0x00 0xD3 | D172: TEST 7 5 4 3 0x00 0x00 0xD3 | G172: TEST 7 5 4 3 0x00 0x00 0xD3 | J172: TEST 7 5 4 3 0x00 0x00 0xD3
A173: TEST 7 5 4 3 0x00 0x00 0x50 | D173: TEST 7 5 4 3 0x00 0x00 0x50 | G173: TEST 7 5 4 3 0x00 0x00 0x50 | J173: TEST 7 5 4 3 0x00 0x00 0x50
A174: TEST 7 5 4 3 0x00 0x1F 0xFD | D174: TEST 7 5 4 3 0x00 0x20 0x75 | G174: TEST 7 5 4 3 0x00 0x20 0x9D | J174: TEST 7 5 4 3 0x00 0x21 0x3D
A175: exit | D175: exit | G175: exit | J175: exit
A178: TTG Freq
A179: 1880.0 MHZ | B179: Response | D179: Timeout | E179: Begin State | F179: End State | G179: Attempts
A180: eng | D180: 0.5 | E180: DSHELL | F180: DSHELL | G180: 1
A181: TEST 7 5 4 5 0x00 0x00 0xD3 | D181: 1 | E181: DSHELL | F181: DSHELL | G181: 1
A182: TEST 7 5 4 5 0x00 0x00 0x50 | D182: 1 | E182: DSHELL | F182: DSHELL | G182: 1
A183: TEST 7 5 4 5 0x00 0x36 0x99 | D183: 1 | E183: DSHELL | F183: DSHELL | G183: 1
A184: exit | D184: 0.5 | E184: DSHELL | F184: DSHELL | G184: 1
A188: Gain Setup
A189: Setup | B189: Response | D189: Timeout | E189: Begin State | F189: End State | G189: Attempts
A190: bdcgain 1 43 | D190: 0.5 | E190: DSHELL | F190: DSHELL | G190: 1
A191: bdcgain 2 43 | D191: 0.5 | E191: DSHELL | F191: DSHELL | G191: 1
A192: bdcgain 3 43 | D192: 0.5 | E192: DSHELL | F192: DSHELL | G192: 1
A193: bdcgain 4 43 | D193: 0.5 | E193: DSHELL | F193: DSHELL | G193: 1
A194: bdcgain 5 43 | D194: 0.5 | E194: DSHELL | F194: DSHELL | G194: 1
A195: bdcgain 6 43 | D195: 0.5 | E195: DSHELL | F195: DSHELL | G195: 1
A198: Config Atten Setup
A199: Setup | B199: Response | D199: Timeout | E199: Begin State | F199: End State | G199: Attempts
A200: bdcgain 1 35varGain | D200: 0.5 | E200: DSHELL | F200: ENG | G200: 1
A201: bdcgain 2 35varGain | D201: 0.5 | E201: DSHELL | F201: ENG | G201: 1
A202: bdcgain 3 35varGain | D202: 0.5 | E202: DSHELL | F202: ENG | G202: 1
A203: bdcgain 4 35varGain | D203: 0.5 | E203: DSHELL | F203: ENG | G203: 1
A204: bdcgain 5 35varGain | D204: 0.5 | E204: DSHELL | F204: ENG | G204: 1
A205: bdcgain 6 35varGain | D205: 0.5 | E205: DSHELL | F205: ENG | G205: 1
A209: Data Path Settings
A210: Data Path 1 | D210: Timeout | E210: Begin State | F210: End State | G210: Attempts
A211: eng | D211: 0.5 | E211: DSHELL | F211: ENG | G211: 1
A212: Test 1 1 0 0 0 | D212: 0.5 | E212: ENG | F212: ENG | G212: 1
A213: exit | D213: 0.5 | E213: ENG | F213: DSHELL | G213: 1
A216: Data Path 2 | D216: Timeout | E216: Begin State | F216: End State | G216: Attempts
A217: eng | D217: 0.5 | E217: DSHELL | F217: ENG | G217: 1
A218: Test 1 0 1 0 0 | D218: 0.5 | E218: ENG | F218: ENG | G218: 1
A219: exit | D219: 0.5 | E219: ENG | F219: DSHELL | G219: 1
A222: Data Path 3 | D222: Timeout | E222: Begin State | F222: End State | G222: Attempts
A223: eng | D223: 0.5 | E223: DSHELL | F223: ENG | G223: 1
A224: Test 1 0 0 1 0 | D224: 0.5 | E224: ENG | F224: ENG | G224: 1
A225: exit | D225: 0.5 | E225: ENG | F225: DSHELL | G225: 1
A228: Data Path 4 | D228: Timeout | E228: Begin State | F228: End State | G228: Attempts
A229: eng | D229: 0.5 | E229: DSHELL | F229: ENG | G229: 1
A230: Test 1 0 0 0 1 | D230: 0.5 | E230: ENG | F230: ENG | G230: 1
A231: exit | D231: 0.5 | E231: ENG | F231: DSHELL | G231: 1
A234: Data Path 5 | D234: Timeout | E234: Begin State | F234: End State | G234: Attempts
A235: eng | D235: 0.5 | E235: DSHELL | F235: ENG | G235: 1
A236: Test 1 1 1 1 1 | D236: 0.5 | E236: ENG | F236: ENG | G236: 1
A237: exit | D237: 0.5 | E237: ENG | F237: DSHELL | G237: 1
A240: Compensation Settings
A241: Receiver compensated gain | D241: Timeout | E241: Begin State | F241: End State | G241: Attempts
A242: eng | D242: 0.5 | E242: DSHELL | F242: ENG | G242: 1
A243: Test 4 0xA0 0x48 6 | B243: DATA Read: | D243: 1 | E243: ENG | F243: ENG | G243: 1
A244: TEST 4 0xA0 0x1F 1 | B244: DATA Read: 41 | D244: 1 | E244: ENG | F244: ENG | G244: 1
A245: Test 4 0xA0 0x30 6 | B245: DATA Read: | D245: 1 | E245: ENG | F245: ENG | G245: 1
A246: exit | D246: 0.5 | E246: ENG | F246: DSHELL | G246: 1
A249: TTG compensated Level | D249: Timeout | E249: Begin State | F249: End State | G249: Attempts
A250: eng | D250: 0.5 | E250: DSHELL | F250: ENG | G250: 1
A251: Test 4 0xA0 0x42 6 | B251: DATA Read: | D251: 1 | E251: ENG | F251: ENG | G251: 1
A252: TEST 4 0xA0 0x1F 1 | B252: DATA Read: 41 | D252: 1 | E252: ENG | F252: ENG | G252: 1 | H252: Note: | I252: If we get DATA Read: 41, then the software will skip
A253: Test 4 0xA0 0x2A 6 | B253: DATA Read: | D253: 1 | E253: ENG | F253: ENG | G253: 1 | I253: over the next line and go directly to exit
A254: exit | D254: 0.5 | E254: ENG | F254: DSHELL | G254: 1
A257: Receiver Gain Compensation | D257: Timeout | E257: Begin State | F257: End State | G257: Attempts
A258: eng | D258: 0.5 | E258: DSHELL | F258: ENG | G258: 1
A259: TEST 4 0xA0 0x1F 1 | B259: DATA Read: 41 | D259: 0.5 | E259: ENG | F259: ENG | G259: 1
A260: Test 4 0xA0 0x20 6 | B260: DATA Read: | D260: 0.5 | E260: ENG | F260: ENG | G260: 1
A261: exit | D261: 0.5 | E261: ENG | F261: DSHELL | G261: 1
A264: EnableTTG | B264: Response | D264: Timeout | E264: Begin State | F264: End State | G264: Attempts
A265: eng | D265: 0.5 | E265: DSHELL | F265: ENG | G265: 1
A266: TEST 7 3 8 6 8 | D266: 0.5 | E266: ENG | F266: ENG | G266: 1
A267: TEST 7 3 4 4 5 | D267: 0.5 | E267: ENG | F267: ENG | G267: 1
A268: TEST 7 3 4 6 1 | D268: 0.5 | E268: ENG | F268: ENG | G268: 1
A269: exit | D269: 0.5 | E269: ENG | F269: DSHELL | G269: 1
A272: DisableTTG | D272: Timeout | E272: Begin State | F272: End State | G272: Attempts
A273: eng | D273: 0.5 | E273: DSHELL | F273: ENG | G273: 1
A274: TEST 7 3 8 6 5 | D274: 0.5 | E274: ENG | F274: ENG | G274: 1
A275: TEST 7 3 4 4 1 | D275: 0.5 | E275: ENG | F275: ENG | G275: 1
A276: TEST 7 3 4 6 0 | D276: 0.5 | E276: ENG | F276: ENG | G276: 1
A277: exit | D277: 0.5 | E277: ENG | F277: DSHELL | G277: 1
A280: Mute On | D280: Timeout | E280: Begin State | F280: End State | G280: Attempts
A281: eng | D281: 0.5 | E281: DSHELL | F281: ENG | G281: 1
A282: TEST 7 3 8 6 8 | D282: 0.5 | E282: ENG | F282: ENG | G282: 1
A283: exit | D283: 0.5 | E283: ENG | F283: DSHELL | G283: 1
A286: Mute Off | D286: Timeout | E286: Begin State | F286: End State | G286: Attempts
A287: eng | D287: 0.5 | E287: DSHELL | F287: ENG | G287: 1
A288: TEST 7 3 8 6 5 | D288: 0.5 | E288: ENG | F288: ENG | G288: 1
A289: exit | D289: 0.5 | E289: ENG | F289: DSHELL | G289: 1
A292: Change Admin State
A293: Command | B293: Response | D293: Timeout | E293: Begin State | F293: End State | G293: # of retries
A294: etest 15 1 | D294: 2 | E294: DSHELL | F294: DSHELL | G294: 1
A298: Check Alarms
A299: Command | B299: Response | D299: Timeout | E299: Begin State | F299: End State | G299: # of retries
A300: ALARMS | B300: FAULT_GPS_HOLDOVER | D300: 2 | E300: DSHELL | F300: DSHELL | G300: 1
A304: Mini-RLS Command Sequence 12A (AMPS)
A305: Command | B305: Response | D305: Timeout | E305: Begin State | F305: End State | G305: # of retries
A306: ALARMS | B306: FAULT_GPS_HOLDOVER | D306: 2 | E306: DSHELL | F306: DSHELL | G306: 1
A307: TIME | B307: GPS Time: | D307: 2 | E307: DSHELL | F307: DSHELL | G307: 2
A308: SVCR # # 2 # # 0 1 0 0 0 1 1 1 # 0 0 | B308: returnCode 0 | D308: 2 | E308: DSHELL | F308: DSHELL | G308: 1
A309: WAIT | D309: 15 | E309: DSHELL | F309: DSHELL | G309: 1
A310: TDATA # 0 2 # # # -16 0 1 0 0 11 0 63 -16 | B310: TDOA | D310: 15 | E310: DSHELL | F310: DSHELL | G310: 1
A314: Mini-RLS Command Sequence 12B (GSM)
A315: Command | B315: Response | D315: Timeout | E315: Begin State | F315: End State | G315: # of retries
A316: ALARMS | B316: FAULT_GPS_HOLDOVER | D316: 2 | E316: DSHELL | F316: DSHELL | G316: 1
A317: TIME | B317: GPS Time: | D317: 2 | E317: DSHELL | F317: DSHELL | G317: 2
A318: GVCR # 2 # # 0 # 0 # # 17 1 0 0 0 0 0 0 1 1 1 8 0 0 0 0 0 0 0 0 0 0 0 | B318: returnCode 0 | D318: 2 | E318: DSHELL | F318: DSHELL | G318: 1
A319: WAIT | D319: 15 | E319: DSHELL | F319: DSHELL | G319: 1
A320: TDATA # 0 2 # # # -16 0 1 0 0 11 0 63 -16 | B320: TDOA | D320: 15 | E320: DSHELL | F320: DSHELL | G320: 1

Sheet: 06164001
B2: Factors | F2: Temperature Coefficient
B3: TTG | C3: 200
B4: Gain | C4: 200 | F4: -3.5000000000000003E-2 | H4: dB/deg
B5: TTG Comp | C5: 200
B6: Gain Factor | C6: 200
F8: Center Temperature
F10: 30 | H10: deg
A16: Test Case 3 - SNR
A17: Signal Generator
A18: RF Power | B18: IF Power | C18: RF Frequency | D18: IF Frequency | E18: Command | F18: Response | H18: Timeout | I18: Attempts | J18: Block Size | K18: RF Channel | L18: IF Channel | M18: TTG Channel | N18: # Samples | O18: Averaging | P18: Low Limit | Q18: High Limit
A19: -40 | C19: 1710.2 | E19: TDOA 31# # # 1 63 -16 # 0 0 1 0 0 0 0 1 # 0 | F19: TDOA | H19: 5.0 | I19: 2 | J19: 256 | K19: 512 | L19: 1 | M19: 696 | N19: 1024 | O19: 1 | P19: 29 | Q19: 9999
A21: -40 | C21: 1715 | E21: TDOA 32# # # 1 63 -16 # 0 0 1 0 0 0 0 1 # 0 | F21: TDOA | H21: 5.0 | I21: 2 | J21: 256 | K21: 536 | L21: 25 | M21: 696 | N21: 1024 | O21: 1 | P21: 29 | Q21: 9999
A22: -40 | C22: 1719.6 | E22: TDOA 33# # # 1 63 -16 # 0 0 1 0 0 0 0 1 # 0 | F22: TDOA | H22: 5.0 | I22: 2 | J22: 256 | K22: 559 | L22: 48 | M22: 696 | N22: 1024 | O22: 1 | P22: 29 | Q22: 9999
A23: -40 | C23: 1724.2 | E23: TDOA 34# # # 1 63 -16 # 0 0 1 0 0 0 0 1 # 0 | F23: TDOA | H23: 5.0 | I23: 2 | J23: 256 | K23: 582 | L23: 71 | M23: 696 | N23: 1024 | O23: 1 | P23: 29 | Q23: 9999
A24: -40 | C24: 1729 | E24: TDOA 35# # # 1 63 -16 # 0 0 1 0 0 0 0 1 # 0 | F24: TDOA | H24: 5.0 | I24: 2 | J24: 256 | K24: 606 | L24: 95 | M24: 696 | N24: 1024 | O24: 1 | P24: 29 | Q24: 9999
A25: -40 | C25: 1733.6 | E25: TDOA 36# # # 1 63 -16 # 0 0 1 0 0 0 0 1 # 0 | F25: TDOA | H25: 5.0 | I25: 2 | J25: 256 | K25: 629 | L25: 118 | M25: 696 | N25: 1024 | O25: 1 | P25: 29 | Q25: 9999
A26: -40 | C26: 1738.2 | E26: TDOA 37# # # 1 63 -16 # 0 0 1 0 0 0 0 1 # 0 | F26: TDOA | H26: 5.0 | I26: 2 | J26: 256 | K26: 652 | L26: 16 | M26: 696 | N26: 1024 | O26: 1 | P26: 29 | Q26: 9999
A27: -40 | C27: 1743 | E27: TDOA 38# # # 1 63 -16 # 0 0 1 0 0 0 0 1 # 0 | F27: TDOA | H27: 5.0 | I27: 2 | J27: 256 | K27: 676 | L27: 40 | M27: 696 | N27: 1024 | O27: 1 | P27: 29 | Q27: 9999
A28: -40 | C28: 1747.4 | E28: TDOA 39# # # 1 63 -16 # 0 0 1 0 0 0 0 1 # 0 | F28: TDOA | H28: 5.0 | I28: 2 | J28: 256 | K28: 698 | L28: 62 | M28: 696 | N28: 1024 | O28: 1 | P28: 29 | Q28: 9999
A29: -40 | C29: 1747.6 | E29: TDOA 130# # # 1 63 -16 # 0 0 1 0 0 0 0 1 # 0 | F29: TDOA | H29: 5.0 | I29: 2 | J29: 256 | K29: 699 | L29: 63 | M29: 696 | N29: 1024 | O29: 1 | P29: 29 | Q29: 9999
A30: -40 | C30: 1752.4 | E30: TDOA 131# # # 1 63 -16 # 0 0 1 0 0 0 0 1 # 0 | F30: TDOA | H30: 5.0 | I30: 2 | J30: 256 | K30: 723 | L30: 87 | M30: 696 | N30: 1024 | O30: 1 | P30: 29 | Q30: 9999
A31: -40 | C31: 1757 | E31: TDOA 132# # # 1 63 -16 # 0 0 1 0 0 0 0 1 # 0 | F31: TDOA | H31: 5.0 | I31: 2 | J31: 256 | K31: 746 | L31: 110 | M31: 696 | N31: 1024 | O31: 1 | P31: 29 | Q31: 9999
A32: -40 | C32: 1761.6 | E32: TDOA 133# # # 1 63 -16 # 0 0 1 0 0 0 0 1 # 0 | F32: TDOA | H32: 5.0 | I32: 2 | J32: 256 | K32: 769 | L32: 8 | M32: 696 | N32: 1024 | O32: 1 | P32: 29 | Q32: 9999
A33: -40 | C33: 1766.4 | E33: TDOA 134# # # 1 63 -16 # 0 0 1 0 0 0 0 1 # 0 | F33: TDOA | H33: 5.0 | I33: 2 | J33: 256 | K33: 793 | L33: 32 | M33: 696 | N33: 1024 | O33: 1 | P33: 29 | Q33: 9999
A34: -40 | C34: 1771 | E34: TDOA 135# # # 1 63 -16 # 0 0 1 0 0 0 0 1 # 0 | F34: TDOA | H34: 5.0 | I34: 2 | J34: 256 | K34: 816 | L34: 55 | M34: 696 | N34: 1024 | O34: 1 | P34: 29 | Q34: 9999
A35: -40 | C35: 1775.6 | E35: TDOA 136# # # 1 63 -16 # 0 0 1 0 0 0 0 1 # 0 | F35: TDOA | H35: 5.0 | I35: 2 | J35: 256 | K35: 839 | L35: 78 | M35: 696 | N35: 1024 | O35: 1 | P35: 29 | Q35: 9999
A36: -40 | C36: 1780.4 | E36: TDOA 137# # # 1 63 -16 # 0 0 1 0 0 0 0 1 # 0 | F36: TDOA | H36: 5.0 | I36: 2 | J36: 256 | K36: 863 | L36: 102 | M36: 696 | N36: 1024 | O36: 1 | P36: 29 | Q36: 9999
A37: -40 | C37: 1784.8 | E37: TDOA 138# # # 1 63 -16 # 0 0 1 0 0 0 0 1 # 0 | F37: TDOA | H37: 5.0 | I37: 2 | J37: 256 | K37: 885 | L37: 124 | M37: 696 | N37: 1024 | O37: 1 | P37: 29 | Q37: 9999
A41: Test Case 5 - Two-Tone Response
B42: SigGen1 | D42: SigGen2
A43: Center RF Channel | B43: RF Frequency | C43: RF Power | D43: RF Frequency | E43: Command | F43: Response | H43: Timeout | I43: Attempts | J43: Block Size | K43: Lower Channel | L43: Upper Channel | M43: # Samples | N43: Cnfg Attn | O43: Averaging | P43: Low Limit | Q43: High Limit | R43: Lower Channel Delta | S43: Upper Channel Delta
B44: 1710.34 | C44: -45 | D44: 1710.46 | E44: TDOA 51# # # 1 63 -16 # 0 0 1 0 0 0 0 1 # 0 | F44: TDOA | H44: 5.0 | I44: 2 | J44: 256 | K44: 513 | L44: 513 | M44: 1024 | N44: 15 | O44: 1 | P44: -999 | Q44: -60 | R44: 1 | S44: 1
B46: 1714.94 | C46: -45 | D46: 1715.06 | E46: TDOA 52# # # 1 63 -16 # 0 0 1 0 0 0 0 1 # 0 | F46: TDOA | H46: 5.0 | I46: 2 | J46: 256 | K46: 536 | L46: 536 | M46: 1024 | N46: 15 | O46: 1 | P46: -999 | Q46: -60 | R46: 1 | S46: 1
B47: 1719.54 | C47: -45 | D47: 1719.66 | E47: TDOA 53# # # 1 63 -16 # 0 0 1 0 0 0 0 1 # 0 | F47: TDOA | H47: 5.0 | I47: 2 | J47: 256 | K47: 559 | L47: 559 | M47: 1024 | N47: 15 | O47: 1 | P47: -999 | Q47: -60 | R47: 1 | S47: 1
B48: 1724.14 | C48: -45 | D48: 1724.26 | E48: TDOA 54# # # 1 63 -16 # 0 0 1 0 0 0 0 1 # 0 | F48: TDOA | H48: 5.0 | I48: 2 | J48: 256 | K48: 582 | L48: 582 | M48: 1024 | N48: 15 | O48: 1 | P48: -999 | Q48: -60 | R48: 1 | S48: 1
B49: 1728.94 | C49: -45 | D49: 1729.06 | E49: TDOA 55# # # 1 63 -16 # 0 0 1 0 0 0 0 1 # 0 | F49: TDOA | H49: 5.0 | I49: 2 | J49: 256 | K49: 606 | L49: 606 | M49: 1024 | N49: 15 | O49: 1 | P49: -999 | Q49: -60 | R49: 1 | S49: 1
B50: 1733.54 | C50: -45 | D50: 1733.66 | E50: TDOA 56# # # 1 63 -16 # 0 0 1 0 0 0 0 1 # 0 | F50: TDOA | H50: 5.0 | I50: 2 | J50: 256 | K50: 629 | L50: 629 | M50: 1024 | N50: 15 | O50: 1 | P50: -999 | Q50: -60 | R50: 1 | S50: 1
B51: 1738.14 | C51: -45 | D51: 1738.26 | E51: TDOA 57# # # 1 63 -16 # 0 0 1 0 0 0 0 1 # 0 | F51: TDOA | H51: 5.0 | I51: 2 | J51: 256 | K51: 652 | L51: 652 | M51: 1024 | N51: 15 | O51: 1 | P51: -999 | Q51: -60 | R51: 1 | S51: 1
B52: 1742.94 | C52: -45 | D52: 1743.06 | E52: TDOA 58# # # 1 63 -16 # 0 0 1 0 0 0 0 1 # 0 | F52: TDOA | H52: 5.0 | I52: 2 | J52: 256 | K52: 676 | L52: 676 | M52: 1024 | N52: 15 | O52: 1 | P52: -999 | Q52: -60 | R52: 1 | S52: 1
B53: 1747.34 | C53: -45 | D53: 1747.46 | E53: TDOA 59# # # 1 63 -16 # 0 0 1 0 0 0 0 1 # 0 | F53: TDOA | H53: 5.0 | I53: 2 | J53: 256 | K53: 698 | L53: 698 | M53: 1024 | N53: 15 | O53: 1 | P53: -999 | Q53: -60 | R53: 1 | S53: 1
B54: 1747.54 | C54: -45 | D54: 1747.66 | E54: TDOA 150# # # 1 63 -16 # 0 0 1 0 0 0 0 1 # 0 | F54: TDOA | H54: 5.0 | I54: 2 | J54: 256 | K54: 699 | L54: 699 | M54: 1024 | N54: 15 | O54: 1 | P54: -999 | Q54: -60 | R54: 1 | S54: 1
B55: 1752.34 | C55: -45 | D55: 1752.46 | E55: TDOA 151# # # 1 63 -16 # 0 0 1 0 0 0 0 1 # 0 | F55: TDOA | H55: 5.0 | I55: 2 | J55: 256 | K55: 723 | L55: 723 | M55: 1024 | N55: 15 | O55: 1 | P55: -999 | Q55: -60 | R55: 1 | S55: 1
B56: 1756.94 | C56: -45 | D56: 1757.06 | E56: TDOA 152# # # 1 63 -16 # 0 0 1 0 0 0 0 1 # 0 | F56: TDOA | H56: 5.0 | I56: 2 | J56: 256 | K56: 746 | L56: 746 | M56: 1024 | N56: 15 | O56: 1 | P56: -999 | Q56: -60 | R56: 1 | S56: 1
A61: Test Case 6 - Phase Noise
A62: Signal Generator
A63: RF Power | B63: IF Power | C63: RF Frequency | D63: IF Frequency | E63: Command | F63: Response | H63: Timeout | I63: Attempts | J63: Block Size | K63: RF Channel | L63: IF Channel | M63: # Samples | N63: Averaging | O63: Low Limit | P63: High Limit
A64: -40 | C64: 1710.2 | E64: TDOA 61# # # 1 63 -16 # 0 0 1 0 0 0 0 1 # 0 | F64: TDOA | H64: 5.0 | I64: 2 | J64: 256 | K64: 512 | L64: 1 | M64: 1024 | N64: 8 | O64: 0 | P64: 3
A66: -40 | C66: 1715 | E66: TDOA 62# # # 1 63 -16 # 0 0 1 0 0 0 0 1 # 0 | F66: TDOA | H66: 5.0 | I66: 2 | J66: 256 | K66: 536 | L66: 25 | M66: 1024 | N66: 8 | O66: 0 | P66: 3
A67: -40 | C67: 1719.6 | E67: TDOA 63# # # 1 63 -16 # 0 0 1 0 0 0 0 1 # 0 | F67: TDOA | H67: 5.0 | I67: 2 | J67: 256 | K67: 559 | L67: 48 | M67: 1024 | N67: 8 | O67: 0 | P67: 3
A68: -40 | C68: 1724.2 | E68: TDOA 64# # # 1 63 -16 # 0 0 1 0 0 0 0 1 # 0 | F68: TDOA | H68: 5.0 | I68: 2 | J68: 256 | K68: 582 | L68: 71 | M68: 1024 | N68: 8 | O68: 0 | P68: 3
A69: -40 | C69: 1729 | E69: TDOA 65# # # 1 63 -16 # 0 0 1 0 0 0 0 1 # 0 | F69: TDOA | H69: 5.0 | I69: 2 | J69: 256 | K69: 606 | L69: 95 | M69: 1024 | N69: 8 | O69: 0 | P69: 3
A70: -40 | C70: 1733.6 | E70: TDOA 66# # # 1 63 -16 # 0 0 1 0 0 0 0 1 # 0 | F70: TDOA | H70: 5.0 | I70: 2 | J70: 256 | K70: 629 | L70: 118 | M70: 1024 | N70: 8 | O70: 0 | P70: 3
A71: -40 | C71: 1738.2 | E71: TDOA 67# # # 1 63 -16 # 0 0 1 0 0 0 0 1 # 0 | F71: TDOA | H71: 5.0 | I71: 2 | J71: 256 | K71: 652 | L71: 16 | M71: 1024 | N71: 8 | O71: 0 | P71: 3
A72: -40 | C72: 1743 | E72: TDOA 68# # # 1 63 -16 # 0 0 1 0 0 0 0 1 # 0 | F72: TDOA | H72: 5.0 | I72: 2 | J72: 256 | K72: 676 | L72: 40 | M72: 1024 | N72: 8 | O72: 0 | P72: 3
A73: -40 | C73: 1747.4 | E73: TDOA 69# # # 1 63 -16 # 0 0 1 0 0 0 0 1 # 0 | F73: TDOA | H73: 5.0 | I73: 2 | J73: 256 | K73: 698 | L73: 62 | M73: 1024 | N73: 8 | O73: 0 | P73: 3
A74: -40 | C74: 1747.6 | E74: TDOA 161# # # 1 63 -16 # 0 0 1 0 0 0 0 1 # 0 | F74: TDOA | H74: 5.0 | I74: 2 | J74: 256 | K74: 699 | L74: 63 | M74: 1024 | N74: 8 | O74: 0 | P74: 3
A75: -40 | C75: 1752.4 | E75: TDOA 162# # # 1 63 -16 # 0 0 1 0 0 0 0 1 # 0 | F75: TDOA | H75: 5.0 | I75: 2 | J75: 256 | K75: 723 | L75: 87 | M75: 1024 | N75: 8 | O75: 0 | P75: 3
A76: -40 | C76: 1757 | E76: TDOA 163# # # 1 63 -16 # 0 0 1 0 0 0 0 1 # 0 | F76: TDOA | H76: 5.0 | I76: 2 | J76: 256 | K76: 746 | L76: 110 | M76: 1024 | N76: 8 | O76: 0 | P76: 3
A77: -40 | C77: 1761.6 | E77: TDOA 164# # # 1 63 -16 # 0 0 1 0 0 0 0 1 # 0 | F77: TDOA | H77: 5.0 | I77: 2 | J77: 256 | K77: 769 | L77: 8 | M77: 1024 | N77: 8 | O77: 0 | P77: 3
A78: -40 | C78: 1766.4 | E78: TDOA 165# # # 1 63 -16 # 0 0 1 0 0 0 0 1 # 0 | F78: TDOA | H78: 5.0 | I78: 2 | J78: 256 | K78: 793 | L78: 32 | M78: 1024 | N78: 8 | O78: 0 | P78: 3
A79: -40 | C79: 1771 | E79: TDOA 166# # # 1 63 -16 # 0 0 1 0 0 0 0 1 # 0 | F79: TDOA | H79: 5.0 | I79: 2 | J79: 256 | K79: 816 | L79: 55 | M79: 1024 | N79: 8 | O79: 0 | P79: 3
A80: -40 | C80: 1775.6 | E80: TDOA 167# # # 1 63 -16 # 0 0 1 0 0 0 0 1 # 0 | F80: TDOA | H80: 5.0 | I80: 2 | J80: 256 | K80: 839 | L80: 78 | M80: 1024 | N80: 8 | O80: 0 | P80: 3
A81: -40 | C81: 1780.4 | E81: TDOA 168# # # 1 63 -16 # 0 0 1 0 0 0 0 1 # 0 | F81: TDOA | H81: 5.0 | I81: 2 | J81: 256 | K81: 863 | L81: 102 | M81: 1024 | N81: 8 | O81: 0 | P81: 3
A82: -40 | C82: 1784.8 | E82: TDOA 169# # # 1 63 -16 # 0 0 1 0 0 0 0 1 # 0 | F82: TDOA | H82: 5.0 | I82: 2 | J82: 256 | K82: 885 | L82: 124 | M82: 1024 | N82: 8 | O82: 0 | P82: 3
A86: Test Case 7 - Data Integrity
A87: Signal Generator
A88: RF Power | B88: IF Power | C88: RF Frequency | D88: IF Frequency | E88: Command | F88: Response | H88: Timeout | I88: Attempts | J88: Block Size | K88: RF Channel | L88: IF Channel | M88: TTG Channel | N88: # Samples | O88: Cnfg Attn | P88: Averaging | Q88: Low Limit | R88: High Limit
A89: -40 | B89: -40 | C89: 1747 | D89: 70 | E89: TDOA 71# # # 1 63 -16 # 0 0 1 0 0 0 0 1 # 0 | F89: TDOA | H89: 5.0 | I89: 2 | J89: 256 | K89: 696 | L89: 60 | M89: 696 | N89: 1024 | O89: 6 | P89: 1 | Q89: 29 | R89: 9999
A90: -40 | B90: -40 | C90: 1747 | D90: 70 | E90: TDOA 72# # # 1 63 -16 # 0 0 1 0 0 0 0 1 # 0 | F90: TDOA | H90: 5.0 | I90: 2 | J90: 256 | K90: 696 | L90: 60 | M90: 696 | N90: 1024 | O90: 6 | P90: 1 | Q90: 29 | R90: 9999
A91: -40 | B91: -40 | C91: 1747 | D91: 70 | E91: TDOA 73# # # 1 63 -16 # 0 0 1 0 0 0 0 1 # 0 | F91: TDOA | H91: 5.0 | I91: 2 | J91: 256 | K91: 696 | L91: 60 | M91: 696 | N91: 1024 | O91: 6 | P91: 1 | Q91: 29 | R91: 9999
A92: -40 | B92: -40 | C92: 1747 | D92: 70 | E92: TDOA 74# # # 1 63 -16 # 0 0 1 0 0 0 0 1 # 0 | F92: TDOA | H92: 5.0 | I92: 2 | J92: 256 | K92: 696 | L92: 60 | M92: 696 | N92: 1024 | O92: 6 | P92: 1 | Q92: 29 | R92: 9999
A93: -40 | B93: -40 | C93: 1747 | D93: 70 | E93: TDOA 75# # # 1 63 -16 # 0 0 1 0 0 0 0 1 # 0 | F93: TDOA | H93: 5.0 | I93: 2 | J93: 256 | K93: 696 | L93: 60 | M93: 696 | N93: 1024 | O93: 6 | P93: 1 | Q93: 29 | R93: 9999
A97: Test Case 8 - Noise Floor
A98: Signal Generator
A99: RF Power | B99: IF Power | C99: RF Frequency | D99: IF Frequency | E99: Command | F99: Response | H99: Timeout | I99: Attempts | J99: Block Size | K99: RF Channel | L99: IF Channel | M99: # Samples | N99: Cnfg Attn | O99: Averaging | P99: Signal Averaging | Q99: Low Limit Noise | R99: High Limit Noise | S99: Low Limit Gain | T99: High Limit Gain
A100: -45 | C100: 1710.2 | E100: TDOA 81# # # 1 63 -16 # 0 0 1 0 0 0 0 1 # 0 | F100: TDOA | H100: 5.0 | I100: 2 | J100: 256 | K100: 512 | L100: 1 | M100: 1024 | N100: 0 | O100: 8 | P100: 1 | Q100: -174 | R100: -121 | S100: 30 | T100: 36
A102: -45 | C102: 1715 | E102: TDOA 82# # # 1 63 -16 # 0 0 1 0 0 0 0 1 # 0 | F102: TDOA | H102: 5.0 | I102: 2 | J102: 256 | K102: 536 | L102: 25 | M102: 1024 | N102: 0 | O102: 8 | P102: 1 | Q102: -174 | R102: -121 | S102: 30 | T102: 36
A103: -45 | C103: 1719.6 | E103: TDOA 83# # # 1 63 -16 # 0 0 1 0 0 0 0 1 # 0 | F103: TDOA | H103: 5.0 | I103: 2 | J103: 256 | K103: 559 | L103: 48 | M103: 1024 | N103: 0 | O103: 8 | P103: 1 | Q103: -174 | R103: -121 | S103: 30 | T103: 36
A104: -45 | C104: 1724.2 | E104: TDOA 84# # # 1 63 -16 # 0 0 1 0 0 0 0 1 # 0 | F104: TDOA | H104: 5.0 | I104: 2 | J104: 256 | K104: 582 | L104: 71 | M104: 1024 | N104: 0 | O104: 8 | P104: 1 | Q104: -174 | R104: -121 | S104: 30 | T104: 36
A105: -45 | C105: 1729 | E105: TDOA 85# # # 1 63 -16 # 0 0 1 0 0 0 0 1 # 0 | F105: TDOA | H105: 5.0 | I105: 2 | J105: 256 | K105: 606 | L105: 95 | M105: 1024 | N105: 0 | O105: 8 | P105: 1 | Q105: -174 | R105: -121 | S105: 30 | T105: 36
A106: -45 | C106: 1733.6 | E106: TDOA 86# # # 1 63 -16 # 0 0 1 0 0 0 0 1 # 0 | F106: TDOA | H106: 5.0 | I106: 2 | J106: 256 | K106: 629 | L106: 118 | M106: 1024 | N106: 0 | O106: 8 | P106: 1 | Q106: -174 | R106: -121 | S106: 30 | T106: 36
A107: -45 | C107: 1738.2 | E107: TDOA 87# # # 1 63 -16 # 0 0 1 0 0 0 0 1 # 0 | F107: TDOA | H107: 5.0 | I107: 2 | J107: 256 | K107: 652 | L107: 16 | M107: 1024 | N107: 0 | O107: 8 | P107: 1 | Q107: -174 | R107: -121 | S107: 30 | T107: 36
A108: -45 | C108: 1743 | E108: TDOA 88# # # 1 63 -16 # 0 0 1 0 0 0 0 1 # 0 | F108: TDOA | H108: 5.0 | I108: 2 | J108: 256 | K108: 676 | L108: 40 | M108: 1024 | N108: 0 | O108: 8 | P108: 1 | Q108: -174 | R108: -121 | S108: 30 | T108: 36
A109: -45 | C109: 1747.4 | E109: TDOA 89# # # 1 63 -16 # 0 0 1 0 0 0 0 1 # 0 | F109: TDOA | H109: 5.0 | I109: 2 | J109: 256 | K109: 698 | L109: 62 | M109: 1024 | N109: 0 | O109: 8 | P109: 1 | Q109: -174 | R109: -121 | S109: 30 | T109: 36
A110: -45 | C110: 1747.6 | E110: TDOA 180# # # 1 63 -16 # 0 0 1 0 0 0 0 1 # 0 | F110: TDOA | H110: 5.0 | I110: 2 | J110: 256 | K110: 699 | L110: 63 | M110: 1024 | N110: 0 | O110: 8 | P110: 1 | Q110: -174 | R110: -121 | S110: 30 | T110: 36
A111: -45 | C111: 1752.4 | E111: TDOA 181# # # 1 63 -16 # 0 0 1 0 0 0 0 1 # 0 | F111: TDOA | H111: 5.0 | I111: 2 | J111: 256 | K111: 723 | L111: 87 | M111: 1024 | N111: 0 | O111: 8 | P111: 1 | Q111: -174 | R111: -121 | S111: 30 | T111: 36
A112: -45 | C112: 1757 | E112: TDOA 182# # # 1 63 -16 # 0 0 1 0 0 0 0 1 # 0 | F112: TDOA | H112: 5.0 | I112: 2 | J112: 256 | K112: 746 | L112: 110 | M112: 1024 | N112: 0 | O112: 8 | P112: 1 | Q112: -174 | R112: -121 | S112: 30 | T112: 36
A113: -45 | C113: 1761.6 | E113: TDOA 183# # # 1 63 -16 # 0 0 1 0 0 0 0 1 # 0 | F113: TDOA | H113: 5.0 | I113: 2 | J113: 256 | K113: 769 | L113: 8 | M113: 1024 | N113: 0 | O113: 8 | P113: 1 | Q113: -174 | R113: -121 | S113: 30 | T113: 36
A114: -45 | C114: 1766.4 | E114: TDOA 184# # # 1 63 -16 # 0 0 1 0 0 0 0 1 # 0 | F114: TDOA | H114: 5.0 | I114: 2 | J114: 256 | K114: 793 | L114: 32 | M114: 1024 | N114: 0 | O114: 8 | P114: 1 | Q114: -174 | R114: -121 | S114: 30 | T114: 36
A115: -45 | C115: 1771 | E115: TDOA 185# # # 1 63 -16 # 0 0 1 0 0 0 0 1 # 0 | F115: TDOA | H115: 5.0 | I115: 2 | J115: 256 | K115: 816 | L115: 55 | M115: 1024 | N115: 0 | O115: 8 | P115: 1 | Q115: -174 | R115: -121 | S115: 30 | T115: 36
A116: -45 | C116: 1775.6 | E116: TDOA 186# # # 1 63 -16 # 0 0 1 0 0 0 0 1 # 0 | F116: TDOA | H116: 5.0 | I116: 2 | J116: 256 | K116: 839 | L116: 78 | M116: 1024 | N116: 0 | O116: 8 | P116: 1 | Q116: -174 | R116: -121 | S116: 30 | T116: 36
A117: -45 | C117: 1780.4 | E117: TDOA 187# # # 1 63 -16 # 0 0 1 0 0 0 0 1 # 0 | F117: TDOA | H117: 5.0 | I117: 2 | J117: 256 | K117: 863 | L117: 102 | M117: 1024 | N117: 0 | O117: 8 | P117: 1 | Q117: -174 | R117: -121 | S117: 30 | T117: 36
A118: -45 | C118: 1784.8 | E118: TDOA 188# # # 1 63 -16 # 0 0 1 0 0 0 0 1 # 0 | F118: TDOA | H118: 5.0 | I118: 2 | J118: 256 | K118: 885 | L118: 124 | M118: 1024 | N118: 0 | O118: 8 | P118: 1 | Q118: -174 | R118: -121 | S118: 30 | T118: 36
A122: Test Case 9 - DDC Tuning
A123: Signal Generator
A124: RF Power | B124: IF Power | C124: RF Frequency | D124: IF Frequency | E124: Command | F124: Response | H124: Timeout | I124: Attempts | J124: Block Size | K124: RF Channel | L124: IF Channel | M124: # Samples | N124: Averaging | O124: Low Limit | P124: High Limit
A125: -40 | C125: 1710.2 | E125: TDOA 91# # # 1 63 -16 # 0 0 1 0 0 0 0 1 # 0 | F125: TDOA | H125: 5.0 | I125: 2 | J125: 256 | K125: 512 | L125: 1 | M125: 1024 | N125: 1 | O125: 29 | P125: 9999
A127: -40 | C127: 1715 | E127: TDOA 92# # # 1 63 -16 # 0 0 1 0 0 0 0 1 # 0 | F127: TDOA | H127: 5.0 | I127: 2 | J127: 256 | K127: 536 | L127: 25 | M127: 1024 | N127: 1 | O127: 29 | P127: 9999
A128: -40 | C128: 1719.6 | E128: TDOA 93# # # 1 63 -16 # 0 0 1 0 0 0 0 1 # 0 | F128: TDOA | H128: 5.0 | I128: 2 | J128: 256 | K128: 559 | L128: 48 | M128: 1024 | N128: 1 | O128: 29 | P128: 9999
A129: -40 | C129: 1724.2 | E129: TDOA 94# # # 1 63 -16 # 0 0 1 0 0 0 0 1 # 0 | F129: TDOA | H129: 5.0 | I129: 2 | J129: 256 | K129: 582 | L129: 71 | M129: 1024 | N129: 1 | O129: 29 | P129: 9999
A130: -40 | C130: 1729 | E130: TDOA 95# # # 1 63 -16 # 0 0 1 0 0 0 0 1 # 0 | F130: TDOA | H130: 5.0 | I130: 2 | J130: 256 | K130: 606 | L130: 95 | M130: 1024 | N130: 1 | O130: 29 | P130: 9999
A131: -40 | C131: 1733.6 | E131: TDOA 96# # # 1 63 -16 # 0 0 1 0 0 0 0 1 # 0 | F131: TDOA | H131: 5.0 | I131: 2 | J131: 256 | K131: 629 | L131: 118 | M131: 1024 | N131: 1 | O131: 29 | P131: 9999
A132: -40 | C132: 1738.2 | E132: TDOA 97# # # 1 63 -16 # 0 0 1 0 0 0 0 1 # 0 | F132: TDOA | H132: 5.0 | I132: 2 | J132: 256 | K132: 652 | L132: 16 | M132: 1024 | N132: 1 | O132: 29 | P132: 9999
A133: -40 | C133: 1743 | E133: TDOA 98# # # 1 63 -16 # 0 0 1 0 0 0 0 1 # 0 | F133: TDOA | H133: 5.0 | I133: 2 | J133: 256 | K133: 676 | L133: 40 | M133: 1024 | N133: 1 | O133: 29 | P133: 9999
A134: -40 | C134: 1747.4 | E134: TDOA 99# # # 1 63 -16 # 0 0 1 0 0 0 0 1 # 0 | F134: TDOA | H134: 5.0 | I134: 2 | J134: 256 | K134: 698 | L134: 62 | M134: 1024 | N134: 1 | O134: 29 | P134: 9999
A135: -40 | C135: 1747.6 | E135: TDOA 190# # # 1 63 -16 # 0 0 1 0 0 0 0 1 # 0 | F135: TDOA | H135: 5.0 | I135: 2 | J135: 256 | K135: 699 | L135: 63 | M135: 1024 | N135: 1 | O135: 29 | P135: 9999
A136: -40 | C136: 1752.4 | E136: TDOA 191# # # 1 63 -16 # 0 0 1 0 0 0 0 1 # 0 | F136: TDOA | H136: 5.0 | I136: 2 | J136: 256 | K136: 723 | L136: 87 | M136: 1024 | N136: 1 | O136: 29 | P136: 9999
A137: -40 | C137: 1757 | E137: TDOA 192# # # 1 63 -16 # 0 0 1 0 0 0 0 1 # 0 | F137: TDOA | H137: 5.0 | I137: 2 | J137: 256 | K137: 746 | L137: 110 | M137: 1024 | N137: 1 | O137: 29 | P137: 9999
A138: -40 | C138: 1761.6 | E138: TDOA 193# # # 1 63 -16 # 0 0 1 0 0 0 0 1 # 0 | F138: TDOA | H138: 5.0 | I138: 2 | J138: 256 | K138: 769 | L138: 8 | M138: 1024 | N138: 1 | O138: 29 | P138: 9999
A139: -40 | C139: 1766.4 | E139: TDOA 194# # # 1 63 -16 # 0 0 1 0 0 0 0 1 # 0 | F139: TDOA | H139: 5.0 | I139: 2 | J139: 256 | K139: 793 | L139: 32 | M139: 1024 | N139: 1 | O139: 29 | P139: 9999
A140: -40 | C140: 1771 | E140: TDOA 195# # # 1 63 -16 # 0 0 1 0 0 0 0 1 # 0 | F140: TDOA | H140: 5.0 | I140: 2 | J140: 256 | K140: 816 | L140: 55 | M140: 1024 | N140: 1 | O140: 29 | P140: 9999
A141: -40 | C141: 1775.6 | E141: TDOA 196# # # 1 63 -16 # 0 0 1 0 0 0 0 1 # 0 | F141: TDOA | H141: 5.0 | I141: 2 | J141: 256 | K141: 839 | L141: 78 | M141: 1024 | N141: 1 | O141: 29 | P141: 9999
A142: -40 | C142: 1780.4 | E142: TDOA 197# # # 1 63 -16 # 0 0 1 0 0 0 0 1 # 0 | F142: TDOA | H142: 5.0 | I142: 2 | J142: 256 | K142: 863 | L142: 102 | M142: 1024 | N142: 1 | O142: 29 | P142: 9999
A143: -40 | C143: 1784.8 | E143: TDOA 198# # # 1 63 -16 # 0 0 1 0 0 0 0 1 # 0 | F143: TDOA | H143: 5.0 | I143: 2 | J143: 256 | K143: 885 | L143: 124 | M143: 1024 | N143: 1 | O143: 29 | P143: 9999
A147: Test Case 12 - Mini-RLS
A148: Signal Generator | C148: LMU Command
A149: RF Power | B149: RF Frequency | C149: Command Set | G149: Block Size | H149: # Blocks | I149: RF Channel | J149: # Samples | K149: |delay| (nsec) | L149: Phase Curvature | M149: Repeat and Average
A150: -40 | B150: 1850.2 | C150: CommandSequence12B | G150: 256 | H150: 4 | I150: 512 | J150: 1024 | K150: 150 | L150: 0.5 | M150: 2
A151: -40 | B151: =R[-1]C+0.2 -> 1850.4 | C151: CommandSequence12B | G151: 256 | H151: 4 | I151: =R[-1]C+1 -> 513 | J151: 1024 | K151: 150 | L151: 0.5 | M151: 2
A152: -40 | B152: 1880.01 | C152: CommandSequence12A | G152: 256 | H152: 4 | I152: 33769 | J152: 1024 | K152: 150 | L152: 0.5 | M152: 2
A153: -40 | B153: =R[-1]C+0.03 -> 1880.04 | C153: CommandSequence12A | G153: 256 | H153: 4 | I153: =R[-1]C+1 -> 33770 | J153: 1024 | K153: 150 | L153: 0.5 | M153: 2
A156: Test Case 13 - Config Attenuator
A157: Signal Generator
A158: RF Power | B158: IF Power | C158: RF Frequency | D158: IF Frequency | E158: Command | F158: Response | H158: Timeout | I158: Attempts | J158: Block Size | K158: RF Channel | L158: IF Channel | M158: TTG Channel | N158: # Samples | O158: Cnfg Attn Setting | P158: Averaging | Q158: Low Limit from previous level (dBm) | R158: High Limit from previous level (dBm)
A159: -40 | B159: -40 | C159: 1747 | D159: 70 | E159: TDOA 71# # # 1 63 -16 # 0 0 1 0 0 0 0 1 # 0 | F159: TDOA | H159: 5 | I159: 2 | J159: 256 | K159: 696 | L159: 60 | M159: 696 | N159: 1024 | O159: 0 | P159: 1 | Q159: -60 | R159: 0
A160: -40 | B160: -40 | C160: 1747 | D160: 70 | E160: TDOA 72# # # 1 63 -16 # 0 0 1 0 0 0 0 1 # 0 | F160: TDOA | H160: 5 | I160: 2 | J160: 256 | K160: 696 | L160: 60 | M160: 696 | N160: 1024 | O160: -8 | P160: 1 | Q160: -10 | R160: -6
A161: -40 | B161: -40 | C161: 1747 | D161: 70 | E161: TDOA 73# # # 1 63 -16 # 0 0 1 0 0 0 0 1 # 0 | F161: TDOA | H161: 5 | I161: 2 | J161: 256 | K161: 696 | L161: 60 | M161: 696 | N161: 1024 | O161: -10 | P161: 1 | Q161: -3.3 | R161: -0.7
A162: -40 | B162: -40 | C162: 1747 | D162: 70 | E162: TDOA 74# # # 1 63 -16 # 0 0 1 0 0 0 0 1 # 0 | F162: TDOA | H162: 5 | I162: 2 | J162: 256 | K162: 696 | L162: 60 | M162: 696 | N162: 1024 | O162: 6 | P162: 1 | Q162: 13.5 | R162: 18.5
A163: -40 | B163: -40 | C163: 1747 | D163: 70 | E163: TDOA 75# # # 1 63 -16 # 0 0 1 0 0 0 0 1 # 0 | F163: TDOA | H163: 5 | I163: 2 | J163: 256 | K163: 696 | L163: 60 | M163: 696 | N163: 1024 | O163: 2 | P163: 1 | Q163: -5.5 | R163: -2.5
A164: -40 | B164: -40 | C164: 1747 | D164: 70 | E164: TDOA 76# # # 1 63 -16 # 0 0 1 0 0 0 0 1 # 0 | F164: TDOA | H164: 5 | I164: 2 | J164: 256 | K164: 696 | L164: 60 | M164: 696 | N164: 1024 | O164: 1 | P164: 1 | Q164: -2 | R164: 0
A169: LO PLL
A170: 1023.5 MHz | D170: 1038.5 MHz | G170: 1043.5 MHz | J170: 1063.5 MHz
A171: eng | D171: eng | G171: eng | J171: eng
A172: TEST 7 5 4 3 0x00 0x00 0xD3 | D172: TEST 7 5 4 3 0x00 0x00 0xD3 | G172: TEST 7 5 4 3 0x00 0x00 0xD3 | J172: TEST 7 5 4 3 0x00 0x00 0xD3
A173: TEST 7 5 4 3 0x00 0x00 0x50 | D173: TEST 7 5 4 3 0x00 0x00 0x50 | G173: TEST 7 5 4 3 0x00 0x00 0x50 | J173: TEST 7 5 4 3 0x00 0x00 0x50
A174: TEST 7 5 4 3 0x00 0x1F 0xFD | D174: TEST 7 5 4 3 0x00 0x20 0x75 | G174: TEST 7 5 4 3 0x00 0x20 0x9D | J174: TEST 7 5 4 3 0x00 0x21 0x3D
A175: exit | D175: exit | G175: exit | J175: exit
A178: TTG Freq
A179: 1880.0 MHZ | B179: Response | D179: Timeout | E179: Begin State | F179: End State | G179: Attempts
A180: eng | D180: 0.5 | E180: DSHELL | F180: DSHELL | G180: 1
A181: TEST 7 5 4 5 0x00 0x00 0xD3 | D181: 1 | E181: DSHELL | F181: DSHELL | G181: 1
A182: TEST 7 5 4 5 0x00 0x00 0x50 | D182: 1 | E182: DSHELL | F182: DSHELL | G182: 1
A183: TEST 7 5 4 5 0x00 0x36 0x99 | D183: 1 | E183: DSHELL | F183: DSHELL | G183: 1
A184: exit | D184: 0.5 | E184: DSHELL | F184: DSHELL | G184: 1
A188: Gain Setup
A189: Setup | B189: Response | D189: Timeout | E189: Begin State | F189: End State | G189: Attempts
A190: bdcgain 1 43 | D190: 0.5 | E190: DSHELL | F190: DSHELL | G190: 1
A191: bdcgain 2 43 | D191: 0.5 | E191: DSHELL | F191: DSHELL | G191: 1
A192: bdcgain 3 43 | D192: 0.5 | E192: DSHELL | F192: DSHELL | G192: 1
A193: bdcgain 4 43 | D193: 0.5 | E193: DSHELL | F193: DSHELL | G193: 1
A194: bdcgain 5 43 | D194: 0.5 | E194: DSHELL | F194: DSHELL | G194: 1
A195: bdcgain 6 43 | D195: 0.5 | E195: DSHELL | F195: DSHELL | G195: 1
A198: Config Atten Setup
A199: Setup | B199: Response | D199: Timeout | E199: Begin State | F199: End State | G199: Attempts
A200: bdcgain 1 25varGain | D200: 0.5 | E200: DSHELL | F200: ENG | G200: 1
A201: bdcgain 2 25varGain | D201: 0.5 | E201: DSHELL | F201: ENG | G201: 1
A202: bdcgain 3 25varGain | D202: 0.5 | E202: DSHELL | F202: ENG | G202: 1
A203: bdcgain 4 25varGain | D203: 0.5 | E203: DSHELL | F203: ENG | G203: 1
A204: bdcgain 5 25varGain | D204: 0.5 | E204: DSHELL | F204: ENG | G204: 1
A205: bdcgain 6 25varGain | D205: 0.5 | E205: DSHELL | F205: ENG | G205: 1
A209: Data Path Settings
A210: Data Path 1 | D210: Timeout | E210: Begin State | F210: End State | G210: Attempts
A211: eng | D211: 0.5 | E211: DSHELL | F211: ENG | G211: 1
A212: Test 1 1 0 0 0 | D212: 0.5 | E212: ENG | F212: ENG | G212: 1
A213: exit | D213: 0.5 | E213: ENG | F213: DSHELL | G213: 1
A216: Data Path 2 | D216: Timeout | E216: Begin State | F216: End State | G216: Attempts
A217: eng | D217: 0.5 | E217: DSHELL | F217: ENG | G217: 1
A218: Test 1 0 1 0 0 | D218: 0.5 | E218: ENG | F218: ENG | G218: 1
A219: exit | D219: 0.5 | E219: ENG | F219: DSHELL | G219: 1
A222: Data Path 3 | D222: Timeout | E222: Begin State | F222: End State | G222: Attempts
A223: eng | D223: 0.5 | E223: DSHELL | F223: ENG | G223: 1
A224: Test 1 0 0 1 0 | D224: 0.5 | E224: ENG | F224: ENG | G224: 1
A225: exit | D225: 0.5 | E225: ENG | F225: DSHELL | G225: 1
A228: Data Path 4 | D228: Timeout | E228: Begin State | F228: End State | G228: Attempts
A229: eng | D229: 0.5 | E229: DSHELL | F229: ENG | G229: 1
A230: Test 1 0 0 0 1 | D230: 0.5 | E230: ENG | F230: ENG | G230: 1
A231: exit | D231: 0.5 | E231: ENG | F231: DSHELL | G231: 1
A234: Data Path 5 | D234: Timeout | E234: Begin State | F234: End State | G234: Attempts
A235: eng | D235: 0.5 | E235: DSHELL | F235: ENG | G235: 1
A236: Test 1 1 1 1 1 | D236: 0.5 | E236: ENG | F236: ENG | G236: 1
A237: exit | D237: 0.5 | E237: ENG | F237: DSHELL | G237: 1
A240: Compensation Settings
A241: Receiver compensated gain | D241: Timeout | E241: Begin State | F241: End State | G241: Attempts
A242: eng | D242: 0.5 | E242: DSHELL | F242: ENG | G242: 1
A243: Test 4 0xA0 0x48 6 | B243: DATA Read: | D243: 1 | E243: ENG | F243: ENG | G243: 1
A244: TEST 4 0xA0 0x1F 1 | B244: DATA Read: 41 | D244: 1 | E244: ENG | F244: ENG | G244: 1
A245: Test 4 0xA0 0x30 6 | B245: DATA Read: | D245: 1 | E245: ENG | F245: ENG | G245: 1
A246: exit | D246: 0.5 | E246: ENG | F246: DSHELL | G246: 1
A249: TTG compensated Level | D249: Timeout | E249: Begin State | F249: End State | G249: Attempts
A250: eng | D250: 0.5 | E250: DSHELL | F250: ENG | G250: 1
A251: Test 4 0xA0 0x42 6 | B251: DATA Read: | D251: 1 | E251: ENG | F251: ENG | G251: 1
A252: TEST 4 0xA0 0x1F 1 | B252: DATA Read: 41 | D252: 1 | E252: ENG | F252: ENG | G252: 1 | H252: Note: | I252: If we get DATA Read: 41, then the software will skip
A253: Test 4 0xA0 0x2A 6 | B253: DATA Read: | D253: 1 | E253: ENG | F253: ENG | G253: 1 | I253: over the next line and go directly to exit
A254: exit | D254: 0.5 | E254: ENG | F254: DSHELL | G254: 1
A257: Receiver Gain Compensation | D257: Timeout | E257: Begin State | F257: End State | G257: Attempts
A258: eng | D258: 0.5 | E258: DSHELL | F258: ENG | G258: 1
A259: TEST 4 0xA0 0x1F 1 | B259: DATA Read: 41 | D259: 0.5 | E259: ENG | F259: ENG | G259: 1
A260: Test 4 0xA0 0x20 6 | B260: DATA Read: | D260: 0.5 | E260: ENG | F260: ENG | G260: 1
A261: exit | D261: 0.5 | E261: ENG | F261: DSHELL | G261: 1
A264: EnableTTG | B264: Response | D264: Timeout | E264: Begin State | F264: End State | G264: Attempts
A265: eng | D265: 0.5 | E265: DSHELL | F265: ENG | G265: 1
A266: TEST 7 3 8 6 8 | D266: 0.5 | E266: ENG | F266: ENG | G266: 1
A267: TEST 7 3 4 4 5 | D267: 0.5 | E267: ENG | F267: ENG | G267: 1
A268: TEST 7 3 4 6 1 | D268: 0.5 | E268: ENG | F268: ENG | G268: 1
A269: exit | D269: 0.5 | E269: ENG | F269: DSHELL | G269: 1
A272: DisableTTG | D272: Timeout | E272: Begin State | F272: End State | G272: Attempts
A273: eng | D273: 0.5 | E273: DSHELL | F273: ENG | G273: 1
A274: TEST 7 3 8 6 5 | D274: 0.5 | E274: ENG | F274: ENG | G274: 1
A275: TEST 7 3 4 4 1 | D275: 0.5 | E275: ENG | F275: ENG | G275: 1
A276: TEST 7 3 4 6 0 | D276: 0.5 | E276: ENG | F276: ENG | G276: 1
A277: exit | D277: 0.5 | E277: ENG | F277: DSHELL | G277: 1
A280: Mute On | D280: Timeout | E280: Begin State | F280: End State | G280: Attempts
A281: eng | D281: 0.5 | E281: DSHELL | F281: ENG | G281: 1
A282: TEST 7 3 8 6 8 | D282: 0.5 | E282: ENG | F282: ENG | G282: 1
A283: exit | D283: 0.5 | E283: ENG | F283: DSHELL | G283: 1
A286: Mute Off | D286: Timeout | E286: Begin State | F286: End State | G286: Attempts
A287: eng | D287: 0.5 | E287: DSHELL | F287: ENG | G287: 1
A288: TEST 7 3 8 6 5 | D288: 0.5 | E288: ENG | F288: ENG | G288: 1
A289: exit | D289: 0.5 | E289: ENG | F289: DSHELL | G289: 1
A292: Change Admin State
A293: Command | B293: Response | D293: Timeout | E293: Begin State | F293: End State | G293: # of retries
A294: etest 15 1 | D294: 2 | E294: DSHELL | F294: DSHELL | G294: 1
A298: Check Alarms
A299: Command | B299: Response | D299: Timeout | E299: Begin State | F299: End State | G299: # of retries
A300: ALARMS | B300: FAULT_GPS_HOLDOVER | D300: 2 | E300: DSHELL | F300: DSHELL | G300: 1
A304: Mini-RLS Command Sequence 12A (AMPS)
A305: Command | B305: Response | D305: Timeout | E305: Begin State | F305: End State | G305: # of retries
A306: ALARMS | B306: FAULT_GPS_HOLDOVER | D306: 2 | E306: DSHELL | F306: DSHELL | G306: 1
A307: TIME | B307: GPS Time: | D307: 2 | E307: DSHELL | F307: DSHELL | G307: 2
A308: SVCR # # 2 # # 0 1 0 0 0 1 1 1 # 0 0 | B308: returnCode 0 | D308: 2 | E308: DSHELL | F308: DSHELL | G308: 1
A309: WAIT | D309: 15 | E309: DSHELL | F309: DSHELL | G309: 1
A310: TDATA # 0 2 # # # -16 0 1 0 0 11 0 63 -16 | B310: TDOA | D310: 15 | E310: DSHELL | F310: DSHELL | G310: 1
A314: Mini-RLS Command Sequence 12B (GSM)
A315: Command | B315: Response | D315: Timeout | E315: Begin State | F315: End State | G315: # of retries
A316: ALARMS | B316: FAULT_GPS_HOLDOVER | D316: 2 | E316: DSHELL | F316: DSHELL | G316: 1
A317: TIME | B317: GPS Time: | D317: 2 | E317: DSHELL | F317: DSHELL | G317: 2
A318: GVCR # 2 # # 0 # 0 # # 17 1 0 0 0 0 0 0 1 1 1 8 0 0 0 0 0 0 0 0 0 0 0 | B318: returnCode 0 | D318: 2 | E318: DSHELL | F318: DSHELL | G318: 1
A319: WAIT | D319: 15 | E319: DSHELL | F319: DSHELL | G319: 1
A320: TDATA # 0 2 # # # -16 0 1 0 0 11 0 63 -16 | B320: TDOA | D320: 15 | E320: DSHELL | F320: DSHELL | G320: 1

Sheet: 061642
B2: Factors | F2: Temperature Coefficient
B3: TTG | C3: 200
B4: Gain | C4: 200 | F4: -3.5000000000000003E-2 | H4: dB/deg
B5: TTG Comp | C5: 200
B6: Gain Factor | C6: 200
F8: Center Temperature
F10: 30 | H10: deg
A16: Test Case 3 - SNR
A17: Signal Generator
A18: RF Power | B18: IF Power | C18: RF Frequency | D18: IF Frequency | E18: Command | F18: Response | H18: Timeout | I18: Attempts | J18: Block Size | K18: RF Channel | L18: IF Channel | M18: TTG Channel | N18: # Samples | O18: Averaging | P18: Low Limit | Q18: High Limit
A19: -50 | C19: 1850.04 | E19: TDOA 31# # # 0 63 -16 # 0 0 1 0 0 0 0 1 # 0 | F19: TDOA | H19: 5.0 | I19: 2 | J19: 256 | K19: =32768+RC[1] -> 32770 | L19: 2 | M19: 383 | N19: 1024 | O19: 1 | P19: 29 | Q19: 9999
A21: -50 | C21: 1852.47 | E21: TDOA 32# # # 0 63 -16 # 0 0 1 0 0 0 0 1 # 0 | F21: TDOA | H21: 5.0 | I21: 2 | J21: 256 | K21: =32768+RC[1] -> 32851 | L21: 83 | M21: 383 | N21: 1024 | O21: 1 | P21: 29 | Q21: 9999
A22: -50 | C22: 1854.99 | E22: TDOA 33# # # 0 63 -16 # 0 0 1 0 0 0 0 1 # 0 | F22: TDOA | H22: 5.0 | I22: 2 | J22: 256 | K22: =32768+RC[1] -> 32935 | L22: 167 | M22: 383 | N22: 1024 | O22: 1 | P22: 29 | Q22: 9999
A23: -50 | C23: 1864.98 | E23: TDOA 34# # # 0 63 -16 # 0 0 1 0 0 0 0 1 # 0 | F23: TDOA | H23: 5.0 | I23: 2 | J23: 256 | K23: =32768+RC[1] -> 33268 | L23: 500 | M23: 383 | N23: 1024 | O23: 1 | P23: 29 | Q23: 9999
A24: -50 | C24: 1867.5 | E24: TDOA 35# # # 0 63 -16 # 0 0 1 0 0 0 0 1 # 0 | F24: TDOA | H24: 5.0 | I24: 2 | J24: 256 | K24: =32768+RC[1] -> 33352 | L24: 584 | M24: 383 | N24: 1024 | O24: 1 | P24: 29 | Q24: 9999
A25: -50 | C25: 1869.99 | E25: TDOA 36# # # 0 63 -16 # 0 0 1 0 0 0 0 1 # 0 | F25: TDOA | H25: 5.0 | I25: 2 | J25: 256 | K25: =32768+RC[1] -> 33435 | L25: 667 | M25: 383 | N25: 1024 | O25: 1 | P25: 29 | Q25: 9999
A26: -50 | C26: 1870.02 | E26: TDOA 37# # # 0 63 -16 # 0 0 1 0 0 0 0 1 # 0 | F26: TDOA | H26: 5.0 | I26: 2 | J26: 256 | K26: =32768+RC[1] -> 33436 | L26: 668 | M26: 383 | N26: 1024 | O26: 1 | P26: 29 | Q26: 9999
A27: -50 | C27: 1872.39 | E27: TDOA 38# # # 0 63 -16 # 0 0 1 0 0 0 0 1 # 0 | F27: TDOA | H27: 5.0 | I27: 2 | J27: 256 | K27: =32768+RC[1] -> 33515 | L27: 747 | M27: 383 | N27: 1024 | O27: 1 | P27: 29 | Q27: 9999
A28: -50 | C28: 1875 | E28: TDOA 39# # # 0 63 -16 # 0 0 1 0 0 0 0 1 # 0 | F28: TDOA | H28: 5.0 | I28: 2 | J28: 256 | K28: =32768+RC[1] -> 33602 | L28: 834 | M28: 383 | N28: 1024 | O28: 1 | P28: 29 | Q28: 9999
A29: -50 | C29: 1884.99 | E29: TDOA 130# # # 0 63 -16 # 0 0 1 0 0 0 0 1 # 0 | F29: TDOA | H29: 5.0 | I29: 2 | J29: 256 | K29: =32768+RC[1] -> 33935 | L29: 1167 | M29: 383 | N29: 1024 | O29: 1 | P29: 29 | Q29: 9999
A30: -50 | C30: 1887.45 | E30: TDOA 131# # # 0 63 -16 # 0 0 1 0 0 0 0 1 # 0 | F30: TDOA | H30: 5.0 | I30: 2 | J30: 256 | K30: =32768+RC[1] -> 34017 | L30: 1249 | M30: 383 | N30: 1024 | O30: 1 | P30: 29 | Q30: 9999
A31: -50 | C31: 1890 | E31: TDOA 132# # # 0 63 -16 # 0 0 1 0 0 0 0 1 # 0 | F31: TDOA | H31: 5.0 | I31: 2 | J31: 256 | K31: =32768+RC[1] -> 34102 | L31: 1334 | M31: 383 | N31: 1024 | O31: 1 | P31: 29 | Q31: 9999
A32: -50 | C32: 1890.03 | E32: TDOA 133# # # 0 63 -16 # 0 0 1 0 0 0 0 1 # 0 | F32: TDOA | H32: 5.0 | I32: 2 | J32: 256 | K32: =32768+RC[1] -> 34103 | L32: 1335 | M32: 383 | N32: 1024 | O32: 1 | P32: 29 | Q32: 9999
A33: -50 | C33: 1892.4 | E33: TDOA 134# # # 0 63 -16 # 0 0 1 0 0 0 0 1 # 0 | F33: TDOA | H33: 5.0 | I33: 2 | J33: 256 | K33: =32768+RC[1] -> 34182 | L33: 1414 | M33: 383 | N33: 1024 | O33: 1 | P33: 29 | Q33: 9999
A34: -50 | C34: 1894.95 | E34: TDOA 135# # # 0 63 -16 # 0 0 1 0 0 0 0 1 # 0 | F34: TDOA | H34: 5.0 | I34: 2 | J34: 256 | K34: =32768+RC[1] -> 34267 | L34: 1499 | M34: 383 | N34: 1024 | O34: 1 | P34: 29 | Q34: 9999
A35: -50 | C35: 1905 | E35: TDOA 136# # # 0 63 -16 # 0 0 1 0 0 0 0 1 # 0 | F35: TDOA | H35: 5.0 | I35: 2 | J35: 256 | K35: =32768+RC[1] -> 34602 | L35: 1834 | M35: 383 | N35: 1024 | O35: 1 | P35: 29 | Q35: 9999
A36: -50 | C36: 1907.43 | E36: TDOA 137# # # 0 63 -16 # 0 0 1 0 0 0 0 1 # 0 | F36: TDOA | H36: 5.0 | I36: 2 | J36: 256 | K36: =32768+RC[1] -> 34683 | L36: 1915 | M36: 383 | N36: 1024 | O36: 1 | P36: 29 | Q36: 9999
A37: -50 | C37: 1909.92 | E37: TDOA 138# # # 0 63 -16 # 0 0 1 0 0 0 0 1 # 0 | F37: TDOA | H37: 5.0 | I37: 2 | J37: 256 | K37: =32768+RC[1] -> 34766 | L37: 1998 | M37: 383 | N37: 1024 | O37: 1 | P37: 29 | Q37: 9999
A41: Test Case 5 - Two-Tone Response
B42: SigGen1 | D42: SigGen2
A43: Center RF Channel | B43: RF Frequency | C43: RF Power | D43: RF Frequency | E43: Command | F43: Response | H43: Timeout | I43: Attempts | J43: Block Size | K43: Lower Channel | L43: Upper Channel | M43: # Samples | N43: Cnfg Attn | O43: Averaging | P43: Low Limit | Q43: High Limit | R43: Lower Channel Delta | S43: Upper Channel Delta
A44: 1852.5 | B44: 1852.44 | C44: -55 | D44: 1852.56 | E44: TDOA 51# # # 0 63 -16 # 0 0 1 0 0 0 0 1 # 0 | F44: TDOA | H44: 5.0 | I44: 2 | J44: 256 | K44: 32850 | L44: =RC[-1]+4 -> 32854 | M44: 1024 | N44: 15 | O44: 1 | P44: -999 | Q44: -60 | R44: 1 | S44: 1
A46: 1852.8 | B46: 1852.74 | C46: -55 | D46: 1852.86 | E46: TDOA 52# # # 0 63 -16 # 0 0 1 0 0 0 0 1 # 0 | F46: TDOA | H46: 5.0 | I46: 2 | J46: 256 | K46: 32860 | L46: =RC[-1]+4 -> 32864 | M46: 1024 | N46: 15 | O46: 1 | P46: -999 | Q46: -60 | R46: 1 | S46: 1
A47: 1857.6 | B47: 1857.54 | C47: -55 | D47: 1857.66 | E47: TDOA 53# # # 0 63 -16 # 0 0 1 0 0 0 0 1 # 0 | F47: TDOA | H47: 5.0 | I47: 2 | J47: 256 | K47: 33020 | L47: =RC[-1]+4 -> 33024 | M47: 1024 | N47: 15 | O47: 1 | P47: -999 | Q47: -60 | R47: 1 | S47: 1
A48: 1857.9 | B48: 1857.84 | C48: -55 | D48: 1857.96 | E48: TDOA 54# # # 0 63 -16 # 0 0 1 0 0 0 0 1 # 0 | F48: TDOA | H48: 5.0 | I48: 2 | J48: 256 | K48: 33030 | L48: =RC[-1]+4 -> 33034 | M48: 1024 | N48: 15 | O48: 1 | P48: -999 | Q48: -60 | R48: 1 | S48: 1
A49: 1862.4 | B49: 1862.34 | C49: -55 | D49: 1862.46 | E49: TDOA 55# # # 0 63 -16 # 0 0 1 0 0 0 0 1 # 0 | F49: TDOA | H49: 5.0 | I49: 2 | J49: 256 | K49: 33180 | L49: =RC[-1]+4 -> 33184 | M49: 1024 | N49: 15 | O49: 1 | P49: -999 | Q49: -60 | R49: 1 | S49: 1
A50: 1862.7 | B50: 1862.64 | C50: -55 | D50: 1862.76 | E50: TDOA 56# # # 0 63 -16 # 0 0 1 0 0 0 0 1 # 0 | F50: TDOA | H50: 5.0 | I50: 2 | J50: 256 | K50: 33190 | L50: =RC[-1]+4 -> 33194 | M50: 1024 | N50: 15 | O50: 1 | P50: -999 | Q50: -60 | R50: 1 | S50: 1
A51: 1867.5 | B51: 1867.44 | C51: -55 | D51: 1867.56 | E51: TDOA 57# # # 0 63 -16 # 0 0 1 0 0 0 0 1 # 0 | F51: TDOA | H51: 5.0 | I51: 2 | J51: 256 | K51: 33350 | L51: =RC[-1]+4 -> 33354 | M51: 1024 | N51: 15 | O51: 1 | P51: -999 | Q51: -60 | R51: 1 | S51: 1
A52: 1867.8 | B52: 1867.74 | C52: -55 | D52: 1867.86 | E52: TDOA 58# # # 0 63 -16 # 0 0 1 0 0 0 0 1 # 0 | F52: TDOA | H52: 5.0 | I52: 2 | J52: 256 | K52: 33360 | L52: =RC[-1]+4 -> 33364 | M52: 1024 | N52: 15 | O52: 1 | P52: -999 | Q52: -60 | R52: 1 | S52: 1
A53: 1872.6 | B53: 1872.54 | C53: -55 | D53: 1872.66 | E53: TDOA 59# # # 0 63 -16 # 0 0 1 0 0 0 0 1 # 0 | F53: TDOA | H53: 5.0 | I53: 2 | J53: 256 | K53: 33520 | L53: =RC[-1]+4 -> 33524 | M53: 1024 | N53: 15 | O53: 1 | P53: -999 | Q53: -60 | R53: 1 | S53: 1
A54: 1872.9 | B54: 1872.84 | C54: -55 | D54: 1872.96 | E54: TDOA 150# # # 0 63 -16 # 0 0 1 0 0 0 0 1 # 0 | F54: TDOA | H54: 5.0 | I54: 2 | J54: 256 | K54: 33530 | L54: =RC[-1]+4 -> 33534 | M54: 1024 | N54: 15 | O54: 1 | P54: -999 | Q54: -60 | R54: 1 | S54: 1
A55: 1877.4 | B55: 1877.34 | C55: -55 | D55: 1877.46 | E55: TDOA 151# # # 0 63 -16 # 0 0 1 0 0 0 0 1 # 0 | F55: TDOA | H55: 5.0 | I55: 2 | J55: 256 | K55: 33680 | L55: =RC[-1]+4 -> 33684 | M55: 1024 | N55: 15 | O55: 1 | P55: -999 | Q55: -60 | R55: 1 | S55: 1
A56: 1877.7 | B56: 1877.64 | C56: -55 | D56: 1877.76 | E56: TDOA 152# # # 0 63 -16 # 0 0 1 0 0 0 0 1 # 0 | F56: TDOA | H56: 5.0 | I56: 2 | J56: 256 | K56: 33690 | L56: =RC[-1]+4 -> 33694 | M56: 1024 | N56: 15 | O56: 1 | P56: -999 | Q56: -60 | R56: 1 | S56: 1
A57: 1882.5 | B57: 1882.44 | C57: -55 | D57: 1882.56 | E57: TDOA 153# # # 0 63 -16 # 0 0 1 0 0 0 0 1 # 0 | F57: TDOA | H57: 5.0 | I57: 2 | J57: 256 | K57: 33850 | L57: =RC[-1]+4 -> 33854 | M57: 1024 | N57: 15 | O57: 1 | P57: -999 | Q57: -60 | R57: 1 | S57: 1
A58: 1882.8 | B58: 1882.74 | C58: -55 | D58: 1882.86 | E58: TDOA 154# # # 0 63 -16 # 0 0 1 0 0 0 0 1 # 0 | F58: TDOA | H58: 5.0 | I58: 2 | J58: 256 | K58: 33860 | L58: =RC[-1]+4 -> 33864 | M58: 1024 | N58: 15 | O58: 1 | P58: -999 | Q58: -60 | R58: 1 | S58: 1
A59: 1887.6 | B59: 1887.54 | C59: -55 | D59: 1887.66 | E59: TDOA 155# # # 0 63 -16 # 0 0 1 0 0 0 0 1 # 0 | F59: TDOA | H59: 5.0 | I59: 2 | J59: 256 | K59: 34020 | L59: =RC[-1]+4 -> 34024 | M59: 1024 | N59: 15 | O59: 1 | P59: -999 | Q59: -60 | R59: 1 | S59: 1
A60: 1887.9 | B60: 1887.84 | C60: -55 | D60: 1887.96 | E60: TDOA 156# # # 0 63 -16 # 0 0 1 0 0 0 0 1 # 0 | F60: TDOA | H60: 5.0 | I60: 2 | J60: 256 | K60: 34030 | L60: =RC[-1]+4 -> 34034 | M60: 1024 | N60: 15 | O60: 1 | P60: -999 | Q60: -60 | R60: 1 | S60: 1
A61: 1892.4 | B61: 1892.34 | C61: -55 | D61: 1892.46 | E61: TDOA 157# # # 0 63 -16 # 0 0 1 0 0 0 0 1 # 0 | F61: TDOA | H61: 5.0 | I61: 2 | J61: 256 | K61: 34180 | L61: =RC[-1]+4 -> 34184 | M61: 1024 | N61: 15 | O61: 1 | P61: -999 | Q61: -60 | R61: 1 | S61: 1
A62: 1892.7 | B62: 1892.64 | C62: -55 | D62: 1892.76 | E62: TDOA 158# # # 0 63 -16 # 0 0 1 0 0 0 0 1 # 0 | F62: TDOA | H62: 5.0 | I62: 2 | J62: 256 | K62: 34190 | L62: =RC[-1]+4 -> 34194 | M62: 1024 | N62: 15 | O62: 1 | P62: -999 | Q62: -60 | R62: 1 | S62: 1
A63: 1897.5 | B63: 1897.44 | C63: -55 | D63: 1897.56 | E63: TDOA 159# # # 0 63 -16 # 0 0 1 0 0 0 0 1 # 0 | F63: TDOA | H63: 5.0 | I63: 2 | J63: 256 | K63: 34350 | L63: =RC[-1]+4 -> 34354 | M63: 1024 | N63: 15 | O63: 1 | P63: -999 | Q63: -60 | R63: 1 | S63: 1
A64: 1897.8 | B64: 1897.74 | C64: -55 | D64: 1897.86 | E64: TDOA 250# # # 0 63 -16 # 0 0 1 0 0 0 0 1 # 0 | F64: TDOA | H64: 5.0 | I64: 2 | J64: 256 | K64: 34360 | L64: =RC[-1]+4 -> 34364 | M64: 1024 | N64: 15 | O64: 1 | P64: -999 | Q64: -60 | R64: 1 | S64: 1
A65: 1902.6 | B65: 1902.54 | C65: -55 | D65: 1902.66 | E65: TDOA 251# # # 0 63 -16 # 0 0 1 0 0 0 0 1 # 0 | F65: TDOA | H65: 5.0 | I65: 2 | J65: 256 | K65: 34520 | L65: =RC[-1]+4 -> 34524 | M65: 1024 | N65: 15 | O65: 1 | P65: -999 | Q65: -60 | R65: 1 | S65: 1
A66: 1902.9 | B66: 1902.84 | C66: -55 | D66: 1902.96 | E66: TDOA 252# # # 0 63 -16 # 0 0 1 0 0 0 0 1 # 0 | F66: TDOA | H66: 5.0 | I66: 2 | J66: 256 | K66: 34530 | L66: =RC[-1]+4 -> 34534 | M66: 1024 | N66: 15 | O66: 1 | P66: -999 | Q66: -60 | R66: 1 | S66: 1
A67: 1907.4 | B67: 1907.34 | C67: -55 | D67: 1907.46 | E67: TDOA 253# # # 0 63 -16 # 0 0 1 0 0 0 0 1 # 0 | F67: TDOA | H67: 5.0 | I67: 2 | J67: 256 | K67: 34680 | L67: =RC[-1]+4 -> 34684 | M67: 1024 | N67: 15 | O67: 1 | P67: -999 | Q67: -60 | R67: 1 | S67: 1
A68: 1907.7 | B68: 1907.64 | C68: -55 | D68: 1907.76 | E68: TDOA 254# # # 0 63 -16 # 0 0 1 0 0 0 0 1 # 0 | F68: TDOA | H68: 5.0 | I68: 2 | J68: 256 | K68: 34690 | L68: =RC[-1]+4 -> 34694 | M68: 1024 | N68: 15 | O68: 1 | P68: -999 | Q68: -60 | R68: 1 | S68: 1
A73: Test Case 6 - Phase Noise
A74: Signal Generator
A75: RF Power | B75: IF Power | C75: RF Frequency | D75: IF Frequency | E75: Command | F75: Response | H75: Timeout | I75: Attempts | J75: Block Size | K75: RF Channel | L75: IF Channel | M75: # Samples | N75: Averaging | O75: Low Limit | P75: High Limit
A76: -60 | C76: 1852.5 | E76: TDOA 61# # # 0 63 -16 # 0 0 1 0 0 0 0 1 # 0 | F76: TDOA | H76: 5.0 | I76: 2 | J76: 256 | K76: 32852 | L76: 128 | M76: 1024 | N76: 8 | O76: 0 | P76: 3
A78: -60 | C78: 1857.51 | E78: TDOA 62# # # 0 63 -16 # 0 0 1 0 0 0 0 1 # 0 | F78: TDOA | H78: 5.0 | I78: 2 | J78: 256 | K78: 33019 | L78: 128 | M78: 1024 | N78: 8 | O78: 0 | P78: 3
A79: -60 | C79: 1862.52 | E79: TDOA 63# # # 0 63 -16 # 0 0 1 0 0 0 0 1 # 0 | F79: TDOA | H79: 5.0 | I79: 2 | J79: 256 | K79: 33186 | L79: 128 | M79: 1024 | N79: 8 | O79: 0 | P79: 3
A80: -60 | C80: 1867.5 | E80: TDOA 64# # # 0 63 -16 # 0 0 1 0 0 0 0 1 # 0 | F80: TDOA | H80: 5.0 | I80: 2 | J80: 256 | K80: 33352 | L80: 128 | M80: 1024 | N80: 8 | O80: 0 | P80: 3
A81: -60 | C81: 1872.51 | E81: TDOA 65# # # 0 63 -16 # 0 0 1 0 0 0 0 1 # 0 | F81: TDOA | H81: 5.0 | I81: 2 | J81: 256 | K81: 33519 | L81: 128 | M81: 1024 | N81: 8 | O81: 0 | P81: 3
A82: -60 | C82: 1877.52 | E82: TDOA 66# # # 0 63 -16 # 0 0 1 0 0 0 0 1 # 0 | F82: TDOA | H82: 5.0 | I82: 2 | J82: 256 | K82: 33686 | L82: 128 | M82: 1024 | N82: 8 | O82: 0 | P82: 3
A83: -60 | C83: 1882.5 | E83: TDOA 67# # # 0 63 -16 # 0 0 1 0 0 0 0 1 # 0 | F83: TDOA | H83: 5.0 | I83: 2 | J83: 256 | K83: 33852 | L83: 128 | M83: 1024 | N83: 8 | O83: 0 | P83: 3
A84: -60 | C84: 1887.51 | E84: TDOA 68# # # 0 63 -16 # 0 0 1 0 0 0 0 1 # 0 | F84: TDOA | H84: 5.0 | I84: 2 | J84: 256 | K84: 34019 | L84: 128 | M84: 1024 | N84: 8 | O84: 0 | P84: 3
A85: -60 | C85: 1892.52 | E85: TDOA 69# # # 0 63 -16 # 0 0 1 0 0 0 0 1 # 0 | F85: TDOA | H85: 5.0 | I85: 2 | J85: 256 | K85: 34186 | L85: 128 | M85: 1024 | N85: 8 | O85: 0 | P85: 3
A86: -60 | C86: 1897.5 | E86: TDOA 161# # # 0 63 -16 # 0 0 1 0 0 0 0 1 # 0 | F86: TDOA | H86: 5.0 | I86: 2 | J86: 256 | K86: 34352 | L86: 128 | M86: 1024 | N86: 8 | O86: 0 | P86: 3
A87: -60 | C87: 1902.51 | E87: TDOA 162# # # 0 63 -16 # 0 0 1 0 0 0 0 1 # 0 | F87: TDOA | H87: 5.0 | I87: 2 | J87: 256 | K87: 34519 | L87: 128 | M87: 1024 | N87: 8 | O87: 0 | P87: 3
A88: -60 | C88: 1907.52 | E88: TDOA 163# # # 0 63 -16 # 0 0 1 0 0 0 0 1 # 0 | F88: TDOA | H88: 5.0 | I88: 2 | J88: 256 | K88: 34686 | L88: 128 | M88: 1024 | N88: 8 | O88: 0 | P88: 3
A92: Test Case 7 - Data Integrity
A93: Signal Generator
A94: RF Power | B94: IF Power | C94: RF Frequency | D94: IF Frequency | E94: Command | F94: Response | H94: Timeout | I94: Attempts | J94: Block Size | K94: RF Channel | L94: IF Channel | M94: TTG Channel | N94: # Samples | O94: Cnfg Attn | P94: Averaging | Q94: Low Limit | R94: High Limit
A95: -50 | B95: -50 | C95: 1879.98 | D95: 70 | E95: TDOA 71# # # 0 63 -16 # 0 0 1 0 0 0 0 1 # 0 | F95: TDOA | H95: 5.0 | I95: 2 | J95: 256 | K95: 33768 | L95: 60 | M95: 696 | N95: 1024 | O95: 6 | P95: 1 | Q95: 29 | R95: 9999
A96: -50 | B96: -50 | C96: 1879.98 | D96: 70 | E96: TDOA 72# # # 0 63 -16 # 0 0 1 0 0 0 0 1 # 0 | F96: TDOA | H96: 5.0 | I96: 2 | J96: 256 | K96: 33768 | L96: 60 | M96: 696 | N96: 1024 | O96: 6 | P96: 1 | Q96: 29 | R96: 9999
A97: -50 | B97: -50 | C97: 1879.98 | D97: 70 | E97: TDOA 73# # # 0 63 -16 # 0 0 1 0 0 0 0 1 # 0 | F97: TDOA | H97: 5.0 | I97: 2 | J97: 256 | K97: 33768 | L97: 60 | M97: 696 | N97: 1024 | O97: 6 | P97: 1 | Q97: 29 | R97: 9999
A98: -50 | B98: -50 | C98: 1879.98 | D98: 70 | E98: TDOA 74# # # 0 63 -16 # 0 0 1 0 0 0 0 1 # 0 | F98: TDOA | H98: 5.0 | I98: 2 | J98: 256 | K98: 33768 | L98: 60 | M98: 696 | N98: 1024 | O98: 6 | P98: 1 | Q98: 29 | R98: 9999
A99: -50 | B99: -50 | C99: 1879.98 | D99: 70 | E99: TDOA 75# # # 0 63 -16 # 0 0 1 0 0 0 0 1 # 0 | F99: TDOA | H99: 5.0 | I99: 2 | J99: 256 | K99: 33768 | L99: 60 | M99: 696 | N99: 1024 | O99: 6 | P99: 1 | Q99: 29 | R99: 9999
A103: Test Case 8 - Noise Floor
A104: Signal Generator
A105: RF Power | B105: IF Power | C105: RF Frequency | D105: IF Frequency | E105: Command | F105: Response | H105: Timeout | I105: Attempts | J105: Block Size | K105: RF Channel | L105: IF Channel | M105: # Samples | N105: Cnfg Attn | O105: Averaging | P105: Signal Averaging | Q105: Low Limit Noise | R105: High Limit Noise | S105: Low Limit Gain | T105: High Limit Gain
A106: -50 | C106: 1880.01 | E106: TDOA 87# # # 0 63 -16 # 0 0 1 0 0 0 0 1 # 0 | F106: TDOA | H106: 5.0 | I106: 2 | J106: 256 | K106: 33769 | L106: 1001 | M106: 1024 | N106: 0 | O106: 8 | P106: 1 | Q106: -174 | R106: -121 | S106: 40 | T106: 46
A108: -50 | C108: 1850.04 | E108: TDOA 81# # # 0 63 -16 # 0 0 1 0 0 0 0 1 # 0 | F108: TDOA | H108: 5.0 | I108: 2 | J108: 256 | K108: 32770 | L108: 2 | M108: 1024 | N108: 0 | O108: 8 | P108: 1 | Q108: -174 | R108: -121 | S108: 40 | T108: 46
A109: -50 | C109: 1855.02 | E109: TDOA 82# # # 0 63 -16 # 0 0 1 0 0 0 0 1 # 0 | F109: TDOA | H109: 5.0 | I109: 2 | J109: 256 | K109: 32936 | L109: 168 | M109: 1024 | N109: 0 | O109: 8 | P109: 1 | Q109: -174 | R109: -121 | S109: 40 | T109: 46
A110: -50 | C110: 1860 | E110: TDOA 83# # # 0 63 -16 # 0 0 1 0 0 0 0 1 # 0 | F110: TDOA | H110: 5.0 | I110: 2 | J110: 256 | K110: 33102 | L110: 334 | M110: 1024 | N110: 0 | O110: 8 | P110: 1 | Q110: -174 | R110: -121 | S110: 40 | T110: 46
A111: -50 | C111: 1865.01 | E111: TDOA 84# # # 0 63 -16 # 0 0 1 0 0 0 0 1 # 0 | F111: TDOA | H111: 5.0 | I111: 2 | J111: 256 | K111: 33269 | L111: 501 | M111: 1024 | N111: 0 | O111: 8 | P111: 1 | Q111: -174 | R111: -121 | S111: 40 | T111: 46
A112: -50 | C112: 1870.02 | E112: TDOA 85# # # 0 63 -16 # 0 0 1 0 0 0 0 1 # 0 | F112: TDOA | H112: 5.0 | I112: 2 | J112: 256 | K112: 33436 | L112: 668 | M112: 1024 | N112: 0 | O112: 8 | P112: 1 | Q112: -174 | R112: -121 | S112: 40 | T112: 46
A113: -50 | C113: 1875 | E113: TDOA 86# # # 0 63 -16 # 0 0 1 0 0 0 0 1 # 0 | F113: TDOA | H113: 5.0 | I113: 2 | J113: 256 | K113: 33602 | L113: 834 | M113: 1024 | N113: 0 | O113: 8 | P113: 1 | Q113: -174 | R113: -121 | S113: 40 | T113: 46
A114: -50 | C114: 1885.02 | E114: TDOA 88# # # 0 63 -16 # 0 0 1 0 0 0 0 1 # 0 | F114: TDOA | H114: 5.0 | I114: 2 | J114: 256 | K114: 33936 | L114: 1168 | M114: 1024 | N114: 0 | O114: 8 | P114: 1 | Q114: -174 | R114: -121 | S114: 40 | T114: 46
A115: -50 | C115: 1890 | E115: TDOA 89# # # 0 63 -16 # 0 0 1 0 0 0 0 1 # 0 | F115: TDOA | H115: 5.0 | I115: 2 | J115: 256 | K115: 34102 | L115: 1334 | M115: 1024 | N115: 0 | O115: 8 | P115: 1 | Q115: -174 | R115: -121 | S115: 40 | T115: 46
A116: -50 | C116: 1895.01 | E116: TDOA 180# # # 0 63 -16 # 0 0 1 0 0 0 0 1 # 0 | F116: TDOA | H116: 5.0 | I116: 2 | J116: 256 | K116: 34269 | L116: 1501 | M116: 1024 | N116: 0 | O116: 8 | P116: 1 | Q116: -174 | R116: -121 | S116: 40 | T116: 46
A117: -50 | C117: 1900.02 | E117: TDOA 181# # # 0 63 -16 # 0 0 1 0 0 0 0 1 # 0 | F117: TDOA | H117: 5.0 | I117: 2 | J117: 256 | K117: 34436 | L117: 1668 | M117: 1024 | N117: 0 | O117: 8 | P117: 1 | Q117: -174 | R117: -121 | S117: 40 | T117: 46
A118: -50 | C118: 1905 | E118: TDOA 182# # # 0 63 -16 # 0 0 1 0 0 0 0 1 # 0 | F118: TDOA | H118: 5.0 | I118: 2 | J118: 256 | K118: 34602 | L118: 1834 | M118: 1024 | N118: 0 | O118: 8 | P118: 1 | Q118: -174 | R118: -121 | S118: 40 | T118: 46
A119: -50 | C119: 1909.92 | E119: TDOA 183# # # 0 63 -16 # 0 0 1 0 0 0 0 1 # 0 | F119: TDOA | H119: 5.0 | I119: 2 | J119: 256 | K119: 34766 | L119: 1998 | M119: 1024 | N119: 0 | O119: 8 | P119: 1 | Q119: -174 | R119: -121 | S119: 40 | T119: 46
A123: Test Case 9 - DDC Tuning
A124: Signal Generator
A125: RF Power | B125: IF Power | C125: RF Frequency | D125: IF Frequency | E125: Command | F125: Response | H125: Timeout | I125: Attempts | J125: Block Size | K125: RF Channel | L125: IF Channel | M125: # Samples | N125: Averaging | O125: Low Limit | P125: High Limit
A126: -50 | C126: 1880.01 | E126: TDOA 98# # # 0 63 -16 # 0 0 1 0 0 0 0 1 # 0 | F126: TDOA | H126: 5.0 | I126: 2 | J126: 256 | K126: 33769 | L126: =RC[-1]-32768 -> 1001 | M126: 1024 | N126: 1 | O126: 29 | P126: 9999
A128: -50 | C128: 1850.04 | E128: TDOA 91# # # 0 63 -16 # 0 0 1 0 0 0 0 1 # 0 | F128: TDOA | H128: 5.0 | I128: 2 | J128: 256 | K128: 32770 | L128: =RC[-1]-32768 -> 2 | M128: 1024 | N128: 1 | O128: 29 | P128: 9999
A129: -50 | C129: 1855.11 | E129: TDOA 92# # # 0 63 -16 # 0 0 1 0 0 0 0 1 # 0 | F129: TDOA | H129: 5.0 | I129: 2 | J129: 256 | K129: 32939 | L129: =RC[-1]-32768 -> 171 | M129: 1024 | N129: 1 | O129: 29 | P129: 9999
A130: -50 | C130: 1860.21 | E130: TDOA 93# # # 0 63 -16 # 0 0 1 0 0 0 0 1 # 0 | F130: TDOA | H130: 5.0 | I130: 2 | J130: 256 | K130: 33109 | L130: =RC[-1]-32768 -> 341 | M130: 1024 | N130: 1 | O130: 29 | P130: 9999
A131: -50 | C131: 1865.31 | E131: TDOA 94# # # 0 63 -16 # 0 0 1 0 0 0 0 1 # 0 | F131: TDOA | H131: 5.0 | I131: 2 | J131: 256 | K131: 33279 | L131: =RC[-1]-32768 -> 511 | M131: 1024 | N131: 1 | O131: 29 | P131: 9999
A132: -50 | C132: 1870.41 | E132: TDOA 95# # # 0 63 -16 # 0 0 1 0 0 0 0 1 # 0 | F132: TDOA | H132: 5.0 | I132: 2 | J132: 256 | K132: 33449 | L132: =RC[-1]-32768 -> 681 | M132: 1024 | N132: 1 | O132: 29 | P132: 9999
A133: -50 | C133: 1875.51 | E133: TDOA 96# # # 0 63 -16 # 0 0 1 0 0 0 0 1 # 0 | F133: TDOA | H133: 5.0 | I133: 2 | J133: 256 | K133: 33619 | L133: =RC[-1]-32768 -> 851 | M133: 1024 | N133: 1 | O133: 29 | P133: 9999
A134: -50 | C134: 1880.61 | E134: TDOA 97# # # 0 63 -16 # 0 0 1 0 0 0 0 1 # 0 | F134: TDOA | H134: 5.0 | I134: 2 | J134: 256 | K134: 33789 | L134: =RC[-1]-32768 -> 1021 | M134: 1024 | N134: 1 | O134: 29 | P134: 9999
A135: -50 | C135: 1885.71 | E135: TDOA 98# # # 0 63 -16 # 0 0 1 0 0 0 0 1 # 0 | F135: TDOA | H135: 5.0 | I135: 2 | J135: 256 | K135: 33959 | L135: =RC[-1]-32768 -> 1191 | M135: 1024 | N135: 1 | O135: 29 | P135: 9999
A136: -50 | C136: 1890.81 | E136: TDOA 99# # # 0 63 -16 # 0 0 1 0 0 0 0 1 # 0 | F136: TDOA | H136: 5.0 | I136: 2 | J136: 256 | K136: 34129 | L136: =RC[-1]-32768 -> 1361 | M136: 1024 | N136: 1 | O136: 29 | P136: 9999
A137: -50 | C137: 1895.91 | E137: TDOA 190# # # 0 63 -16 # 0 0 1 0 0 0 0 1 # 0 | F137: TDOA | H137: 5.0 | I137: 2 | J137: 256 | K137: 34299 | L137: =RC[-1]-32768 -> 1531 | M137: 1024 | N137: 1 | O137: 29 | P137: 9999
A138: -50 | C138: 1901.01 | E138: TDOA 191# # # 0 63 -16 # 0 0 1 0 0 0 0 1 # 0 | F138: TDOA | H138: 5.0 | I138: 2 | J138: 256 | K138: 34469 | L138: =RC[-1]-32768 -> 1701 | M138: 1024 | N138: 1 | O138: 29 | P138: 9999
A139: -50 | C139: 1906.11 | E139: TDOA 192# # # 0 63 -16 # 0 0 1 0 0 0 0 1 # 0 | F139: TDOA | H139: 5.0 | I139: 2 | J139: 256 | K139: 34639 | L139: =RC[-1]-32768 -> 1871 | M139: 1024 | N139: 1 | O139: 29 | P139: 9999
A140: -50 | C140: 1909.89 | E140: TDOA 193# # # 0 63 -16 # 0 0 1 0 0 0 0 1 # 0 | F140: TDOA | H140: 5.0 | I140: 2 | J140: 256 | K140: 34765 | L140: =RC[-1]-32768 -> 1997 | M140: 1024 | N140: 1 | O140: 29 | P140: 9999
A144: Test Case 12 - Mini-RLS
A145: Signal Generator | C145: LMU Command
A146: RF Power | B146: RF Frequency | C146: Command Set | G146: Block Size | H146: # Blocks | I146: RF Channel | J146: # Samples | K146: |delay| (nsec) | L146: Phase Curvature | M146: Repeat and Average
A147: -40 | B147: 1850.2 | C147: CommandSequence12B | G147: 256 | H147: 4 | I147: 512 | J147: 1024 | K147: 150 | L147: 0.5 | M147: 2
A148: -40 | B148: =R[-1]C+0.2 -> 1850.4 | C148: CommandSequence12B | G148: 256 | H148: 4 | I148: =R[-1]C+1 -> 513 | J148: 1024 | K148: 150 | L148: 0.5 | M148: 2
A149: -40 | B149: 1880.01 | C149: CommandSequence12A | G149: 256 | H149: 4 | I149: 33769 | J149: 1024 | K149: 150 | L149: 0.5 | M149: 2
A150: -40 | B150: =R[-1]C+0.03 -> 1880.04 | C150: CommandSequence12A | G150: 256 | H150: 4 | I150: =R[-1]C+1 -> 33770 | J150: 1024 | K150: 150 | L150: 0.5 | M150: 2
A153: Test Case 13 - Config Attenuator
A154: Signal Generator
A155: RF Power | B155: IF Power | C155: RF Frequency | D155: IF Frequency | E155: Command | F155: Response | H155: Timeout | I155: Attempts | J155: Block Size | K155: RF Channel | L155: IF Channel | M155: TTG Channel | N155: # Samples | O155: Cnfg Attn Setting | P155: Averaging | Q155: Low Limit from previous level (dBm) | R155: High Limit from previous level (dBm)
A156: -50 | B156: -50 | C156: 1880.01 | D156: 70 | E156: TDOA 71# # # 0 63 -16 # 0 0 1 0 0 0 0 1 # 0 | F156: TDOA | H156: 5 | I156: 2 | J156: 256 | K156: 33769 | L156: 128 | M156: 33769 | N156: 1024 | O156: 0 | P156: 1 | Q156: -60 | R156: 0
A157: -50 | B157: -50 | C157: 1880.01 | D157: 70 | E157: TDOA 72# # # 0 63 -16 # 0 0 1 0 0 0 0 1 # 0 | F157: TDOA | H157: 5 | I157: 2 | J157: 256 | K157: 33769 | L157: 128 | M157: 33769 | N157: 1024 | O157: -8 | P157: 1 | Q157: -10 | R157: -6
A158: -50 | B158: -50 | C158: 1880.01 | D158: 70 | E158: TDOA 73# # # 0 63 -16 # 0 0 1 0 0 0 0 1 # 0 | F158: TDOA | H158: 5 | I158: 2 | J158: 256 | K158: 33769 | L158: 128 | M158: 33769 | N158: 1024 | O158: -10 | P158: 1 | Q158: -3.3 | R158: -0.7
A159: -50 | B159: -50 | C159: 1880.01 | D159: 70 | E159: TDOA 74# # # 0 63 -16 # 0 0 1 0 0 0 0 1 # 0 | F159: TDOA | H159: 5 | I159: 2 | J159: 256 | K159: 33769 | L159: 128 | M159: 33769 | N159: 1024 | O159: 6 | P159: 1 | Q159: 13.5 | R159: 18.5
A160: -50 | B160: -50 | C160: 1880.01 | D160: 70 | E160: TDOA 75# # # 0 63 -16 # 0 0 1 0 0 0 0 1 # 0 | F160: TDOA | H160: 5 | I160: 2 | J160: 256 | K160: 33769 | L160: 128 | M160: 33769 | N160: 1024 | O160: 2 | P160: 1 | Q160: -5.5 | R160: -2.5
A161: -50 | B161: -50 | C161: 1880.01 | D161: 70 | E161: TDOA 76# # # 0 63 -16 # 0 0 1 0 0 0 0 1 # 0 | F161: TDOA | H161: 5 | I161: 2 | J161: 256 | K161: 33769 | L161: 128 | M161: 33769 | N161: 1024 | O161: 1 | P161: 1 | Q161: -2 | R161: 0
A166: LO PLL
A167: 1023.5 MHz | D167: 1038.5 MHz | G167: 1043.5 MHz | J167: 1063.5 MHz
A168: eng | D168: eng | G168: eng | J168: eng
A169: TEST 7 5 4 3 0x00 0x00 0xD3 | D169: TEST 7 5 4 3 0x00 0x00 0xD3 | G169: TEST 7 5 4 3 0x00 0x00 0xD3 | J169: TEST 7 5 4 3 0x00 0x00 0xD3
A170: TEST 7 5 4 3 0x00 0x00 0x50 | D170: TEST 7 5 4 3 0x00 0x00 0x50 | G170: TEST 7 5 4 3 0x00 0x00 0x50 | J170: TEST 7 5 4 3 0x00 0x00 0x50
A171: TEST 7 5 4 3 0x00 0x1F 0xFD | D171: TEST 7 5 4 3 0x00 0x20 0x75 | G171: TEST 7 5 4 3 0x00 0x20 0x9D | J171: TEST 7 5 4 3 0x00 0x21 0x3D
A172: exit | D172: exit | G172: exit | J172: exit
A175: TTG Freq
A176: 1880.0 MHZ | B176: Response | D176: Timeout | E176: Begin State | F176: End State | G176: Attempts
A177: eng | D177: 0.5 | E177: DSHELL | F177: DSHELL | G177: 1
A178: TEST 7 5 4 5 0x00 0x00 0xD3 | D178: 1 | E178: DSHELL | F178: DSHELL | G178: 1
A179: TEST 7 5 4 5 0x00 0x00 0x50 | D179: 1 | E179: DSHELL | F179: DSHELL | G179: 1
A180: TEST 7 5 4 5 0x00 0x3A 0xC1 | D180: 1 | E180: DSHELL | F180: DSHELL | G180: 1
A181: exit | D181: 0.5 | E181: DSHELL | F181: DSHELL | G181: 1
A185: Gain Setup
A186: Setup | B186: Response | D186: Timeout | E186: Begin State | F186: End State | G186: Attempts
A187: bdcgain 1 43 | D187: 0.5 | E187: DSHELL | F187: DSHELL | G187: 1
A188: bdcgain 2 43 | D188: 0.5 | E188: DSHELL | F188: DSHELL | G188: 1
A189: bdcgain 3 43 | D189: 0.5 | E189: DSHELL | F189: DSHELL | G189: 1
A190: bdcgain 4 43 | D190: 0.5 | E190: DSHELL | F190: DSHELL | G190: 1
A191: bdcgain 5 43 | D191: 0.5 | E191: DSHELL | F191: DSHELL | G191: 1
A192: bdcgain 6 43 | D192: 0.5 | E192: DSHELL | F192: DSHELL | G192: 1
A195: Config Atten Setup
A196: Setup | B196: Response | D196: Timeout | E196: Begin State | F196: End State | G196: Attempts
A197: bdcgain 1 35varGain | D197: 0.5 | E197: DSHELL | F197: ENG | G197: 1
A198: bdcgain 2 35varGain | D198: 0.5 | E198: DSHELL | F198: ENG | G198: 1
A199: bdcgain 3 35varGain | D199: 0.5 | E199: DSHELL | F199: ENG | G199: 1
A200: bdcgain 4 35varGain | D200: 0.5 | E200: DSHELL | F200: ENG | G200: 1
A201: bdcgain 5 35varGain | D201: 0.5 | E201: DSHELL | F201: ENG | G201: 1
A202: bdcgain 6 35varGain | D202: 0.5 | E202: DSHELL | F202: ENG | G202: 1
A206: Data Path Settings
A207: Data Path 1 | D207: Timeout | E207: Begin State | F207: End State | G207: Attempts
A208: eng | D208: 0.5 | E208: DSHELL | F208: ENG | G208: 1
A209: Test 1 1 0 0 0 | D209: 0.5 | E209: ENG | F209: ENG | G209: 1
A210: exit | D210: 0.5 | E210: ENG | F210: DSHELL | G210: 1
A213: Data Path 2 | D213: Timeout | E213: Begin State | F213: End State | G213: Attempts
A214: eng | D214: 0.5 | E214: DSHELL | F214: ENG | G214: 1
A215: Test 1 0 1 0 0 | D215: 0.5 | E215: ENG | F215: ENG | G215: 1
A216: exit | D216: 0.5 | E216: ENG | F216: DSHELL | G216: 1
A219: Data Path 3 | D219: Timeout | E219: Begin State | F219: End State | G219: Attempts
A220: eng | D220: 0.5 | E220: DSHELL | F220: ENG | G220: 1
A221: Test 1 0 0 1 0 | D221: 0.5 | E221: ENG | F221: ENG | G221: 1
A222: exit | D222: 0.5 | E222: ENG | F222: DSHELL | G222: 1
A225: Data Path 4 | D225: Timeout | E225: Begin State | F225: End State | G225: Attempts
A226: eng | D226: 0.5 | E226: DSHELL | F226: ENG | G226: 1
A227: Test 1 0 0 0 1 | D227: 0.5 | E227: ENG | F227: ENG | G227: 1
A228: exit | D228: 0.5 | E228: ENG | F228: DSHELL | G228: 1
A231: Data Path 5 | D231: Timeout | E231: Begin State | F231: End State | G231: Attempts
A232: eng | D232: 0.5 | E232: DSHELL | F232: ENG | G232: 1
A233: Test 1 1 1 1 1 | D233: 0.5 | E233: ENG | F233: ENG | G233: 1
A234: exit | D234: 0.5 | E234: ENG | F234: DSHELL | G234: 1
A237: Compensation Settings
A238: Receiver compensated gain | D238: Timeout | E238: Begin State | F238: End State | G238: Attempts
A239: eng | D239: 0.5 | E239: DSHELL | F239: ENG | G239: 1
A240: Test 4 0xA0 0x48 6 | B240: DATA Read: | D240: 1 | E240: ENG | F240: ENG | G240: 1
A241: TEST 4 0xA0 0x1F 1 | B241: DATA Read: 41 | D241: 1 | E241: ENG | F241: ENG | G241: 1
A242: Test 4 0xA0 0x30 6 | B242: DATA Read: | D242: 1 | E242: ENG | F242: ENG | G242: 1
A243: exit | D243: 0.5 | E243: ENG | F243: DSHELL | G243: 1
A246: TTG compensated Level | D246: Timeout | E246: Begin State | F246: End State | G246: Attempts
A247: eng | D247: 0.5 | E247: DSHELL | F247: ENG | G247: 1
A248: Test 4 0xA0 0x42 6 | B248: DATA Read: | D248: 1 | E248: ENG | F248: ENG | G248: 1
A249: TEST 4 0xA0 0x1F 1 | B249: DATA Read: 41 | D249: 1 | E249: ENG | F249: ENG | G249: 1 | H249: Note: | I249: If we get DATA Read: 41, then the software will skip
A250: Test 4 0xA0 0x2A 6 | B250: DATA Read: | D250: 1 | E250: ENG | F250: ENG | G250: 1 | I250: over the next line and go directly to exit
A251: exit | D251: 0.5 | E251: ENG | F251: DSHELL | G251: 1
A254: Receiver Gain Compensation | D254: Timeout | E254: Begin State | F254: End State | G254: Attempts
A255: eng | D255: 0.5 | E255: DSHELL | F255: ENG | G255: 1
A256: TEST 4 0xA0 0x1F 1 | B256: DATA Read: 41 | D256: 0.5 | E256: ENG | F256: ENG | G256: 1
A257: Test 4 0xA0 0x20 6 | B257: DATA Read: | D257: 0.5 | E257: ENG | F257: ENG | G257: 1
A258: exit | D258: 0.5 | E258: ENG | F258: DSHELL | G258: 1
A261: EnableTTG | B261: Response | D261: Timeout | E261: Begin State | F261: End State | G261: Attempts
A262: eng | D262: 0.5 | E262: DSHELL | F262: ENG | G262: 1
A263: TEST 7 3 8 6 8 | D263: 0.5 | E263: ENG | F263: ENG | G263: 1
A264: TEST 7 3 4 4 5 | D264: 0.5 | E264: ENG | F264: ENG | G264: 1
A265: TEST 7 3 4 6 1 | D265: 0.5 | E265: ENG | F265: ENG | G265: 1
A266: exit | D266: 0.5 | E266: ENG | F266: DSHELL | G266: 1
A269: DisableTTG | D269: Timeout | E269: Begin State | F269: End State | G269: Attempts
A270: eng | D270: 0.5 | E270: DSHELL | F270: ENG | G270: 1
A271: TEST 7 3 8 6 5 | D271: 0.5 | E271: ENG | F271: ENG | G271: 1
A272: TEST 7 3 4 4 1 | D272: 0.5 | E272: ENG | F272: ENG | G272: 1
A273: TEST 7 3 4 6 0 | D273: 0.5 | E273: ENG | F273: ENG | G273: 1
A274: exit | D274: 0.5 | E274: ENG | F274: DSHELL | G274: 1
A277: Mute On | D277: Timeout | E277: Begin State | F277: End State | G277: Attempts
A278: eng | D278: 0.5 | E278: DSHELL | F278: ENG | G278: 1
A279: TEST 7 3 8 6 8 | D279: 0.5 | E279: ENG | F279: ENG | G279: 1
A280: exit | D280: 0.5 | E280: ENG | F280: DSHELL | G280: 1
A283: Mute Off | D283: Timeout | E283: Begin State | F283: End State | G283: Attempts
A284: eng | D284: 0.5 | E284: DSHELL | F284: ENG | G284: 1
A285: TEST 7 3 8 6 5 | D285: 0.5 | E285: ENG | F285: ENG | G285: 1
A286: exit | D286: 0.5 | E286: ENG | F286: DSHELL | G286: 1
A289: Change Admin State
A290: Command | B290: Response | D290: Timeout | E290: Begin State | F290: End State | G290: # of retries
A291: etest 15 1 | D291: 2 | E291: DSHELL | F291: DSHELL | G291: 1
A295: Check Alarms
A296: Command | B296: Response | D296: Timeout | E296: Begin State | F296: End State | G296: # of retries
A297: ALARMS | B297: FAULT_GPS_HOLDOVER | D297: 2 | E297: DSHELL | F297: DSHELL | G297: 1
A301: Mini-RLS Command Sequence 12A (AMPS)
A302: Command | B302: Response | D302: Timeout | E302: Begin State | F302: End State | G302: # of retries
A303: ALARMS | B303: FAULT_GPS_HOLDOVER | D303: 2 | E303: DSHELL | F303: DSHELL | G303: 1
A304: TIME | B304: GPS Time: | D304: 2 | E304: DSHELL | F304: DSHELL | G304: 2
A305: SVCR # # 2 # # 0 1 0 0 0 1 1 1 # 0 0 | B305: returnCode 0 | D305: 2 | E305: DSHELL | F305: DSHELL | G305: 1
A306: WAIT | D306: 15 | E306: DSHELL | F306: DSHELL | G306: 1
A307: TDATA # 0 2 # # # -16 0 1 0 0 11 0 63 -16 | B307: TDOA | D307: 15 | E307: DSHELL | F307: DSHELL | G307: 1
A311: Mini-RLS Command Sequence 12B (GSM)
A312: Command | B312: Response | D312: Timeout | E312: Begin State | F312: End State | G312: # of retries
A313: ALARMS | B313: FAULT_GPS_HOLDOVER | D313: 2 | E313: DSHELL | F313: DSHELL | G313: 1
A314: TIME | B314: GPS Time: | D314: 2 | E314: DSHELL | F314: DSHELL | G314: 2
A315: GVCR # 2 # # 0 # 0 # # 17 1 0 0 0 0 0 0 1 1 1 8 0 0 0 0 0 0 0 0 0 0 0 | B315: returnCode 0 | D315: 2 | E315: DSHELL | F315: DSHELL | G315: 1
A316: WAIT | D316: 15 | E316: DSHELL | F316: DSHELL | G316: 1
A317: TDATA # 0 2 # # # -16 0 1 0 0 11 0 63 -16 | B317: TDOA | D317: 15 | E317: DSHELL | F317: DSHELL | G317: 1

Sheet: 061605
C1: Factors
C2: TTG | D2: 100
C3: Gain | D3: 200
C4: TTG Comp | D4: 100
C5: Gain Comp | D5: 250
F8: Temperature Coefficient | J8: Center Temperature
F10: -3.5000000000000003E-2 | H10: dB/deg | J10: 30 | L10: deg
A15: Test Case 2 - Processor Memory
A16: Command | B16: Response | D16: Timeout | E16: Begin State | F16: End State | G16: Attempts
A17: BIT 4 1 | B17: No Failure | D17: 20 | E17: DSHELL | F17: DSHELL | G17: 1
A18: BIT 4 2 | B18: No Failure | D18: 20 | E18: DSHELL | F18: DSHELL | G18: 1
A19: BIT 4 3 | B19: No Failure | D19: 20 | E19: DSHELL | F19: DSHELL | G19: 1
A20: BIT 4 4 | B20: No Failure | D20: 20 | E20: DSHELL | F20: DSHELL | G20: 1
A24: Test Case 3 - SNR
A25: Signal Generator
A26: RF Power | B26: IF Power | C26: RF Frequency | D26: IF Frequency | E26: Command | F26: Response | H26: Timeout | I26: Attempts | J26: Block Size | K26: RF Channel | L26: IF Channel | M26: TTG Channel | N26: # Samples | O26: Averaging | P26: Low Limit | Q26: High Limit
A27: -40 | B27: -40 | C27: 824.04 | D27: 70 | E27: TDOA 31# # # 0 63 -16 # 0 0 1 0 0 0 0 1 # 0 | F27: TDOA | H27: 5.0 | I27: 2 | J27: 256 | K27: 991 | L27: 128 | M27: 383 | N27: 1024 | O27: 1 | P27: 25 | Q27: 9999
A29: -40 | B29: -40 | C29: 827.01 | D29: 70 | E29: TDOA 32# # # 0 63 -16 # 0 0 1 0 0 0 0 1 # 0 | F29: TDOA | H29: 5.0 | I29: 2 | J29: 256 | K29: 67 | L29: 128 | M29: 383 | N29: 1024 | O29: 1 | P29: 25 | Q29: 9999
A30: -40 | B30: -40 | C30: 829.71 | D30: 70 | E30: TDOA 33# # # 0 63 -16 # 0 0 1 0 0 0 0 1 # 0 | F30: TDOA | H30: 5.0 | I30: 2 | J30: 256 | K30: 157 | L30: 128 | M30: 383 | N30: 1024 | O30: 1 | P30: 25 | Q30: 9999
A31: -40 | B31: -40 | C31: 829.74 | D31: 70 | E31: TDOA 34# # # 0 63 -16 # 0 0 1 0 0 0 0 1 # 0 | F31: TDOA | H31: 5.0 | I31: 2 | J31: 256 | K31: 158 | L31: 128 | M31: 383 | N31: 1024 | O31: 1 | P31: 25 | Q31: 9999
A32: -40 | B32: -40 | C32: 832.5 | D32: 70 | E32: TDOA 35# # # 0 63 -16 # 0 0 1 0 0 0 0 1 # 0 | F32: TDOA | H32: 5.0 | I32: 2 | J32: 256 | K32: 250 | L32: 128 | M32: 383 | N32: 1024 | O32: 1 | P32: 25 | Q32: 9999
A33: -40 | B33: -40 | C33: 834.99 | D33: 70 | E33: TDOA 36# # # 0 63 -16 # 0 0 1 0 0 0 0 1 # 0 | F33: TDOA | H33: 5.0 | I33: 2 | J33: 256 | K33: 333 | L33: 128 | M33: 383 | N33: 1024 | O33: 1 | P33: 25 | Q33: 9999
A34: -40 | B34: -40 | C34: 835.02 | D34: 70 | E34: TDOA 37# # # 0 63 -16 # 0 0 1 0 0 0 0 1 # 0 | F34: TDOA | H34: 5.0 | I34: 2 | J34: 256 | K34: 334 | L34: 128 | M34: 383 | N34: 1024 | O34: 1 | P34: 25 | Q34: 9999
A35: -40 | B35: -40 | C35: 837.51 | D35: 70 | E35: TDOA 38# # # 0 63 -16 # 0 0 1 0 0 0 0 1 # 0 | F35: TDOA | H35: 5.0 | I35: 2 | J35: 256 | K35: 417 | L35: 128 | M35: 383 | N35: 1024 | O35: 1 | P35: 25 | Q35: 9999
A36: -40 | B36: -40 | C36: 840.21 | D36: 70 | E36: TDOA 39# # # 0 63 -16 # 0 0 1 0 0 0 0 1 # 0 | F36: TDOA | H36: 5.0 | I36: 2 | J36: 256 | K36: 507 | L36: 128 | M36: 383 | N36: 1024 | O36: 1 | P36: 25 | Q36: 9999
A37: -40 | B37: -40 | C37: 840.24 | D37: 70 | E37: TDOA 130# # # 0 63 -16 # 0 0 1 0 0 0 0 1 # 0 | F37: TDOA | H37: 5.0 | I37: 2 | J37: 256 | K37: 508 | L37: 128 | M37: 383 | N37: 1024 | O37: 1 | P37: 25 | Q37: 9999
A38: -40 | B38: -40 | C38: 842.01 | D38: 70 | E38: TDOA 131# # # 0 63 -16 # 0 0 1 0 0 0 0 1 # 0 | F38: TDOA | H38: 5.0 | I38: 2 | J38: 256 | K38: 567 | L38: 128 | M38: 383 | N38: 1024 | O38: 1 | P38: 25 | Q38: 9999
A39: -40 | B39: -40 | C39: 844.65 | D39: 70 | E39: TDOA 132# # # 0 63 -16 # 0 0 1 0 0 0 0 1 # 0 | F39: TDOA | H39: 5.0 | I39: 2 | J39: 256 | K39: 655 | L39: 128 | M39: 383 | N39: 1024 | O39: 1 | P39: 25 | Q39: 9999
A40: -40 | B40: -40 | C40: 844.68 | D40: 70 | E40: TDOA 133# # # 0 63 -16 # 0 0 1 0 0 0 0 1 # 0 | F40: TDOA | H40: 5.0 | I40: 2 | J40: 256 | K40: 656 | L40: 128 | M40: 383 | N40: 1024 | O40: 1 | P40: 25 | Q40: 9999
A41: -40 | B41: -40 | C41: 846.51 | D41: 70 | E41: TDOA 134# # # 0 63 -16 # 0 0 1 0 0 0 0 1 # 0 | F41: TDOA | H41: 5.0 | I41: 2 | J41: 256 | K41: 717 | L41: 128 | M41: 383 | N41: 1024 | O41: 1 | P41: 25 | Q41: 9999
A42: -40 | B42: -40 | C42: 848.97 | D42: 70 | E42: TDOA 135# # # 0 63 -16 # 0 0 1 0 0 0 0 1 # 0 | F42: TDOA | H42: 5.0 | I42: 2 | J42: 256 | K42: 799 | L42: 128 | M42: 383 | N42: 1024 | O42: 1 | P42: 25 | Q42: 9999
A46: Test Case 5 - Two-Tone Response
B47: SigGen1 | D47: SigGen2
A48: Center RF Channel | B48: RF Frequency | C48: RF Power | D48: RF Frequency | E48: Command | F48: Response | G48: Timeout | H48: Attempts | I48: Block Size | J48: Lower Channel | K48: Upper Channel | L48: # Samples | M48: Cnfg Attn | N48: Averaging | O48: Low Limit | P48: High Limit | Q48: Lower Channel Delta | R48: Upper Channel Delta
A49: 824.4 | B49: =RC[-1]-0.06 -> 824.34 | C49: -45 | D49: =RC[-3]+0.06 -> 824.45999999999992 | E49: TDOA 51# # # 0 63 -16 # 0 0 1 0 0 0 0 1 # 0 | F49: TDOA | G49: 5.0 | H49: 2 | I49: 256 | J49: 1001 | K49: 1005 | L49: 1024 | M49: 15 | N49: 1 | O49: -999 | P49: -65 | Q49: 4 | R49: 4
A51: 827.07 | B51: =RC[-1]-0.06 -> 827.0100000000001 | C51: -45 | D51: =RC[-3]+0.06 -> 827.13 | E51: TDOA 52# # # 0 63 -16 # 0 0 1 0 0 0 0 1 # 0 | F51: TDOA | G51: 5.0 | H51: 2 | I51: 256 | J51: 67 | K51: 71 | L51: 1024 | M51: 15 | N51: 1 | O51: -999 | P51: -65 | Q51: 4 | R51: 4
A52: 827.37 | B52: =RC[-1]-0.06 -> 827.31000000000006 | C52: -45 | D52: =RC[-3]+0.06 -> 827.43 | E52: TDOA 53# # # 0 63 -16 # 0 0 1 0 0 0 0 1 # 0 | F52: TDOA | G52: 5.0 | H52: 2 | I52: 256 | J52: 77 | K52: 81 | L52: 1024 | M52: 15 | N52: 1 | O52: -999 | P52: -65 | Q52: 4 | R52: 4
A53: 829.77 | B53: =RC[-1]-0.06 -> 829.71 | C53: -45 | D53: =RC[-3]+0.06 -> 829.82999999999993 | E53: TDOA 54# # # 0 63 -16 # 0 0 1 0 0 0 0 1 # 0 | F53: TDOA | G53: 5.0 | H53: 2 | I53: 256 | J53: 157 | K53: 161 | L53: 1024 | M53: 15 | N53: 1 | O53: -999 | P53: -65 | Q53: 4 | R53: 4
A54: 830.07 | B54: =RC[-1]-0.06 -> 830.0100000000001 | C54: -45 | D54: =RC[-3]+0.06 -> 830.13 | E54: TDOA 55# # # 0 63 -16 # 0 0 1 0 0 0 0 1 # 0 | F54: TDOA | G54: 5.0 | H54: 2 | I54: 256 | J54: 167 | K54: 171 | L54: 1024 | M54: 15 | N54: 1 | O54: -999 | P54: -65 | Q54: 4 | R54: 4
A55: 829.8 | B55: =RC[-1]-0.06 -> 829.74 | C55: -45 | D55: =RC[-3]+0.06 -> 829.8599999999999 | E55: TDOA 56# # # 0 63 -16 # 0 0 1 0 0 0 0 1 # 0 | F55: TDOA | G55: 5.0 | H55: 2 | I55: 256 | J55: 158 | K55: 162 | L55: 1024 | M55: 15 | N55: 1 | O55: -999 | P55: -65 | Q55: 4 | R55: 4
A56: 830.1 | B56: =RC[-1]-0.06 -> 830.04000000000008 | C56: -45 | D56: =RC[-3]+0.06 -> 830.16 | E56: TDOA 57# # # 0 63 -16 # 0 0 1 0 0 0 0 1 # 0 | F56: TDOA | G56: 5.0 | H56: 2 | I56: 256 | J56: 168 | K56: 172 | L56: 1024 | M56: 15 | N56: 1 | O56: -999 | P56: -65 | Q56: 4 | R56: 4
A57: 832.56 | B57: =RC[-1]-0.06 -> 832.5 | C57: -45 | D57: =RC[-3]+0.06 -> 832.61999999999989 | E57: TDOA 58# # # 0 63 -16 # 0 0 1 0 0 0 0 1 # 0 | F57: TDOA | G57: 5.0 | H57: 2 | I57: 256 | J57: 250 | K57: 254 | L57: 1024 | M57: 15 | N57: 1 | O57: -999 | P57: -65 | Q57: 4 | R57: 4
A58: 832.86 | B58: =RC[-1]-0.06 -> 832.80000000000007 | C58: -45 | D58: =RC[-3]+0.06 -> 832.92 | E58: TDOA 59# # # 0 63 -16 # 0 0 1 0 0 0 0 1 # 0 | F58: TDOA | G58: 5.0 | H58: 2 | I58: 256 | J58: 260 | K58: 264 | L58: 1024 | M58: 15 | N58: 1 | O58: -999 | P58: -65 | Q58: 4 | R58: 4
A59: 835.05 | B59: =RC[-1]-0.06 -> 834.99 | C59: -45 | D59: =RC[-3]+0.06 -> 835.1099999999999 | E59: TDOA 150# # # 0 63 -16 # 0 0 1 0 0 0 0 1 # 0 | F59: TDOA | G59: 5.0 | H59: 2 | I59: 256 | J59: 333 | K59: 337 | L59: 1024 | M59: 15 | N59: 1 | O59: -999 | P59: -65 | Q59: 4 | R59: 4
A60: 835.35 | B60: =RC[-1]-0.06 -> 835.29000000000008 | C60: -45 | D60: =RC[-3]+0.06 -> 835.41 | E60: TDOA 151# # # 0 63 -16 # 0 0 1 0 0 0 0 1 # 0 | F60: TDOA | G60: 5.0 | H60: 2 | I60: 256 | J60: 343 | K60: 347 | L60: 1024 | M60: 15 | N60: 1 | O60: -999 | P60: -65 | Q60: 4 | R60: 4
A61: 835.08 | B61: =RC[-1]-0.06 -> 835.0200000000001 | C61: -45 | D61: =RC[-3]+0.06 -> 835.14 | E61: TDOA 152# # # 0 63 -16 # 0 0 1 0 0 0 0 1 # 0 | F61: TDOA | G61: 5.0 | H61: 2 | I61: 256 | J61: 334 | K61: 338 | L61: 1024 | M61: 15 | N61: 1 | O61: -999 | P61: -65 | Q61: 4 | R61: 4
A62: 835.38 | B62: =RC[-1]-0.06 -> 835.32 | C62: -45 | D62: =RC[-3]+0.06 -> 835.43999999999994 | E62: TDOA 153# # # 0 63 -16 # 0 0 1 0 0 0 0 1 # 0 | F62: TDOA | G62: 5.0 | H62: 2 | I62: 256 | J62: 344 | K62: 348 | L62: 1024 | M62: 15 | N62: 1 | O62: -999 | P62: -65 | Q62: 4 | R62: 4
A63: 837.57 | B63: =RC[-1]-0.06 -> 837.5100000000001 | C63: -45 | D63: =RC[-3]+0.06 -> 837.63 | E63: TDOA 154# # # 0 63 -16 # 0 0 1 0 0 0 0 1 # 0 | F63: TDOA | G63: 5.0 | H63: 2 | I63: 256 | J63: 417 | K63: 421 | L63: 1024 | M63: 15 | N63: 1 | O63: -999 | P63: -65 | Q63: 4 | R63: 4
A64: 837.87 | B64: =RC[-1]-0.06 -> 837.81000000000006 | C64: -45 | D64: =RC[-3]+0.06 -> 837.93 | E64: TDOA 155# # # 0 63 -16 # 0 0 1 0 0 0 0 1 # 0 | F64: TDOA | G64: 5.0 | H64: 2 | I64: 256 | J64: 427 | K64: 431 | L64: 1024 | M64: 15 | N64: 1 | O64: -999 | P64: -65 | Q64: 4 | R64: 4
A65: 840.27 | B65: =RC[-1]-0.06 -> 840.21 | C65: -45 | D65: =RC[-3]+0.06 -> 840.32999999999993 | E65: TDOA 156# # # 0 63 -16 # 0 0 1 0 0 0 0 1 # 0 | F65: TDOA | G65: 5.0 | H65: 2 | I65: 256 | J65: 507 | K65: 511 | L65: 1024 | M65: 15 | N65: 1 | O65: -999 | P65: -65 | Q65: 4 | R65: 4
A66: 840.57 | B66: =RC[-1]-0.06 -> 840.5100000000001 | C66: -45 | D66: =RC[-3]+0.06 -> 840.63 | E66: TDOA 157# # # 0 63 -16 # 0 0 1 0 0 0 0 1 # 0 | F66: TDOA | G66: 5.0 | H66: 2 | I66: 256 | J66: 517 | K66: 521 | L66: 1024 | M66: 15 | N66: 1 | O66: -999 | P66: -65 | Q66: 4 | R66: 4
A67: 840.3 | B67: =RC[-1]-0.06 -> 840.24 | C67: -45 | D67: =RC[-3]+0.06 -> 840.3599999999999 | E67: TDOA 158# # # 0 63 -16 # 0 0 1 0 0 0 0 1 # 0 | F67: TDOA | G67: 5.0 | H67: 2 | I67: 256 | J67: 508 | K67: 512 | L67: 1024 | M67: 15 | N67: 1 | O67: -999 | P67: -65 | Q67: 4 | R67: 4
A68: 840.6 | B68: =RC[-1]-0.06 -> 840.54000000000008 | C68: -45 | D68: =RC[-3]+0.06 -> 840.66 | E68: TDOA 159# # # 0 63 -16 # 0 0 1 0 0 0 0 1 # 0 | F68: TDOA | G68: 5.0 | H68: 2 | I68: 256 | J68: 518 | K68: 522 | L68: 1024 | M68: 15 | N68: 1 | O68: -999 | P68: -65 | Q68: 4 | R68: 4
A69: 842.07 | B69: =RC[-1]-0.06 -> 842.0100000000001 | C69: -45 | D69: =RC[-3]+0.06 -> 842.13 | E69: TDOA 250# # # 0 63 -16 # 0 0 1 0 0 0 0 1 # 0 | F69: TDOA | G69: 5.0 | H69: 2 | I69: 256 | J69: 567 | K69: 571 | L69: 1024 | M69: 15 | N69: 1 | O69: -999 | P69: -65 | Q69: 4 | R69: 4
A70: 842.37 | B70: =RC[-1]-0.06 -> 842.31000000000006 | C70: -45 | D70: =RC[-3]+0.06 -> 842.43 | E70: TDOA 251# # # 0 63 -16 # 0 0 1 0 0 0 0 1 # 0 | F70: TDOA | G70: 5.0 | H70: 2 | I70: 256 | J70: 577 | K70: 581 | L70: 1024 | M70: 15 | N70: 1 | O70: -999 | P70: -65 | Q70: 4 | R70: 4
A71: 844.71 | B71: =RC[-1]-0.06 -> 844.65000000000009 | C71: -45 | D71: =RC[-3]+0.06 -> 844.77 | E71: TDOA 252# # # 0 63 -16 # 0 0 1 0 0 0 0 1 # 0 | F71: TDOA | G71: 5.0 | H71: 2 | I71: 256 | J71: 655 | K71: 659 | L71: 1024 | M71: 15 | N71: 1 | O71: -999 | P71: -65 | Q71: 4 | R71: 4
A72: 845.01 | B72: =RC[-1]-0.06 -> 844.95 | C72: -45 | D72: =RC[-3]+0.06 -> 845.06999999999994 | E72: TDOA 253# # # 0 63 -16 # 0 0 1 0 0 0 0 1 # 0 | F72: TDOA | G72: 5.0 | H72: 2 | I72: 256 | J72: 665 | K72: 669 | L72: 1024 | M72: 15 | N72: 1 | O72: -999 | P72: -65 | Q72: 4 | R72: 4
A73: 844.74 | B73: =RC[-1]-0.06 -> 844.68000000000006 | C73: -45 | D73: =RC[-3]+0.06 -> 844.8 | E73: TDOA 254# # # 0 63 -16 # 0 0 1 0 0 0 0 1 # 0 | F73: TDOA | G73: 5.0 | H73: 2 | I73: 256 | J73: 656 | K73: 660 | L73: 1024 | M73: 15 | N73: 1 | O73: -999 | P73: -65 | Q73: 4 | R73: 4
A74: 845.04 | B74: =RC[-1]-0.06 -> 844.98 | C74: -45 | D74: =RC[-3]+0.06 -> 845.09999999999991 | E74: TDOA 255# # # 0 63 -16 # 0 0 1 0 0 0 0 1 # 0 | F74: TDOA | G74: 5.0 | H74: 2 | I74: 256 | J74: 666 | K74: 670 | L74: 1024 | M74: 15 | N74: 1 | O74: -999 | P74: -65 | Q74: 4 | R74: 4
A75: 846.57 | B75: =RC[-1]-0.06 -> 846.5100000000001 | C75: -45 | D75: =RC[-3]+0.06 -> 846.63 | E75: TDOA 256# # # 0 63 -16 # 0 0 1 0 0 0 0 1 # 0 | F75: TDOA | G75: 5.0 | H75: 2 | I75: 256 | J75: 717 | K75: 721 | L75: 1024 | M75: 15 | N75: 1 | O75: -999 | P75: -65 | Q75: 4 | R75: 4
A76: 846.87 | B76: =RC[-1]-0.06 -> 846.81000000000006 | C76: -45 | D76: =RC[-3]+0.06 -> 846.93 | E76: TDOA 257# # # 0 63 -16 # 0 0 1 0 0 0 0 1 # 0 | F76: TDOA | G76: 5.0 | H76: 2 | I76: 256 | J76: 727 | K76: 731 | L76: 1024 | M76: 15 | N76: 1 | O76: -999 | P76: -65 | Q76: 4 | R76: 4
A77: 849.03 | B77: =RC[-1]-0.06 -> 848.97 | C77: -45 | D77: =RC[-3]+0.06 -> 849.08999999999992 | E77: TDOA 258# # # 0 63 -16 # 0 0 1 0 0 0 0 1 # 0 | F77: TDOA | G77: 5.0 | H77: 2 | I77: 256 | J77: 799 | K77: 803 | L77: 1024 | M77: 15 | N77: 1 | O77: -999 | P77: -65 | Q77: 4 | R77: 4
A82: Test Case 6 - Phase Noise
A83: Signal Generator
A84: RF Power | B84: IF Power | C84: RF Frequency | D84: IF Frequency | E84: Command | F84: Response | G84: Timeout | H84: Attempts | I84: Block Size | J84: RF Channel | K84: IF Channel | L84: # Samples | M84: Averaging | N84: Low Limit | O84: High Limit
A85: -50 | B85: -50 | C85: 827.04 | D85: 70 | E85: TDOA 61# # # 0 63 -16 # 0 0 1 0 0 0 0 1 # 0 | F85: TDOA | G85: 5.0 | H85: 2 | I85: 256 | J85: 68 | K85: 128 | L85: 1024 | M85: 8 | N85: 0 | O85: 3
A87: -50 | B87: -50 | C87: 832.5 | D87: 70 | E87: TDOA 62# # # 0 63 -16 # 0 0 1 0 0 0 0 1 # 0 | F87: TDOA | G87: 5.0 | H87: 2 | I87: 256 | J87: 250 | K87: 128 | L87: 1024 | M87: 8 | N87: 0 | O87: 3
A88: -50 | B88: -50 | C88: 837.51 | D88: 70 | E88: TDOA 63# # # 0 63 -16 # 0 0 1 0 0 0 0 1 # 0 | F88: TDOA | G88: 5.0 | H88: 2 | I88: 256 | J88: 417 | K88: 128 | L88: 1024 | M88: 8 | N88: 0 | O88: 3
A89: -50 | B89: -50 | C89: 842.01 | D89: 70 | E89: TDOA 64# # # 0 63 -16 # 0 0 1 0 0 0 0 1 # 0 | F89: TDOA | G89: 5.0 | H89: 2 | I89: 256 | J89: 567 | K89: 128 | L89: 1024 | M89: 8 | N89: 0 | O89: 3
A90: -50 | B90: -50 | C90: 846.51 | D90: 70 | E90: TDOA 65# # # 0 63 -16 # 0 0 1 0 0 0 0 1 # 0 | F90: TDOA | G90: 5.0 | H90: 2 | I90: 256 | J90: 717 | K90: 128 | L90: 1024 | M90: 8 | N90: 0 | O90: 3
A94: Test Case 7 - Data Integrity
A95: Signal Generator
A96: RF Power | B96: IF Power | C96: RF Frequency | D96: IF Frequency | E96: Command | F96: Response | H96: Timeout | I96: Attempts | J96: Block Size | K96: RF Channel | L96: IF Channel | M96: TTG Channel | N96: # Samples | O96: Cnfg Attn | P96: Averaging | Q96: Low Limit | R96: High Limit
A97: -40 | B97: -45 | C97: 828.84 | D97: 70 | E97: TDOA 71# # # 0 63 -16 # 0 0 1 0 0 0 0 1 # 0 | F97: TDOA | H97: 5.0 | I97: 2 | J97: 256 | K97: 128 | L97: 128 | M97: 383 | N97: 1024 | O97: 6 | P97: 1 | Q97: 25 | R97: 9999
A98: -40 | B98: -45 | C98: 828.84 | D98: 70 | E98: TDOA 72# # # 0 63 -16 # 0 0 1 0 0 0 0 1 # 0 | F98: TDOA | H98: 5.0 | I98: 2 | J98: 256 | K98: 128 | L98: 128 | M98: 383 | N98: 1024 | O98: 6 | P98: 1 | Q98: 25 | R98: 9999
A99: -40 | B99: -45 | C99: 828.84 | D99: 70 | E99: TDOA 73# # # 0 63 -16 # 0 0 1 0 0 0 0 1 # 0 | F99: TDOA | H99: 5.0 | I99: 2 | J99: 256 | K99: 128 | L99: 128 | M99: 383 | N99: 1024 | O99: 6 | P99: 1 | Q99: 25 | R99: 9999
A100: -40 | B100: -45 | C100: 828.84 | D100: 70 | E100: TDOA 74# # # 0 63 -16 # 0 0 1 0 0 0 0 1 # 0 | F100: TDOA | H100: 5.0 | I100: 2 | J100: 256 | K100: 128 | L100: 128 | M100: 383 | N100: 1024 | O100: 6 | P100: 1 | Q100: 25 | R100: 9999
A101: -40 | B101: -45 | C101: 828.84 | D101: 70 | E101: TDOA 75# # # 0 63 -16 # 0 0 1 0 0 0 0 1 # 0 | F101: TDOA | H101: 5.0 | I101: 2 | J101: 256 | K101: 128 | L101: 128 | M101: 383 | N101: 1024 | O101: 6 | P101: 1 | Q101: 25 | R101: 9999
A105: Test Case 8 - Noise Floor
A106: Signal Generator
A107: RF Power | B107: IF Power | C107: RF Frequency | D107: IF Frequency | E107: Command | F107: Response | H107: Timeout | I107: Attempts | J107: Block Size | K107: RF Channel | L107: IF Channel | M107: # Samples | N107: Cnfg Attn | O107: Signal Averaging | P107: Averaging | Q107: Low Limit | R107: High Limit | S107: Low Limit Gain | T107: High Limit Gain
A108: -40 | B108: -40 | C108: 836.5 | D108: 70 | E108: TDOA 86# # # 0 63 -16 # 0 0 1 0 0 0 0 1 # 0 | F108: TDOA | H108: 5.0 | I108: 2 | J108: 256 | K108: 383 | L108: 128 | M108: 1024 | N108: 0 | O108: 1 | P108: 8 | Q108: -174 | R108: -131 | S108: 30 | T108: 36
A110: -40 | B110: -40 | C110: 827.04 | D110: 70 | E110: TDOA 81# # # 0 63 -16 # 0 0 1 0 0 0 0 1 # 0 | F110: TDOA | H110: 5.0 | I110: 2 | J110: 256 | K110: 68 | L110: 128 | M110: 1024 | N110: 0 | O110: 1 | P110: 8 | Q110: -174 | R110: -131 | S110: 30 | T110: 36
A111: -40 | B111: -40 | C111: 832.5 | D111: 70 | E111: TDOA 82# # # 0 63 -16 # 0 0 1 0 0 0 0 1 # 0 | F111: TDOA | H111: 5.0 | I111: 2 | J111: 256 | K111: 250 | L111: 128 | M111: 1024 | N111: 0 | O111: 1 | P111: 8 | Q111: -174 | R111: -131 | S111: 30 | T111: 36
A112: -40 | B112: -40 | C112: 837.51 | D112: 70 | E112: TDOA 83# # # 0 63 -16 # 0 0 1 0 0 0 0 1 # 0 | F112: TDOA | H112: 5.0 | I112: 2 | J112: 256 | K112: 417 | L112: 128 | M112: 1024 | N112: 0 | O112: 1 | P112: 8 | Q112: -174 | R112: -131 | S112: 30 | T112: 36
A113: -40 | B113: -40 | C113: 842.01 | D113: 70 | E113: TDOA 84# # # 0 63 -16 # 0 0 1 0 0 0 0 1 # 0 | F113: TDOA | H113: 5.0 | I113: 2 | J113: 256 | K113: 567 | L113: 128 | M113: 1024 | N113: 0 | O113: 1 | P113: 8 | Q113: -174 | R113: -131 | S113: 30 | T113: 36
A114: -40 | B114: -40 | C114: 846.51 | D114: 70 | E114: TDOA 85# # # 0 63 -16 # 0 0 1 0 0 0 0 1 # 0 | F114: TDOA | H114: 5.0 | I114: 2 | J114: 256 | K114: 717 | L114: 128 | M114: 1024 | N114: 0 | O114: 1 | P114: 8 | Q114: -174 | R114: -131 | S114: 30 | T114: 36
A115: -40 | B115: -40 | C115: 848.97 | D115: 70 | E115: TDOA 86# # # 0 63 -16 # 0 0 1 0 0 0 0 1 # 0 | F115: TDOA | H115: 5.0 | I115: 2 | J115: 256 | K115: 799 | L115: 128 | M115: 1024 | N115: 0 | O115: 1 | P115: 8 | Q115: -174 | R115: -131 | S115: 30 | T115: 36
A116: -40 | B116: -40 | C116: 824.04 | D116: 70 | E116: TDOA 87# # # 0 63 -16 # 0 0 1 0 0 0 0 1 # 0 | F116: TDOA | H116: 5.0 | I116: 2 | J116: 256 | K116: 991 | L116: 128 | M116: 1024 | N116: 0 | O116: 1 | P116: 8 | Q116: -174 | R116: -131 | S116: 30 | T116: 36
A120: Test Case 9 - DDC Tuning
A121: Signal Generator
A122: RF Power | B122: IF Power | C122: RF Frequency | D122: IF Frequency | E122: Command | F122: Response | H122: Timeout | I122: Attempts | J122: Block Size | K122: RF Channel | L122: IF Channel | M122: # Samples | N122: Averaging | O122: Low Limit | P122: High Limit
A123: -40 | B123: -40 | C123: 825.6 | D123: 68.8 | E123: TDOA 91# # # 0 63 -16 # 0 0 1 0 0 0 0 1 # 0 | F123: TDOA | H123: 5.0 | I123: 2 | J123: 256 | K123: 20 | L123: 88 | M123: 1024 | N123: 1 | O123: 25 | P123: 9999
A125: -40 | B125: -40 | C125: 828.6 | D125: 69.400000000000006 | E125: TDOA 92# # # 0 63 -16 # 0 0 1 0 0 0 0 1 # 0 | F125: TDOA | H125: 5.0 | I125: 2 | J125: 256 | K125: 120 | L125: 108 | M125: 1024 | N125: 1 | O125: 25 | P125: 9999
A126: -40 | B126: -40 | C126: 831.6 | D126: 70 | E126: TDOA 93# # # 0 63 -16 # 0 0 1 0 0 0 0 1 # 0 | F126: TDOA | H126: 5.0 | I126: 2 | J126: 256 | K126: 220 | L126: 128 | M126: 1024 | N126: 1 | O126: 25 | P126: 9999
A127: -40 | B127: -40 | C127: 834.6 | D127: 70.45 | E127: TDOA 94# # # 0 63 -16 # 0 0 1 0 0 0 0 1 # 0 | F127: TDOA | H127: 5.0 | I127: 2 | J127: 256 | K127: 320 | L127: 143 | M127: 1024 | N127: 1 | O127: 25 | P127: 9999
A128: -40 | B128: -40 | C128: 837.6 | D128: 70.900000000000006 | E128: TDOA 95# # # 0 63 -16 # 0 0 1 0 0 0 0 1 # 0 | F128: TDOA | H128: 5.0 | I128: 2 | J128: 256 | K128: 420 | L128: 158 | M128: 1024 | N128: 1 | O128: 25 | P128: 9999
A129: -40 | B129: -40 | C129: 840.6 | D129: 71.349999999999994 | E129: TDOA 96# # # 0 63 -16 # 0 0 1 0 0 0 0 1 # 0 | F129: TDOA | H129: 5.0 | I129: 2 | J129: 256 | K129: 520 | L129: 173 | M129: 1024 | N129: 1 | O129: 25 | P129: 9999
A130: -40 | B130: -40 | C130: 843.6 | D130: 71.8 | E130: TDOA 97# # # 0 63 -16 # 0 0 1 0 0 0 0 1 # 0 | F130: TDOA | H130: 5.0 | I130: 2 | J130: 256 | K130: 620 | L130: 188 | M130: 1024 | N130: 1 | O130: 25 | P130: 9999
A131: -40 | B131: -40 | C131: 848.97 | D131: 72.25 | E131: TDOA 98# # # 0 63 -16 # 0 0 1 0 0 0 0 1 # 0 | F131: TDOA | H131: 5.0 | I131: 2 | J131: 256 | K131: 799 | L131: 203 | M131: 1024 | N131: 1 | O131: 25 | P131: 9999
A132: -40 | B132: -40 | C132: 824.04 | D132: 68.2 | E132: TDOA 99# # # 0 63 -16 # 0 0 1 0 0 0 0 1 # 0 | F132: TDOA | H132: 5.0 | I132: 2 | J132: 256 | K132: 991 | L132: 68 | M132: 1024 | N132: 1 | O132: 25 | P132: 9999
A136: Test Case 10 - T1
A137: Command Prior to 10 | B137: Response | D137: Timeout | E137: Begin State | F137: End State | G137: Attempts
A138: GoT1Master | D138: 3 | E138: DSHELL | F138: DSHELL | G138: 1
A139: RunLocalT1 500 100 | B139: Bad 0 | D139: 20 | E139: DSHELL | F139: DSHELL | G139: 1
A143: Command | B143: Response | D143: Timeout | E143: Begin State | F143: End State | G143: Attempts
A144: GOMASTER | D144: 3 | E144: DSHELL | F144: DSHELL | G144: 1
A145: RUNLOCALLOOP 500 100 | B145: Bad 0 | D145: 20 | E145: DSHELL | F145: DSHELL | G145: 1
A149: Test Case 11 - Ethernet
A150: Command | B150: Response | D150: Timeout | E150: Begin State | F150: End State | G150: Attempts
A151: ethtest | B151: ethtest | D151: 20 | E151: DSHELL | F151: DSHELL | G151: 1
A155: Test Case 12 - Mini-RLS
A156: Signal Generator | C156: LMU Command
A157: RF Power | B157: RF Frequency | C157: Command Set | G157: Block Size | H157: # Blocks | I157: RF Channel | J157: # Samples | K157: |delay| (nsec) | L157: Phase Curvature | M157: Repeat and Average
A158: -40 | B158: 824.2 | C158: CommandSequence12B | G158: 256 | H158: 4 | I158: 128 | J158: 1024 | K158: 150 | L158: 0.5 | M158: 5
A159: -40 | B159: 829 | C159: CommandSequence12B | G159: 256 | H159: 4 | I159: 152 | J159: 1024 | K159: 150 | L159: 0.5 | M159: 5
A160: -40 | B160: 834 | C160: CommandSequence12B | G160: 256 | H160: 4 | I160: 177 | J160: 1024 | K160: 150 | L160: 0.5 | M160: 5
A161: -40 | B161: 839 | C161: CommandSequence12B | G161: 256 | H161: 4 | I161: 202 | J161: 1024 | K161: 150 | L161: 0.5 | M161: 5
A162: -40 | B162: 844 | C162: CommandSequence12B | G162: 256 | H162: 4 | I162: 227 | J162: 1024 | K162: 150 | L162: 0.5 | M162: 5
A163: -40 | B163: 848.8 | C163: CommandSequence12B | G163: 256 | H163: 4 | I163: 251 | J163: 1024 | K163: 150 | L163: 0.5 | M163: 5
A164: -40 | B164: 824.04 | C164: CommandSequence12A | G164: 256 | H164: 4 | I164: 991 | J164: 1024 | K164: 150 | L164: 0.5 | M164: 5
A165: -40 | B165: 828.98999999999546 | C165: CommandSequence12A | G165: 256 | H165: 4 | I165: 133 | J165: 1024 | K165: 150 | L165: 0.5 | M165: 5
A166: -40 | B166: 833.99999999999091 | C166: CommandSequence12A | G166: 256 | H166: 4 | I166: 300 | J166: 1024 | K166: 150 | L166: 0.5 | M166: 5
A167: -40 | B167: 839.00999999998635 | C167: CommandSequence12A | G167: 256 | H167: 4 | I167: 467 | J167: 1024 | K167: 150 | L167: 0.5 | M167: 5
A168: -40 | B168: 844.01999999998179 | C168: CommandSequence12A | G168: 256 | H168: 4 | I168: 634 | J168: 1024 | K168: 150 | L168: 0.5 | M168: 5
A169: -40 | B169: 848.96999999997729 | C169: CommandSequence12A | G169: 256 | H169: 4 | I169: 799 | J169: 1024 | K169: 150 | L169: 0.5 | M169: 5
A172: Test Case 13 - Config Attenuator
A173: Signal Generator
A174: RF Power | B174: IF Power | C174: RF Frequency | D174: IF Frequency | E174: Command | F174: Response | H174: Timeout | I174: Attempts | J174: Block Size | K174: RF Channel | L174: IF Channel | M174: TTG Channel | N174: # Samples | O174: Cnfg Attn Setting | P174: Averaging | Q174: Low Limit from previous level (dBm) | R174: High Limit from previous level (dBm)
A175: -40 | B175: -40 | C175: 836.5 | D175: 70 | E175: TDOA 71# # # 0 63 -16 # 0 0 1 0 0 0 0 1 # 0 | F175: TDOA | H175: 5 | I175: 2 | J175: 256 | K175: 383 | L175: 128 | M175: 383 | N175: 1024 | O175: 0 | P175: 1 | Q175: -60 | R175: 0
A176: -40 | B176: -40 | C176: 836.5 | D176: 70 | E176: TDOA 72# # # 0 63 -16 # 0 0 1 0 0 0 0 1 # 0 | F176: TDOA | H176: 5 | I176: 2 | J176: 256 | K176: 383 | L176: 128 | M176: 383 | N176: 1024 | O176: -8 | P176: 1 | Q176: -10 | R176: -6
A177: -40 | B177: -40 | C177: 836.5 | D177: 70 | E177: TDOA 73# # # 0 63 -16 # 0 0 1 0 0 0 0 1 # 0 | F177: TDOA | H177: 5 | I177: 2 | J177: 256 | K177: 383 | L177: 128 | M177: 383 | N177: 1024 | O177: -10 | P177: 1 | Q177: -3.3 | R177: -0.7
A178: -40 | B178: -40 | C178: 836.5 | D178: 70 | E178: TDOA 74# # # 0 63 -16 # 0 0 1 0 0 0 0 1 # 0 | F178: TDOA | H178: 5 | I178: 2 | J178: 256 | K178: 383 | L178: 128 | M178: 383 | N178: 1024 | O178: 6 | P178: 1 | Q178: 13.5 | R178: 18.5
A179: -40 | B179: -40 | C179: 836.5 | D179: 70 | E179: TDOA 75# # # 0 63 -16 # 0 0 1 0 0 0 0 1 # 0 | F179: TDOA | H179: 5 | I179: 2 | J179: 256 | K179: 383 | L179: 128 | M179: 383 | N179: 1024 | O179: 2 | P179: 1 | Q179: -5.5 | R179: -2.5
A180: -40 | B180: -40 | C180: 836.5 | D180: 70 | E180: TDOA 76# # # 0 63 -16 # 0 0 1 0 0 0 0 1 # 0 | F180: TDOA | H180: 5 | I180: 2 | J180: 256 | K180: 383 | L180: 128 | M180: 383 | N180: 1024 | O180: 1 | P180: 1 | Q180: -2 | R180: 0
A185: LO PLL
A186: 756.0 MHz | D186: 766.5 MHz | G186: 778.0 MHz
A187: eng | D187: eng | G187: eng
A188: TEST 2 5 4 3 0x00 0x00 0x50 | D188: TEST 2 5 4 3 0x00 0x00 0xD3 | G188: TEST 2 5 4 3 0x00 0x00 0x50
A189: TEST 2 5 4 3 0x10 0x17 0xA1 | D189: TEST 2 5 4 3 0x00 0x00 0x50 | G189: TEST 2 5 4 3 0x10 0x18 0x51
A190: TEST 2 5 4 3 0x00 0x12 0xD3 | D190: TEST 2 5 4 3 0x10 0x17 0xF5 | G190: TEST 2 5 4 3 0x00 0x12 0xD3
A191: exit | D191: exit | G191: exit
A195: TTG Freq
A196: 836.5 MHZ | B196: Response | D196: Timeout | E196: Begin State | F196: End State | G196: Attempts
A197: eng | D197: 0.5 | E197: DSHELL | F197: ENG | G197: 1
A198: TEST 2 5 4 5 0x00 0x00 0xD3 | D198: 1 | E198: DSHELL | F198: ENG | G198: 1
A199: TEST 2 5 4 5 0x00 0x00 0x50 | D199: 1 | E199: DSHELL | F199: ENG | G199: 1
A200: TEST 2 5 4 5 0x10 0x1A 0x25 | D200: 1 | E200: DSHELL | F200: ENG | G200: 1
A201: exit | D201: 0.5 | E201: ENG | F201: DSHELL | G201: 1
A205: Gain Setup
A206: Setup | B206: Response | D206: Timeout | E206: Begin State | F206: End State | G206: Attempts
A207: gain 1 33 | D207: 0.5 | E207: DSHELL | F207: ENG | G207: 1
A208: gain 2 33 | D208: 0.5 | E208: DSHELL | F208: ENG | G208: 1
A209: gain 3 33 | D209: 0.5 | E209: DSHELL | F209: ENG | G209: 1
A210: gain 4 33 | D210: 0.5 | E210: DSHELL | F210: ENG | G210: 1
A211: gain 5 33 | D211: 0.5 | E211: DSHELL | F211: ENG | G211: 1
A212: gain 6 33 | D212: 0.5 | E212: DSHELL | F212: ENG | G212: 1
A215: Config Atten Setup
A216: Setup | B216: Response | D216: Timeout | E216: Begin State | F216: End State | G216: Attempts
A217: gain 1 25varGain | D217: 0.5 | E217: DSHELL | F217: ENG | G217: 1
A218: gain 2 25varGain | D218: 0.5 | E218: DSHELL | F218: ENG | G218: 1
A219: gain 3 25varGain | D219: 0.5 | E219: DSHELL | F219: ENG | G219: 1
A220: gain 4 25varGain | D220: 0.5 | E220: DSHELL | F220: ENG | G220: 1
A221: gain 5 25varGain | D221: 0.5 | E221: DSHELL | F221: ENG | G221: 1
A222: gain 6 25varGain | D222: 0.5 | E222: DSHELL | F222: ENG | G222: 1
A225: Data Path Settings
A226: Data Path 1 | D226: Timeout | E226: Begin State | F226: End State | G226: Attempts
A227: eng | D227: 0.5 | E227: DSHELL | F227: ENG | G227: 1
A228: Test 1 1 0 0 0 | D228: 0.5 | E228: ENG | F228: ENG | G228: 1
A229: exit | D229: 0.5 | E229: ENG | F229: DSHELL | G229: 1
A232: Data Path 2 | D232: Timeout | E232: Begin State | F232: End State | G232: Attempts
A233: eng | D233: 0.5 | E233: DSHELL | F233: ENG | G233: 1
A234: Test 1 0 1 0 0 | D234: 0.5 | E234: ENG | F234: ENG | G234: 1
A235: exit | D235: 0.5 | E235: ENG | F235: DSHELL | G235: 1
A238: Data Path 3 | D238: Timeout | E238: Begin State | F238: End State | G238: Attempts
A239: eng | D239: 0.5 | E239: DSHELL | F239: ENG | G239: 1
A240: Test 1 0 0 1 0 | D240: 0.5 | E240: ENG | F240: ENG | G240: 1
A241: exit | D241: 0.5 | E241: ENG | F241: DSHELL | G241: 1
A244: Data Path 4 | D244: Timeout | E244: Begin State | F244: End State | G244: Attempts
A245: eng | D245: 0.5 | E245: DSHELL | F245: ENG | G245: 1
A246: Test 1 0 0 0 1 | D246: 0.5 | E246: ENG | F246: ENG | G246: 1
A247: exit | D247: 0.5 | E247: ENG | F247: DSHELL | G247: 1
A250: Data Path 5 | D250: Timeout | E250: Begin State | F250: End State | G250: Attempts
A251: eng | D251: 0.5 | E251: DSHELL | F251: ENG | G251: 1
A252: Test 1 1 1 1 1 | D252: 0.5 | E252: ENG | F252: ENG | G252: 1
A253: exit | D253: 0.5 | E253: ENG | F253: DSHELL | G253: 1
A256: Compensation Settings
A257: Receiver compensated gain | D257: Timeout | E257: Begin State | F257: End State | G257: Attempts
A258: eng | D258: 0.5 | E258: DSHELL | F258: ENG | G258: 1
A259: Test 4 0xA4 0x48 6 | B259: DATA Read: | D259: 1 | E259: ENG | F259: ENG | G259: 1
A260: TEST 4 0xA4 0x1F 1 | B260: DATA Read: 41 | D260: 1 | E260: ENG | F260: ENG | G260: 1
A261: Test 4 0xA4 0x30 6 | B261: DATA Read: | D261: 1 | E261: ENG | F261: ENG | G261: 1
A262: exit | D262: 0.5 | E262: ENG | F262: DSHELL | G262: 1
A265: TTG compensated Level | D265: Timeout | E265: Begin State | F265: End State | G265: Attempts
A266: eng | D266: 0.5 | E266: DSHELL | F266: ENG | G266: 1
A267: Test 4 0xA4 0x42 6 | B267: DATA Read: | D267: 1 | E267: ENG | F267: ENG | G267: 1
A268: TEST 4 0xA4 0x1F 1 | B268: DATA Read: 41 | D268: 1 | E268: ENG | F268: ENG | G268: 1 | H268: Note: | I268: If we get DATA Read: 41, then the software will skip
A269: Test 4 0xA4 0x2A 6 | B269: DATA Read: | D269: 1 | E269: ENG | F269: ENG | G269: 1 | I269: over the next line and go directly to exit
A270: exit | D270: 0.5 | E270: ENG | F270: DSHELL | G270: 1
A273: Receiver Gain Compensation | D273: Timeout | E273: Begin State | F273: End State | G273: Attempts
A274: eng | D274: 0.5 | E274: DSHELL | F274: ENG | G274: 1
A275: TEST 4 0xA4 0x1F 1 | B275: DATA Read: 41 | D275: 0.5 | E275: ENG | F275: ENG | G275: 1
A276: Test 4 0xA4 0x20 6 | B276: DATA Read: | D276: 0.5 | E276: ENG | F276: ENG | G276: 1
A277: exit | D277: 0.5 | E277: ENG | F277: DSHELL | G277: 1
A280: EnableTTG | B280: Response | D280: Timeout | E280: Begin State | F280: End State | G280: Attempts
A281: eng | D281: 0.5 | E281: DSHELL | F281: ENG | G281: 1
A282: TEST 2 3 8 6 8 | D282: 0.5 | E282: ENG | F282: ENG | G282: 1
A283: TEST 2 3 4 4 5 | D283: 0.5 | E283: ENG | F283: ENG | G283: 1
A284: TEST 2 3 4 6 1 | D284: 0.5 | E284: ENG | F284: ENG | G284: 1
A285: exit | D285: 0.5 | E285: ENG | F285: DSHELL | G285: 1
A288: DisableTTG | D288: Timeout | E288: Begin State | F288: End State | G288: Attempts
A289: eng | D289: 0.5 | E289: DSHELL | F289: ENG | G289: 1
A290: TEST 2 3 8 6 5 | D290: 0.5 | E290: ENG | F290: ENG | G290: 1
A291: TEST 2 3 4 4 1 | D291: 0.5 | E291: ENG | F291: ENG | G291: 1
A292: TEST 2 3 4 6 0 | D292: 0.5 | E292: ENG | F292: ENG | G292: 1
A293: exit | D293: 0.5 | E293: ENG | F293: DSHELL | G293: 1
A296: Mute On | D296: Timeout | E296: Begin State | F296: End State | G296: Attempts
A297: eng | D297: 0.5 | E297: DSHELL | F297: ENG | G297: 1
A298: TEST 2 3 8 6 8 | D298: 0.5 | E298: ENG | F298: ENG | G298: 1
A299: exit | D299: 0.5 | E299: ENG | F299: DSHELL | G299: 1
A302: Mute Off | D302: Timeout | E302: Begin State | F302: End State | G302: Attempts
A303: eng | D303: 0.5 | E303: DSHELL | F303: ENG | G303: 1
A304: TEST 2 3 8 6 5 | D304: 0.5 | E304: ENG | F304: ENG | G304: 1
A305: exit | D305: 0.5 | E305: ENG | F305: DSHELL | G305: 1
A308: Change Admin State
A309: Command | B309: Response | D309: Timeout | E309: Begin State | F309: End State | G309: # of retries
A310: etest 15 1 | D310: 2 | E310: DSHELL | F310: DSHELL | G310: 1
A314: Check Alarms
A315: Command | B315: Response | D315: Timeout | E315: Begin State | F315: End State | G315: # of retries
A316: ALARMS | B316: FAULT_GPS_HOLDOVER | D316: 2 | E316: DSHELL | F316: DSHELL | G316: 1
A320: Mini-RLS Command Sequence 12A (AMPS)
A321: Command | B321: Response | D321: Timeout | E321: Begin State | F321: End State | G321: # of retries
A322: ALARMS | B322: FAULT_GPS_HOLDOVER | D322: 2 | E322: DSHELL | F322: DSHELL | G322: 1
A323: TIME | B323: GPS Time: | D323: 2 | E323: DSHELL | F323: DSHELL | G323: 2
A324: SVCR # # 2 # # 0 1 0 0 0 1 1 1 # 0 0 | B324: returnCode 0 | D324: 2 | E324: DSHELL | F324: DSHELL | G324: 1
A325: WAIT | D325: 15 | E325: DSHELL | F325: DSHELL | G325: 1
A326: TDATA # 0 2 # # # -16 0 1 0 0 11 0 63 -16 | B326: TDOA | D326: 15 | E326: DSHELL | F326: DSHELL | G326: 1
A330: Mini-RLS Command Sequence 12B (GSM)
A331: Command | B331: Response | D331: Timeout | E331: Begin State | F331: End State | G331: # of retries
A332: ALARMS | B332: FAULT_GPS_HOLDOVER | D332: 2 | E332: DSHELL | F332: DSHELL | G332: 1
A333: TIME | B333: GPS Time: | D333: 2 | E333: DSHELL | F333: DSHELL | G333: 2
A334: GVCR # 2 # # 0 # 0 # # 17 1 0 0 0 0 0 0 1 1 1 8 0 0 0 0 0 0 0 0 0 0 0 | B334: returnCode 0 | D334: 2 | E334: DSHELL | F334: DSHELL | G334: 1
A335: WAIT | D335: 15 | E335: DSHELL | F335: DSHELL | G335: 1
A336: TDATA # 0 2 # # # -16 0 1 0 0 11 0 63 -16 | B336: TDOA | D336: 15 | E336: DSHELL | F336: DSHELL | G336: 1

Sheet: 061609
C1: Factors
C2: TTG | D2: 50
C3: Gain | D3: 400
C4: TTG Comp | D4: 100
C5: Gain Comp | D5: 350
F8: Temperature Coefficient | J8: Center Temperature
F10: -3.5000000000000003E-2 | H10: dB/deg | J10: 30 | L10: deg
A15: Test Case 2 - Processor Memory
A16: Command | B16: Response | D16: Timeout | E16: Begin State | F16: End State | G16: Attempts
A17: BIT 4 1 | B17: No Failure | D17: 20 | E17: DSHELL | F17: DSHELL | G17: 1
A18: BIT 4 2 | B18: No Failure | D18: 20 | E18: DSHELL | F18: DSHELL | G18: 1
A19: BIT 4 3 | B19: No Failure | D19: 20 | E19: DSHELL | F19: DSHELL | G19: 1
A20: BIT 4 4 | B20: No Failure | D20: 20 | E20: DSHELL | F20: DSHELL | G20: 1
A24: Test Case 3 - SNR
A25: Signal Generator
A26: RF Power | B26: IF Power | C26: RF Frequency | D26: IF Frequency | E26: Command | F26: Response | H26: Timeout | I26: Attempts | J26: Block Size | K26: RF Channel | L26: IF Channel | M26: TTG Channel | N26: # Samples | O26: Averaging | P26: Low Limit | Q26: High Limit
A27: -50 | B27: -50 | C27: 1850.04 | D27: 70 | E27: TDOA 31# # # 0 63 -16 # 0 0 1 0 0 0 0 1 # 0 | F27: TDOA | H27: 5.0 | I27: 2 | J27: 256 | K27: 32770 | L27: 2 | M27: 383 | N27: 1024 | O27: 1 | P27: 25 | Q27: 9999
A29: -50 | B29: -50 | C29: 1852.47 | D29: 70 | E29: TDOA 32# # # 0 63 -16 # 0 0 1 0 0 0 0 1 # 0 | F29: TDOA | H29: 5.0 | I29: 2 | J29: 256 | K29: 32851 | L29: 83 | M29: 383 | N29: 1024 | O29: 1 | P29: 25 | Q29: 9999
A30: -50 | B30: -50 | C30: 1854.99 | D30: 70 | E30: TDOA 33# # # 0 63 -16 # 0 0 1 0 0 0 0 1 # 0 | F30: TDOA | H30: 5.0 | I30: 2 | J30: 256 | K30: 32935 | L30: 167 | M30: 383 | N30: 1024 | O30: 1 | P30: 25 | Q30: 9999
A31: -50 | B31: -50 | C31: 1864.98 | D31: 70 | E31: TDOA 34# # # 0 63 -16 # 0 0 1 0 0 0 0 1 # 0 | F31: TDOA | H31: 5.0 | I31: 2 | J31: 256 | K31: 33268 | L31: 500 | M31: 383 | N31: 1024 | O31: 1 | P31: 25 | Q31: 9999
A32: -50 | B32: -50 | C32: 1867.5 | D32: 70 | E32: TDOA 35# # # 0 63 -16 # 0 0 1 0 0 0 0 1 # 0 | F32: TDOA | H32: 5.0 | I32: 2 | J32: 256 | K32: 33352 | L32: 584 | M32: 383 | N32: 1024 | O32: 1 | P32: 25 | Q32: 9999
A33: -50 | B33: -50 | C33: 1869.99 | D33: 70 | E33: TDOA 36# # # 0 63 -16 # 0 0 1 0 0 0 0 1 # 0 | F33: TDOA | H33: 5.0 | I33: 2 | J33: 256 | K33: 33435 | L33: 667 | M33: 383 | N33: 1024 | O33: 1 | P33: 25 | Q33: 9999
A34: -50 | B34: -50 | C34: 1870.02 | D34: 70 | E34: TDOA 37# # # 0 63 -16 # 0 0 1 0 0 0 0 1 # 0 | F34: TDOA | H34: 5.0 | I34: 2 | J34: 256 | K34: 33436 | L34: 668 | M34: 383 | N34: 1024 | O34: 1 | P34: 25 | Q34: 9999
A35: -50 | B35: -50 | C35: 1872.39 | D35: 70 | E35: TDOA 38# # # 0 63 -16 # 0 0 1 0 0 0 0 1 # 0 | F35: TDOA | H35: 5.0 | I35: 2 | J35: 256 | K35: 33515 | L35: 747 | M35: 383 | N35: 1024 | O35: 1 | P35: 25 | Q35: 9999
A36: -50 | B36: -50 | C36: 1875 | D36: 70 | E36: TDOA 39# # # 0 63 -16 # 0 0 1 0 0 0 0 1 # 0 | F36: TDOA | H36: 5.0 | I36: 2 | J36: 256 | K36: 33602 | L36: 834 | M36: 383 | N36: 1024 | O36: 1 | P36: 25 | Q36: 9999
A37: -50 | B37: -50 | C37: 1884.99 | D37: 70 | E37: TDOA 130# # # 0 63 -16 # 0 0 1 0 0 0 0 1 # 0 | F37: TDOA | H37: 5.0 | I37: 2 | J37: 256 | K37: 33935 | L37: 1167 | M37: 383 | N37: 1024 | O37: 1 | P37: 25 | Q37: 9999
A38: -50 | B38: -50 | C38: 1887.45 | D38: 70 | E38: TDOA 131# # # 0 63 -16 # 0 0 1 0 0 0 0 1 # 0 | F38: TDOA | H38: 5.0 | I38: 2 | J38: 256 | K38: 34017 | L38: 1249 | M38: 383 | N38: 1024 | O38: 1 | P38: 25 | Q38: 9999
A39: -50 | B39: -50 | C39: 1890 | D39: 70 | E39: TDOA 132# # # 0 63 -16 # 0 0 1 0 0 0 0 1 # 0 | F39: TDOA | H39: 5.0 | I39: 2 | J39: 256 | K39: 34102 | L39: 1334 | M39: 383 | N39: 1024 | O39: 1 | P39: 25 | Q39: 9999
A40: -50 | B40: -50 | C40: 1890.03 | D40: 70 | E40: TDOA 133# # # 0 63 -16 # 0 0 1 0 0 0 0 1 # 0 | F40: TDOA | H40: 5.0 | I40: 2 | J40: 256 | K40: 34103 | L40: 1335 | M40: 383 | N40: 1024 | O40: 1 | P40: 25 | Q40: 9999
A41: -50 | B41: -50 | C41: 1892.4 | D41: 70 | E41: TDOA 134# # # 0 63 -16 # 0 0 1 0 0 0 0 1 # 0 | F41: TDOA | H41: 5.0 | I41: 2 | J41: 256 | K41: 34182 | L41: 1414 | M41: 383 | N41: 1024 | O41: 1 | P41: 25 | Q41: 9999
A42: -50 | B42: -50 | C42: 1894.95 | D42: 70 | E42: TDOA 135# # # 0 63 -16 # 0 0 1 0 0 0 0 1 # 0 | F42: TDOA | H42: 5.0 | I42: 2 | J42: 256 | K42: 34267 | L42: 1499 | M42: 383 | N42: 1024 | O42: 1 | P42: 25 | Q42: 9999
A43: -50 | B43: -50 | C43: 1905 | D43: 70 | E43: TDOA 136# # # 0 63 -16 # 0 0 1 0 0 0 0 1 # 0 | F43: TDOA | H43: 5.0 | I43: 2 | J43: 256 | K43: 34602 | L43: 1834 | M43: 383 | N43: 1024 | O43: 1 | P43: 25 | Q43: 9999
A44: -50 | B44: -50 | C44: 1907.43 | D44: 70 | E44: TDOA 137# # # 0 63 -16 # 0 0 1 0 0 0 0 1 # 0 | F44: TDOA | H44: 5.0 | I44: 2 | J44: 256 | K44: 34683 | L44: 1915 | M44: 383 | N44: 1024 | O44: 1 | P44: 25 | Q44: 9999
A45: -50 | B45: -50 | C45: 1909.92 | D45: 70 | E45: TDOA 138# # # 0 63 -16 # 0 0 1 0 0 0 0 1 # 0 | F45: TDOA | H45: 5.0 | I45: 2 | J45: 256 | K45: 34766 | L45: 1998 | M45: 383 | N45: 1024 | O45: 1 | P45: 25 | Q45: 9999
A49: Test Case 5 - Two-Tone Response
B50: SigGen1 | D50: SigGen2
A51: Center RF Channel | B51: RF Frequency | C51: RF Power | D51: RF Frequency | E51: Command | F51: Response | G51: Timeout | H51: Attempts | I51: Block Size | J51: Lower Channel | K51: Upper Channel | L51: # Samples | M51: Cnfg Attn | N51: Averaging | O51: Low Limit | P51: High Limit | Q51: Lower Channel Delta | R51: Upper Channel Delta
A52: 1852.5 | B52: 1852.44 | C52: -55 | D52: 1852.56 | E52: TDOA 51# # # 0 63 -16 # 0 0 1 0 0 0 0 1 # 0 | F52: TDOA | G52: 5.0 | H52: 2 | I52: 256 | J52: 32850 | K52: 32854 | L52: 1024 | M52: 15 | N52: 1 | O52: -999 | P52: -65 | Q52: 4 | R52: 4
A54: 1852.8 | B54: 1852.74 | C54: -55 | D54: 1852.86 | E54: TDOA 52# # # 0 63 -16 # 0 0 1 0 0 0 0 1 # 0 | F54: TDOA | G54: 5.0 | H54: 2 | I54: 256 | J54: 32860 | K54: 32864 | L54: 1024 | M54: 15 | N54: 1 | O54: -999 | P54: -65 | Q54: 4 | R54: 4
A55: 1857.6 | B55: 1857.54 | C55: -55 | D55: 1857.66 | E55: TDOA 53# # # 0 63 -16 # 0 0 1 0 0 0 0 1 # 0 | F55: TDOA | G55: 5.0 | H55: 2 | I55: 256 | J55: 33020 | K55: 33024 | L55: 1024 | M55: 15 | N55: 1 | O55: -999 | P55: -65 | Q55: 4 | R55: 4
A56: 1857.9 | B56: 1857.84 | C56: -55 | D56: 1857.96 | E56: TDOA 54# # # 0 63 -16 # 0 0 1 0 0 0 0 1 # 0 | F56: TDOA | G56: 5.0 | H56: 2 | I56: 256 | J56: 33030 | K56: 33034 | L56: 1024 | M56: 15 | N56: 1 | O56: -999 | P56: -65 | Q56: 4 | R56: 4
A57: 1862.4 | B57: 1862.34 | C57: -55 | D57: 1862.46 | E57: TDOA 55# # # 0 63 -16 # 0 0 1 0 0 0 0 1 # 0 | F57: TDOA | G57: 5.0 | H57: 2 | I57: 256 | J57: 33180 | K57: 33184 | L57: 1024 | M57: 15 | N57: 1 | O57: -999 | P57: -65 | Q57: 4 | R57: 4
A58: 1862.7 | B58: 1862.64 | C58: -55 | D58: 1862.76 | E58: TDOA 56# # # 0 63 -16 # 0 0 1 0 0 0 0 1 # 0 | F58: TDOA | G58: 5.0 | H58: 2 | I58: 256 | J58: 33190 | K58: 33194 | L58: 1024 | M58: 15 | N58: 1 | O58: -999 | P58: -65 | Q58: 4 | R58: 4
A59: 1867.5 | B59: 1867.44 | C59: -55 | D59: 1867.56 | E59: TDOA 57# # # 0 63 -16 # 0 0 1 0 0 0 0 1 # 0 | F59: TDOA | G59: 5.0 | H59: 2 | I59: 256 | J59: 33350 | K59: 33354 | L59: 1024 | M59: 15 | N59: 1 | O59: -999 | P59: -65 | Q59: 4 | R59: 4
A60: 1867.8 | B60: 1867.74 | C60: -55 | D60: 1867.86 | E60: TDOA 58# # # 0 63 -16 # 0 0 1 0 0 0 0 1 # 0 | F60: TDOA | G60: 5.0 | H60: 2 | I60: 256 | J60: 33360 | K60: 33364 | L60: 1024 | M60: 15 | N60: 1 | O60: -999 | P60: -65 | Q60: 4 | R60: 4
A61: 1872.6 | B61: 1872.54 | C61: -55 | D61: 1872.66 | E61: TDOA 59# # # 0 63 -16 # 0 0 1 0 0 0 0 1 # 0 | F61: TDOA | G61: 5.0 | H61: 2 | I61: 256 | J61: 33520 | K61: 33524 | L61: 1024 | M61: 15 | N61: 1 | O61: -999 | P61: -65 | Q61: 4 | R61: 4
A62: 1872.9 | B62: 1872.84 | C62: -55 | D62: 1872.96 | E62: TDOA 150# # # 0 63 -16 # 0 0 1 0 0 0 0 1 # 0 | F62: TDOA | G62: 5.0 | H62: 2 | I62: 256 | J62: 33530 | K62: 33534 | L62: 1024 | M62: 15 | N62: 1 | O62: -999 | P62: -65 | Q62: 4 | R62: 4
A63: 1877.4 | B63: 1877.34 | C63: -55 | D63: 1877.46 | E63: TDOA 151# # # 0 63 -16 # 0 0 1 0 0 0 0 1 # 0 | F63: TDOA | G63: 5.0 | H63: 2 | I63: 256 | J63: 33680 | K63: 33684 | L63: 1024 | M63: 15 | N63: 1 | O63: -999 | P63: -65 | Q63: 4 | R63: 4
A64: 1877.7 | B64: 1877.64 | C64: -55 | D64: 1877.76 | E64: TDOA 152# # # 0 63 -16 # 0 0 1 0 0 0 0 1 # 0 | F64: TDOA | G64: 5.0 | H64: 2 | I64: 256 | J64: 33690 | K64: 33694 | L64: 1024 | M64: 15 | N64: 1 | O64: -999 | P64: -65 | Q64: 4 | R64: 4
A65: 1882.5 | B65: 1882.44 | C65: -55 | D65: 1882.56 | E65: TDOA 153# # # 0 63 -16 # 0 0 1 0 0 0 0 1 # 0 | F65: TDOA | G65: 5.0 | H65: 2 | I65: 256 | J65: 33850 | K65: 33854 | L65: 1024 | M65: 15 | N65: 1 | O65: -999 | P65: -65 | Q65: 4 | R65: 4
A66: 1882.8 | B66: 1882.74 | C66: -55 | D66: 1882.86 | E66: TDOA 154# # # 0 63 -16 # 0 0 1 0 0 0 0 1 # 0 | F66: TDOA | G66: 5.0 | H66: 2 | I66: 256 | J66: 33860 | K66: 33864 | L66: 1024 | M66: 15 | N66: 1 | O66: -999 | P66: -65 | Q66: 4 | R66: 4
A67: 1887.6 | B67: 1887.54 | C67: -55 | D67: 1887.66 | E67: TDOA 155# # # 0 63 -16 # 0 0 1 0 0 0 0 1 # 0 | F67: TDOA | G67: 5.0 | H67: 2 | I67: 256 | J67: 34020 | K67: 34024 | L67: 1024 | M67: 15 | N67: 1 | O67: -999 | P67: -65 | Q67: 4 | R67: 4
A68: 1887.9 | B68: 1887.84 | C68: -55 | D68: 1887.96 | E68: TDOA 156# # # 0 63 -16 # 0 0 1 0 0 0 0 1 # 0 | F68: TDOA | G68: 5.0 | H68: 2 | I68: 256 | J68: 34030 | K68: 34034 | L68: 1024 | M68: 15 | N68: 1 | O68: -999 | P68: -65 | Q68: 4 | R68: 4
A69: 1892.4 | B69: 1892.34 | C69: -55 | D69: 1892.46 | E69: TDOA 157# # # 0 63 -16 # 0 0 1 0 0 0 0 1 # 0 | F69: TDOA | G69: 5.0 | H69: 2 | I69: 256 | J69: 34180 | K69: 34184 | L69: 1024 | M69: 15 | N69: 1 | O69: -999 | P69: -65 | Q69: 4 | R69: 4
A70: 1892.7 | B70: 1892.64 | C70: -55 | D70: 1892.76 | E70: TDOA 158# # # 0 63 -16 # 0 0 1 0 0 0 0 1 # 0 | F70: TDOA | G70: 5.0 | H70: 2 | I70: 256 | J70: 34190 | K70: 34194 | L70: 1024 | M70: 15 | N70: 1 | O70: -999 | P70: -65 | Q70: 4 | R70: 4
A71: 1897.5 | B71: 1897.44 | C71: -55 | D71: 1897.56 | E71: TDOA 159# # # 0 63 -16 # 0 0 1 0 0 0 0 1 # 0 | F71: TDOA | G71: 5.0 | H71: 2 | I71: 256 | J71: 34350 | K71: 34354 | L71: 1024 | M71: 15 | N71: 1 | O71: -999 | P71: -65 | Q71: 4 | R71: 4
A72: 1897.8 | B72: 1897.74 | C72: -55 | D72: 1897.86 | E72: TDOA 250# # # 0 63 -16 # 0 0 1 0 0 0 0 1 # 0 | F72: TDOA | G72: 5.0 | H72: 2 | I72: 256 | J72: 34360 | K72: 34364 | L72: 1024 | M72: 15 | N72: 1 | O72: -999 | P72: -65 | Q72: 4 | R72: 4
A73: 1902.6 | B73: 1902.54 | C73: -55 | D73: 1902.66 | E73: TDOA 251# # # 0 63 -16 # 0 0 1 0 0 0 0 1 # 0 | F73: TDOA | G73: 5.0 | H73: 2 | I73: 256 | J73: 34520 | K73: 34524 | L73: 1024 | M73: 15 | N73: 1 | O73: -999 | P73: -65 | Q73: 4 | R73: 4
A74: 1902.9 | B74: 1902.84 | C74: -55 | D74: 1902.96 | E74: TDOA 252# # # 0 63 -16 # 0 0 1 0 0 0 0 1 # 0 | F74: TDOA | G74: 5.0 | H74: 2 | I74: 256 | J74: 34530 | K74: 34534 | L74: 1024 | M74: 15 | N74: 1 | O74: -999 | P74: -65 | Q74: 4 | R74: 4
A75: 1907.4 | B75: 1907.34 | C75: -55 | D75: 1907.46 | E75: TDOA 253# # # 0 63 -16 # 0 0 1 0 0 0 0 1 # 0 | F75: TDOA | G75: 5.0 | H75: 2 | I75: 256 | J75: 34680 | K75: 34684 | L75: 1024 | M75: 15 | N75: 1 | O75: -999 | P75: -65 | Q75: 4 | R75: 4
A76: 1907.7 | B76: 1907.64 | C76: -55 | D76: 1907.76 | E76: TDOA 254# # # 0 63 -16 # 0 0 1 0 0 0 0 1 # 0 | F76: TDOA | G76: 5.0 | H76: 2 | I76: 256 | J76: 34690 | K76: 34694 | L76: 1024 | M76: 15 | N76: 1 | O76: -999 | P76: -65 | Q76: 4 | R76: 4
A80: Test Case 6 - Phase Noise
A81: Signal Generator
A82: RF Power | B82: IF Power | C82: RF Frequency | D82: IF Frequency | E82: Command | F82: Response | G82: Timeout | H82: Attempts | I82: Block Size | J82: RF Channel | K82: IF Channel | L82: # Samples | M82: Averaging | N82: Low Limit | O82: High Limit
A83: -50 | B83: -50 | C83: 1852.5 | D83: 70 | E83: TDOA 61# # # 0 63 -16 # 0 0 1 0 0 0 0 1 # 0 | F83: TDOA | G83: 5.0 | H83: 2 | I83: 256 | J83: 32852 | K83: 84 | L83: 1024 | M83: 8 | N83: 0 | O83: 3
A85: -50 | B85: -50 | C85: 1857.51 | D85: 70 | E85: TDOA 62# # # 0 63 -16 # 0 0 1 0 0 0 0 1 # 0 | F85: TDOA | G85: 5.0 | H85: 2 | I85: 256 | J85: 33019 | K85: 251 | L85: 1024 | M85: 8 | N85: 0 | O85: 3
A86: -50 | B86: -50 | C86: 1862.52 | D86: 70 | E86: TDOA 63# # # 0 63 -16 # 0 0 1 0 0 0 0 1 # 0 | F86: TDOA | G86: 5.0 | H86: 2 | I86: 256 | J86: 33186 | K86: 418 | L86: 1024 | M86: 8 | N86: 0 | O86: 3
A87: -50 | B87: -50 | C87: 1867.5 | D87: 70 | E87: TDOA 64# # # 0 63 -16 # 0 0 1 0 0 0 0 1 # 0 | F87: TDOA | G87: 5.0 | H87: 2 | I87: 256 | J87: 33352 | K87: 584 | L87: 1024 | M87: 8 | N87: 0 | O87: 3
A88: -50 | B88: -50 | C88: 1872.51 | D88: 70 | E88: TDOA 65# # # 0 63 -16 # 0 0 1 0 0 0 0 1 # 0 | F88: TDOA | G88: 5.0 | H88: 2 | I88: 256 | J88: 33519 | K88: 751 | L88: 1024 | M88: 8 | N88: 0 | O88: 3
A89: -50 | B89: -50 | C89: 1877.52 | D89: 70 | E89: TDOA 66# # # 0 63 -16 # 0 0 1 0 0 0 0 1 # 0 | F89: TDOA | G89: 5.0 | H89: 2 | I89: 256 | J89: 33686 | K89: 918 | L89: 1024 | M89: 8 | N89: 0 | O89: 3
A90: -50 | B90: -50 | C90: 1882.5 | D90: 70 | E90: TDOA 67# # # 0 63 -16 # 0 0 1 0 0 0 0 1 # 0 | F90: TDOA | G90: 5.0 | H90: 2 | I90: 256 | J90: 33852 | K90: 1084 | L90: 1024 | M90: 8 | N90: 0 | O90: 3
A91: -50 | B91: -50 | C91: 1887.51 | D91: 70 | E91: TDOA 68# # # 0 63 -16 # 0 0 1 0 0 0 0 1 # 0 | F91: TDOA | G91: 5.0 | H91: 2 | I91: 256 | J91: 34019 | K91: 1251 | L91: 1024 | M91: 8 | N91: 0 | O91: 3
A92: -50 | B92: -50 | C92: 1892.52 | D92: 70 | E92: TDOA 69# # # 0 63 -16 # 0 0 1 0 0 0 0 1 # 0 | F92: TDOA | G92: 5.0 | H92: 2 | I92: 256 | J92: 34186 | K92: 1418 | L92: 1024 | M92: 8 | N92: 0 | O92: 3
A93: -50 | B93: -50 | C93: 1897.5 | D93: 70 | E93: TDOA 60# # # 0 63 -16 # 0 0 1 0 0 0 0 1 # 0 | F93: TDOA | G93: 5.0 | H93: 2 | I93: 256 | J93: 34352 | K93: 1584 | L93: 1024 | M93: 8 | N93: 0 | O93: 3
A94: -50 | B94: -50 | C94: 1902.51 | D94: 70 | E94: TDOA 161# # # 0 63 -16 # 0 0 1 0 0 0 0 1 # 0 | F94: TDOA | G94: 5.0 | H94: 2 | I94: 256 | J94: 34519 | K94: 1751 | L94: 1024 | M94: 8 | N94: 0 | O94: 3
A95: -50 | B95: -50 | C95: 1907.52 | D95: 70 | E95: TDOA 162# # # 0 63 -16 # 0 0 1 0 0 0 0 1 # 0 | F95: TDOA | G95: 5.0 | H95: 2 | I95: 256 | J95: 34686 | K95: 1918 | L95: 1024 | M95: 8 | N95: 0 | O95: 3
A99: Test Case 7 - Data Integrity
A100: Signal Generator
A101: RF Power | B101: IF Power | C101: RF Frequency | D101: IF Frequency | E101: Command | F101: Response | H101: Timeout | I101: Attempts | J101: Block Size | K101: RF Channel | L101: IF Channel | M101: TTG Channel | N101: # Samples | O101: Cnfg Attn | P101: Averaging | Q101: Low Limit | R101: High Limit
A102: -50 | B102: -50 | C102: 1879.98 | D102: 1880 | E102: TDOA 71# # # 0 63 -16 # 0 0 1 0 0 0 0 1 # 0 | F102: TDOA | H102: 5.0 | I102: 2 | J102: 256 | K102: 33768 | L102: 128 | M102: 383 | N102: 1024 | O102: 6 | P102: 1 | Q102: 25 | R102: 9999
A103: -50 | B103: -50 | C103: 1879.98 | D103: 1880 | E103: TDOA 72# # # 0 63 -16 # 0 0 1 0 0 0 0 1 # 0 | F103: TDOA | H103: 5.0 | I103: 2 | J103: 256 | K103: 33768 | L103: 128 | M103: 383 | N103: 1024 | O103: 6 | P103: 1 | Q103: 25 | R103: 9999
A104: -50 | B104: -50 | C104: 1879.98 | D104: 1880 | E104: TDOA 73# # # 0 63 -16 # 0 0 1 0 0 0 0 1 # 0 | F104: TDOA | H104: 5.0 | I104: 2 | J104: 256 | K104: 33768 | L104: 128 | M104: 383 | N104: 1024 | O104: 6 | P104: 1 | Q104: 25 | R104: 9999
A105: -50 | B105: -50 | C105: 1879.98 | D105: 1880 | E105: TDOA 74# # # 0 63 -16 # 0 0 1 0 0 0 0 1 # 0 | F105: TDOA | H105: 5.0 | I105: 2 | J105: 256 | K105: 33768 | L105: 128 | M105: 383 | N105: 1024 | O105: 6 | P105: 1 | Q105: 25 | R105: 9999
A106: -50 | B106: -50 | C106: 1879.98 | D106: 1880 | E106: TDOA 75# # # 0 63 -16 # 0 0 1 0 0 0 0 1 # 0 | F106: TDOA | H106: 5.0 | I106: 2 | J106: 256 | K106: 33768 | L106: 128 | M106: 383 | N106: 1024 | O106: 6 | P106: 1 | Q106: 25 | R106: 9999
A110: Test Case 8 - Noise Floor
A111: Signal Generator
A112: RF Power | B112: IF Power | C112: RF Frequency | D112: IF Frequency | E112: Command | F112: Response | H112: Timeout | I112: Attempts | J112: Block Size | K112: RF Channel | L112: IF Channel | M112: # Samples | N112: Cnfg Attn | O112: Averaging | P112: Signal Averaging | Q112: Low Limit | R112: High Limit | S112: Low Limit Gain | T112: High Limit Gain
A113: -55 | C113: 1880.01 | D113: 70 | E113: TDOA 87# # # 0 63 -16 # 0 0 1 0 0 0 0 1 # 0 | F113: TDOA | H113: 5.0 | I113: 2 | J113: 256 | K113: 33769 | L113: 1001 | M113: 1024 | N113: 0 | O113: 8 | P113: 1 | Q113: -174 | R113: -121 | S113: 40 | T113: 46
A115: -55 | C115: 1850.04 | D115: 70 | E115: TDOA 81# # # 0 63 -16 # 0 0 1 0 0 0 0 1 # 0 | F115: TDOA | H115: 5.0 | I115: 2 | J115: 256 | K115: 32770 | L115: 2 | M115: 1024 | N115: 0 | O115: 8 | P115: 1 | Q115: -174 | R115: -121 | S115: 40 | T115: 46
A116: -55 | C116: 1855.02 | D116: 70 | E116: TDOA 82# # # 0 63 -16 # 0 0 1 0 0 0 0 1 # 0 | F116: TDOA | H116: 5.0 | I116: 2 | J116: 256 | K116: 32936 | L116: 168 | M116: 1024 | N116: 0 | O116: 8 | P116: 1 | Q116: -174 | R116: -121 | S116: 40 | T116: 46
A117: -55 | C117: 1860 | D117: 70 | E117: TDOA 83# # # 0 63 -16 # 0 0 1 0 0 0 0 1 # 0 | F117: TDOA | H117: 5.0 | I117: 2 | J117: 256 | K117: 33102 | L117: 334 | M117: 1024 | N117: 0 | O117: 8 | P117: 1 | Q117: -174 | R117: -121 | S117: 40 | T117: 46
A118: -55 | C118: 1865.01 | D118: 70 | E118: TDOA 84# # # 0 63 -16 # 0 0 1 0 0 0 0 1 # 0 | F118: TDOA | H118: 5.0 | I118: 2 | J118: 256 | K118: 33269 | L118: 501 | M118: 1024 | N118: 0 | O118: 8 | P118: 1 | Q118: -174 | R118: -121 | S118: 40 | T118: 46
A119: -55 | C119: 1870.02 | D119: 70 | E119: TDOA 85# # # 0 63 -16 # 0 0 1 0 0 0 0 1 # 0 | F119: TDOA | H119: 5.0 | I119: 2 | J119: 256 | K119: 33436 | L119: 668 | M119: 1024 | N119: 0 | O119: 8 | P119: 1 | Q119: -174 | R119: -121 | S119: 40 | T119: 46
A120: -55 | C120: 1875 | D120: 70 | E120: TDOA 86# # # 0 63 -16 # 0 0 1 0 0 0 0 1 # 0 | F120: TDOA | H120: 5.0 | I120: 2 | J120: 256 | K120: 33602 | L120: 834 | M120: 1024 | N120: 0 | O120: 8 | P120: 1 | Q120: -174 | R120: -121 | S120: 40 | T120: 46
A121: -55 | C121: 1885.02 | D121: 70 | E121: TDOA 88# # # 0 63 -16 # 0 0 1 0 0 0 0 1 # 0 | F121: TDOA | H121: 5.0 | I121: 2 | J121: 256 | K121: 33936 | L121: 1168 | M121: 1024 | N121: 0 | O121: 8 | P121: 1 | Q121: -174 | R121: -121 | S121: 40 | T121: 46
A122: -55 | C122: 1890 | D122: 70 | E122: TDOA 89# # # 0 63 -16 # 0 0 1 0 0 0 0 1 # 0 | F122: TDOA | H122: 5.0 | I122: 2 | J122: 256 | K122: 34102 | L122: 1334 | M122: 1024 | N122: 0 | O122: 8 | P122: 1 | Q122: -174 | R122: -121 | S122: 40 | T122: 46
A123: -55 | C123: 1895.01 | D123: 70 | E123: TDOA 80# # # 0 63 -16 # 0 0 1 0 0 0 0 1 # 0 | F123: TDOA | H123: 5.0 | I123: 2 | J123: 256 | K123: 34269 | L123: 1501 | M123: 1024 | N123: 0 | O123: 8 | P123: 1 | Q123: -174 | R123: -121 | S123: 40 | T123: 46
A124: -55 | C124: 1900.02 | D124: 70 | E124: TDOA 181# # # 0 63 -16 # 0 0 1 0 0 0 0 1 # 0 | F124: TDOA | H124: 5.0 | I124: 2 | J124: 256 | K124: 34436 | L124: 1668 | M124: 1024 | N124: 0 | O124: 8 | P124: 1 | Q124: -174 | R124: -121 | S124: 40 | T124: 46
A125: -55 | C125: 1905 | D125: 70 | E125: TDOA 182# # # 0 63 -16 # 0 0 1 0 0 0 0 1 # 0 | F125: TDOA | H125: 5.0 | I125: 2 | J125: 256 | K125: 34602 | L125: 1834 | M125: 1024 | N125: 0 | O125: 8 | P125: 1 | Q125: -174 | R125: -121 | S125: 40 | T125: 46
A126: -55 | C126: 1909.92 | D126: 70 | E126: TDOA 183# # # 0 63 -16 # 0 0 1 0 0 0 0 1 # 0 | F126: TDOA | H126: 5.0 | I126: 2 | J126: 256 | K126: 34766 | L126: 1998 | M126: 1024 | N126: 0 | O126: 8 | P126: 1 | Q126: -174 | R126: -121 | S126: 40 | T126: 46
A130: Test Case 9 - DDC Tuning
A131: Signal Generator
A132: RF Power | B132: IF Power | C132: RF Frequency | D132: IF Frequency | E132: Command | F132: Response | H132: Timeout | I132: Attempts | J132: Block Size | K132: RF Channel | L132: IF Channel | M132: # Samples | N132: Averaging | O132: Low Limit | P132: High Limit
A133: -50 | B133: -50 | C133: 1850.04 | E133: TDOA 91# # # 0 63 -16 # 0 0 1 0 0 0 0 1 # 0 | F133: TDOA | H133: 5.0 | I133: 2 | J133: 256 | K133: 32770 | M133: 1024 | N133: 1 | O133: 25 | P133: 9999
A135: -50 | B135: -50 | C135: 1855.11 | E135: TDOA 92# # # 0 63 -16 # 0 0 1 0 0 0 0 1 # 0 | F135: TDOA | H135: 5.0 | I135: 2 | J135: 256 | K135: 32939 | M135: 1024 | N135: 1 | O135: 25 | P135: 9999
A136: -50 | B136: -50 | C136: 1860.21 | E136: TDOA 93# # # 0 63 -16 # 0 0 1 0 0 0 0 1 # 0 | F136: TDOA | H136: 5.0 | I136: 2 | J136: 256 | K136: 33109 | M136: 1024 | N136: 1 | O136: 25 | P136: 9999
A137: -50 | B137: -50 | C137: 1865.31 | E137: TDOA 94# # # 0 63 -16 # 0 0 1 0 0 0 0 1 # 0 | F137: TDOA | H137: 5.0 | I137: 2 | J137: 256 | K137: 33279 | M137: 1024 | N137: 1 | O137: 25 | P137: 9999
A138: -50 | B138: -50 | C138: 1870.41 | E138: TDOA 95# # # 0 63 -16 # 0 0 1 0 0 0 0 1 # 0 | F138: TDOA | H138: 5.0 | I138: 2 | J138: 256 | K138: 33449 | M138: 1024 | N138: 1 | O138: 25 | P138: 9999
A139: -50 | B139: -50 | C139: 1875.51 | E139: TDOA 96# # # 0 63 -16 # 0 0 1 0 0 0 0 1 # 0 | F139: TDOA | H139: 5.0 | I139: 2 | J139: 256 | K139: 33619 | M139: 1024 | N139: 1 | O139: 25 | P139: 9999
A140: -50 | B140: -50 | C140: 1880.61 | E140: TDOA 97# # # 0 63 -16 # 0 0 1 0 0 0 0 1 # 0 | F140: TDOA | H140: 5.0 | I140: 2 | J140: 256 | K140: 33789 | M140: 1024 | N140: 1 | O140: 25 | P140: 9999
A141: -50 | B141: -50 | C141: 1885.71 | E141: TDOA 98# # # 0 63 -16 # 0 0 1 0 0 0 0 1 # 0 | F141: TDOA | H141: 5.0 | I141: 2 | J141: 256 | K141: 33959 | M141: 1024 | N141: 1 | O141: 25 | P141: 9999
A142: -50 | B142: -50 | C142: 1890.81 | E142: TDOA 99# # # 0 63 -16 # 0 0 1 0 0 0 0 1 # 0 | F142: TDOA | H142: 5.0 | I142: 2 | J142: 256 | K142: 34129 | M142: 1024 | N142: 1 | O142: 25 | P142: 9999
A143: -50 | B143: -50 | C143: 1895.91 | E143: TDOA 90# # # 0 63 -16 # 0 0 1 0 0 0 0 1 # 0 | F143: TDOA | H143: 5.0 | I143: 2 | J143: 256 | K143: 34299 | M143: 1024 | N143: 1 | O143: 25 | P143: 9999
A144: -50 | B144: -50 | C144: 1901.01 | E144: TDOA 191# # # 0 63 -16 # 0 0 1 0 0 0 0 1 # 0 | F144: TDOA | H144: 5.0 | I144: 2 | J144: 256 | K144: 34469 | M144: 1024 | N144: 1 | O144: 25 | P144: 9999
A145: -50 | B145: -50 | C145: 1906.11 | E145: TDOA 192# # # 0 63 -16 # 0 0 1 0 0 0 0 1 # 0 | F145: TDOA | H145: 5.0 | I145: 2 | J145: 256 | K145: 34639 | M145: 1024 | N145: 1 | O145: 25 | P145: 9999
A146: -50 | B146: -50 | C146: 1909.89 | E146: TDOA 193# # # 0 63 -16 # 0 0 1 0 0 0 0 1 # 0 | F146: TDOA | H146: 5.0 | I146: 2 | J146: 256 | K146: 34765 | M146: 1024 | N146: 1 | O146: 25 | P146: 9999
A150: Test Case 10 - T1
A151: Command Prior to 10 | B151: Response | D151: Timeout | E151: Begin State | F151: End State | G151: Attempts
A152: GoT1Master | D152: 3 | E152: DSHELL | F152: DSHELL | G152: 1
A153: RunLocalT1 500 100 | B153: Bad 0 | D153: 20 | E153: DSHELL | F153: DSHELL | G153: 1
A157: Command | B157: Response | D157: Timeout | E157: Begin State | F157: End State | G157: Attempts
A158: GOMASTER | D158: 3 | E158: DSHELL | F158: DSHELL | G158: 1
A159: RUNLOCALLOOP 500 100 | B159: Bad 0 | D159: 20 | E159: DSHELL | F159: DSHELL | G159: 1
A163: Test Case 11 - Ethernet
A164: Command | B164: Response | D164: Timeout | E164: Begin State | F164: End State | G164: Attempts
A165: ethtest | B165: ethtest | D165: 20 | E165: DSHELL | F165: DSHELL | G165: 1
A169: Test Case 12 - Mini-RLS
A170: Signal Generator | C170: LMU Command
A171: RF Power | B171: RF Frequency | C171: Command Set | G171: Block Size | H171: # Blocks | I171: RF Channel | J171: # Samples | K171: |delay| (nsec) | L171: Phase Curvature | M171: Repeat and Average
A172: -40 | B172: 824.2 | C172: CommandSequence12B | G172: 256 | H172: 4 | I172: 128 | J172: 1024 | K172: 150 | L172: 0.5 | M172: 5
A173: -40 | B173: 829 | C173: CommandSequence12B | G173: 256 | H173: 4 | I173: 152 | J173: 1024 | K173: 150 | L173: 0.5 | M173: 5
A174: -40 | B174: 834 | C174: CommandSequence12B | G174: 256 | H174: 4 | I174: 177 | J174: 1024 | K174: 150 | L174: 0.5 | M174: 5
A175: -40 | B175: 839 | C175: CommandSequence12B | G175: 256 | H175: 4 | I175: 202 | J175: 1024 | K175: 150 | L175: 0.5 | M175: 5
A176: -40 | B176: 844 | C176: CommandSequence12B | G176: 256 | H176: 4 | I176: 227 | J176: 1024 | K176: 150 | L176: 0.5 | M176: 5
A177: -40 | B177: 848.8 | C177: CommandSequence12B | G177: 256 | H177: 4 | I177: 251 | J177: 1024 | K177: 150 | L177: 0.5 | M177: 5
A178: -40 | B178: 824.04 | C178: CommandSequence12A | G178: 256 | H178: 4 | I178: 991 | J178: 1024 | K178: 150 | L178: 0.5 | M178: 5
A179: -40 | B179: 828.98999999999546 | C179: CommandSequence12A | G179: 256 | H179: 4 | I179: 133 | J179: 1024 | K179: 150 | L179: 0.5 | M179: 5
A180: -40 | B180: 833.99999999999091 | C180: CommandSequence12A | G180: 256 | H180: 4 | I180: 300 | J180: 1024 | K180: 150 | L180: 0.5 | M180: 5
A181: -40 | B181: 839.00999999998635 | C181: CommandSequence12A | G181: 256 | H181: 4 | I181: 467 | J181: 1024 | K181: 150 | L181: 0.5 | M181: 5
A182: -40 | B182: 844.01999999998179 | C182: CommandSequence12A | G182: 256 | H182: 4 | I182: 634 | J182: 1024 | K182: 150 | L182: 0.5 | M182: 5
A183: -40 | B183: 848.96999999997729 | C183: CommandSequence12A | G183: 256 | H183: 4 | I183: 799 | J183: 1024 | K183: 150 | L183: 0.5 | M183: 5
A186: Test Case 13 - Config Attenuator
A187: Signal Generator
A188: RF Power | B188: IF Power | C188: RF Frequency | D188: IF Frequency | E188: Command | F188: Response | H188: Timeout | I188: Attempts | J188: Block Size | K188: RF Channel | L188: IF Channel | M188: TTG Channel | N188: # Samples | O188: Cnfg Attn Setting | P188: Averaging | Q188: Low Limit from previous level (dBm) | R188: High Limit from previous level (dBm)
A189: -50 | B189: -50 | C189: 1880.01 | D189: 70 | E189: TDOA 71# # # 0 63 -16 # 0 0 1 0 0 0 0 1 # 0 | F189: TDOA | H189: 5 | I189: 2 | J189: 256 | K189: 33769 | L189: 128 | M189: 33769 | N189: 1024 | O189: 0 | P189: 1 | Q189: -60 | R189: 0
A190: -50 | B190: -50 | C190: 1880.01 | D190: 70 | E190: TDOA 72# # # 0 63 -16 # 0 0 1 0 0 0 0 1 # 0 | F190: TDOA | H190: 5 | I190: 2 | J190: 256 | K190: 33769 | L190: 128 | M190: 33769 | N190: 1024 | O190: -8 | P190: 1 | Q190: -10 | R190: -6
A191: -50 | B191: -50 | C191: 1880.01 | D191: 70 | E191: TDOA 73# # # 0 63 -16 # 0 0 1 0 0 0 0 1 # 0 | F191: TDOA | H191: 5 | I191: 2 | J191: 256 | K191: 33769 | L191: 128 | M191: 33769 | N191: 1024 | O191: -10 | P191: 1 | Q191: -3.3 | R191: -0.7
A192: -50 | B192: -50 | C192: 1880.01 | D192: 70 | E192: TDOA 74# # # 0 63 -16 # 0 0 1 0 0 0 0 1 # 0 | F192: TDOA | H192: 5 | I192: 2 | J192: 256 | K192: 33769 | L192: 128 | M192: 33769 | N192: 1024 | O192: 6 | P192: 1 | Q192: 13.5 | R192: 18.5
A193: -50 | B193: -50 | C193: 1880.01 | D193: 70 | E193: TDOA 75# # # 0 63 -16 # 0 0 1 0 0 0 0 1 # 0 | F193: TDOA | H193: 5 | I193: 2 | J193: 256 | K193: 33769 | L193: 128 | M193: 33769 | N193: 1024 | O193: 2 | P193: 1 | Q193: -5.5 | R193: -2.5
A194: -50 | B194: -50 | C194: 1880.01 | D194: 70 | E194: TDOA 76# # # 0 63 -16 # 0 0 1 0 0 0 0 1 # 0 | F194: TDOA | H194: 5 | I194: 2 | J194: 256 | K194: 33769 | L194: 128 | M194: 33769 | N194: 1024 | O194: 1 | P194: 1 | Q194: -2 | R194: 0
A198: TTG Freq
A199: 836.5 MHZ | B199: Response | D199: Timeout | E199: Begin State | F199: End State | G199: Attempts
A200: eng | D200: 0.5 | E200: DSHELL | F200: ENG | G200: 1
A201: TEST 2 5 4 5 0x00 0x00 0xD3 | D201: 1 | E201: DSHELL | F201: ENG | G201: 1
A202: TEST 2 5 4 5 0x00 0x00 0x50 | D202: 1 | E202: DSHELL | F202: ENG | G202: 1
A203: TEST 2 5 4 5 0x00 0x3A 0xC1 | D203: 1 | E203: DSHELL | F203: ENG | G203: 1
A204: exit | D204: 0.5 | E204: ENG | F204: DSHELL | G204: 1
A208: Gain Setup
A209: Setup | B209: Response | D209: Timeout | E209: Begin State | F209: End State | G209: Attempts
A210: gain 1 43 | D210: 0.5 | E210: DSHELL | F210: ENG | G210: 1
A211: gain 2 43 | D211: 0.5 | E211: DSHELL | F211: ENG | G211: 1
A212: gain 3 43 | D212: 0.5 | E212: DSHELL | F212: ENG | G212: 1
A213: gain 4 43 | D213: 0.5 | E213: DSHELL | F213: ENG | G213: 1
A214: gain 5 43 | D214: 0.5 | E214: DSHELL | F214: ENG | G214: 1
A215: gain 6 43 | D215: 0.5 | E215: DSHELL | F215: ENG | G215: 1
A218: Config Atten Setup
A219: Setup | B219: Response | D219: Timeout | E219: Begin State | F219: End State | G219: Attempts
A220: gain 1 35varGain | D220: 0.5 | E220: DSHELL | F220: ENG | G220: 1
A221: gain 2 35varGain | D221: 0.5 | E221: DSHELL | F221: ENG | G221: 1
A222: gain 3 35varGain | D222: 0.5 | E222: DSHELL | F222: ENG | G222: 1
A223: gain 4 35varGain | D223: 0.5 | E223: DSHELL | F223: ENG | G223: 1
A224: gain 5 35varGain | D224: 0.5 | E224: DSHELL | F224: ENG | G224: 1
A225: gain 6 35varGain | D225: 0.5 | E225: DSHELL | F225: ENG | G225: 1
A228: Data Path Settings
A229: Data Path 1 | D229: Timeout | E229: Begin State | F229: End State | G229: Attempts
A230: eng | D230: 0.5 | E230: DSHELL | F230: ENG | G230: 1
A231: Test 1 1 0 0 0 | D231: 0.5 | E231: ENG | F231: ENG | G231: 1
A232: exit | D232: 0.5 | E232: ENG | F232: DSHELL | G232: 1
A235: Data Path 2 | D235: Timeout | E235: Begin State | F235: End State | G235: Attempts
A236: eng | D236: 0.5 | E236: DSHELL | F236: ENG | G236: 1
A237: Test 1 0 1 0 0 | D237: 0.5 | E237: ENG | F237: ENG | G237: 1
A238: exit | D238: 0.5 | E238: ENG | F238: DSHELL | G238: 1
A241: Data Path 3 | D241: Timeout | E241: Begin State | F241: End State | G241: Attempts
A242: eng | D242: 0.5 | E242: DSHELL | F242: ENG | G242: 1
A243: Test 1 0 0 1 0 | D243: 0.5 | E243: ENG | F243: ENG | G243: 1
A244: exit | D244: 0.5 | E244: ENG | F244: DSHELL | G244: 1
A247: Data Path 4 | D247: Timeout | E247: Begin State | F247: End State | G247: Attempts
A248: eng | D248: 0.5 | E248: DSHELL | F248: ENG | G248: 1
A249: Test 1 0 0 0 1 | D249: 0.5 | E249: ENG | F249: ENG | G249: 1
A250: exit | D250: 0.5 | E250: ENG | F250: DSHELL | G250: 1
A253: Data Path 5 | D253: Timeout | E253: Begin State | F253: End State | G253: Attempts
A254: eng | D254: 0.5 | E254: DSHELL | F254: ENG | G254: 1
A255: Test 1 1 1 1 1 | D255: 0.5 | E255: ENG | F255: ENG | G255: 1
A256: exit | D256: 0.5 | E256: ENG | F256: DSHELL | G256: 1
A259: Compensation Settings
A260: Receiver compensated gain | D260: Timeout | E260: Begin State | F260: End State | G260: Attempts
A261: eng | D261: 0.5 | E261: DSHELL | F261: ENG | G261: 1
A262: Test 4 0xA4 0x48 6 | B262: DATA Read: | D262: 1 | E262: ENG | F262: ENG | G262: 1
A263: TEST 4 0xA4 0x1F 1 | B263: DATA Read: 41 | D263: 1 | E263: ENG | F263: ENG | G263: 1
A264: Test 4 0xA4 0x30 6 | B264: DATA Read: | D264: 1 | E264: ENG | F264: ENG | G264: 1
A265: exit | D265: 0.5 | E265: ENG | F265: DSHELL | G265: 1
A268: TTG compensated Level | D268: Timeout | E268: Begin State | F268: End State | G268: Attempts
A269: eng | D269: 0.5 | E269: DSHELL | F269: ENG | G269: 1
A270: Test 4 0xA4 0x42 6 | B270: DATA Read: | D270: 1 | E270: ENG | F270: ENG | G270: 1
A271: TEST 4 0xA4 0x1F 1 | B271: DATA Read: 41 | D271: 1 | E271: ENG | F271: ENG | G271: 1 | H271: Note: | I271: If we get DATA Read: 41, then the software will skip
A272: Test 4 0xA4 0x2A 6 | B272: DATA Read: | D272: 1 | E272: ENG | F272: ENG | G272: 1 | I272: over the next line and go directly to exit
A273: exit | D273: 0.5 | E273: ENG | F273: DSHELL | G273: 1
A276: Receiver Gain Compensation | D276: Timeout | E276: Begin State | F276: End State | G276: Attempts
A277: eng | D277: 0.5 | E277: DSHELL | F277: ENG | G277: 1
A278: TEST 4 0xA4 0x1F 1 | B278: DATA Read: 41 | D278: 0.5 | E278: ENG | F278: ENG | G278: 1
A279: Test 4 0xA4 0x20 6 | B279: DATA Read: | D279: 0.5 | E279: ENG | F279: ENG | G279: 1
A280: exit | D280: 0.5 | E280: ENG | F280: DSHELL | G280: 1
A283: EnableTTG | B283: Response | D283: Timeout | E283: Begin State | F283: End State | G283: Attempts
A284: eng | D284: 0.5 | E284: DSHELL | F284: ENG | G284: 1
A285: TEST 2 3 8 6 8 | D285: 0.5 | E285: ENG | F285: ENG | G285: 1
A286: TEST 2 3 4 4 5 | D286: 0.5 | E286: ENG | F286: ENG | G286: 1
A287: TEST 2 3 4 6 1 | D287: 0.5 | E287: ENG | F287: ENG | G287: 1
A288: exit | D288: 0.5 | E288: ENG | F288: DSHELL | G288: 1
A291: DisableTTG | D291: Timeout | E291: Begin State | F291: End State | G291: Attempts
A292: eng | D292: 0.5 | E292: DSHELL | F292: ENG | G292: 1
A293: TEST 2 3 8 6 5 | D293: 0.5 | E293: ENG | F293: ENG | G293: 1
A294: TEST 2 3 4 4 1 | D294: 0.5 | E294: ENG | F294: ENG | G294: 1
A295: TEST 2 3 4 6 0 | D295: 0.5 | E295: ENG | F295: ENG | G295: 1
A296: exit | D296: 0.5 | E296: ENG | F296: DSHELL | G296: 1
A299: Mute On | D299: Timeout | E299: Begin State | F299: End State | G299: Attempts
A300: eng | D300: 0.5 | E300: DSHELL | F300: ENG | G300: 1
A301: TEST 2 3 8 6 8 | D301: 0.5 | E301: ENG | F301: ENG | G301: 1
A302: exit | D302: 0.5 | E302: ENG | F302: DSHELL | G302: 1
A305: Mute Off | D305: Timeout | E305: Begin State | F305: End State | G305: Attempts
A306: eng | D306: 0.5 | E306: DSHELL | F306: ENG | G306: 1
A307: TEST 2 3 8 6 5 | D307: 0.5 | E307: ENG | F307: ENG | G307: 1
A308: exit | D308: 0.5 | E308: ENG | F308: DSHELL | G308: 1
A311: Change Admin State
A312: Command | B312: Response | D312: Timeout | E312: Begin State | F312: End State | G312: # of retries
A313: etest 15 1 | D313: 2 | E313: DSHELL | F313: DSHELL | G313: 1
A317: Check Alarms
A318: Command | B318: Response | D318: Timeout | E318: Begin State | F318: End State | G318: # of retries
A319: ALARMS | B319: FAULT_GPS_HOLDOVER | D319: 2 | E319: DSHELL | F319: DSHELL | G319: 1
A323: Mini-RLS Command Sequence 12A (AMPS)
A324: Command | B324: Response | D324: Timeout | E324: Begin State | F324: End State | G324: # of retries
A325: ALARMS | B325: FAULT_GPS_HOLDOVER | D325: 2 | E325: DSHELL | F325: DSHELL | G325: 1
A326: TIME | B326: GPS Time: | D326: 2 | E326: DSHELL | F326: DSHELL | G326: 2
A327: SVCR # # 2 # # 0 1 0 0 0 1 1 1 # 0 0 | B327: returnCode 0 | D327: 2 | E327: DSHELL | F327: DSHELL | G327: 1
A328: WAIT | D328: 15 | E328: DSHELL | F328: DSHELL | G328: 1
A329: TDATA # 0 2 # # # -16 0 1 0 0 11 0 63 -16 | B329: TDOA | D329: 15 | E329: DSHELL | F329: DSHELL | G329: 1
A333: Mini-RLS Command Sequence 12B (GSM)
A334: Command | B334: Response | D334: Timeout | E334: Begin State | F334: End State | G334: # of retries
A335: ALARMS | B335: FAULT_GPS_HOLDOVER | D335: 2 | E335: DSHELL | F335: DSHELL | G335: 1
A336: TIME | B336: GPS Time: | D336: 2 | E336: DSHELL | F336: DSHELL | G336: 2
A337: GVCR # 2 # # 0 # 0 # # 17 1 0 0 0 0 0 0 1 1 1 8 0 0 0 0 0 0 0 0 0 0 0 | B337: returnCode 0 | D337: 2 | E337: DSHELL | F337: DSHELL | G337: 1
A338: WAIT | D338: 15 | E338: DSHELL | F338: DSHELL | G338: 1
A339: TDATA # 0 2 # # # -16 0 1 0 0 11 0 63 -16 | B339: TDOA | D339: 15 | E339: DSHELL | F339: DSHELL | G339: 1

Sheet: 06160901
C1: Factors
C2: TTG | D2: 50
C3: Gain | D3: 300
C4: TTG Comp | D4: 100
C5: Gain Comp | D5: 250
F8: Temperature Coefficient | J8: Center Temperature
F10: -3.5000000000000003E-2 | H10: dB/deg | J10: 30 | L10: deg
A15: Test Case 2 - Processor Memory
A16: Command | B16: Response | D16: Timeout | E16: Begin State | F16: End State | G16: Attempts
A17: BIT 4 1 | B17: No Failure | D17: 20 | E17: DSHELL | F17: DSHELL | G17: 1
A18: BIT 4 2 | B18: No Failure | D18: 20 | E18: DSHELL | F18: DSHELL | G18: 1
A19: BIT 4 3 | B19: No Failure | D19: 20 | E19: DSHELL | F19: DSHELL | G19: 1
A20: BIT 4 4 | B20: No Failure | D20: 20 | E20: DSHELL | F20: DSHELL | G20: 1
A24: Test Case 3 - SNR
A25: Signal Generator
A26: RF Power | B26: IF Power | C26: RF Frequency | D26: IF Frequency | E26: Command | F26: Response | H26: Timeout | I26: Attempts | J26: Block Size | K26: RF Channel | L26: IF Channel | M26: TTG Channel | N26: # Samples | O26: Averaging | P26: Low Limit | Q26: High Limit
A27: -40 | C27: 1850.04 | D27: 70 | E27: TDOA 31# # # 0 63 -16 # 0 0 1 0 0 0 0 1 # 0 | F27: TDOA | H27: 5.0 | I27: 2 | J27: 256 | K27: 32770 | L27: 2 | M27: 383 | N27: 1024 | O27: 1 | P27: 25 | Q27: 9999
A29: -40 | C29: 1852.47 | D29: 70 | E29: TDOA 32# # # 0 63 -16 # 0 0 1 0 0 0 0 1 # 0 | F29: TDOA | H29: 5.0 | I29: 2 | J29: 256 | K29: 32851 | L29: 83 | M29: 383 | N29: 1024 | O29: 1 | P29: 25 | Q29: 9999
A30: -40 | C30: 1854.99 | D30: 70 | E30: TDOA 33# # # 0 63 -16 # 0 0 1 0 0 0 0 1 # 0 | F30: TDOA | H30: 5.0 | I30: 2 | J30: 256 | K30: 32935 | L30: 167 | M30: 383 | N30: 1024 | O30: 1 | P30: 25 | Q30: 9999
A31: -40 | C31: 1864.98 | D31: 70 | E31: TDOA 34# # # 0 63 -16 # 0 0 1 0 0 0 0 1 # 0 | F31: TDOA | H31: 5.0 | I31: 2 | J31: 256 | K31: 33268 | L31: 500 | M31: 383 | N31: 1024 | O31: 1 | P31: 25 | Q31: 9999
A32: -40 | C32: 1867.5 | D32: 70 | E32: TDOA 35# # # 0 63 -16 # 0 0 1 0 0 0 0 1 # 0 | F32: TDOA | H32: 5.0 | I32: 2 | J32: 256 | K32: 33352 | L32: 584 | M32: 383 | N32: 1024 | O32: 1 | P32: 25 | Q32: 9999
A33: -40 | C33: 1869.99 | D33: 70 | E33: TDOA 36# # # 0 63 -16 # 0 0 1 0 0 0 0 1 # 0 | F33: TDOA | H33: 5.0 | I33: 2 | J33: 256 | K33: 33435 | L33: 667 | M33: 383 | N33: 1024 | O33: 1 | P33: 25 | Q33: 9999
A34: -40 | C34: 1870.02 | D34: 70 | E34: TDOA 37# # # 0 63 -16 # 0 0 1 0 0 0 0 1 # 0 | F34: TDOA | H34: 5.0 | I34: 2 | J34: 256 | K34: 33436 | L34: 668 | M34: 383 | N34: 1024 | O34: 1 | P34: 25 | Q34: 9999
A35: -40 | C35: 1872.39 | D35: 70 | E35: TDOA 38# # # 0 63 -16 # 0 0 1 0 0 0 0 1 # 0 | F35: TDOA | H35: 5.0 | I35: 2 | J35: 256 | K35: 33515 | L35: 747 | M35: 383 | N35: 1024 | O35: 1 | P35: 25 | Q35: 9999
A36: -40 | C36: 1875 | D36: 70 | E36: TDOA 39# # # 0 63 -16 # 0 0 1 0 0 0 0 1 # 0 | F36: TDOA | H36: 5.0 | I36: 2 | J36: 256 | K36: 33602 | L36: 834 | M36: 383 | N36: 1024 | O36: 1 | P36: 25 | Q36: 9999
A37: -40 | C37: 1884.99 | D37: 70 | E37: TDOA 130# # # 0 63 -16 # 0 0 1 0 0 0 0 1 # 0 | F37: TDOA | H37: 5.0 | I37: 2 | J37: 256 | K37: 33935 | L37: 1167 | M37: 383 | N37: 1024 | O37: 1 | P37: 25 | Q37: 9999
A38: -40 | C38: 1887.45 | D38: 70 | E38: TDOA 131# # # 0 63 -16 # 0 0 1 0 0 0 0 1 # 0 | F38: TDOA | H38: 5.0 | I38: 2 | J38: 256 | K38: 34017 | L38: 1249 | M38: 383 | N38: 1024 | O38: 1 | P38: 25 | Q38: 9999
A39: -40 | C39: 1890 | D39: 70 | E39: TDOA 132# # # 0 63 -16 # 0 0 1 0 0 0 0 1 # 0 | F39: TDOA | H39: 5.0 | I39: 2 | J39: 256 | K39: 34102 | L39: 1334 | M39: 383 | N39: 1024 | O39: 1 | P39: 25 | Q39: 9999
A40: -40 | C40: 1890.03 | D40: 70 | E40: TDOA 133# # # 0 63 -16 # 0 0 1 0 0 0 0 1 # 0 | F40: TDOA | H40: 5.0 | I40: 2 | J40: 256 | K40: 34103 | L40: 1335 | M40: 383 | N40: 1024 | O40: 1 | P40: 25 | Q40: 9999
A41: -40 | C41: 1892.4 | D41: 70 | E41: TDOA 134# # # 0 63 -16 # 0 0 1 0 0 0 0 1 # 0 | F41: TDOA | H41: 5.0 | I41: 2 | J41: 256 | K41: 34182 | L41: 1414 | M41: 383 | N41: 1024 | O41: 1 | P41: 25 | Q41: 9999
A42: -40 | C42: 1894.95 | D42: 70 | E42: TDOA 135# # # 0 63 -16 # 0 0 1 0 0 0 0 1 # 0 | F42: TDOA | H42: 5.0 | I42: 2 | J42: 256 | K42: 34267 | L42: 1499 | M42: 383 | N42: 1024 | O42: 1 | P42: 25 | Q42: 9999
A43: -40 | C43: 1905 | D43: 70 | E43: TDOA 136# # # 0 63 -16 # 0 0 1 0 0 0 0 1 # 0 | F43: TDOA | H43: 5.0 | I43: 2 | J43: 256 | K43: 34602 | L43: 1834 | M43: 383 | N43: 1024 | O43: 1 | P43: 25 | Q43: 9999
A44: -40 | C44: 1907.43 | D44: 70 | E44: TDOA 137# # # 0 63 -16 # 0 0 1 0 0 0 0 1 # 0 | F44: TDOA | H44: 5.0 | I44: 2 | J44: 256 | K44: 34683 | L44: 1915 | M44: 383 | N44: 1024 | O44: 1 | P44: 25 | Q44: 9999
A45: -40 | C45: 1909.92 | D45: 70 | E45: TDOA 138# # # 0 63 -16 # 0 0 1 0 0 0 0 1 # 0 | F45: TDOA | H45: 5.0 | I45: 2 | J45: 256 | K45: 34766 | L45: 1998 | M45: 383 | N45: 1024 | O45: 1 | P45: 25 | Q45: 9999
A49: Test Case 5 - Two-Tone Response
B50: SigGen1 | D50: SigGen2
A51: Center RF Channel | B51: RF Frequency | C51: RF Power | D51: RF Frequency | E51: Command | F51: Response | G51: Timeout | H51: Attempts | I51: Block Size | J51: Lower Channel | K51: Upper Channel | L51: # Samples | M51: Cnfg Attn | N51: Averaging | O51: Low Limit | P51: High Limit | Q51: Lower Channel Delta | R51: Upper Channel Delta
A52: 1852.5 | B52: 1852.44 | C52: -45 | D52: 1852.56 | E52: TDOA 51# # # 0 63 -16 # 0 0 1 0 0 0 0 1 # 0 | F52: TDOA | G52: 5.0 | H52: 2 | I52: 256 | J52: 32850 | K52: 32854 | L52: 1024 | M52: 15 | N52: 1 | O52: -999 | P52: -65 | Q52: 4 | R52: 4
A54: 1852.8 | B54: 1852.74 | C54: -45 | D54: 1852.86 | E54: TDOA 52# # # 0 63 -16 # 0 0 1 0 0 0 0 1 # 0 | F54: TDOA | G54: 5.0 | H54: 2 | I54: 256 | J54: 32860 | K54: 32864 | L54: 1024 | M54: 15 | N54: 1 | O54: -999 | P54: -65 | Q54: 4 | R54: 4
A55: 1857.6 | B55: 1857.54 | C55: -45 | D55: 1857.66 | E55: TDOA 53# # # 0 63 -16 # 0 0 1 0 0 0 0 1 # 0 | F55: TDOA | G55: 5.0 | H55: 2 | I55: 256 | J55: 33020 | K55: 33024 | L55: 1024 | M55: 15 | N55: 1 | O55: -999 | P55: -65 | Q55: 4 | R55: 4
A56: 1857.9 | B56: 1857.84 | C56: -45 | D56: 1857.96 | E56: TDOA 54# # # 0 63 -16 # 0 0 1 0 0 0 0 1 # 0 | F56: TDOA | G56: 5.0 | H56: 2 | I56: 256 | J56: 33030 | K56: 33034 | L56: 1024 | M56: 15 | N56: 1 | O56: -999 | P56: -65 | Q56: 4 | R56: 4
A57: 1862.4 | B57: 1862.34 | C57: -45 | D57: 1862.46 | E57: TDOA 55# # # 0 63 -16 # 0 0 1 0 0 0 0 1 # 0 | F57: TDOA | G57: 5.0 | H57: 2 | I57: 256 | J57: 33180 | K57: 33184 | L57: 1024 | M57: 15 | N57: 1 | O57: -999 | P57: -65 | Q57: 4 | R57: 4
A58: 1862.7 | B58: 1862.64 | C58: -45 | D58: 1862.76 | E58: TDOA 56# # # 0 63 -16 # 0 0 1 0 0 0 0 1 # 0 | F58: TDOA | G58: 5.0 | H58: 2 | I58: 256 | J58: 33190 | K58: 33194 | L58: 1024 | M58: 15 | N58: 1 | O58: -999 | P58: -65 | Q58: 4 | R58: 4
A59: 1867.5 | B59: 1867.44 | C59: -45 | D59: 1867.56 | E59: TDOA 57# # # 0 63 -16 # 0 0 1 0 0 0 0 1 # 0 | F59: TDOA | G59: 5.0 | H59: 2 | I59: 256 | J59: 33350 | K59: 33354 | L59: 1024 | M59: 15 | N59: 1 | O59: -999 | P59: -65 | Q59: 4 | R59: 4
A60: 1867.8 | B60: 1867.74 | C60: -45 | D60: 1867.86 | E60: TDOA 58# # # 0 63 -16 # 0 0 1 0 0 0 0 1 # 0 | F60: TDOA | G60: 5.0 | H60: 2 | I60: 256 | J60: 33360 | K60: 33364 | L60: 1024 | M60: 15 | N60: 1 | O60: -999 | P60: -65 | Q60: 4 | R60: 4
A61: 1872.6 | B61: 1872.54 | C61: -45 | D61: 1872.66 | E61: TDOA 59# # # 0 63 -16 # 0 0 1 0 0 0 0 1 # 0 | F61: TDOA | G61: 5.0 | H61: 2 | I61: 256 | J61: 33520 | K61: 33524 | L61: 1024 | M61: 15 | N61: 1 | O61: -999 | P61: -65 | Q61: 4 | R61: 4
A62: 1872.9 | B62: 1872.84 | C62: -45 | D62: 1872.96 | E62: TDOA 150# # # 0 63 -16 # 0 0 1 0 0 0 0 1 # 0 | F62: TDOA | G62: 5.0 | H62: 2 | I62: 256 | J62: 33530 | K62: 33534 | L62: 1024 | M62: 15 | N62: 1 | O62: -999 | P62: -65 | Q62: 4 | R62: 4
A63: 1877.4 | B63: 1877.34 | C63: -45 | D63: 1877.46 | E63: TDOA 151# # # 0 63 -16 # 0 0 1 0 0 0 0 1 # 0 | F63: TDOA | G63: 5.0 | H63: 2 | I63: 256 | J63: 33680 | K63: 33684 | L63: 1024 | M63: 15 | N63: 1 | O63: -999 | P63: -65 | Q63: 4 | R63: 4
A64: 1877.7 | B64: 1877.64 | C64: -45 | D64: 1877.76 | E64: TDOA 152# # # 0 63 -16 # 0 0 1 0 0 0 0 1 # 0 | F64: TDOA | G64: 5.0 | H64: 2 | I64: 256 | J64: 33690 | K64: 33694 | L64: 1024 | M64: 15 | N64: 1 | O64: -999 | P64: -65 | Q64: 4 | R64: 4
A65: 1882.5 | B65: 1882.44 | C65: -45 | D65: 1882.56 | E65: TDOA 153# # # 0 63 -16 # 0 0 1 0 0 0 0 1 # 0 | F65: TDOA | G65: 5.0 | H65: 2 | I65: 256 | J65: 33850 | K65: 33854 | L65: 1024 | M65: 15 | N65: 1 | O65: -999 | P65: -65 | Q65: 4 | R65: 4
A66: 1882.8 | B66: 1882.74 | C66: -45 | D66: 1882.86 | E66: TDOA 154# # # 0 63 -16 # 0 0 1 0 0 0 0 1 # 0 | F66: TDOA | G66: 5.0 | H66: 2 | I66: 256 | J66: 33860 | K66: 33864 | L66: 1024 | M66: 15 | N66: 1 | O66: -999 | P66: -65 | Q66: 4 | R66: 4
A67: 1887.6 | B67: 1887.54 | C67: -45 | D67: 1887.66 | E67: TDOA 155# # # 0 63 -16 # 0 0 1 0 0 0 0 1 # 0 | F67: TDOA | G67: 5.0 | H67: 2 | I67: 256 | J67: 34020 | K67: 34024 | L67: 1024 | M67: 15 | N67: 1 | O67: -999 | P67: -65 | Q67: 4 | R67: 4
A68: 1887.9 | B68: 1887.84 | C68: -45 | D68: 1887.96 | E68: TDOA 156# # # 0 63 -16 # 0 0 1 0 0 0 0 1 # 0 | F68: TDOA | G68: 5.0 | H68: 2 | I68: 256 | J68: 34030 | K68: 34034 | L68: 1024 | M68: 15 | N68: 1 | O68: -999 | P68: -65 | Q68: 4 | R68: 4
A69: 1892.4 | B69: 1892.34 | C69: -45 | D69: 1892.46 | E69: TDOA 157# # # 0 63 -16 # 0 0 1 0 0 0 0 1 # 0 | F69: TDOA | G69: 5.0 | H69: 2 | I69: 256 | J69: 34180 | K69: 34184 | L69: 1024 | M69: 15 | N69: 1 | O69: -999 | P69: -65 | Q69: 4 | R69: 4
A70: 1892.7 | B70: 1892.64 | C70: -45 | D70: 1892.76 | E70: TDOA 158# # # 0 63 -16 # 0 0 1 0 0 0 0 1 # 0 | F70: TDOA | G70: 5.0 | H70: 2 | I70: 256 | J70: 34190 | K70: 34194 | L70: 1024 | M70: 15 | N70: 1 | O70: -999 | P70: -65 | Q70: 4 | R70: 4
A71: 1897.5 | B71: 1897.44 | C71: -45 | D71: 1897.56 | E71: TDOA 159# # # 0 63 -16 # 0 0 1 0 0 0 0 1 # 0 | F71: TDOA | G71: 5.0 | H71: 2 | I71: 256 | J71: 34350 | K71: 34354 | L71: 1024 | M71: 15 | N71: 1 | O71: -999 | P71: -65 | Q71: 4 | R71: 4
A72: 1897.8 | B72: 1897.74 | C72: -45 | D72: 1897.86 | E72: TDOA 250# # # 0 63 -16 # 0 0 1 0 0 0 0 1 # 0 | F72: TDOA | G72: 5.0 | H72: 2 | I72: 256 | J72: 34360 | K72: 34364 | L72: 1024 | M72: 15 | N72: 1 | O72: -999 | P72: -65 | Q72: 4 | R72: 4
A73: 1902.6 | B73: 1902.54 | C73: -45 | D73: 1902.66 | E73: TDOA 251# # # 0 63 -16 # 0 0 1 0 0 0 0 1 # 0 | F73: TDOA | G73: 5.0 | H73: 2 | I73: 256 | J73: 34520 | K73: 34524 | L73: 1024 | M73: 15 | N73: 1 | O73: -999 | P73: -65 | Q73: 4 | R73: 4
A74: 1902.9 | B74: 1902.84 | C74: -45 | D74: 1902.96 | E74: TDOA 252# # # 0 63 -16 # 0 0 1 0 0 0 0 1 # 0 | F74: TDOA | G74: 5.0 | H74: 2 | I74: 256 | J74: 34530 | K74: 34534 | L74: 1024 | M74: 15 | N74: 1 | O74: -999 | P74: -65 | Q74: 4 | R74: 4
A75: 1907.4 | B75: 1907.34 | C75: -45 | D75: 1907.46 | E75: TDOA 253# # # 0 63 -16 # 0 0 1 0 0 0 0 1 # 0 | F75: TDOA | G75: 5.0 | H75: 2 | I75: 256 | J75: 34680 | K75: 34684 | L75: 1024 | M75: 15 | N75: 1 | O75: -999 | P75: -65 | Q75: 4 | R75: 4
A76: 1907.7 | B76: 1907.64 | C76: -45 | D76: 1907.76 | E76: TDOA 254# # # 0 63 -16 # 0 0 1 0 0 0 0 1 # 0 | F76: TDOA | G76: 5.0 | H76: 2 | I76: 256 | J76: 34690 | K76: 34694 | L76: 1024 | M76: 15 | N76: 1 | O76: -999 | P76: -65 | Q76: 4 | R76: 4
A80: Test Case 6 - Phase Noise
A81: Signal Generator
A82: RF Power | B82: IF Power | C82: RF Frequency | D82: IF Frequency | E82: Command | F82: Response | G82: Timeout | H82: Attempts | I82: Block Size | J82: RF Channel | K82: IF Channel | L82: # Samples | M82: Averaging | N82: Low Limit | O82: High Limit
A83: -40 | C83: 1852.5 | D83: 70 | E83: TDOA 61# # # 0 63 -16 # 0 0 1 0 0 0 0 1 # 0 | F83: TDOA | G83: 5.0 | H83: 2 | I83: 256 | J83: 32852 | K83: 84 | L83: 1024 | M83: 8 | N83: 0 | O83: 3
A85: -40 | C85: 1857.51 | D85: 70 | E85: TDOA 62# # # 0 63 -16 # 0 0 1 0 0 0 0 1 # 0 | F85: TDOA | G85: 5.0 | H85: 2 | I85: 256 | J85: 33019 | K85: 251 | L85: 1024 | M85: 8 | N85: 0 | O85: 3
A86: -40 | C86: 1862.52 | D86: 70 | E86: TDOA 63# # # 0 63 -16 # 0 0 1 0 0 0 0 1 # 0 | F86: TDOA | G86: 5.0 | H86: 2 | I86: 256 | J86: 33186 | K86: 418 | L86: 1024 | M86: 8 | N86: 0 | O86: 3
A87: -40 | C87: 1867.5 | D87: 70 | E87: TDOA 64# # # 0 63 -16 # 0 0 1 0 0 0 0 1 # 0 | F87: TDOA | G87: 5.0 | H87: 2 | I87: 256 | J87: 33352 | K87: 584 | L87: 1024 | M87: 8 | N87: 0 | O87: 3
A88: -40 | C88: 1872.51 | D88: 70 | E88: TDOA 65# # # 0 63 -16 # 0 0 1 0 0 0 0 1 # 0 | F88: TDOA | G88: 5.0 | H88: 2 | I88: 256 | J88: 33519 | K88: 751 | L88: 1024 | M88: 8 | N88: 0 | O88: 3
A89: -40 | C89: 1877.52 | D89: 70 | E89: TDOA 66# # # 0 63 -16 # 0 0 1 0 0 0 0 1 # 0 | F89: TDOA | G89: 5.0 | H89: 2 | I89: 256 | J89: 33686 | K89: 918 | L89: 1024 | M89: 8 | N89: 0 | O89: 3
A90: -40 | C90: 1882.5 | D90: 70 | E90: TDOA 67# # # 0 63 -16 # 0 0 1 0 0 0 0 1 # 0 | F90: TDOA | G90: 5.0 | H90: 2 | I90: 256 | J90: 33852 | K90: 1084 | L90: 1024 | M90: 8 | N90: 0 | O90: 3
A91: -40 | C91: 1887.51 | D91: 70 | E91: TDOA 68# # # 0 63 -16 # 0 0 1 0 0 0 0 1 # 0 | F91: TDOA | G91: 5.0 | H91: 2 | I91: 256 | J91: 34019 | K91: 1251 | L91: 1024 | M91: 8 | N91: 0 | O91: 3
A92: -40 | C92: 1892.52 | D92: 70 | E92: TDOA 69# # # 0 63 -16 # 0 0 1 0 0 0 0 1 # 0 | F92: TDOA | G92: 5.0 | H92: 2 | I92: 256 | J92: 34186 | K92: 1418 | L92: 1024 | M92: 8 | N92: 0 | O92: 3
A93: -40 | C93: 1897.5 | D93: 70 | E93: TDOA 60# # # 0 63 -16 # 0 0 1 0 0 0 0 1 # 0 | F93: TDOA | G93: 5.0 | H93: 2 | I93: 256 | J93: 34352 | K93: 1584 | L93: 1024 | M93: 8 | N93: 0 | O93: 3
A94: -40 | C94: 1902.51 | D94: 70 | E94: TDOA 161# # # 0 63 -16 # 0 0 1 0 0 0 0 1 # 0 | F94: TDOA | G94: 5.0 | H94: 2 | I94: 256 | J94: 34519 | K94: 1751 | L94: 1024 | M94: 8 | N94: 0 | O94: 3
A95: -40 | C95: 1907.52 | D95: 70 | E95: TDOA 162# # # 0 63 -16 # 0 0 1 0 0 0 0 1 # 0 | F95: TDOA | G95: 5.0 | H95: 2 | I95: 256 | J95: 34686 | K95: 1918 | L95: 1024 | M95: 8 | N95: 0 | O95: 3
A99: Test Case 7 - Data Integrity
A100: Signal Generator
A101: RF Power | B101: IF Power | C101: RF Frequency | D101: IF Frequency | E101: Command | F101: Response | H101: Timeout | I101: Attempts | J101: Block Size | K101: RF Channel | L101: IF Channel | M101: TTG Channel | N101: # Samples | O101: Cnfg Attn | P101: Averaging | Q101: Low Limit | R101: High Limit
A102: -40 | B102: -40 | C102: 1879.98 | D102: 1880 | E102: TDOA 71# # # 0 63 -16 # 0 0 1 0 0 0 0 1 # 0 | F102: TDOA | H102: 5.0 | I102: 2 | J102: 256 | K102: 33768 | L102: 128 | M102: 383 | N102: 1024 | O102: 6 | P102: 1 | Q102: 25 | R102: 9999
A103: -40 | B103: -40 | C103: 1879.98 | D103: 1880 | E103: TDOA 72# # # 0 63 -16 # 0 0 1 0 0 0 0 1 # 0 | F103: TDOA | H103: 5.0 | I103: 2 | J103: 256 | K103: 33768 | L103: 128 | M103: 383 | N103: 1024 | O103: 6 | P103: 1 | Q103: 25 | R103: 9999
A104: -40 | B104: -40 | C104: 1879.98 | D104: 1880 | E104: TDOA 73# # # 0 63 -16 # 0 0 1 0 0 0 0 1 # 0 | F104: TDOA | H104: 5.0 | I104: 2 | J104: 256 | K104: 33768 | L104: 128 | M104: 383 | N104: 1024 | O104: 6 | P104: 1 | Q104: 25 | R104: 9999
A105: -40 | B105: -40 | C105: 1879.98 | D105: 1880 | E105: TDOA 74# # # 0 63 -16 # 0 0 1 0 0 0 0 1 # 0 | F105: TDOA | H105: 5.0 | I105: 2 | J105: 256 | K105: 33768 | L105: 128 | M105: 383 | N105: 1024 | O105: 6 | P105: 1 | Q105: 25 | R105: 9999
A106: -40 | B106: -40 | C106: 1879.98 | D106: 1880 | E106: TDOA 75# # # 0 63 -16 # 0 0 1 0 0 0 0 1 # 0 | F106: TDOA | H106: 5.0 | I106: 2 | J106: 256 | K106: 33768 | L106: 128 | M106: 383 | N106: 1024 | O106: 6 | P106: 1 | Q106: 25 | R106: 9999
A110: Test Case 8 - Noise Floor
A111: Signal Generator
A112: RF Power | B112: IF Power | C112: RF Frequency | D112: IF Frequency | E112: Command | F112: Response | H112: Timeout | I112: Attempts | J112: Block Size | K112: RF Channel | L112: IF Channel | M112: # Samples | N112: Cnfg Attn | O112: Averaging | P112: Signal Averaging | Q112: Low Limit | R112: High Limit | S112: Low Limit Gain | T112: High Limit Gain
A113: -45 | C113: 1880.01 | D113: 70 | E113: TDOA 80# # # 0 63 -16 # 0 0 1 0 0 0 0 1 # 0 | F113: TDOA | H113: 5.0 | I113: 2 | J113: 256 | K113: 33769 | L113: 1501 | M113: 1024 | N113: 0 | O113: 8 | P113: 1 | Q113: -174 | R113: -131 | S113: 30 | T113: 36
A115: -45 | C115: 1850.04 | D115: 70 | E115: TDOA 81# # # 0 63 -16 # 0 0 1 0 0 0 0 1 # 0 | F115: TDOA | H115: 5.0 | I115: 2 | J115: 256 | K115: 32770 | L115: 2 | M115: 1024 | N115: 0 | O115: 8 | P115: 1 | Q115: -174 | R115: -131 | S115: 30 | T115: 36
A116: -45 | C116: 1855.02 | D116: 70 | E116: TDOA 82# # # 0 63 -16 # 0 0 1 0 0 0 0 1 # 0 | F116: TDOA | H116: 5.0 | I116: 2 | J116: 256 | K116: 32936 | L116: 168 | M116: 1024 | N116: 0 | O116: 8 | P116: 1 | Q116: -174 | R116: -131 | S116: 30 | T116: 36
A117: -45 | C117: 1860 | D117: 70 | E117: TDOA 83# # # 0 63 -16 # 0 0 1 0 0 0 0 1 # 0 | F117: TDOA | H117: 5.0 | I117: 2 | J117: 256 | K117: 33102 | L117: 334 | M117: 1024 | N117: 0 | O117: 8 | P117: 1 | Q117: -174 | R117: -131 | S117: 30 | T117: 36
A118: -45 | C118: 1865.01 | D118: 70 | E118: TDOA 84# # # 0 63 -16 # 0 0 1 0 0 0 0 1 # 0 | F118: TDOA | H118: 5.0 | I118: 2 | J118: 256 | K118: 33269 | L118: 501 | M118: 1024 | N118: 0 | O118: 8 | P118: 1 | Q118: -174 | R118: -131 | S118: 30 | T118: 36
A119: -45 | C119: 1870.02 | D119: 70 | E119: TDOA 85# # # 0 63 -16 # 0 0 1 0 0 0 0 1 # 0 | F119: TDOA | H119: 5.0 | I119: 2 | J119: 256 | K119: 33436 | L119: 668 | M119: 1024 | N119: 0 | O119: 8 | P119: 1 | Q119: -174 | R119: -131 | S119: 30 | T119: 36
A120: -45 | C120: 1875 | D120: 70 | E120: TDOA 86# # # 0 63 -16 # 0 0 1 0 0 0 0 1 # 0 | F120: TDOA | H120: 5.0 | I120: 2 | J120: 256 | K120: 33602 | L120: 834 | M120: 1024 | N120: 0 | O120: 8 | P120: 1 | Q120: -174 | R120: -131 | S120: 30 | T120: 36
A121: -45 | C121: 1880.01 | D121: 70 | E121: TDOA 87# # # 0 63 -16 # 0 0 1 0 0 0 0 1 # 0 | F121: TDOA | H121: 5.0 | I121: 2 | J121: 256 | K121: 33769 | L121: 1001 | M121: 1024 | N121: 0 | O121: 8 | P121: 1 | Q121: -174 | R121: -131 | S121: 30 | T121: 36
A122: -45 | C122: 1885.02 | D122: 70 | E122: TDOA 88# # # 0 63 -16 # 0 0 1 0 0 0 0 1 # 0 | F122: TDOA | H122: 5.0 | I122: 2 | J122: 256 | K122: 33936 | L122: 1168 | M122: 1024 | N122: 0 | O122: 8 | P122: 1 | Q122: -174 | R122: -131 | S122: 30 | T122: 36
A123: -45 | C123: 1890 | D123: 70 | E123: TDOA 89# # # 0 63 -16 # 0 0 1 0 0 0 0 1 # 0 | F123: TDOA | H123: 5.0 | I123: 2 | J123: 256 | K123: 34102 | L123: 1334 | M123: 1024 | N123: 0 | O123: 8 | P123: 1 | Q123: -174 | R123: -131 | S123: 30 | T123: 36
A124: -45 | C124: 1895.01 | D124: 70 | E124: TDOA 80# # # 0 63 -16 # 0 0 1 0 0 0 0 1 # 0 | F124: TDOA | H124: 5.0 | I124: 2 | J124: 256 | K124: 34269 | L124: 1501 | M124: 1024 | N124: 0 | O124: 8 | P124: 1 | Q124: -174 | R124: -131 | S124: 30 | T124: 36
A125: -45 | C125: 1900.02 | D125: 70 | E125: TDOA 181# # # 0 63 -16 # 0 0 1 0 0 0 0 1 # 0 | F125: TDOA | H125: 5.0 | I125: 2 | J125: 256 | K125: 34436 | L125: 1668 | M125: 1024 | N125: 0 | O125: 8 | P125: 1 | Q125: -174 | R125: -131 | S125: 30 | T125: 36
A126: -45 | C126: 1905 | D126: 70 | E126: TDOA 182# # # 0 63 -16 # 0 0 1 0 0 0 0 1 # 0 | F126: TDOA | H126: 5.0 | I126: 2 | J126: 256 | K126: 34602 | L126: 1834 | M126: 1024 | N126: 0 | O126: 8 | P126: 1 | Q126: -174 | R126: -131 | S126: 30 | T126: 36
A127: -45 | C127: 1909.92 | D127: 70 | E127: TDOA 183# # # 0 63 -16 # 0 0 1 0 0 0 0 1 # 0 | F127: TDOA | H127: 5.0 | I127: 2 | J127: 256 | K127: 34766 | L127: 1998 | M127: 1024 | N127: 0 | O127: 8 | P127: 1 | Q127: -174 | R127: -131 | S127: 30 | T127: 36
A131: Test Case 9 - DDC Tuning
A132: Signal Generator
A133: RF Power | B133: IF Power | C133: RF Frequency | D133: IF Frequency | E133: Command | F133: Response | H133: Timeout | I133: Attempts | J133: Block Size | K133: RF Channel | L133: IF Channel | M133: # Samples | N133: Averaging | O133: Low Limit | P133: High Limit
A134: -40 | B134: -40 | C134: 1850.04 | E134: TDOA 91# # # 0 63 -16 # 0 0 1 0 0 0 0 1 # 0 | F134: TDOA | H134: 5.0 | I134: 2 | J134: 256 | K134: 32770 | M134: 1024 | N134: 1 | O134: 25 | P134: 9999
A136: -40 | B136: -40 | C136: 1855.11 | E136: TDOA 92# # # 0 63 -16 # 0 0 1 0 0 0 0 1 # 0 | F136: TDOA | H136: 5.0 | I136: 2 | J136: 256 | K136: 32939 | M136: 1024 | N136: 1 | O136: 25 | P136: 9999
A137: -40 | B137: -40 | C137: 1860.21 | E137: TDOA 93# # # 0 63 -16 # 0 0 1 0 0 0 0 1 # 0 | F137: TDOA | H137: 5.0 | I137: 2 | J137: 256 | K137: 33109 | M137: 1024 | N137: 1 | O137: 25 | P137: 9999
A138: -40 | B138: -40 | C138: 1865.31 | E138: TDOA 94# # # 0 63 -16 # 0 0 1 0 0 0 0 1 # 0 | F138: TDOA | H138: 5.0 | I138: 2 | J138: 256 | K138: 33279 | M138: 1024 | N138: 1 | O138: 25 | P138: 9999
A139: -40 | B139: -40 | C139: 1870.41 | E139: TDOA 95# # # 0 63 -16 # 0 0 1 0 0 0 0 1 # 0 | F139: TDOA | H139: 5.0 | I139: 2 | J139: 256 | K139: 33449 | M139: 1024 | N139: 1 | O139: 25 | P139: 9999
A140: -40 | B140: -40 | C140: 1875.51 | E140: TDOA 96# # # 0 63 -16 # 0 0 1 0 0 0 0 1 # 0 | F140: TDOA | H140: 5.0 | I140: 2 | J140: 256 | K140: 33619 | M140: 1024 | N140: 1 | O140: 25 | P140: 9999
A141: -40 | B141: -40 | C141: 1880.61 | E141: TDOA 97# # # 0 63 -16 # 0 0 1 0 0 0 0 1 # 0 | F141: TDOA | H141: 5.0 | I141: 2 | J141: 256 | K141: 33789 | M141: 1024 | N141: 1 | O141: 25 | P141: 9999
A142: -40 | B142: -40 | C142: 1885.71 | E142: TDOA 98# # # 0 63 -16 # 0 0 1 0 0 0 0 1 # 0 | F142: TDOA | H142: 5.0 | I142: 2 | J142: 256 | K142: 33959 | M142: 1024 | N142: 1 | O142: 25 | P142: 9999
A143: -40 | B143: -40 | C143: 1890.81 | E143: TDOA 99# # # 0 63 -16 # 0 0 1 0 0 0 0 1 # 0 | F143: TDOA | H143: 5.0 | I143: 2 | J143: 256 | K143: 34129 | M143: 1024 | N143: 1 | O143: 25 | P143: 9999
A144: -40 | B144: -40 | C144: 1895.91 | E144: TDOA 90# # # 0 63 -16 # 0 0 1 0 0 0 0 1 # 0 | F144: TDOA | H144: 5.0 | I144: 2 | J144: 256 | K144: 34299 | M144: 1024 | N144: 1 | O144: 25 | P144: 9999
A145: -40 | B145: -40 | C145: 1901.01 | E145: TDOA 191# # # 0 63 -16 # 0 0 1 0 0 0 0 1 # 0 | F145: TDOA | H145: 5.0 | I145: 2 | J145: 256 | K145: 34469 | M145: 1024 | N145: 1 | O145: 25 | P145: 9999
A146: -40 | B146: -40 | C146: 1906.11 | E146: TDOA 192# # # 0 63 -16 # 0 0 1 0 0 0 0 1 # 0 | F146: TDOA | H146: 5.0 | I146: 2 | J146: 256 | K146: 34639 | M146: 1024 | N146: 1 | O146: 25 | P146: 9999
A147: -40 | B147: -40 | C147: 1909.89 | E147: TDOA 193# # # 0 63 -16 # 0 0 1 0 0 0 0 1 # 0 | F147: TDOA | H147: 5.0 | I147: 2 | J147: 256 | K147: 34765 | M147: 1024 | N147: 1 | O147: 25 | P147: 9999
A151: Test Case 10 - T1
A152: Command Prior to 10 | B152: Response | D152: Timeout | E152: Begin State | F152: End State | G152: Attempts
A153: GoT1Master | D153: 3 | E153: DSHELL | F153: DSHELL | G153: 1
A154: RunLocalT1 500 100 | B154: Bad 0 | D154: 20 | E154: DSHELL | F154: DSHELL | G154: 1
A158: Command | B158: Response | D158: Timeout | E158: Begin State | F158: End State | G158: Attempts
A159: GOMASTER | D159: 3 | E159: DSHELL | F159: DSHELL | G159: 1
A160: RUNLOCALLOOP 500 100 | B160: Bad 0 | D160: 20 | E160: DSHELL | F160: DSHELL | G160: 1
A164: Test Case 11 - Ethernet
A165: Command | B165: Response | D165: Timeout | E165: Begin State | F165: End State | G165: Attempts
A166: ethtest | B166: ethtest | D166: 20 | E166: DSHELL | F166: DSHELL | G166: 1
A170: Test Case 12 - Mini-RLS
A171: Signal Generator | C171: LMU Command
A172: RF Power | B172: RF Frequency | C172: Command Set | G172: Block Size | H172: # Blocks | I172: RF Channel | J172: # Samples | K172: |delay| (nsec) | L172: Phase Curvature | M172: Repeat and Average
A173: -40 | B173: 824.2 | C173: CommandSequence12B | G173: 256 | H173: 4 | I173: 128 | J173: 1024 | K173: 150 | L173: 0.5 | M173: 5
A174: -40 | B174: 829 | C174: CommandSequence12B | G174: 256 | H174: 4 | I174: 152 | J174: 1024 | K174: 150 | L174: 0.5 | M174: 5
A175: -40 | B175: 834 | C175: CommandSequence12B | G175: 256 | H175: 4 | I175: 177 | J175: 1024 | K175: 150 | L175: 0.5 | M175: 5
A176: -40 | B176: 839 | C176: CommandSequence12B | G176: 256 | H176: 4 | I176: 202 | J176: 1024 | K176: 150 | L176: 0.5 | M176: 5
A177: -40 | B177: 844 | C177: CommandSequence12B | G177: 256 | H177: 4 | I177: 227 | J177: 1024 | K177: 150 | L177: 0.5 | M177: 5
A178: -40 | B178: 848.8 | C178: CommandSequence12B | G178: 256 | H178: 4 | I178: 251 | J178: 1024 | K178: 150 | L178: 0.5 | M178: 5
A179: -40 | B179: 824.04 | C179: CommandSequence12A | G179: 256 | H179: 4 | I179: 991 | J179: 1024 | K179: 150 | L179: 0.5 | M179: 5
A180: -40 | B180: 828.98999999999546 | C180: CommandSequence12A | G180: 256 | H180: 4 | I180: 133 | J180: 1024 | K180: 150 | L180: 0.5 | M180: 5
A181: -40 | B181: 833.99999999999091 | C181: CommandSequence12A | G181: 256 | H181: 4 | I181: 300 | J181: 1024 | K181: 150 | L181: 0.5 | M181: 5
A182: -40 | B182: 839.00999999998635 | C182: CommandSequence12A | G182: 256 | H182: 4 | I182: 467 | J182: 1024 | K182: 150 | L182: 0.5 | M182: 5
A183: -40 | B183: 844.01999999998179 | C183: CommandSequence12A | G183: 256 | H183: 4 | I183: 634 | J183: 1024 | K183: 150 | L183: 0.5 | M183: 5
A184: -40 | B184: 848.96999999997729 | C184: CommandSequence12A | G184: 256 | H184: 4 | I184: 799 | J184: 1024 | K184: 150 | L184: 0.5 | M184: 5
A187: Test Case 13 - Config Attenuator
A188: Signal Generator
A189: RF Power | B189: IF Power | C189: RF Frequency | D189: IF Frequency | E189: Command | F189: Response | H189: Timeout | I189: Attempts | J189: Block Size | K189: RF Channel | L189: IF Channel | M189: TTG Channel | N189: # Samples | O189: Cnfg Attn Setting | P189: Averaging | Q189: Low Limit from previous level (dBm) | R189: High Limit from previous level (dBm)
A190: -40 | B190: -40 | C190: 1880.01 | D190: 70 | E190: TDOA 71# # # 0 63 -16 # 0 0 1 0 0 0 0 1 # 0 | F190: TDOA | H190: 5 | I190: 2 | J190: 256 | K190: 33769 | L190: 128 | M190: 33769 | N190: 1024 | O190: 0 | P190: 1 | Q190: -60 | R190: 0
A191: -40 | B191: -40 | C191: 1880.01 | D191: 70 | E191: TDOA 72# # # 0 63 -16 # 0 0 1 0 0 0 0 1 # 0 | F191: TDOA | H191: 5 | I191: 2 | J191: 256 | K191: 33769 | L191: 128 | M191: 33769 | N191: 1024 | O191: -8 | P191: 1 | Q191: -10 | R191: -6
A192: -40 | B192: -40 | C192: 1880.01 | D192: 70 | E192: TDOA 73# # # 0 63 -16 # 0 0 1 0 0 0 0 1 # 0 | F192: TDOA | H192: 5 | I192: 2 | J192: 256 | K192: 33769 | L192: 128 | M192: 33769 | N192: 1024 | O192: -10 | P192: 1 | Q192: -3.3 | R192: -0.7
A193: -40 | B193: -40 | C193: 1880.01 | D193: 70 | E193: TDOA 74# # # 0 63 -16 # 0 0 1 0 0 0 0 1 # 0 | F193: TDOA | H193: 5 | I193: 2 | J193: 256 | K193: 33769 | L193: 128 | M193: 33769 | N193: 1024 | O193: 6 | P193: 1 | Q193: 13.5 | R193: 18.5
A194: -40 | B194: -40 | C194: 1880.01 | D194: 70 | E194: TDOA 75# # # 0 63 -16 # 0 0 1 0 0 0 0 1 # 0 | F194: TDOA | H194: 5 | I194: 2 | J194: 256 | K194: 33769 | L194: 128 | M194: 33769 | N194: 1024 | O194: 2 | P194: 1 | Q194: -5.5 | R194: -2.5
A195: -40 | B195: -40 | C195: 1880.01 | D195: 70 | E195: TDOA 76# # # 0 63 -16 # 0 0 1 0 0 0 0 1 # 0 | F195: TDOA | H195: 5 | I195: 2 | J195: 256 | K195: 33769 | L195: 128 | M195: 33769 | N195: 1024 | O195: 1 | P195: 1 | Q195: -2 | R195: 0
A199: TTG Freq
A200: 836.5 MHZ | B200: Response | D200: Timeout | E200: Begin State | F200: End State | G200: Attempts
A201: eng | D201: 0.5 | E201: DSHELL | F201: ENG | G201: 1
A202: TEST 2 5 4 5 0x00 0x00 0xD3 | D202: 1 | E202: DSHELL | F202: ENG | G202: 1
A203: TEST 2 5 4 5 0x00 0x00 0x50 | D203: 1 | E203: DSHELL | F203: ENG | G203: 1
A204: TEST 2 5 4 5 0x00 0x3A 0xC1 | D204: 1 | E204: DSHELL | F204: ENG | G204: 1
A205: exit | D205: 0.5 | E205: ENG | F205: DSHELL | G205: 1
A208: Gain Setup
A209: Setup | B209: Response | D209: Timeout | E209: Begin State | F209: End State | G209: Attempts
A210: gain 1 33 | D210: 0.5 | E210: DSHELL | F210: ENG | G210: 1
A211: gain 2 33 | D211: 0.5 | E211: DSHELL | F211: ENG | G211: 1
A212: gain 3 33 | D212: 0.5 | E212: DSHELL | F212: ENG | G212: 1
A213: gain 4 33 | D213: 0.5 | E213: DSHELL | F213: ENG | G213: 1
A214: gain 5 33 | D214: 0.5 | E214: DSHELL | F214: ENG | G214: 1
A215: gain 6 33 | D215: 0.5 | E215: DSHELL | F215: ENG | G215: 1
A218: Config Atten Setup
A219: Setup | B219: Response | D219: Timeout | E219: Begin State | F219: End State | G219: Attempts
A220: gain 1 25varGain | D220: 0.5 | E220: DSHELL | F220: ENG | G220: 1
A221: gain 2 25varGain | D221: 0.5 | E221: DSHELL | F221: ENG | G221: 1
A222: gain 3 25varGain | D222: 0.5 | E222: DSHELL | F222: ENG | G222: 1
A223: gain 4 25varGain | D223: 0.5 | E223: DSHELL | F223: ENG | G223: 1
A224: gain 5 25varGain | D224: 0.5 | E224: DSHELL | F224: ENG | G224: 1
A225: gain 6 25varGain | D225: 0.5 | E225: DSHELL | F225: ENG | G225: 1
A228: Data Path Settings
A229: Data Path 1 | D229: Timeout | E229: Begin State | F229: End State | G229: Attempts
A230: eng | D230: 0.5 | E230: DSHELL | F230: ENG | G230: 1
A231: Test 1 1 0 0 0 | D231: 0.5 | E231: ENG | F231: ENG | G231: 1
A232: exit | D232: 0.5 | E232: ENG | F232: DSHELL | G232: 1
A235: Data Path 2 | D235: Timeout | E235: Begin State | F235: End State | G235: Attempts
A236: eng | D236: 0.5 | E236: DSHELL | F236: ENG | G236: 1
A237: Test 1 0 1 0 0 | D237: 0.5 | E237: ENG | F237: ENG | G237: 1
A238: exit | D238: 0.5 | E238: ENG | F238: DSHELL | G238: 1
A241: Data Path 3 | D241: Timeout | E241: Begin State | F241: End State | G241: Attempts
A242: eng | D242: 0.5 | E242: DSHELL | F242: ENG | G242: 1
A243: Test 1 0 0 1 0 | D243: 0.5 | E243: ENG | F243: ENG | G243: 1
A244: exit | D244: 0.5 | E244: ENG | F244: DSHELL | G244: 1
A247: Data Path 4 | D247: Timeout | E247: Begin State | F247: End State | G247: Attempts
A248: eng | D248: 0.5 | E248: DSHELL | F248: ENG | G248: 1
A249: Test 1 0 0 0 1 | D249: 0.5 | E249: ENG | F249: ENG | G249: 1
A250: exit | D250: 0.5 | E250: ENG | F250: DSHELL | G250: 1
A253: Data Path 5 | D253: Timeout | E253: Begin State | F253: End State | G253: Attempts
A254: eng | D254: 0.5 | E254: DSHELL | F254: ENG | G254: 1
A255: Test 1 1 1 1 1 | D255: 0.5 | E255: ENG | F255: ENG | G255: 1
A256: exit | D256: 0.5 | E256: ENG | F256: DSHELL | G256: 1
A259: Compensation Settings
A260: Receiver compensated gain | D260: Timeout | E260: Begin State | F260: End State | G260: Attempts
A261: eng | D261: 0.5 | E261: DSHELL | F261: ENG | G261: 1
A262: Test 4 0xA4 0x48 6 | B262: DATA Read: | D262: 1 | E262: ENG | F262: ENG | G262: 1
A263: TEST 4 0xA4 0x1F 1 | B263: DATA Read: 41 | D263: 1 | E263: ENG | F263: ENG | G263: 1
A264: Test 4 0xA4 0x30 6 | B264: DATA Read: | D264: 1 | E264: ENG | F264: ENG | G264: 1
A265: exit | D265: 0.5 | E265: ENG | F265: DSHELL | G265: 1
A268: TTG compensated Level | D268: Timeout | E268: Begin State | F268: End State | G268: Attempts
A269: eng | D269: 0.5 | E269: DSHELL | F269: ENG | G269: 1
A270: Test 4 0xA4 0x42 6 | B270: DATA Read: | D270: 1 | E270: ENG | F270: ENG | G270: 1
A271: TEST 4 0xA4 0x1F 1 | B271: DATA Read: 41 | D271: 1 | E271: ENG | F271: ENG | G271: 1 | H271: Note: | I271: If we get DATA Read: 41, then the software will skip
A272: Test 4 0xA4 0x2A 6 | B272: DATA Read: | D272: 1 | E272: ENG | F272: ENG | G272: 1 | I272: over the next line and go directly to exit
A273: exit | D273: 0.5 | E273: ENG | F273: DSHELL | G273: 1
A276: Receiver Gain Compensation | D276: Timeout | E276: Begin State | F276: End State | G276: Attempts
A277: eng | D277: 0.5 | E277: DSHELL | F277: ENG | G277: 1
A278: TEST 4 0xA4 0x1F 1 | B278: DATA Read: 41 | D278: 0.5 | E278: ENG | F278: ENG | G278: 1
A279: Test 4 0xA4 0x20 6 | B279: DATA Read: | D279: 0.5 | E279: ENG | F279: ENG | G279: 1
A280: exit | D280: 0.5 | E280: ENG | F280: DSHELL | G280: 1
A283: EnableTTG | B283: Response | D283: Timeout | E283: Begin State | F283: End State | G283: Attempts
A284: eng | D284: 0.5 | E284: DSHELL | F284: ENG | G284: 1
A285: TEST 2 3 8 6 8 | D285: 0.5 | E285: ENG | F285: ENG | G285: 1
A286: TEST 2 3 4 4 5 | D286: 0.5 | E286: ENG | F286: ENG | G286: 1
A287: TEST 2 3 4 6 1 | D287: 0.5 | E287: ENG | F287: ENG | G287: 1
A288: exit | D288: 0.5 | E288: ENG | F288: DSHELL | G288: 1
A291: DisableTTG | D291: Timeout | E291: Begin State | F291: End State | G291: Attempts
A292: eng | D292: 0.5 | E292: DSHELL | F292: ENG | G292: 1
A293: TEST 2 3 8 6 5 | D293: 0.5 | E293: ENG | F293: ENG | G293: 1
A294: TEST 2 3 4 4 1 | D294: 0.5 | E294: ENG | F294: ENG | G294: 1
A295: TEST 2 3 4 6 0 | D295: 0.5 | E295: ENG | F295: ENG | G295: 1
A296: exit | D296: 0.5 | E296: ENG | F296: DSHELL | G296: 1
A299: Mute On | D299: Timeout | E299: Begin State | F299: End State | G299: Attempts
A300: eng | D300: 0.5 | E300: DSHELL | F300: ENG | G300: 1
A301: TEST 2 3 8 6 8 | D301: 0.5 | E301: ENG | F301: ENG | G301: 1
A302: exit | D302: 0.5 | E302: ENG | F302: DSHELL | G302: 1
A305: Mute Off | D305: Timeout | E305: Begin State | F305: End State | G305: Attempts
A306: eng | D306: 0.5 | E306: DSHELL | F306: ENG | G306: 1
A307: TEST 2 3 8 6 5 | D307: 0.5 | E307: ENG | F307: ENG | G307: 1
A308: exit | D308: 0.5 | E308: ENG | F308: DSHELL | G308: 1
A311: Change Admin State
A312: Command | B312: Response | D312: Timeout | E312: Begin State | F312: End State | G312: # of retries
A313: etest 15 1 | D313: 2 | E313: DSHELL | F313: DSHELL | G313: 1
A317: Check Alarms
A318: Command | B318: Response | D318: Timeout | E318: Begin State | F318: End State | G318: # of retries
A319: ALARMS | B319: FAULT_GPS_HOLDOVER | D319: 2 | E319: DSHELL | F319: DSHELL | G319: 1
A323: Mini-RLS Command Sequence 12A (AMPS)
A324: Command | B324: Response | D324: Timeout | E324: Begin State | F324: End State | G324: # of retries
A325: ALARMS | B325: FAULT_GPS_HOLDOVER | D325: 2 | E325: DSHELL | F325: DSHELL | G325: 1
A326: TIME | B326: GPS Time: | D326: 2 | E326: DSHELL | F326: DSHELL | G326: 2
A327: SVCR # # 2 # # 0 1 0 0 0 1 1 1 # 0 0 | B327: returnCode 0 | D327: 2 | E327: DSHELL | F327: DSHELL | G327: 1
A328: WAIT | D328: 15 | E328: DSHELL | F328: DSHELL | G328: 1
A329: TDATA # 0 2 # # # -16 0 1 0 0 11 0 63 -16 | B329: TDOA | D329: 15 | E329: DSHELL | F329: DSHELL | G329: 1
A333: Mini-RLS Command Sequence 12B (GSM)
A334: Command | B334: Response | D334: Timeout | E334: Begin State | F334: End State | G334: # of retries
A335: ALARMS | B335: FAULT_GPS_HOLDOVER | D335: 2 | E335: DSHELL | F335: DSHELL | G335: 1
A336: TIME | B336: GPS Time: | D336: 2 | E336: DSHELL | F336: DSHELL | G336: 2
A337: GVCR # 2 # # 0 # 0 # # 17 1 0 0 0 0 0 0 1 1 1 8 0 0 0 0 0 0 0 0 0 0 0 | B337: returnCode 0 | D337: 2 | E337: DSHELL | F337: DSHELL | G337: 1
A338: WAIT | D338: 15 | E338: DSHELL | F338: DSHELL | G338: 1
A339: TDATA # 0 2 # # # -16 0 1 0 0 11 0 63 -16 | B339: TDOA | D339: 15 | E339: DSHELL | F339: DSHELL | G339: 1

Sheet: 061636
C1: Factors
C2: TTG | D2: 50
C3: Gain | D3: 400
C4: TTG Comp | D4: 100
C5: Gain Comp | D5: 350
F8: Temperature Coefficient | J8: Center Temperature
F10: -3.5000000000000003E-2 | H10: dB/deg | J10: 30 | L10: deg
A15: Test Case 2 - Processor Memory
A16: Command | B16: Response | D16: Timeout | E16: Begin State | F16: End State | G16: Attempts
A17: BIT 4 1 | B17: No Failure | D17: 20 | E17: DSHELL | F17: DSHELL | G17: 1
A18: BIT 4 2 | B18: No Failure | D18: 20 | E18: DSHELL | F18: DSHELL | G18: 1
A19: BIT 4 3 | B19: No Failure | D19: 20 | E19: DSHELL | F19: DSHELL | G19: 1
A20: BIT 4 4 | B20: No Failure | D20: 20 | E20: DSHELL | F20: DSHELL | G20: 1
A24: Test Case 3 - SNR
A25: Signal Generator
A26: RF Power | B26: IF Power | C26: RF Frequency | D26: IF Frequency | E26: Command | F26: Response | H26: Timeout | I26: Attempts | J26: Block Size | K26: RF Channel | L26: IF Channel | M26: TTG Channel | N26: # Samples | O26: Averaging | P26: Low Limit | Q26: High Limit
A27: -50 | B27: -50 | C27: 824.04 | D27: 70 | E27: TDOA 31# # # 0 63 -16 # 0 0 1 0 0 0 0 1 # 0 | F27: TDOA | H27: 5.0 | I27: 2 | J27: 256 | K27: 991 | L27: 128 | M27: 383 | N27: 1024 | O27: 1 | P27: 29 | Q27: 9999
A29: -50 | B29: -50 | C29: 827.01 | D29: 70 | E29: TDOA 32# # # 0 63 -16 # 0 0 1 0 0 0 0 1 # 0 | F29: TDOA | H29: 5.0 | I29: 2 | J29: 256 | K29: 67 | L29: 128 | M29: 383 | N29: 1024 | O29: 1 | P29: 29 | Q29: 9999
A30: -50 | B30: -50 | C30: 829.71 | D30: 70 | E30: TDOA 33# # # 0 63 -16 # 0 0 1 0 0 0 0 1 # 0 | F30: TDOA | H30: 5.0 | I30: 2 | J30: 256 | K30: 157 | L30: 128 | M30: 383 | N30: 1024 | O30: 1 | P30: 29 | Q30: 9999
A31: -50 | B31: -50 | C31: 829.74 | D31: 70 | E31: TDOA 34# # # 0 63 -16 # 0 0 1 0 0 0 0 1 # 0 | F31: TDOA | H31: 5.0 | I31: 2 | J31: 256 | K31: 158 | L31: 128 | M31: 383 | N31: 1024 | O31: 1 | P31: 29 | Q31: 9999
A32: -50 | B32: -50 | C32: 832.5 | D32: 70 | E32: TDOA 35# # # 0 63 -16 # 0 0 1 0 0 0 0 1 # 0 | F32: TDOA | H32: 5.0 | I32: 2 | J32: 256 | K32: 250 | L32: 128 | M32: 383 | N32: 1024 | O32: 1 | P32: 29 | Q32: 9999
A33: -50 | B33: -50 | C33: 834.99 | D33: 70 | E33: TDOA 36# # # 0 63 -16 # 0 0 1 0 0 0 0 1 # 0 | F33: TDOA | H33: 5.0 | I33: 2 | J33: 256 | K33: 333 | L33: 128 | M33: 383 | N33: 1024 | O33: 1 | P33: 29 | Q33: 9999
A34: -50 | B34: -50 | C34: 835.02 | D34: 70 | E34: TDOA 37# # # 0 63 -16 # 0 0 1 0 0 0 0 1 # 0 | F34: TDOA | H34: 5.0 | I34: 2 | J34: 256 | K34: 334 | L34: 128 | M34: 383 | N34: 1024 | O34: 1 | P34: 29 | Q34: 9999
A35: -50 | B35: -50 | C35: 836.5 | D35: 70 | E35: TDOA 38# # # 0 63 -16 # 0 0 1 0 0 0 0 1 # 0 | F35: TDOA | H35: 5.0 | I35: 2 | J35: 256 | K35: 383 | L35: 128 | M35: 383 | N35: 1024 | O35: 1 | P35: 29 | Q35: 9999
A36: -50 | B36: -50 | C36: 837.51 | D36: 70 | E36: TDOA 39# # # 0 63 -16 # 0 0 1 0 0 0 0 1 # 0 | F36: TDOA | H36: 5.0 | I36: 2 | J36: 256 | K36: 417 | L36: 128 | M36: 383 | N36: 1024 | O36: 1 | P36: 29 | Q36: 9999
A37: -50 | B37: -50 | C37: 840.21 | D37: 70 | E37: TDOA 130# # # 0 63 -16 # 0 0 1 0 0 0 0 1 # 0 | F37: TDOA | H37: 5.0 | I37: 2 | J37: 256 | K37: 507 | L37: 128 | M37: 383 | N37: 1024 | O37: 1 | P37: 29 | Q37: 9999
A38: -50 | B38: -50 | C38: 840.24 | D38: 70 | E38: TDOA 131# # # 0 63 -16 # 0 0 1 0 0 0 0 1 # 0 | F38: TDOA | H38: 5.0 | I38: 2 | J38: 256 | K38: 508 | L38: 128 | M38: 383 | N38: 1024 | O38: 1 | P38: 29 | Q38: 9999
A39: -50 | B39: -50 | C39: 842.01 | D39: 70 | E39: TDOA 132# # # 0 63 -16 # 0 0 1 0 0 0 0 1 # 0 | F39: TDOA | H39: 5.0 | I39: 2 | J39: 256 | K39: 567 | L39: 128 | M39: 383 | N39: 1024 | O39: 1 | P39: 29 | Q39: 9999
A40: -50 | B40: -50 | C40: 844.65 | D40: 70 | E40: TDOA 133# # # 0 63 -16 # 0 0 1 0 0 0 0 1 # 0 | F40: TDOA | H40: 5.0 | I40: 2 | J40: 256 | K40: 655 | L40: 128 | M40: 383 | N40: 1024 | O40: 1 | P40: 29 | Q40: 9999
A41: -50 | B41: -50 | C41: 844.68 | D41: 70 | E41: TDOA 134# # # 0 63 -16 # 0 0 1 0 0 0 0 1 # 0 | F41: TDOA | H41: 5.0 | I41: 2 | J41: 256 | K41: 656 | L41: 128 | M41: 383 | N41: 1024 | O41: 1 | P41: 29 | Q41: 9999
A42: -50 | B42: -50 | C42: 846.51 | D42: 70 | E42: TDOA 135# # # 0 63 -16 # 0 0 1 0 0 0 0 1 # 0 | F42: TDOA | H42: 5.0 | I42: 2 | J42: 256 | K42: 717 | L42: 128 | M42: 383 | N42: 1024 | O42: 1 | P42: 29 | Q42: 9999
A43: -50 | B43: -50 | C43: 848.97 | D43: 70 | E43: TDOA 136# # # 0 63 -16 # 0 0 1 0 0 0 0 1 # 0 | F43: TDOA | H43: 5.0 | I43: 2 | J43: 256 | K43: 799 | L43: 128 | M43: 383 | N43: 1024 | O43: 1 | P43: 29 | Q43: 9999
A47: Test Case 5 - Two-Tone Response
B48: SigGen1 | D48: SigGen2
A49: Center RF Channel | B49: RF Frequency | C49: RF Power | D49: RF Frequency | E49: Command | F49: Response | G49: Timeout | H49: Attempts | I49: Block Size | J49: Lower Channel | K49: Upper Channel | L49: # Samples | M49: Cnfg Attn | N49: Averaging | O49: Low Limit | P49: High Limit | Q49: Lower Channel Delta | R49: Upper Channel Delta
A50: 824.4 | B50: =RC[-1]-0.06 -> 824.34 | C50: -55 | D50: =RC[-3]+0.06 -> 824.45999999999992 | E50: TDOA 51# # # 0 63 -16 # 0 0 1 0 0 0 0 1 # 0 | F50: TDOA | G50: 5.0 | H50: 2 | I50: 256 | J50: 1001 | K50: 1005 | L50: 1024 | M50: 15 | N50: 1 | O50: -999 | P50: -65 | Q50: 4 | R50: 4
A52: 827.07 | B52: =RC[-1]-0.06 -> 827.0100000000001 | C52: -55 | D52: =RC[-3]+0.06 -> 827.13 | E52: TDOA 52# # # 0 63 -16 # 0 0 1 0 0 0 0 1 # 0 | F52: TDOA | G52: 5.0 | H52: 2 | I52: 256 | J52: 67 | K52: 71 | L52: 1024 | M52: 15 | N52: 1 | O52: -999 | P52: -65 | Q52: 4 | R52: 4
A53: 827.37 | B53: =RC[-1]-0.06 -> 827.31000000000006 | C53: -55 | D53: =RC[-3]+0.06 -> 827.43 | E53: TDOA 53# # # 0 63 -16 # 0 0 1 0 0 0 0 1 # 0 | F53: TDOA | G53: 5.0 | H53: 2 | I53: 256 | J53: 77 | K53: 81 | L53: 1024 | M53: 15 | N53: 1 | O53: -999 | P53: -65 | Q53: 4 | R53: 4
A54: 829.77 | B54: =RC[-1]-0.06 -> 829.71 | C54: -55 | D54: =RC[-3]+0.06 -> 829.82999999999993 | E54: TDOA 54# # # 0 63 -16 # 0 0 1 0 0 0 0 1 # 0 | F54: TDOA | G54: 5.0 | H54: 2 | I54: 256 | J54: 157 | K54: 161 | L54: 1024 | M54: 15 | N54: 1 | O54: -999 | P54: -65 | Q54: 4 | R54: 4
A55: 830.07 | B55: =RC[-1]-0.06 -> 830.0100000000001 | C55: -55 | D55: =RC[-3]+0.06 -> 830.13 | E55: TDOA 55# # # 0 63 -16 # 0 0 1 0 0 0 0 1 # 0 | F55: TDOA | G55: 5.0 | H55: 2 | I55: 256 | J55: 167 | K55: 171 | L55: 1024 | M55: 15 | N55: 1 | O55: -999 | P55: -65 | Q55: 4 | R55: 4
A56: 829.8 | B56: =RC[-1]-0.06 -> 829.74 | C56: -55 | D56: =RC[-3]+0.06 -> 829.8599999999999 | E56: TDOA 56# # # 0 63 -16 # 0 0 1 0 0 0 0 1 # 0 | F56: TDOA | G56: 5.0 | H56: 2 | I56: 256 | J56: 158 | K56: 162 | L56: 1024 | M56: 15 | N56: 1 | O56: -999 | P56: -65 | Q56: 4 | R56: 4
A57: 830.1 | B57: =RC[-1]-0.06 -> 830.04000000000008 | C57: -55 | D57: =RC[-3]+0.06 -> 830.16 | E57: TDOA 57# # # 0 63 -16 # 0 0 1 0 0 0 0 1 # 0 | F57: TDOA | G57: 5.0 | H57: 2 | I57: 256 | J57: 168 | K57: 172 | L57: 1024 | M57: 15 | N57: 1 | O57: -999 | P57: -65 | Q57: 4 | R57: 4
A58: 832.56 | B58: =RC[-1]-0.06 -> 832.5 | C58: -55 | D58: =RC[-3]+0.06 -> 832.61999999999989 | E58: TDOA 58# # # 0 63 -16 # 0 0 1 0 0 0 0 1 # 0 | F58: TDOA | G58: 5.0 | H58: 2 | I58: 256 | J58: 250 | K58: 254 | L58: 1024 | M58: 15 | N58: 1 | O58: -999 | P58: -65 | Q58: 4 | R58: 4
A59: 832.86 | B59: =RC[-1]-0.06 -> 832.80000000000007 | C59: -55 | D59: =RC[-3]+0.06 -> 832.92 | E59: TDOA 59# # # 0 63 -16 # 0 0 1 0 0 0 0 1 # 0 | F59: TDOA | G59: 5.0 | H59: 2 | I59: 256 | J59: 260 | K59: 264 | L59: 1024 | M59: 15 | N59: 1 | O59: -999 | P59: -65 | Q59: 4 | R59: 4
A60: 835.05 | B60: =RC[-1]-0.06 -> 834.99 | C60: -55 | D60: =RC[-3]+0.06 -> 835.1099999999999 | E60: TDOA 150# # # 0 63 -16 # 0 0 1 0 0 0 0 1 # 0 | F60: TDOA | G60: 5.0 | H60: 2 | I60: 256 | J60: 333 | K60: 337 | L60: 1024 | M60: 15 | N60: 1 | O60: -999 | P60: -65 | Q60: 4 | R60: 4
A61: 835.35 | B61: =RC[-1]-0.06 -> 835.29000000000008 | C61: -55 | D61: =RC[-3]+0.06 -> 835.41 | E61: TDOA 151# # # 0 63 -16 # 0 0 1 0 0 0 0 1 # 0 | F61: TDOA | G61: 5.0 | H61: 2 | I61: 256 | J61: 343 | K61: 347 | L61: 1024 | M61: 15 | N61: 1 | O61: -999 | P61: -65 | Q61: 4 | R61: 4
A62: 835.08 | B62: =RC[-1]-0.06 -> 835.0200000000001 | C62: -55 | D62: =RC[-3]+0.06 -> 835.14 | E62: TDOA 152# # # 0 63 -16 # 0 0 1 0 0 0 0 1 # 0 | F62: TDOA | G62: 5.0 | H62: 2 | I62: 256 | J62: 334 | K62: 338 | L62: 1024 | M62: 15 | N62: 1 | O62: -999 | P62: -65 | Q62: 4 | R62: 4
A63: 835.38 | B63: =RC[-1]-0.06 -> 835.32 | C63: -55 | D63: =RC[-3]+0.06 -> 835.43999999999994 | E63: TDOA 153# # # 0 63 -16 # 0 0 1 0 0 0 0 1 # 0 | F63: TDOA | G63: 5.0 | H63: 2 | I63: 256 | J63: 344 | K63: 348 | L63: 1024 | M63: 15 | N63: 1 | O63: -999 | P63: -65 | Q63: 4 | R63: 4
A64: 837.57 | B64: =RC[-1]-0.06 -> 837.5100000000001 | C64: -55 | D64: =RC[-3]+0.06 -> 837.63 | E64: TDOA 154# # # 0 63 -16 # 0 0 1 0 0 0 0 1 # 0 | F64: TDOA | G64: 5.0 | H64: 2 | I64: 256 | J64: 417 | K64: 421 | L64: 1024 | M64: 15 | N64: 1 | O64: -999 | P64: -65 | Q64: 4 | R64: 4
A65: 837.87 | B65: =RC[-1]-0.06 -> 837.81000000000006 | C65: -55 | D65: =RC[-3]+0.06 -> 837.93 | E65: TDOA 155# # # 0 63 -16 # 0 0 1 0 0 0 0 1 # 0 | F65: TDOA | G65: 5.0 | H65: 2 | I65: 256 | J65: 427 | K65: 431 | L65: 1024 | M65: 15 | N65: 1 | O65: -999 | P65: -65 | Q65: 4 | R65: 4
A66: 840.27 | B66: =RC[-1]-0.06 -> 840.21 | C66: -55 | D66: =RC[-3]+0.06 -> 840.32999999999993 | E66: TDOA 156# # # 0 63 -16 # 0 0 1 0 0 0 0 1 # 0 | F66: TDOA | G66: 5.0 | H66: 2 | I66: 256 | J66: 507 | K66: 511 | L66: 1024 | M66: 15 | N66: 1 | O66: -999 | P66: -65 | Q66: 4 | R66: 4
A67: 840.57 | B67: =RC[-1]-0.06 -> 840.5100000000001 | C67: -55 | D67: =RC[-3]+0.06 -> 840.63 | E67: TDOA 157# # # 0 63 -16 # 0 0 1 0 0 0 0 1 # 0 | F67: TDOA | G67: 5.0 | H67: 2 | I67: 256 | J67: 517 | K67: 521 | L67: 1024 | M67: 15 | N67: 1 | O67: -999 | P67: -65 | Q67: 4 | R67: 4
A68: 840.3 | B68: =RC[-1]-0.06 -> 840.24 | C68: -55 | D68: =RC[-3]+0.06 -> 840.3599999999999 | E68: TDOA 158# # # 0 63 -16 # 0 0 1 0 0 0 0 1 # 0 | F68: TDOA | G68: 5.0 | H68: 2 | I68: 256 | J68: 508 | K68: 512 | L68: 1024 | M68: 15 | N68: 1 | O68: -999 | P68: -65 | Q68: 4 | R68: 4
A69: 840.6 | B69: =RC[-1]-0.06 -> 840.54000000000008 | C69: -55 | D69: =RC[-3]+0.06 -> 840.66 | E69: TDOA 159# # # 0 63 -16 # 0 0 1 0 0 0 0 1 # 0 | F69: TDOA | G69: 5.0 | H69: 2 | I69: 256 | J69: 518 | K69: 522 | L69: 1024 | M69: 15 | N69: 1 | O69: -999 | P69: -65 | Q69: 4 | R69: 4
A70: 842.07 | B70: =RC[-1]-0.06 -> 842.0100000000001 | C70: -55 | D70: =RC[-3]+0.06 -> 842.13 | E70: TDOA 250# # # 0 63 -16 # 0 0 1 0 0 0 0 1 # 0 | F70: TDOA | G70: 5.0 | H70: 2 | I70: 256 | J70: 567 | K70: 571 | L70: 1024 | M70: 15 | N70: 1 | O70: -999 | P70: -65 | Q70: 4 | R70: 4
A71: 842.37 | B71: =RC[-1]-0.06 -> 842.31000000000006 | C71: -55 | D71: =RC[-3]+0.06 -> 842.43 | E71: TDOA 251# # # 0 63 -16 # 0 0 1 0 0 0 0 1 # 0 | F71: TDOA | G71: 5.0 | H71: 2 | I71: 256 | J71: 577 | K71: 581 | L71: 1024 | M71: 15 | N71: 1 | O71: -999 | P71: -65 | Q71: 4 | R71: 4
A72: 844.71 | B72: =RC[-1]-0.06 -> 844.65000000000009 | C72: -55 | D72: =RC[-3]+0.06 -> 844.77 | E72: TDOA 252# # # 0 63 -16 # 0 0 1 0 0 0 0 1 # 0 | F72: TDOA | G72: 5.0 | H72: 2 | I72: 256 | J72: 655 | K72: 659 | L72: 1024 | M72: 15 | N72: 1 | O72: -999 | P72: -65 | Q72: 4 | R72: 4
A73: 845.01 | B73: =RC[-1]-0.06 -> 844.95 | C73: -55 | D73: =RC[-3]+0.06 -> 845.06999999999994 | E73: TDOA 253# # # 0 63 -16 # 0 0 1 0 0 0 0 1 # 0 | F73: TDOA | G73: 5.0 | H73: 2 | I73: 256 | J73: 665 | K73: 669 | L73: 1024 | M73: 15 | N73: 1 | O73: -999 | P73: -65 | Q73: 4 | R73: 4
A74: 844.74 | B74: =RC[-1]-0.06 -> 844.68000000000006 | C74: -55 | D74: =RC[-3]+0.06 -> 844.8 | E74: TDOA 254# # # 0 63 -16 # 0 0 1 0 0 0 0 1 # 0 | F74: TDOA | G74: 5.0 | H74: 2 | I74: 256 | J74: 656 | K74: 660 | L74: 1024 | M74: 15 | N74: 1 | O74: -999 | P74: -65 | Q74: 4 | R74: 4
A75: 845.04 | B75: =RC[-1]-0.06 -> 844.98 | C75: -55 | D75: =RC[-3]+0.06 -> 845.09999999999991 | E75: TDOA 255# # # 0 63 -16 # 0 0 1 0 0 0 0 1 # 0 | F75: TDOA | G75: 5.0 | H75: 2 | I75: 256 | J75: 666 | K75: 670 | L75: 1024 | M75: 15 | N75: 1 | O75: -999 | P75: -65 | Q75: 4 | R75: 4
A76: 846.57 | B76: =RC[-1]-0.06 -> 846.5100000000001 | C76: -55 | D76: =RC[-3]+0.06 -> 846.63 | E76: TDOA 256# # # 0 63 -16 # 0 0 1 0 0 0 0 1 # 0 | F76: TDOA | G76: 5.0 | H76: 2 | I76: 256 | J76: 717 | K76: 721 | L76: 1024 | M76: 15 | N76: 1 | O76: -999 | P76: -65 | Q76: 4 | R76: 4
A77: 846.87 | B77: =RC[-1]-0.06 -> 846.81000000000006 | C77: -55 | D77: =RC[-3]+0.06 -> 846.93 | E77: TDOA 257# # # 0 63 -16 # 0 0 1 0 0 0 0 1 # 0 | F77: TDOA | G77: 5.0 | H77: 2 | I77: 256 | J77: 727 | K77: 731 | L77: 1024 | M77: 15 | N77: 1 | O77: -999 | P77: -65 | Q77: 4 | R77: 4
A78: 849.03 | B78: =RC[-1]-0.06 -> 848.97 | C78: -55 | D78: =RC[-3]+0.06 -> 849.08999999999992 | E78: TDOA 258# # # 0 63 -16 # 0 0 1 0 0 0 0 1 # 0 | F78: TDOA | G78: 5.0 | H78: 2 | I78: 256 | J78: 799 | K78: 803 | L78: 1024 | M78: 15 | N78: 1 | O78: -999 | P78: -65 | Q78: 4 | R78: 4
A83: Test Case 6 - Phase Noise
A84: Signal Generator
A85: RF Power | B85: IF Power | C85: RF Frequency | D85: IF Frequency | E85: Command | F85: Response | G85: Timeout | H85: Attempts | I85: Block Size | J85: RF Channel | K85: IF Channel | L85: # Samples | M85: Averaging | N85: Low Limit | O85: High Limit
A86: -50 | B86: -50 | C86: 827.04 | D86: 70 | E86: TDOA 61# # # 0 63 -16 # 0 0 1 0 0 0 0 1 # 0 | F86: TDOA | G86: 5.0 | H86: 2 | I86: 256 | J86: 68 | K86: 128 | L86: 1024 | M86: 8 | N86: 0 | O86: 3
A88: -50 | B88: -50 | C88: 832.5 | D88: 70 | E88: TDOA 62# # # 0 63 -16 # 0 0 1 0 0 0 0 1 # 0 | F88: TDOA | G88: 5.0 | H88: 2 | I88: 256 | J88: 250 | K88: 128 | L88: 1024 | M88: 8 | N88: 0 | O88: 3
A89: -50 | B89: -50 | C89: 837.51 | D89: 70 | E89: TDOA 63# # # 0 63 -16 # 0 0 1 0 0 0 0 1 # 0 | F89: TDOA | G89: 5.0 | H89: 2 | I89: 256 | J89: 417 | K89: 128 | L89: 1024 | M89: 8 | N89: 0 | O89: 3
A90: -50 | B90: -50 | C90: 842.01 | D90: 70 | E90: TDOA 64# # # 0 63 -16 # 0 0 1 0 0 0 0 1 # 0 | F90: TDOA | G90: 5.0 | H90: 2 | I90: 256 | J90: 567 | K90: 128 | L90: 1024 | M90: 8 | N90: 0 | O90: 3
A91: -50 | B91: -50 | C91: 846.51 | D91: 70 | E91: TDOA 65# # # 0 63 -16 # 0 0 1 0 0 0 0 1 # 0 | F91: TDOA | G91: 5.0 | H91: 2 | I91: 256 | J91: 717 | K91: 128 | L91: 1024 | M91: 8 | N91: 0 | O91: 3
A95: Test Case 7 - Data Integrity
A96: Signal Generator
A97: RF Power | B97: IF Power | C97: RF Frequency | D97: IF Frequency | E97: Command | F97: Response | H97: Timeout | I97: Attempts | J97: Block Size | K97: RF Channel | L97: IF Channel | M97: TTG Channel | N97: # Samples | O97: Cnfg Attn | P97: Averaging | Q97: Low Limit | R97: High Limit
A98: -50 | B98: -50 | C98: 836.5 | D98: 70 | E98: TDOA 71# # # 0 63 -16 # 0 0 1 0 0 0 0 1 # 0 | F98: TDOA | H98: 5.0 | I98: 2 | J98: 256 | K98: 383 | L98: 416 | M98: 383 | N98: 1024 | P98: 1 | Q98: 29 | R98: 9999
A99: -50 | B99: -50 | C99: 836.5 | D99: 70 | E99: TDOA 72# # # 0 63 -16 # 0 0 1 0 0 0 0 1 # 0 | F99: TDOA | H99: 5.0 | I99: 2 | J99: 256 | K99: 383 | L99: 416 | M99: 383 | N99: 1024 | P99: 1 | Q99: 29 | R99: 9999
A100: -50 | B100: -50 | C100: 836.5 | D100: 70 | E100: TDOA 73# # # 0 63 -16 # 0 0 1 0 0 0 0 1 # 0 | F100: TDOA | H100: 5.0 | I100: 2 | J100: 256 | K100: 383 | L100: 416 | M100: 383 | N100: 1024 | P100: 1 | Q100: 29 | R100: 9999
A101: -50 | B101: -50 | C101: 836.5 | D101: 70 | E101: TDOA 74# # # 0 63 -16 # 0 0 1 0 0 0 0 1 # 0 | F101: TDOA | H101: 5.0 | I101: 2 | J101: 256 | K101: 383 | L101: 416 | M101: 383 | N101: 1024 | P101: 1 | Q101: 29 | R101: 9999
A102: -50 | B102: -50 | C102: 836.5 | D102: 70 | E102: TDOA 75# # # 0 63 -16 # 0 0 1 0 0 0 0 1 # 0 | F102: TDOA | H102: 5.0 | I102: 2 | J102: 256 | K102: 383 | L102: 416 | M102: 383 | N102: 1024 | P102: 1 | Q102: 29 | R102: 9999
A106: Test Case 8 - Noise Floor
A107: Signal Generator
A108: RF Power | B108: IF Power | C108: RF Frequency | D108: IF Frequency | E108: Command | F108: Response | H108: Timeout | I108: Attempts | J108: Block Size | K108: RF Channel | L108: IF Channel | M108: # Samples | N108: Cnfg Attn | O108: Averaging | P108: Signal Averaging | Q108: Low Limit | R108: High Limit | S108: Low Limit Gain | T108: High Limit Gain
A109: -55 | B109: -55 | C109: 836.5 | D109: 70 | E109: TDOA 86# # # 0 63 -16 # 0 0 1 0 0 0 0 1 # 0 | F109: TDOA | H109: 5.0 | I109: 2 | J109: 256 | K109: 383 | L109: 750 | M109: 1024 | N109: 0 | O109: 8 | P109: 1 | Q109: -174 | R109: -121 | S109: 40 | T109: 46
A111: -55 | B111: -55 | C111: 824.04 | D111: 70 | E111: TDOA 81# # # 0 63 -16 # 0 0 1 0 0 0 0 1 # 0 | F111: TDOA | H111: 5.0 | I111: 2 | J111: 256 | K111: 991 | L111: 1 | M111: 1024 | N111: 0 | O111: 8 | P111: 1 | Q111: -174 | R111: -121 | S111: 40 | T111: 46
A112: -55 | B112: -55 | C112: 827.04 | D112: 70 | E112: TDOA 82# # # 0 63 -16 # 0 0 1 0 0 0 0 1 # 0 | F112: TDOA | H112: 5.0 | I112: 2 | J112: 256 | K112: 68 | L112: 101 | M112: 1024 | N112: 0 | O112: 8 | P112: 1 | Q112: -174 | R112: -121 | S112: 40 | T112: 46
A113: -55 | B113: -55 | C113: 832.5 | D113: 70 | E113: TDOA 83# # # 0 63 -16 # 0 0 1 0 0 0 0 1 # 0 | F113: TDOA | H113: 5.0 | I113: 2 | J113: 256 | K113: 250 | L113: 283 | M113: 1024 | N113: 0 | O113: 8 | P113: 1 | Q113: -174 | R113: -121 | S113: 40 | T113: 46
A114: -55 | B114: -55 | C114: 837.51 | D114: 70 | E114: TDOA 84# # # 0 63 -16 # 0 0 1 0 0 0 0 1 # 0 | F114: TDOA | H114: 5.0 | I114: 2 | J114: 256 | K114: 417 | L114: 450 | M114: 1024 | N114: 0 | O114: 8 | P114: 1 | Q114: -174 | R114: -121 | S114: 40 | T114: 46
A115: -55 | B115: -55 | C115: 842.01 | D115: 70 | E115: TDOA 85# # # 0 63 -16 # 0 0 1 0 0 0 0 1 # 0 | F115: TDOA | H115: 5.0 | I115: 2 | J115: 256 | K115: 567 | L115: 600 | M115: 1024 | N115: 0 | O115: 8 | P115: 1 | Q115: -174 | R115: -121 | S115: 40 | T115: 46
A116: -55 | B116: -55 | C116: 846.51 | D116: 70 | E116: TDOA 86# # # 0 63 -16 # 0 0 1 0 0 0 0 1 # 0 | F116: TDOA | H116: 5.0 | I116: 2 | J116: 256 | K116: 717 | L116: 750 | M116: 1024 | N116: 0 | O116: 8 | P116: 1 | Q116: -174 | R116: -121 | S116: 40 | T116: 46
A117: -55 | B117: -55 | C117: 848.97 | D117: 70 | E117: TDOA 87# # # 0 63 -16 # 0 0 1 0 0 0 0 1 # 0 | F117: TDOA | H117: 5.0 | I117: 2 | J117: 256 | K117: 799 | L117: 832 | M117: 1024 | N117: 0 | O117: 8 | P117: 1 | Q117: -174 | R117: -121 | S117: 40 | T117: 46
A121: Test Case 9 - DDC Tuning
A122: Signal Generator
A123: RF Power | B123: IF Power | C123: RF Frequency | D123: IF Frequency | E123: Command | F123: Response | H123: Timeout | I123: Attempts | J123: Block Size | K123: RF Channel | L123: IF Channel | M123: # Samples | N123: Averaging | O123: Low Limit | P123: High Limit
A124: -50 | B124: -50 | C124: 824.04 | E124: TDOA 91# # # 0 63 -16 # 0 0 1 0 0 0 0 1 # 0 | F124: TDOA | H124: 5.0 | I124: 2 | J124: 256 | K124: 991 | M124: 1024 | N124: 1 | O124: 29 | P124: 9999
A126: -50 | B126: -50 | C126: 825.6 | E126: TDOA 92# # # 0 63 -16 # 0 0 1 0 0 0 0 1 # 0 | F126: TDOA | H126: 5.0 | I126: 2 | J126: 256 | K126: 20 | M126: 1024 | N126: 1 | O126: 29 | P126: 9999
A127: -50 | B127: -50 | C127: 828.6 | E127: TDOA 93# # # 0 63 -16 # 0 0 1 0 0 0 0 1 # 0 | F127: TDOA | H127: 5.0 | I127: 2 | J127: 256 | K127: 120 | M127: 1024 | N127: 1 | O127: 29 | P127: 9999
A128: -50 | B128: -50 | C128: 831.6 | E128: TDOA 94# # # 0 63 -16 # 0 0 1 0 0 0 0 1 # 0 | F128: TDOA | H128: 5.0 | I128: 2 | J128: 256 | K128: 220 | M128: 1024 | N128: 1 | O128: 29 | P128: 9999
A129: -50 | B129: -50 | C129: 834.6 | E129: TDOA 95# # # 0 63 -16 # 0 0 1 0 0 0 0 1 # 0 | F129: TDOA | H129: 5.0 | I129: 2 | J129: 256 | K129: 320 | M129: 1024 | N129: 1 | O129: 29 | P129: 9999
A130: -50 | B130: -50 | C130: 837.6 | E130: TDOA 96# # # 0 63 -16 # 0 0 1 0 0 0 0 1 # 0 | F130: TDOA | H130: 5.0 | I130: 2 | J130: 256 | K130: 420 | M130: 1024 | N130: 1 | O130: 29 | P130: 9999
A131: -50 | B131: -50 | C131: 840.6 | E131: TDOA 97# # # 0 63 -16 # 0 0 1 0 0 0 0 1 # 0 | F131: TDOA | H131: 5.0 | I131: 2 | J131: 256 | K131: 520 | M131: 1024 | N131: 1 | O131: 29 | P131: 9999
A132: -50 | B132: -50 | C132: 843.6 | E132: TDOA 98# # # 0 63 -16 # 0 0 1 0 0 0 0 1 # 0 | F132: TDOA | H132: 5.0 | I132: 2 | J132: 256 | K132: 620 | M132: 1024 | N132: 1 | O132: 29 | P132: 9999
A133: -50 | B133: -50 | C133: 848.97 | E133: TDOA 99# # # 0 63 -16 # 0 0 1 0 0 0 0 1 # 0 | F133: TDOA | H133: 5.0 | I133: 2 | J133: 256 | K133: 799 | M133: 1024 | N133: 1 | O133: 29 | P133: 9999
A137: Test Case 10 - T1
A138: Command Prior to 10 | B138: Response | D138: Timeout | E138: Begin State | F138: End State | G138: Attempts
A139: GoT1Master | D139: 3 | E139: DSHELL | F139: DSHELL | G139: 1
A140: RunLocalT1 500 100 | B140: Bad 0 | D140: 20 | E140: DSHELL | F140: DSHELL | G140: 1
A144: Command | B144: Response | D144: Timeout | E144: Begin State | F144: End State | G144: Attempts
A145: GOMASTER | D145: 3 | E145: DSHELL | F145: DSHELL | G145: 1
A146: RUNLOCALLOOP 500 100 | B146: Bad 0 | D146: 20 | E146: DSHELL | F146: DSHELL | G146: 1
A150: Test Case 11 - Ethernet
A151: Command | B151: Response | D151: Timeout | E151: Begin State | F151: End State | G151: Attempts
A152: ethtest | B152: ethtest | D152: 20 | E152: DSHELL | F152: DSHELL | G152: 1
A156: Test Case 12 - Mini-RLS
A157: Signal Generator | C157: LMU Command
A158: RF Power | B158: RF Frequency | C158: Command Set | G158: Block Size | H158: # Blocks | I158: RF Channel | J158: # Samples | K158: |delay| (nsec) | L158: Phase Curvature | M158: Repeat and Average
A159: -40 | B159: 824.2 | C159: CommandSequence12B | G159: 256 | H159: 4 | I159: 128 | J159: 1024 | K159: 150 | L159: 0.5 | M159: 5
A160: -40 | B160: 829 | C160: CommandSequence12B | G160: 256 | H160: 4 | I160: 152 | J160: 1024 | K160: 150 | L160: 0.5 | M160: 5
A161: -40 | B161: 834 | C161: CommandSequence12B | G161: 256 | H161: 4 | I161: 177 | J161: 1024 | K161: 150 | L161: 0.5 | M161: 5
A162: -40 | B162: 839 | C162: CommandSequence12B | G162: 256 | H162: 4 | I162: 202 | J162: 1024 | K162: 150 | L162: 0.5 | M162: 5
A163: -40 | B163: 844 | C163: CommandSequence12B | G163: 256 | H163: 4 | I163: 227 | J163: 1024 | K163: 150 | L163: 0.5 | M163: 5
A164: -40 | B164: 848.8 | C164: CommandSequence12B | G164: 256 | H164: 4 | I164: 251 | J164: 1024 | K164: 150 | L164: 0.5 | M164: 5
A165: -40 | B165: 824.04 | C165: CommandSequence12A | G165: 256 | H165: 4 | I165: 991 | J165: 1024 | K165: 150 | L165: 0.5 | M165: 5
A166: -40 | B166: 828.98999999999546 | C166: CommandSequence12A | G166: 256 | H166: 4 | I166: 133 | J166: 1024 | K166: 150 | L166: 0.5 | M166: 5
A167: -40 | B167: 833.99999999999091 | C167: CommandSequence12A | G167: 256 | H167: 4 | I167: 300 | J167: 1024 | K167: 150 | L167: 0.5 | M167: 5
A168: -40 | B168: 839.00999999998635 | C168: CommandSequence12A | G168: 256 | H168: 4 | I168: 467 | J168: 1024 | K168: 150 | L168: 0.5 | M168: 5
A169: -40 | B169: 844.01999999998179 | C169: CommandSequence12A | G169: 256 | H169: 4 | I169: 634 | J169: 1024 | K169: 150 | L169: 0.5 | M169: 5
A170: -40 | B170: 848.96999999997729 | C170: CommandSequence12A | G170: 256 | H170: 4 | I170: 799 | J170: 1024 | K170: 150 | L170: 0.5 | M170: 5
A173: Test Case 13 - Config Attenuator
A174: Signal Generator
A175: RF Power | B175: IF Power | C175: RF Frequency | D175: IF Frequency | E175: Command | F175: Response | H175: Timeout | I175: Attempts | J175: Block Size | K175: RF Channel | L175: IF Channel | M175: TTG Channel | N175: # Samples | O175: Cnfg Attn Setting | P175: Averaging | Q175: Low Limit from previous level (dBm) | R175: High Limit from previous level (dBm)
A176: -50 | B176: -50 | C176: 836.5 | D176: 70 | E176: TDOA 71# # # 0 63 -16 # 0 0 1 0 0 0 0 1 # 0 | F176: TDOA | H176: 5 | I176: 2 | J176: 256 | K176: 383 | L176: 128 | M176: 383 | N176: 1024 | O176: 0 | P176: 1 | Q176: -60 | R176: 0
A177: -50 | B177: -50 | C177: 836.5 | D177: 70 | E177: TDOA 72# # # 0 63 -16 # 0 0 1 0 0 0 0 1 # 0 | F177: TDOA | H177: 5 | I177: 2 | J177: 256 | K177: 383 | L177: 128 | M177: 383 | N177: 1024 | O177: -8 | P177: 1 | Q177: -10 | R177: -6
A178: -50 | B178: -50 | C178: 836.5 | D178: 70 | E178: TDOA 73# # # 0 63 -16 # 0 0 1 0 0 0 0 1 # 0 | F178: TDOA | H178: 5 | I178: 2 | J178: 256 | K178: 383 | L178: 128 | M178: 383 | N178: 1024 | O178: -10 | P178: 1 | Q178: -3.3 | R178: -0.7
A179: -50 | B179: -50 | C179: 836.5 | D179: 70 | E179: TDOA 74# # # 0 63 -16 # 0 0 1 0 0 0 0 1 # 0 | F179: TDOA | H179: 5 | I179: 2 | J179: 256 | K179: 383 | L179: 128 | M179: 383 | N179: 1024 | O179: 6 | P179: 1 | Q179: 13.5 | R179: 18.5
A180: -50 | B180: -50 | C180: 836.5 | D180: 70 | E180: TDOA 75# # # 0 63 -16 # 0 0 1 0 0 0 0 1 # 0 | F180: TDOA | H180: 5 | I180: 2 | J180: 256 | K180: 383 | L180: 128 | M180: 383 | N180: 1024 | O180: 2 | P180: 1 | Q180: -5.5 | R180: -2.5
A181: -50 | B181: -50 | C181: 836.5 | D181: 70 | E181: TDOA 76# # # 0 63 -16 # 0 0 1 0 0 0 0 1 # 0 | F181: TDOA | H181: 5 | I181: 2 | J181: 256 | K181: 383 | L181: 128 | M181: 383 | N181: 1024 | O181: 1 | P181: 1 | Q181: -2 | R181: 0
A186: LO PLL
A187: 756.0 MHz | D187: 766.5 MHz | G187: 778.0 MHz
A188: eng | D188: eng | G188: eng
A189: TEST 2 5 4 3 0x00 0x00 0x50 | D189: TEST 2 5 4 3 0x00 0x00 0xD3 | G189: TEST 2 5 4 3 0x00 0x00 0x50
A190: TEST 2 5 4 3 0x10 0x17 0xA1 | D190: TEST 2 5 4 3 0x00 0x00 0x50 | G190: TEST 2 5 4 3 0x10 0x18 0x51
A191: TEST 2 5 4 3 0x00 0x12 0xD3 | D191: TEST 2 5 4 3 0x10 0x17 0xF5 | G191: TEST 2 5 4 3 0x00 0x12 0xD3
A192: exit | D192: exit | G192: exit
A196: TTG Freq
A197: 836.5 MHZ | B197: Response | D197: Timeout | E197: Begin State | F197: End State | G197: Attempts
A198: eng | D198: 0.5 | E198: DSHELL | F198: ENG | G198: 1
A199: TEST 2 5 4 5 0x00 0x00 0xD3 | D199: 1 | E199: DSHELL | F199: ENG | G199: 1
A200: TEST 2 5 4 5 0x00 0x00 0x50 | D200: 1 | E200: DSHELL | F200: ENG | G200: 1
A201: TEST 2 5 4 5 0x00 0x1A 0x25 | D201: 1 | E201: DSHELL | F201: ENG | G201: 1
A202: exit | D202: 0.5 | E202: ENG | F202: DSHELL | G202: 1
A206: Gain Setup
A207: Setup | B207: Response | D207: Timeout | E207: Begin State | F207: End State | G207: Attempts
A208: gain 1 43 | D208: 0.5 | E208: DSHELL | F208: ENG | G208: 1
A209: gain 2 43 | D209: 0.5 | E209: DSHELL | F209: ENG | G209: 1
A210: gain 3 43 | D210: 0.5 | E210: DSHELL | F210: ENG | G210: 1
A211: gain 4 43 | D211: 0.5 | E211: DSHELL | F211: ENG | G211: 1
A212: gain 5 43 | D212: 0.5 | E212: DSHELL | F212: ENG | G212: 1
A213: gain 6 43 | D213: 0.5 | E213: DSHELL | F213: ENG | G213: 1
A216: Config Atten Setup
A217: Setup | B217: Response | D217: Timeout | E217: Begin State | F217: End State | G217: Attempts
A218: gain 1 35varGain | D218: 0.5 | E218: DSHELL | F218: ENG | G218: 1
A219: gain 2 35varGain | D219: 0.5 | E219: DSHELL | F219: ENG | G219: 1
A220: gain 3 35varGain | D220: 0.5 | E220: DSHELL | F220: ENG | G220: 1
A221: gain 4 35varGain | D221: 0.5 | E221: DSHELL | F221: ENG | G221: 1
A222: gain 5 35varGain | D222: 0.5 | E222: DSHELL | F222: ENG | G222: 1
A223: gain 6 35varGain | D223: 0.5 | E223: DSHELL | F223: ENG | G223: 1
A226: Data Path Settings
A227: Data Path 1 | D227: Timeout | E227: Begin State | F227: End State | G227: Attempts
A228: eng | D228: 0.5 | E228: DSHELL | F228: ENG | G228: 1
A229: Test 1 1 0 0 0 | D229: 0.5 | E229: ENG | F229: ENG | G229: 1
A230: exit | D230: 0.5 | E230: ENG | F230: DSHELL | G230: 1
A233: Data Path 2 | D233: Timeout | E233: Begin State | F233: End State | G233: Attempts
A234: eng | D234: 0.5 | E234: DSHELL | F234: ENG | G234: 1
A235: Test 1 0 1 0 0 | D235: 0.5 | E235: ENG | F235: ENG | G235: 1
A236: exit | D236: 0.5 | E236: ENG | F236: DSHELL | G236: 1
A239: Data Path 3 | D239: Timeout | E239: Begin State | F239: End State | G239: Attempts
A240: eng | D240: 0.5 | E240: DSHELL | F240: ENG | G240: 1
A241: Test 1 0 0 1 0 | D241: 0.5 | E241: ENG | F241: ENG | G241: 1
A242: exit | D242: 0.5 | E242: ENG | F242: DSHELL | G242: 1
A245: Data Path 4 | D245: Timeout | E245: Begin State | F245: End State | G245: Attempts
A246: eng | D246: 0.5 | E246: DSHELL | F246: ENG | G246: 1
A247: Test 1 0 0 0 1 | D247: 0.5 | E247: ENG | F247: ENG | G247: 1
A248: exit | D248: 0.5 | E248: ENG | F248: DSHELL | G248: 1
A251: Data Path 5 | D251: Timeout | E251: Begin State | F251: End State | G251: Attempts
A252: eng | D252: 0.5 | E252: DSHELL | F252: ENG | G252: 1
A253: Test 1 1 1 1 1 | D253: 0.5 | E253: ENG | F253: ENG | G253: 1
A254: exit | D254: 0.5 | E254: ENG | F254: DSHELL | G254: 1
A257: Compensation Settings
A258: Receiver compensated gain | D258: Timeout | E258: Begin State | F258: End State | G258: Attempts
A259: eng | D259: 0.5 | E259: DSHELL | F259: ENG | G259: 1
A260: Test 4 0xA4 0x48 6 | B260: DATA Read: | D260: 1 | E260: ENG | F260: ENG | G260: 1
A261: TEST 4 0xA4 0x1F 1 | B261: DATA Read: 41 | D261: 1 | E261: ENG | F261: ENG | G261: 1
A262: Test 4 0xA4 0x30 6 | B262: DATA Read: | D262: 1 | E262: ENG | F262: ENG | G262: 1
A263: exit | D263: 0.5 | E263: ENG | F263: DSHELL | G263: 1
A266: TTG compensated Level | D266: Timeout | E266: Begin State | F266: End State | G266: Attempts
A267: eng | D267: 0.5 | E267: DSHELL | F267: ENG | G267: 1
A268: Test 4 0xA4 0x42 6 | B268: DATA Read: | D268: 1 | E268: ENG | F268: ENG | G268: 1
A269: TEST 4 0xA4 0x1F 1 | B269: DATA Read: 41 | D269: 1 | E269: ENG | F269: ENG | G269: 1 | H269: Note: | I269: If we get DATA Read: 41, then the software will skip
A270: Test 4 0xA4 0x2A 6 | B270: DATA Read: | D270: 1 | E270: ENG | F270: ENG | G270: 1 | I270: over the next line and go directly to exit
A271: exit | D271: 0.5 | E271: ENG | F271: DSHELL | G271: 1
A274: Receiver Gain Compensation | D274: Timeout | E274: Begin State | F274: End State | G274: Attempts
A275: eng | D275: 0.5 | E275: DSHELL | F275: ENG | G275: 1
A276: TEST 4 0xA4 0x1F 1 | B276: DATA Read: 41 | D276: 0.5 | E276: ENG | F276: ENG | G276: 1
A277: Test 4 0xA4 0x20 6 | B277: DATA Read: | D277: 0.5 | E277: ENG | F277: ENG | G277: 1
A278: exit | D278: 0.5 | E278: ENG | F278: DSHELL | G278: 1
A281: EnableTTG | B281: Response | D281: Timeout | E281: Begin State | F281: End State | G281: Attempts
A282: eng | D282: 0.5 | E282: DSHELL | F282: ENG | G282: 1
A283: TEST 2 3 8 6 8 | D283: 0.5 | E283: ENG | F283: ENG | G283: 1
A284: TEST 2 3 4 4 5 | D284: 0.5 | E284: ENG | F284: ENG | G284: 1
A285: TEST 2 3 4 6 1 | D285: 0.5 | E285: ENG | F285: ENG | G285: 1
A286: exit | D286: 0.5 | E286: ENG | F286: DSHELL | G286: 1
A289: DisableTTG | D289: Timeout | E289: Begin State | F289: End State | G289: Attempts
A290: eng | D290: 0.5 | E290: DSHELL | F290: ENG | G290: 1
A291: TEST 2 3 8 6 5 | D291: 0.5 | E291: ENG | F291: ENG | G291: 1
A292: TEST 2 3 4 4 1 | D292: 0.5 | E292: ENG | F292: ENG | G292: 1
A293: TEST 2 3 4 6 0 | D293: 0.5 | E293: ENG | F293: ENG | G293: 1
A294: exit | D294: 0.5 | E294: ENG | F294: DSHELL | G294: 1
A297: Mute On | D297: Timeout | E297: Begin State | F297: End State | G297: Attempts
A298: eng | D298: 0.5 | E298: DSHELL | F298: ENG | G298: 1
A299: TEST 2 3 8 6 8 | D299: 0.5 | E299: ENG | F299: ENG | G299: 1
A300: exit | D300: 0.5 | E300: ENG | F300: DSHELL | G300: 1
A303: Mute Off | D303: Timeout | E303: Begin State | F303: End State | G303: Attempts
A304: eng | D304: 0.5 | E304: DSHELL | F304: ENG | G304: 1
A305: TEST 2 3 8 6 5 | D305: 0.5 | E305: ENG | F305: ENG | G305: 1
A306: exit | D306: 0.5 | E306: ENG | F306: DSHELL | G306: 1
A309: Change Admin State
A310: Command | B310: Response | D310: Timeout | E310: Begin State | F310: End State | G310: # of retries
A311: etest 15 1 | D311: 2 | E311: DSHELL | F311: DSHELL | G311: 1
A315: Check Alarms
A316: Command | B316: Response | D316: Timeout | E316: Begin State | F316: End State | G316: # of retries
A317: ALARMS | B317: FAULT_GPS_HOLDOVER | D317: 2 | E317: DSHELL | F317: DSHELL | G317: 1
A321: Mini-RLS Command Sequence 12A (AMPS)
A322: Command | B322: Response | D322: Timeout | E322: Begin State | F322: End State | G322: # of retries
A323: ALARMS | B323: FAULT_GPS_HOLDOVER | D323: 2 | E323: DSHELL | F323: DSHELL | G323: 1
A324: TIME | B324: GPS Time: | D324: 2 | E324: DSHELL | F324: DSHELL | G324: 2
A325: SVCR # # 2 # # 0 1 0 0 0 1 1 1 # 0 0 | B325: returnCode 0 | D325: 2 | E325: DSHELL | F325: DSHELL | G325: 1
A326: WAIT | D326: 15 | E326: DSHELL | F326: DSHELL | G326: 1
A327: TDATA # 0 2 # # # -16 0 1 0 0 11 0 63 -16 | B327: TDOA | D327: 15 | E327: DSHELL | F327: DSHELL | G327: 1
A331: Mini-RLS Command Sequence 12B (GSM)
A332: Command | B332: Response | D332: Timeout | E332: Begin State | F332: End State | G332: # of retries
A333: ALARMS | B333: FAULT_GPS_HOLDOVER | D333: 2 | E333: DSHELL | F333: DSHELL | G333: 1
A334: TIME | B334: GPS Time: | D334: 2 | E334: DSHELL | F334: DSHELL | G334: 2
A335: GVCR # 2 # # 0 # 0 # # 17 1 0 0 0 0 0 0 1 1 1 8 0 0 0 0 0 0 0 0 0 0 0 | B335: returnCode 0 | D335: 2 | E335: DSHELL | F335: DSHELL | G335: 1
A336: WAIT | D336: 15 | E336: DSHELL | F336: DSHELL | G336: 1
A337: TDATA # 0 2 # # # -16 0 1 0 0 11 0 63 -16 | B337: TDOA | D337: 15 | E337: DSHELL | F337: DSHELL | G337: 1

Sheet: 06163601
C1: Factors
C2: TTG | D2: 50
C3: Gain | D3: 300
C4: TTG Comp | D4: 100
C5: Gain Comp | D5: 250
F8: Temperature Coefficient | J8: Center Temperature
F10: -3.5000000000000003E-2 | H10: dB/deg | J10: 30 | L10: deg
A15: Test Case 2 - Processor Memory
A16: Command | B16: Response | D16: Timeout | E16: Begin State | F16: End State | G16: Attempts
A17: BIT 4 1 | B17: No Failure | D17: 20 | E17: DSHELL | F17: DSHELL | G17: 1
A18: BIT 4 2 | B18: No Failure | D18: 20 | E18: DSHELL | F18: DSHELL | G18: 1
A19: BIT 4 3 | B19: No Failure | D19: 20 | E19: DSHELL | F19: DSHELL | G19: 1
A20: BIT 4 4 | B20: No Failure | D20: 20 | E20: DSHELL | F20: DSHELL | G20: 1
A24: Test Case 3 - SNR
A25: Signal Generator
A26: RF Power | B26: IF Power | C26: RF Frequency | D26: IF Frequency | E26: Command | F26: Response | H26: Timeout | I26: Attempts | J26: Block Size | K26: RF Channel | L26: IF Channel | M26: TTG Channel | N26: # Samples | O26: Averaging | P26: Low Limit | Q26: High Limit
A27: -40 | B27: -40 | C27: 824.04 | D27: 70 | E27: TDOA 31# # # 0 63 -16 # 0 0 1 0 0 0 0 1 # 0 | F27: TDOA | H27: 5.0 | I27: 2 | J27: 256 | K27: 991 | L27: 1 | N27: 1024 | O27: 1 | P27: 29 | Q27: 9999
A29: -40 | B29: -40 | C29: 827.01 | D29: 70 | E29: TDOA 32# # # 0 63 -16 # 0 0 1 0 0 0 0 1 # 0 | F29: TDOA | H29: 5.0 | I29: 2 | J29: 256 | K29: 67 | L29: 100 | N29: 1024 | O29: 1 | P29: 29 | Q29: 9999
A30: -40 | B30: -40 | C30: 829.71 | D30: 70 | E30: TDOA 33# # # 0 63 -16 # 0 0 1 0 0 0 0 1 # 0 | F30: TDOA | H30: 5.0 | I30: 2 | J30: 256 | K30: 157 | L30: 190 | N30: 1024 | O30: 1 | P30: 29 | Q30: 9999
A31: -40 | B31: -40 | C31: 829.74 | D31: 70 | E31: TDOA 34# # # 0 63 -16 # 0 0 1 0 0 0 0 1 # 0 | F31: TDOA | H31: 5.0 | I31: 2 | J31: 256 | K31: 158 | L31: 191 | N31: 1024 | O31: 1 | P31: 29 | Q31: 9999
A32: -40 | B32: -40 | C32: 832.5 | D32: 70 | E32: TDOA 35# # # 0 63 -16 # 0 0 1 0 0 0 0 1 # 0 | F32: TDOA | H32: 5.0 | I32: 2 | J32: 256 | K32: 250 | L32: 283 | N32: 1024 | O32: 1 | P32: 29 | Q32: 9999
A33: -40 | B33: -40 | C33: 834.99 | D33: 70 | E33: TDOA 36# # # 0 63 -16 # 0 0 1 0 0 0 0 1 # 0 | F33: TDOA | H33: 5.0 | I33: 2 | J33: 256 | K33: 333 | L33: 366 | N33: 1024 | O33: 1 | P33: 29 | Q33: 9999
A34: -40 | B34: -40 | C34: 835.02 | D34: 70 | E34: TDOA 37# # # 0 63 -16 # 0 0 1 0 0 0 0 1 # 0 | F34: TDOA | H34: 5.0 | I34: 2 | J34: 256 | K34: 334 | L34: 367 | N34: 1024 | O34: 1 | P34: 29 | Q34: 9999
A35: -40 | B35: -40 | C35: 836.5 | D35: 70 | E35: TDOA 38# # # 0 63 -16 # 0 0 1 0 0 0 0 1 # 0 | F35: TDOA | H35: 5.0 | I35: 2 | J35: 256 | K35: 383 | L35: 416 | N35: 1024 | O35: 1 | P35: 29 | Q35: 9999
A36: -40 | B36: -40 | C36: 837.51 | D36: 70 | E36: TDOA 39# # # 0 63 -16 # 0 0 1 0 0 0 0 1 # 0 | F36: TDOA | H36: 5.0 | I36: 2 | J36: 256 | K36: 417 | L36: 450 | N36: 1024 | O36: 1 | P36: 29 | Q36: 9999
A37: -40 | B37: -40 | C37: 840.21 | D37: 70 | E37: TDOA 130# # # 0 63 -16 # 0 0 1 0 0 0 0 1 # 0 | F37: TDOA | H37: 5.0 | I37: 2 | J37: 256 | K37: 507 | L37: 540 | N37: 1024 | O37: 1 | P37: 29 | Q37: 9999
A38: -40 | B38: -40 | C38: 840.24 | D38: 70 | E38: TDOA 131# # # 0 63 -16 # 0 0 1 0 0 0 0 1 # 0 | F38: TDOA | H38: 5.0 | I38: 2 | J38: 256 | K38: 508 | L38: 541 | N38: 1024 | O38: 1 | P38: 29 | Q38: 9999
A39: -40 | B39: -40 | C39: 842.01 | D39: 70 | E39: TDOA 132# # # 0 63 -16 # 0 0 1 0 0 0 0 1 # 0 | F39: TDOA | H39: 5.0 | I39: 2 | J39: 256 | K39: 567 | L39: 600 | N39: 1024 | O39: 1 | P39: 29 | Q39: 9999
A40: -40 | B40: -40 | C40: 844.65 | D40: 70 | E40: TDOA 133# # # 0 63 -16 # 0 0 1 0 0 0 0 1 # 0 | F40: TDOA | H40: 5.0 | I40: 2 | J40: 256 | K40: 655 | L40: 688 | N40: 1024 | O40: 1 | P40: 29 | Q40: 9999
A41: -40 | B41: -40 | C41: 844.68 | D41: 70 | E41: TDOA 134# # # 0 63 -16 # 0 0 1 0 0 0 0 1 # 0 | F41: TDOA | H41: 5.0 | I41: 2 | J41: 256 | K41: 656 | L41: 689 | N41: 1024 | O41: 1 | P41: 29 | Q41: 9999
A42: -40 | B42: -40 | C42: 846.51 | D42: 70 | E42: TDOA 135# # # 0 63 -16 # 0 0 1 0 0 0 0 1 # 0 | F42: TDOA | H42: 5.0 | I42: 2 | J42: 256 | K42: 717 | L42: 750 | N42: 1024 | O42: 1 | P42: 29 | Q42: 9999
A43: -40 | B43: -40 | C43: 848.97 | D43: 70 | E43: TDOA 136# # # 0 63 -16 # 0 0 1 0 0 0 0 1 # 0 | F43: TDOA | H43: 5.0 | I43: 2 | J43: 256 | K43: 799 | L43: 832 | N43: 1024 | O43: 1 | P43: 29
A47: Test Case 5 - Two-Tone Response
B48: SigGen1 | D48: SigGen2
A49: Center RF Channel | B49: RF Frequency | C49: RF Power | D49: RF Frequency | E49: Command | F49: Response | G49: Timeout | H49: Attempts | I49: Block Size | J49: Lower Channel | K49: Upper Channel | L49: # Samples | M49: Cnfg Attn | N49: Averaging | O49: Low Limit | P49: High Limit | Q49: Lower Channel Delta | R49: Upper Channel Delta
B50: 824.34 | C50: -45 | D50: 824.46 | E50: TDOA 51# # # 0 63 -16 # 0 0 1 0 0 0 0 1 # 0 | F50: TDOA | G50: 5.0 | H50: 2 | I50: 256 | J50: 1001 | K50: 1005 | L50: 1024 | N50: 1 | O50: -999 | P50: -65 | Q50: 4 | R50: 4
B52: 827.01 | C52: -45 | D52: 827.13 | E52: TDOA 52# # # 0 63 -16 # 0 0 1 0 0 0 0 1 # 0 | F52: TDOA | G52: 5.0 | H52: 2 | I52: 256 | J52: 67 | K52: 71 | L52: 1024 | N52: 1 | O52: -999 | P52: -65 | Q52: 4 | R52: 4
B53: 827.31 | C53: -45 | D53: 827.43 | E53: TDOA 53# # # 0 63 -16 # 0 0 1 0 0 0 0 1 # 0 | F53: TDOA | G53: 5.0 | H53: 2 | I53: 256 | J53: 77 | K53: 81 | L53: 1024 | N53: 1 | O53: -999 | P53: -65 | Q53: 4 | R53: 4
B54: 829.71 | C54: -45 | D54: 829.83 | E54: TDOA 54# # # 0 63 -16 # 0 0 1 0 0 0 0 1 # 0 | F54: TDOA | G54: 5.0 | H54: 2 | I54: 256 | J54: 157 | K54: 161 | L54: 1024 | N54: 1 | O54: -999 | P54: -65 | Q54: 4 | R54: 4
B55: 830.01 | C55: -45 | D55: 830.13 | E55: TDOA 55# # # 0 63 -16 # 0 0 1 0 0 0 0 1 # 0 | F55: TDOA | G55: 5.0 | H55: 2 | I55: 256 | J55: 167 | K55: 171 | L55: 1024 | N55: 1 | O55: -999 | P55: -65 | Q55: 4 | R55: 4
B56: 829.74 | C56: -45 | D56: 829.86 | E56: TDOA 56# # # 0 63 -16 # 0 0 1 0 0 0 0 1 # 0 | F56: TDOA | G56: 5.0 | H56: 2 | I56: 256 | J56: 158 | K56: 162 | L56: 1024 | N56: 1 | O56: -999 | P56: -65 | Q56: 4 | R56: 4
B57: 830.04 | C57: -45 | D57: 830.16 | E57: TDOA 57# # # 0 63 -16 # 0 0 1 0 0 0 0 1 # 0 | F57: TDOA | G57: 5.0 | H57: 2 | I57: 256 | J57: 168 | K57: 172 | L57: 1024 | N57: 1 | O57: -999 | P57: -65 | Q57: 4 | R57: 4
B58: 832.5 | C58: -45 | D58: 832.62 | E58: TDOA 58# # # 0 63 -16 # 0 0 1 0 0 0 0 1 # 0 | F58: TDOA | G58: 5.0 | H58: 2 | I58: 256 | J58: 250 | K58: 254 | L58: 1024 | N58: 1 | O58: -999 | P58: -65 | Q58: 4 | R58: 4
B59: 832.8 | C59: -45 | D59: 832.92 | E59: TDOA 59# # # 0 63 -16 # 0 0 1 0 0 0 0 1 # 0 | F59: TDOA | G59: 5.0 | H59: 2 | I59: 256 | J59: 260 | K59: 264 | L59: 1024 | N59: 1 | O59: -999 | P59: -65 | Q59: 4 | R59: 4
B60: 834.99 | C60: -45 | D60: 835.11 | E60: TDOA 150# # # 0 63 -16 # 0 0 1 0 0 0 0 1 # 0 | F60: TDOA | G60: 5.0 | H60: 2 | I60: 256 | J60: 333 | K60: 337 | L60: 1024 | N60: 1 | O60: -999 | P60: -65 | Q60: 4 | R60: 4
B61: 835.29 | C61: -45 | D61: 835.41 | E61: TDOA 151# # # 0 63 -16 # 0 0 1 0 0 0 0 1 # 0 | F61: TDOA | G61: 5.0 | H61: 2 | I61: 256 | J61: 343 | K61: 347 | L61: 1024 | N61: 1 | O61: -999 | P61: -65 | Q61: 4 | R61: 4
B62: 835.02 | C62: -45 | D62: 835.14 | E62: TDOA 152# # # 0 63 -16 # 0 0 1 0 0 0 0 1 # 0 | F62: TDOA | G62: 5.0 | H62: 2 | I62: 256 | J62: 334 | K62: 338 | L62: 1024 | N62: 1 | O62: -999 | P62: -65 | Q62: 4 | R62: 4
B63: 835.32 | C63: -45 | D63: 835.44 | E63: TDOA 153# # # 0 63 -16 # 0 0 1 0 0 0 0 1 # 0 | F63: TDOA | G63: 5.0 | H63: 2 | I63: 256 | J63: 344 | K63: 348 | L63: 1024 | N63: 1 | O63: -999 | P63: -65 | Q63: 4 | R63: 4
B64: 837.51 | C64: -45 | D64: 837.63 | E64: TDOA 154# # # 0 63 -16 # 0 0 1 0 0 0 0 1 # 0 | F64: TDOA | G64: 5.0 | H64: 2 | I64: 256 | J64: 417 | K64: 421 | L64: 1024 | N64: 1 | O64: -999 | P64: -65 | Q64: 4 | R64: 4
B65: 837.81 | C65: -45 | D65: 837.93 | E65: TDOA 155# # # 0 63 -16 # 0 0 1 0 0 0 0 1 # 0 | F65: TDOA | G65: 5.0 | H65: 2 | I65: 256 | J65: 427 | K65: 431 | L65: 1024 | N65: 1 | O65: -999 | P65: -65 | Q65: 4 | R65: 4
B66: 840.21 | C66: -45 | D66: 840.33 | E66: TDOA 156# # # 0 63 -16 # 0 0 1 0 0 0 0 1 # 0 | F66: TDOA | G66: 5.0 | H66: 2 | I66: 256 | J66: 507 | K66: 511 | L66: 1024 | N66: 1 | O66: -999 | P66: -65 | Q66: 4 | R66: 4
B67: 840.51 | C67: -45 | D67: 840.63 | E67: TDOA 157# # # 0 63 -16 # 0 0 1 0 0 0 0 1 # 0 | F67: TDOA | G67: 5.0 | H67: 2 | I67: 256 | J67: 517 | K67: 521 | L67: 1024 | N67: 1 | O67: -999 | P67: -65 | Q67: 4 | R67: 4
B68: 840.24 | C68: -45 | D68: 840.36 | E68: TDOA 158# # # 0 63 -16 # 0 0 1 0 0 0 0 1 # 0 | F68: TDOA | G68: 5.0 | H68: 2 | I68: 256 | J68: 508 | K68: 512 | L68: 1024 | N68: 1 | O68: -999 | P68: -65 | Q68: 4 | R68: 4
B69: 840.54 | C69: -45 | D69: 840.66 | E69: TDOA 159# # # 0 63 -16 # 0 0 1 0 0 0 0 1 # 0 | F69: TDOA | G69: 5.0 | H69: 2 | I69: 256 | J69: 518 | K69: 522 | L69: 1024 | N69: 1 | O69: -999 | P69: -65 | Q69: 4 | R69: 4
B70: 842.01 | C70: -45 | D70: 842.13 | E70: TDOA 250# # # 0 63 -16 # 0 0 1 0 0 0 0 1 # 0 | F70: TDOA | G70: 5.0 | H70: 2 | I70: 256 | J70: 567 | K70: 571 | L70: 1024 | N70: 1 | O70: -999 | P70: -65 | Q70: 4 | R70: 4
B71: 842.31 | C71: -45 | D71: 842.43 | E71: TDOA 251# # # 0 63 -16 # 0 0 1 0 0 0 0 1 # 0 | F71: TDOA | G71: 5.0 | H71: 2 | I71: 256 | J71: 577 | K71: 581 | L71: 1024 | N71: 1 | O71: -999 | P71: -65 | Q71: 4 | R71: 4
B72: 844.65 | C72: -45 | D72: 844.77 | E72: TDOA 252# # # 0 63 -16 # 0 0 1 0 0 0 0 1 # 0 | F72: TDOA | G72: 5.0 | H72: 2 | I72: 256 | J72: 655 | K72: 659 | L72: 1024 | N72: 1 | O72: -999 | P72: -65 | Q72: 4 | R72: 4
B73: 844.95 | C73: -45 | D73: 845.07 | E73: TDOA 253# # # 0 63 -16 # 0 0 1 0 0 0 0 1 # 0 | F73: TDOA | G73: 5.0 | H73: 2 | I73: 256 | J73: 665 | K73: 669 | L73: 1024 | N73: 1 | O73: -999 | P73: -65 | Q73: 4 | R73: 4
B74: 844.68 | C74: -45 | D74: 844.8 | E74: TDOA 254# # # 0 63 -16 # 0 0 1 0 0 0 0 1 # 0 | F74: TDOA | G74: 5.0 | H74: 2 | I74: 256 | J74: 656 | K74: 660 | L74: 1024 | N74: 1 | O74: -999 | P74: -65 | Q74: 4 | R74: 4
B75: 844.98 | C75: -45 | D75: 845.1 | E75: TDOA 255# # # 0 63 -16 # 0 0 1 0 0 0 0 1 # 0 | F75: TDOA | G75: 5.0 | H75: 2 | I75: 256 | J75: 666 | K75: 670 | L75: 1024 | N75: 1 | O75: -999 | P75: -65 | Q75: 4 | R75: 4
B76: 846.51 | C76: -45 | D76: 846.63 | E76: TDOA 256# # # 0 63 -16 # 0 0 1 0 0 0 0 1 # 0 | F76: TDOA | G76: 5.0 | H76: 2 | I76: 256 | J76: 717 | K76: 721 | L76: 1024 | N76: 1 | O76: -999 | P76: -65 | Q76: 4 | R76: 4
B77: 846.81 | C77: -45 | D77: 846.93 | E77: TDOA 257# # # 0 63 -16 # 0 0 1 0 0 0 0 1 # 0 | F77: TDOA | G77: 5.0 | H77: 2 | I77: 256 | J77: 727 | K77: 731 | L77: 1024 | N77: 1 | O77: -999 | P77: -65 | Q77: 4 | R77: 4
B78: 848.97 | C78: -45 | D78: 849.09 | E78: TDOA 258# # # 0 63 -16 # 0 0 1 0 0 0 0 1 # 0 | F78: TDOA | G78: 5.0 | H78: 2 | I78: 256 | J78: 799 | K78: 803 | L78: 1024 | N78: 1 | O78: -999 | P78: -65 | Q78: 4 | R78: 4
A82: Test Case 6 - Phase Noise
A83: Signal Generator
A84: RF Power | B84: IF Power | C84: RF Frequency | D84: IF Frequency | E84: Command | F84: Response | G84: Timeout | H84: Attempts | I84: Block Size | J84: RF Channel | K84: IF Channel | L84: # Samples | M84: Averaging | N84: Low Limit | O84: High Limit
A85: -40 | B85: 827.04 | C85: 876.2 | D85: 70 | E85: TDOA 61# # # 0 63 -16 # 0 0 1 0 0 0 0 1 # 0 | F85: TDOA | G85: 5.0 | H85: 2 | I85: 256 | J85: 68 | L85: 1024 | M85: 8 | N85: 0 | O85: 3
A87: -40 | B87: 832.5 | C87: 878.6 | D87: 70 | E87: TDOA 62# # # 0 63 -16 # 0 0 1 0 0 0 0 1 # 0 | F87: TDOA | G87: 5.0 | H87: 2 | I87: 256 | J87: 250 | L87: 1024 | M87: 8 | N87: 0 | O87: 3
A88: -40 | B88: 837.51 | C88: 881 | D88: 70 | E88: TDOA 63# # # 0 63 -16 # 0 0 1 0 0 0 0 1 # 0 | F88: TDOA | G88: 5.0 | H88: 2 | I88: 256 | J88: 417 | L88: 1024 | M88: 8 | N88: 0 | O88: 3
A89: -40 | B89: 842.01 | C89: 883.4 | D89: 70 | E89: TDOA 64# # # 0 63 -16 # 0 0 1 0 0 0 0 1 # 0 | F89: TDOA | G89: 5.0 | H89: 2 | I89: 256 | J89: 567 | L89: 1024 | M89: 8 | N89: 0 | O89: 3
A90: -40 | B90: 846.51 | C90: 885.8 | D90: 70 | E90: TDOA 65# # # 0 63 -16 # 0 0 1 0 0 0 0 1 # 0 | F90: TDOA | G90: 5.0 | H90: 2 | I90: 256 | J90: 717 | L90: 1024 | M90: 8 | N90: 0 | O90: 3
A94: Test Case 7 - Data Integrity
A95: Signal Generator
A96: RF Power | B96: IF Power | C96: RF Frequency | D96: IF Frequency | E96: Command | F96: Response | H96: Timeout | I96: Attempts | J96: Block Size | K96: RF Channel | L96: IF Channel | M96: TTG Channel | N96: # Samples | O96: Cnfg Attn | P96: Averaging | Q96: Low Limit | R96: High Limit
A97: -40 | B97: -40 | C97: 836.5 | D97: 68 | E97: TDOA 71# # # 0 63 -16 # 0 0 1 0 0 0 0 1 # 0 | F97: TDOA | H97: 5.0 | I97: 2 | J97: 256 | K97: 383 | L97: 416 | M97: 383 | N97: 1024 | O97: 1 | P97: 1 | Q97: 29 | R97: 9999
A98: -40 | B98: -40 | C98: 836.5 | D98: 68 | E98: TDOA 72# # # 0 63 -16 # 0 0 1 0 0 0 0 1 # 0 | F98: TDOA | H98: 5.0 | I98: 2 | J98: 256 | K98: 383 | L98: 416 | M98: 383 | N98: 1024 | O98: 1 | P98: 1 | Q98: 29 | R98: 9999
A99: -40 | B99: -40 | C99: 836.5 | D99: 68 | E99: TDOA 73# # # 0 63 -16 # 0 0 1 0 0 0 0 1 # 0 | F99: TDOA | H99: 5.0 | I99: 2 | J99: 256 | K99: 383 | L99: 416 | M99: 383 | N99: 1024 | O99: 1 | P99: 1 | Q99: 29 | R99: 9999
A100: -40 | B100: -40 | C100: 836.5 | D100: 68 | E100: TDOA 74# # # 0 63 -16 # 0 0 1 0 0 0 0 1 # 0 | F100: TDOA | H100: 5.0 | I100: 2 | J100: 256 | K100: 383 | L100: 416 | M100: 383 | N100: 1024 | O100: 1 | P100: 1 | Q100: 29 | R100: 9999
A101: -40 | B101: -40 | C101: 836.5 | D101: 68 | E101: TDOA 75# # # 0 63 -16 # 0 0 1 0 0 0 0 1 # 0 | F101: TDOA | H101: 5.0 | I101: 2 | J101: 256 | K101: 383 | L101: 416 | M101: 383 | N101: 1024 | O101: 1 | P101: 1 | Q101: 29 | R101: 9999
A105: Test Case 8 - Noise Floor
A106: Signal Generator
A107: RF Power | B107: IF Power | C107: RF Frequency | D107: IF Frequency | E107: Command | F107: Response | H107: Timeout | I107: Attempts | J107: Block Size | K107: RF Channel | L107: IF Channel | M107: # Samples | N107: Cnfg Attn | O107: Averaging | P107: Signal Averaging | Q107: Low Limit | R107: High Limit | S107: Low Limit Gain | T107: High Limit Gain
A108: -45 | C108: 836.5 | D108: 70 | E108: TDOA 86# # # 0 63 -16 # 0 0 1 0 0 0 0 1 # 0 | F108: TDOA | H108: 5.0 | I108: 2 | J108: 256 | K108: 383 | L108: 750 | M108: 1024 | N108: 0 | O108: 8 | P108: 1 | Q108: -174 | R108: -121 | S108: 40 | T108: 46
A110: -45 | C110: 824.04 | D110: 70 | E110: TDOA 81# # # 0 63 -16 # 0 0 1 0 0 0 0 1 # 0 | F110: TDOA | H110: 5.0 | I110: 2 | J110: 256 | K110: 991 | L110: 1 | M110: 1024 | N110: 0 | O110: 8 | P110: 1 | Q110: -174 | R110: -131 | S110: 30 | T110: 36
A111: -45 | C111: 827.04 | D111: 70 | E111: TDOA 82# # # 0 63 -16 # 0 0 1 0 0 0 0 1 # 0 | F111: TDOA | H111: 5.0 | I111: 2 | J111: 256 | K111: 68 | L111: 101 | M111: 1024 | N111: 0 | O111: 8 | P111: 1 | Q111: -174 | R111: -131 | S111: 30 | T111: 36
A112: -45 | C112: 832.5 | D112: 70 | E112: TDOA 83# # # 0 63 -16 # 0 0 1 0 0 0 0 1 # 0 | F112: TDOA | H112: 5.0 | I112: 2 | J112: 256 | K112: 250 | L112: 283 | M112: 1024 | N112: 0 | O112: 8 | P112: 1 | Q112: -174 | R112: -131 | S112: 30 | T112: 36
A113: -45 | C113: 837.51 | D113: 70 | E113: TDOA 84# # # 0 63 -16 # 0 0 1 0 0 0 0 1 # 0 | F113: TDOA | H113: 5.0 | I113: 2 | J113: 256 | K113: 417 | L113: 450 | M113: 1024 | N113: 0 | O113: 8 | P113: 1 | Q113: -174 | R113: -131 | S113: 30 | T113: 36
A114: -45 | C114: 842.01 | D114: 70 | E114: TDOA 85# # # 0 63 -16 # 0 0 1 0 0 0 0 1 # 0 | F114: TDOA | H114: 5.0 | I114: 2 | J114: 256 | K114: 567 | L114: 600 | M114: 1024 | N114: 0 | O114: 8 | P114: 1 | Q114: -174 | R114: -131 | S114: 30 | T114: 36
A115: -45 | C115: 846.51 | D115: 70 | E115: TDOA 86# # # 0 63 -16 # 0 0 1 0 0 0 0 1 # 0 | F115: TDOA | H115: 5.0 | I115: 2 | J115: 256 | K115: 717 | L115: 750 | M115: 1024 | N115: 0 | O115: 8 | P115: 1 | Q115: -174 | R115: -131 | S115: 30 | T115: 36
A116: -45 | C116: 848.97 | D116: 70 | E116: TDOA 87# # # 0 63 -16 # 0 0 1 0 0 0 0 1 # 0 | F116: TDOA | H116: 5.0 | I116: 2 | J116: 256 | K116: 799 | L116: 832 | M116: 1024 | N116: 0 | O116: 8 | P116: 1 | Q116: -174 | R116: -131 | S116: 30 | T116: 36
A120: Test Case 9 - DDC Tuning
A121: Signal Generator
A122: RF Power | B122: IF Power | C122: RF Frequency | D122: IF Frequency | E122: Command | F122: Response | H122: Timeout | I122: Attempts | J122: Block Size | K122: RF Channel | L122: IF Channel | M122: # Samples | N122: Averaging | O122: Low Limit | P122: High Limit
A123: -40 | B123: -40 | C123: 824.04 | E123: TDOA 91# # # 0 63 -16 # 0 0 1 0 0 0 0 1 # 0 | F123: TDOA | H123: 5.0 | I123: 2 | J123: 256 | K123: 955 | M123: 1024 | N123: 1 | O123: 29 | P123: 9999
A125: -40 | B125: -40 | C125: 825.6 | E125: TDOA 92# # # 0 63 -16 # 0 0 1 0 0 0 0 1 # 0 | F125: TDOA | H125: 5.0 | I125: 2 | J125: 256 | K125: 967 | M125: 1024 | N125: 1 | O125: 29 | P125: 9999
A126: -40 | B126: -40 | C126: 828.6 | E126: TDOA 93# # # 0 63 -16 # 0 0 1 0 0 0 0 1 # 0 | F126: TDOA | H126: 5.0 | I126: 2 | J126: 256 | K126: 979 | M126: 1024 | N126: 1 | O126: 29 | P126: 9999
A127: -40 | B127: -40 | C127: 831.6 | E127: TDOA 94# # # 0 63 -16 # 0 0 1 0 0 0 0 1 # 0 | F127: TDOA | H127: 5.0 | I127: 2 | J127: 256 | K127: 991 | M127: 1024 | N127: 1 | O127: 29 | P127: 9999
A128: -40 | B128: -40 | C128: 834.6 | E128: TDOA 95# # # 0 63 -16 # 0 0 1 0 0 0 0 1 # 0 | F128: TDOA | H128: 5.0 | I128: 2 | J128: 256 | K128: 1003 | M128: 1024 | N128: 1 | O128: 29 | P128: 9999
A129: -40 | B129: -40 | C129: 837.6 | E129: TDOA 96# # # 0 63 -16 # 0 0 1 0 0 0 0 1 # 0 | F129: TDOA | H129: 5.0 | I129: 2 | J129: 256 | K129: 1015 | M129: 1024 | N129: 1 | O129: 29 | P129: 9999
A130: -40 | B130: -40 | C130: 840.6 | E130: TDOA 97# # # 0 63 -16 # 0 0 1 0 0 0 0 1 # 0 | F130: TDOA | H130: 5.0 | I130: 2 | J130: 256 | K130: 3 | M130: 1024 | N130: 1 | O130: 29 | P130: 9999
A131: -40 | B131: -40 | C131: 843.6 | E131: TDOA 98# # # 0 63 -16 # 0 0 1 0 0 0 0 1 # 0 | F131: TDOA | H131: 5.0 | I131: 2 | J131: 256 | K131: 15 | M131: 1024 | N131: 1 | O131: 29 | P131: 9999
A132: -40 | B132: -40 | C132: 848.97 | E132: TDOA 99# # # 0 63 -16 # 0 0 1 0 0 0 0 1 # 0 | F132: TDOA | H132: 5.0 | I132: 2 | J132: 256 | K132: 27 | M132: 1024 | N132: 1 | O132: 29 | P132: 9999
A136: Test Case 10 - T1
A137: Command Prior to 10 | B137: Response | D137: Timeout | E137: Begin State | F137: End State | G137: Attempts
A138: GoT1Master | D138: 3 | E138: DSHELL | F138: DSHELL | G138: 1
A139: RunLocalT1 500 100 | B139: Bad 0 | D139: 20 | E139: DSHELL | F139: DSHELL | G139: 1
A143: Command | B143: Response | D143: Timeout | E143: Begin State | F143: End State | G143: Attempts
A144: GOMASTER | D144: 3 | E144: DSHELL | F144: DSHELL | G144: 1
A145: RUNLOCALLOOP 500 100 | B145: Bad 0 | D145: 20 | E145: DSHELL | F145: DSHELL | G145: 1
A149: Test Case 11 - Ethernet
A150: Command | B150: Response | D150: Timeout | E150: Begin State | F150: End State | G150: Attempts
A151: ethtest | B151: ethtest | D151: 20 | E151: DSHELL | F151: DSHELL | G151: 1
A155: Test Case 12 - Mini-RLS
A156: Signal Generator | C156: LMU Command
A157: RF Power | B157: RF Frequency | C157: Command Set | G157: Block Size | H157: # Blocks | I157: RF Channel | J157: # Samples | K157: |delay| (nsec) | L157: Phase Curvature | M157: Repeat and Average
A158: -40 | B158: 824.2 | C158: CommandSequence12B | G158: 256 | H158: 4 | I158: 128 | J158: 1024 | K158: 150 | L158: 0.5 | M158: 5
A159: -40 | B159: 829 | C159: CommandSequence12B | G159: 256 | H159: 4 | I159: 152 | J159: 1024 | K159: 150 | L159: 0.5 | M159: 5
A160: -40 | B160: 834 | C160: CommandSequence12B | G160: 256 | H160: 4 | I160: 177 | J160: 1024 | K160: 150 | L160: 0.5 | M160: 5
A161: -40 | B161: 839 | C161: CommandSequence12B | G161: 256 | H161: 4 | I161: 202 | J161: 1024 | K161: 150 | L161: 0.5 | M161: 5
A162: -40 | B162: 844 | C162: CommandSequence12B | G162: 256 | H162: 4 | I162: 227 | J162: 1024 | K162: 150 | L162: 0.5 | M162: 5
A163: -40 | B163: 848.8 | C163: CommandSequence12B | G163: 256 | H163: 4 | I163: 251 | J163: 1024 | K163: 150 | L163: 0.5 | M163: 5
A164: -40 | B164: 824.04 | C164: CommandSequence12A | G164: 256 | H164: 4 | I164: 991 | J164: 1024 | K164: 150 | L164: 0.5 | M164: 5
A165: -40 | B165: 828.98999999999546 | C165: CommandSequence12A | G165: 256 | H165: 4 | I165: 133 | J165: 1024 | K165: 150 | L165: 0.5 | M165: 5
A166: -40 | B166: 833.99999999999091 | C166: CommandSequence12A | G166: 256 | H166: 4 | I166: 300 | J166: 1024 | K166: 150 | L166: 0.5 | M166: 5
A167: -40 | B167: 839.00999999998635 | C167: CommandSequence12A | G167: 256 | H167: 4 | I167: 467 | J167: 1024 | K167: 150 | L167: 0.5 | M167: 5
A168: -40 | B168: 844.01999999998179 | C168: CommandSequence12A | G168: 256 | H168: 4 | I168: 634 | J168: 1024 | K168: 150 | L168: 0.5 | M168: 5
A169: -40 | B169: 848.96999999997729 | C169: CommandSequence12A | G169: 256 | H169: 4 | I169: 799 | J169: 1024 | K169: 150 | L169: 0.5 | M169: 5
A172: Test Case 13 - Config Attenuator
A173: Signal Generator
A174: RF Power | B174: IF Power | C174: RF Frequency | D174: IF Frequency | E174: Command | F174: Response | H174: Timeout | I174: Attempts | J174: Block Size | K174: RF Channel | L174: IF Channel | M174: TTG Channel | N174: # Samples | O174: Cnfg Attn Setting | P174: Averaging | Q174: Low Limit from previous level (dBm) | R174: High Limit from previous level (dBm)
A175: -40 | B175: -40 | C175: 836.5 | D175: 70 | E175: TDOA 71# # # 0 63 -16 # 0 0 1 0 0 0 0 1 # 0 | F175: TDOA | H175: 5 | I175: 2 | J175: 256 | K175: 383 | L175: 128 | M175: 383 | N175: 1024 | O175: 0 | P175: 1 | Q175: -60 | R175: 0
A176: -40 | B176: -40 | C176: 836.5 | D176: 70 | E176: TDOA 72# # # 0 63 -16 # 0 0 1 0 0 0 0 1 # 0 | F176: TDOA | H176: 5 | I176: 2 | J176: 256 | K176: 383 | L176: 128 | M176: 383 | N176: 1024 | O176: -8 | P176: 1 | Q176: -10 | R176: -6
A177: -40 | B177: -40 | C177: 836.5 | D177: 70 | E177: TDOA 73# # # 0 63 -16 # 0 0 1 0 0 0 0 1 # 0 | F177: TDOA | H177: 5 | I177: 2 | J177: 256 | K177: 383 | L177: 128 | M177: 383 | N177: 1024 | O177: -10 | P177: 1 | Q177: -3.3 | R177: -0.7
A178: -40 | B178: -40 | C178: 836.5 | D178: 70 | E178: TDOA 74# # # 0 63 -16 # 0 0 1 0 0 0 0 1 # 0 | F178: TDOA | H178: 5 | I178: 2 | J178: 256 | K178: 383 | L178: 128 | M178: 383 | N178: 1024 | O178: 6 | P178: 1 | Q178: 13.5 | R178: 18.5
A179: -40 | B179: -40 | C179: 836.5 | D179: 70 | E179: TDOA 75# # # 0 63 -16 # 0 0 1 0 0 0 0 1 # 0 | F179: TDOA | H179: 5 | I179: 2 | J179: 256 | K179: 383 | L179: 128 | M179: 383 | N179: 1024 | O179: 2 | P179: 1 | Q179: -5.5 | R179: -2.5
A180: -40 | B180: -40 | C180: 836.5 | D180: 70 | E180: TDOA 76# # # 0 63 -16 # 0 0 1 0 0 0 0 1 # 0 | F180: TDOA | H180: 5 | I180: 2 | J180: 256 | K180: 383 | L180: 128 | M180: 383 | N180: 1024 | O180: 1 | P180: 1 | Q180: -2 | R180: 0
A185: LO PLL
A186: 756.0 MHz | D186: 766.5 MHz | G186: 778.0 MHz
A187: eng | D187: eng | G187: eng
A188: TEST 2 5 4 3 0x00 0x00 0x50 | D188: TEST 2 5 4 3 0x00 0x00 0xD3 | G188: TEST 2 5 4 3 0x00 0x00 0x50
A189: TEST 2 5 4 3 0x10 0x17 0xA1 | D189: TEST 2 5 4 3 0x00 0x00 0x50 | G189: TEST 2 5 4 3 0x10 0x18 0x51
A190: TEST 2 5 4 3 0x00 0x12 0xD3 | D190: TEST 2 5 4 3 0x10 0x17 0xF5 | G190: TEST 2 5 4 3 0x00 0x12 0xD3
A191: exit | D191: exit | G191: exit
A195: TTG Freq
A196: 836.5 MHZ | B196: Response | D196: Timeout | E196: Begin State | F196: End State | G196: Attempts
A197: eng | D197: 0.5 | E197: DSHELL | F197: ENG | G197: 1
A198: TEST 2 5 4 5 0x00 0x00 0xD3 | D198: 1 | E198: DSHELL | F198: ENG | G198: 1
A199: TEST 2 5 4 5 0x00 0x00 0x50 | D199: 1 | E199: DSHELL | F199: ENG | G199: 1
A200: TEST 2 5 4 5 0x00 0x1A 0x25 | D200: 1 | E200: DSHELL | F200: ENG | G200: 1
A201: exit | D201: 0.5 | E201: ENG | F201: DSHELL | G201: 1
A205: Gain Setup
A206: Setup | B206: Response | D206: Timeout | E206: Begin State | F206: End State | G206: Attempts
A207: gain 1 43 | D207: 0.5 | E207: DSHELL | F207: ENG | G207: 1
A208: gain 2 43 | D208: 0.5 | E208: DSHELL | F208: ENG | G208: 1
A209: gain 3 43 | D209: 0.5 | E209: DSHELL | F209: ENG | G209: 1
A210: gain 4 43 | D210: 0.5 | E210: DSHELL | F210: ENG | G210: 1
A211: gain 5 43 | D211: 0.5 | E211: DSHELL | F211: ENG | G211: 1
A212: gain 6 43 | D212: 0.5 | E212: DSHELL | F212: ENG | G212: 1
A215: Config Atten Setup
A216: Setup | B216: Response | D216: Timeout | E216: Begin State | F216: End State | G216: Attempts
A217: gain 1 25varGain | D217: 0.5 | E217: DSHELL | F217: ENG | G217: 1
A218: gain 2 25varGain | D218: 0.5 | E218: DSHELL | F218: ENG | G218: 1
A219: gain 3 25varGain | D219: 0.5 | E219: DSHELL | F219: ENG | G219: 1
A220: gain 4 25varGain | D220: 0.5 | E220: DSHELL | F220: ENG | G220: 1
A221: gain 5 25varGain | D221: 0.5 | E221: DSHELL | F221: ENG | G221: 1
A222: gain 6 25varGain | D222: 0.5 | E222: DSHELL | F222: ENG | G222: 1
A225: Data Path Settings
A226: Data Path 1 | D226: Timeout | E226: Begin State | F226: End State | G226: Attempts
A227: eng | D227: 0.5 | E227: DSHELL | F227: ENG | G227: 1
A228: Test 1 1 0 0 0 | D228: 0.5 | E228: ENG | F228: ENG | G228: 1
A229: exit | D229: 0.5 | E229: ENG | F229: DSHELL | G229: 1
A232: Data Path 2 | D232: Timeout | E232: Begin State | F232: End State | G232: Attempts
A233: eng | D233: 0.5 | E233: DSHELL | F233: ENG | G233: 1
A234: Test 1 0 1 0 0 | D234: 0.5 | E234: ENG | F234: ENG | G234: 1
A235: exit | D235: 0.5 | E235: ENG | F235: DSHELL | G235: 1
A238: Data Path 3 | D238: Timeout | E238: Begin State | F238: End State | G238: Attempts
A239: eng | D239: 0.5 | E239: DSHELL | F239: ENG | G239: 1
A240: Test 1 0 0 1 0 | D240: 0.5 | E240: ENG | F240: ENG | G240: 1
A241: exit | D241: 0.5 | E241: ENG | F241: DSHELL | G241: 1
A244: Data Path 4 | D244: Timeout | E244: Begin State | F244: End State | G244: Attempts
A245: eng | D245: 0.5 | E245: DSHELL | F245: ENG | G245: 1
A246: Test 1 0 0 0 1 | D246: 0.5 | E246: ENG | F246: ENG | G246: 1
A247: exit | D247: 0.5 | E247: ENG | F247: DSHELL | G247: 1
A250: Data Path 5 | D250: Timeout | E250: Begin State | F250: End State | G250: Attempts
A251: eng | D251: 0.5 | E251: DSHELL | F251: ENG | G251: 1
A252: Test 1 1 1 1 1 | D252: 0.5 | E252: ENG | F252: ENG | G252: 1
A253: exit | D253: 0.5 | E253: ENG | F253: DSHELL | G253: 1
A256: Compensation Settings
A257: Receiver compensated gain | D257: Timeout | E257: Begin State | F257: End State | G257: Attempts
A258: eng | D258: 0.5 | E258: DSHELL | F258: ENG | G258: 1
A259: Test 4 0xA4 0x48 6 | B259: DATA Read: | D259: 1 | E259: ENG | F259: ENG | G259: 1
A260: TEST 4 0xA4 0x1F 1 | B260: DATA Read: 41 | D260: 1 | E260: ENG | F260: ENG | G260: 1
A261: Test 4 0xA4 0x30 6 | B261: DATA Read: | D261: 1 | E261: ENG | F261: ENG | G261: 1
A262: exit | D262: 0.5 | E262: ENG | F262: DSHELL | G262: 1
A265: TTG compensated Level | D265: Timeout | E265: Begin State | F265: End State | G265: Attempts
A266: eng | D266: 0.5 | E266: DSHELL | F266: ENG | G266: 1
A267: Test 4 0xA4 0x42 6 | B267: DATA Read: | D267: 1 | E267: ENG | F267: ENG | G267: 1
A268: TEST 4 0xA4 0x1F 1 | B268: DATA Read: 41 | D268: 1 | E268: ENG | F268: ENG | G268: 1 | H268: Note: | I268: If we get DATA Read: 41, then the software will skip
A269: Test 4 0xA4 0x2A 6 | B269: DATA Read: | D269: 1 | E269: ENG | F269: ENG | G269: 1 | I269: over the next line and go directly to exit
A270: exit | D270: 0.5 | E270: ENG | F270: DSHELL | G270: 1
A273: Receiver Gain Compensation | D273: Timeout | E273: Begin State | F273: End State | G273: Attempts
A274: eng | D274: 0.5 | E274: DSHELL | F274: ENG | G274: 1
A275: TEST 4 0xA4 0x1F 1 | B275: DATA Read: 41 | D275: 0.5 | E275: ENG | F275: ENG | G275: 1
A276: Test 4 0xA4 0x20 6 | B276: DATA Read: | D276: 0.5 | E276: ENG | F276: ENG | G276: 1
A277: exit | D277: 0.5 | E277: ENG | F277: DSHELL | G277: 1
A280: EnableTTG | B280: Response | D280: Timeout | E280: Begin State | F280: End State | G280: Attempts
A281: eng | D281: 0.5 | E281: DSHELL | F281: ENG | G281: 1
A282: TEST 2 3 8 6 8 | D282: 0.5 | E282: ENG | F282: ENG | G282: 1
A283: TEST 2 3 4 4 5 | D283: 0.5 | E283: ENG | F283: ENG | G283: 1
A284: TEST 2 3 4 6 1 | D284: 0.5 | E284: ENG | F284: ENG | G284: 1
A285: exit | D285: 0.5 | E285: ENG | F285: DSHELL | G285: 1
A288: DisableTTG | D288: Timeout | E288: Begin State | F288: End State | G288: Attempts
A289: eng | D289: 0.5 | E289: DSHELL | F289: ENG | G289: 1
A290: TEST 2 3 8 6 5 | D290: 0.5 | E290: ENG | F290: ENG | G290: 1
A291: TEST 2 3 4 4 1 | D291: 0.5 | E291: ENG | F291: ENG | G291: 1
A292: TEST 2 3 4 6 0 | D292: 0.5 | E292: ENG | F292: ENG | G292: 1
A293: exit | D293: 0.5 | E293: ENG | F293: DSHELL | G293: 1
A296: Mute On | D296: Timeout | E296: Begin State | F296: End State | G296: Attempts
A297: eng | D297: 0.5 | E297: DSHELL | F297: ENG | G297: 1
A298: TEST 2 3 8 6 8 | D298: 0.5 | E298: ENG | F298: ENG | G298: 1
A299: exit | D299: 0.5 | E299: ENG | F299: DSHELL | G299: 1
A302: Mute Off | D302: Timeout | E302: Begin State | F302: End State | G302: Attempts
A303: eng | D303: 0.5 | E303: DSHELL | F303: ENG | G303: 1
A304: TEST 2 3 8 6 5 | D304: 0.5 | E304: ENG | F304: ENG | G304: 1
A305: exit | D305: 0.5 | E305: ENG | F305: DSHELL | G305: 1
A308: Change Admin State
A309: Command | B309: Response | D309: Timeout | E309: Begin State | F309: End State | G309: # of retries
A310: etest 15 1 | D310: 2 | E310: DSHELL | F310: DSHELL | G310: 1
A314: Check Alarms
A315: Command | B315: Response | D315: Timeout | E315: Begin State | F315: End State | G315: # of retries
A316: ALARMS | B316: FAULT_GPS_HOLDOVER | D316: 2 | E316: DSHELL | F316: DSHELL | G316: 1
A320: Mini-RLS Command Sequence 12A (AMPS)
A321: Command | B321: Response | D321: Timeout | E321: Begin State | F321: End State | G321: # of retries
A322: ALARMS | B322: FAULT_GPS_HOLDOVER | D322: 2 | E322: DSHELL | F322: DSHELL | G322: 1
A323: TIME | B323: GPS Time: | D323: 2 | E323: DSHELL | F323: DSHELL | G323: 2
A324: SVCR # # 2 # # 0 1 0 0 0 1 1 1 # 0 0 | B324: returnCode 0 | D324: 2 | E324: DSHELL | F324: DSHELL | G324: 1
A325: WAIT | D325: 15 | E325: DSHELL | F325: DSHELL | G325: 1
A326: TDATA # 0 2 # # # -16 0 1 0 0 11 0 63 -16 | B326: TDOA | D326: 15 | E326: DSHELL | F326: DSHELL | G326: 1
A330: Mini-RLS Command Sequence 12B (GSM)
A331: Command | B331: Response | D331: Timeout | E331: Begin State | F331: End State | G331: # of retries
A332: ALARMS | B332: FAULT_GPS_HOLDOVER | D332: 2 | E332: DSHELL | F332: DSHELL | G332: 1
A333: TIME | B333: GPS Time: | D333: 2 | E333: DSHELL | F333: DSHELL | G333: 2
A334: GVCR # 2 # # 0 # 0 # # 17 1 0 0 0 0 0 0 1 1 1 8 0 0 0 0 0 0 0 0 0 0 0 | B334: returnCode 0 | D334: 2 | E334: DSHELL | F334: DSHELL | G334: 1
A335: WAIT | D335: 15 | E335: DSHELL | F335: DSHELL | G335: 1
A336: TDATA # 0 2 # # # -16 0 1 0 0 11 0 63 -16 | B336: TDOA | D336: 15 | E336: DSHELL | F336: DSHELL | G336: 1

Sheet: 061639
C1: Factors
C2: TTG | D2: 50
C3: Gain | D3: 400
C4: TTG Comp | D4: 100
C5: Gain Comp | D5: 350
F8: Temperature Coefficient | J8: Center Temperature
F10: -3.5000000000000003E-2 | H10: dB/deg | J10: 30 | L10: deg
A15: Test Case 2 - Processor Memory
A16: Command | B16: Response | D16: Timeout | E16: Begin State | F16: End State | G16: Attempts
A17: BIT 4 1 | B17: No Failure | D17: 20 | E17: DSHELL | F17: DSHELL | G17: 1
A18: BIT 4 2 | B18: No Failure | D18: 20 | E18: DSHELL | F18: DSHELL | G18: 1
A19: BIT 4 3 | B19: No Failure | D19: 20 | E19: DSHELL | F19: DSHELL | G19: 1
A20: BIT 4 4 | B20: No Failure | D20: 20 | E20: DSHELL | F20: DSHELL | G20: 1
A24: Test Case 3 - SNR
A25: Signal Generator
A26: RF Power | B26: IF Power | C26: RF Frequency | D26: IF Frequency | E26: Command | F26: Response | H26: Timeout | I26: Attempts | J26: Block Size | K26: RF Channel | L26: IF Channel | M26: TTG Channel | N26: # Samples | O26: Averaging | P26: Low Limit | Q26: High Limit
A27: -50 | B27: -50 | C27: 876.2 | D27: 70 | E27: TDOA 31# # # 1 63 -16 # 0 0 1 0 0 0 0 1 # 0 | F27: TDOA | H27: 5.0 | I27: 2 | J27: 256 | K27: 955 | L27: 6 | N27: 1024 | O27: 1 | P27: 37.5 | Q27: 9999
A29: -50 | B29: -50 | C29: 878.6 | D29: 70 | E29: TDOA 32# # # 1 63 -16 # 0 0 1 0 0 0 0 1 # 0 | F29: TDOA | H29: 5.0 | I29: 2 | J29: 256 | K29: 967 | L29: 86 | N29: 1024 | O29: 1 | P29: 37.5 | Q29: 9999
A30: -50 | B30: -50 | C30: 881 | D30: 70 | E30: TDOA 33# # # 1 63 -16 # 0 0 1 0 0 0 0 1 # 0 | F30: TDOA | H30: 5.0 | I30: 2 | J30: 256 | K30: 979 | L30: 33 | N30: 1024 | O30: 1 | P30: 37.5 | Q30: 9999
A31: -50 | B31: -50 | C31: 883.4 | D31: 70 | E31: TDOA 34# # # 1 63 -16 # 0 0 1 0 0 0 0 1 # 0 | F31: TDOA | H31: 5.0 | I31: 2 | J31: 256 | K31: 991 | L31: 116 | N31: 1024 | O31: 1 | P31: 37.5 | Q31: 9999
A32: -50 | B32: -50 | C32: 885.8 | D32: 70 | E32: TDOA 35# # # 1 63 -16 # 0 0 1 0 0 0 0 1 # 0 | F32: TDOA | H32: 5.0 | I32: 2 | J32: 256 | K32: 1003 | L32: 29 | N32: 1024 | O32: 1 | P32: 37.5 | Q32: 9999
A33: -50 | B33: -50 | C33: 888.2 | D33: 70 | E33: TDOA 36# # # 1 63 -16 # 0 0 1 0 0 0 0 1 # 0 | F33: TDOA | H33: 5.0 | I33: 2 | J33: 256 | K33: 1015 | L33: 109 | N33: 1024 | O33: 1 | P33: 37.5 | Q33: 9999
A34: -50 | B34: -50 | C34: 890.6 | D34: 70 | E34: TDOA 37# # # 1 63 -16 # 0 0 1 0 0 0 0 1 # 0 | F34: TDOA | H34: 5.0 | I34: 2 | J34: 256 | K34: 3 | L34: 23 | N34: 1024 | O34: 1 | P34: 37.5 | Q34: 9999
A35: -50 | B35: -50 | C35: 893 | D35: 70 | E35: TDOA 38# # # 1 63 -16 # 0 0 1 0 0 0 0 1 # 0 | F35: TDOA | H35: 5.0 | I35: 2 | J35: 256 | K35: 15 | L35: 103 | N35: 1024 | O35: 1 | P35: 37.5 | Q35: 9999
A36: -50 | B36: -50 | C36: 895.4 | D36: 70 | E36: TDOA 39# # # 1 63 -16 # 0 0 1 0 0 0 0 1 # 0 | F36: TDOA | H36: 5.0 | I36: 2 | J36: 256 | K36: 27 | L36: 183 | N36: 1024 | O36: 1 | P36: 37.5 | Q36: 9999
A37: -50 | B37: -50 | C37: 897.8 | D37: 70 | E37: TDOA 130# # # 1 63 -16 # 0 0 1 0 0 0 0 1 # 0 | F37: TDOA | H37: 5.0 | I37: 2 | J37: 256 | K37: 39 | L37: 263 | N37: 1024 | O37: 1 | P37: 37.5 | Q37: 9999
A38: -50 | B38: -50 | C38: 900.2 | D38: 70 | E38: TDOA 131# # # 1 63 -16 # 0 0 1 0 0 0 0 1 # 0 | F38: TDOA | H38: 5.0 | I38: 2 | J38: 256 | K38: 51 | L38: 343 | N38: 1024 | O38: 1 | P38: 37.5 | Q38: 9999
A39: -50 | B39: -50 | C39: 902.6 | D39: 70 | E39: TDOA 132# # # 1 63 -16 # 0 0 1 0 0 0 0 1 # 0 | F39: TDOA | H39: 5.0 | I39: 2 | J39: 256 | K39: 63 | L39: 423 | N39: 1024 | O39: 1 | P39: 37.5 | Q39: 9999
A40: -50 | B40: -50 | C40: 905 | D40: 70 | E40: TDOA 133# # # 1 63 -16 # 0 0 1 0 0 0 0 1 # 0 | F40: TDOA | H40: 5.0 | I40: 2 | J40: 256 | K40: 75 | L40: 503 | N40: 1024 | O40: 1 | P40: 37.5 | Q40: 9999
A41: -50 | B41: -50 | C41: 907.4 | D41: 70 | E41: TDOA 134# # # 1 63 -16 # 0 0 1 0 0 0 0 1 # 0 | F41: TDOA | H41: 5.0 | I41: 2 | J41: 256 | K41: 87 | L41: 583 | N41: 1024 | O41: 1 | P41: 37.5 | Q41: 9999
A42: -50 | B42: -50 | C42: 909.8 | D42: 70 | E42: TDOA 135# # # 1 63 -16 # 0 0 1 0 0 0 0 1 # 0 | F42: TDOA | H42: 5.0 | I42: 2 | J42: 256 | K42: 99 | L42: 663 | N42: 1024 | O42: 1 | P42: 37.5 | Q42: 9999
A43: -50 | B43: -50 | C43: 912.2 | D43: 70 | E43: TDOA 136# # # 1 63 -16 # 0 0 1 0 0 0 0 1 # 0 | F43: TDOA | H43: 5.0 | I43: 2 | J43: 256 | K43: 111 | L43: 743 | N43: 1024 | O43: 1 | P43: 37.5 | Q43: 9999
A44: -50 | B44: -50 | C44: 914.8 | D44: 70 | E44: TDOA 137# # # 1 63 -16 # 0 0 1 0 0 0 0 1 # 0 | F44: TDOA | H44: 5.0 | I44: 2 | J44: 256 | K44: 124 | L44: 829 | N44: 1024 | O44: 1 | P44: 37.5 | Q44: 9999
A48: Test Case 5 - Two-Tone Response
B49: SigGen1 | D49: SigGen2
A50: Center RF Channel | B50: RF Frequency | C50: RF Power | D50: RF Frequency | E50: Command | F50: Response | G50: Timeout | H50: Attempts | I50: Block Size | J50: Lower Channel | K50: Upper Channel | L50: # Samples | M50: Cnfg Attn | N50: Averaging | O50: Low Limit | P50: High Limit | Q50: Lower Channel Delta | R50: Upper Channel Delta
A51: 900.2 | B51: 900.14 | C51: -55 | D51: 900.26 | E51: TDOA 51# # # 1 63 -16 # 0 0 1 0 0 0 0 1 # 0 | F51: TDOA | G51: 5.0 | H51: 2 | I51: 256 | J51: 51 | K51: 51 | L51: 1024 | M51: 1 | N51: 1 | O51: -999 | P51: -65 | Q51: 1 | R51: 1
A53: 876.2 | B53: 876.14 | C53: -55 | D53: 876.26 | E53: TDOA 52# # # 1 63 -16 # 0 0 1 0 0 0 0 1 # 0 | F53: TDOA | G53: 5.0 | H53: 2 | I53: 256 | J53: 955 | K53: 955 | L53: 1024 | M53: 1 | N53: 1 | O53: -999 | P53: -65 | Q53: 1 | R53: 1
A54: 878.6 | B54: 878.54 | C54: -55 | D54: 878.66 | E54: TDOA 53# # # 1 63 -16 # 0 0 1 0 0 0 0 1 # 0 | F54: TDOA | G54: 5.0 | H54: 2 | I54: 256 | J54: 967 | K54: 967 | L54: 1024 | M54: 1 | N54: 1 | O54: -999 | P54: -65 | Q54: 1 | R54: 1
A55: 881 | B55: 880.94 | C55: -55 | D55: 881.06 | E55: TDOA 54# # # 1 63 -16 # 0 0 1 0 0 0 0 1 # 0 | F55: TDOA | G55: 5.0 | H55: 2 | I55: 256 | J55: 979 | K55: 979 | L55: 1024 | M55: 1 | N55: 1 | O55: -999 | P55: -65 | Q55: 1 | R55: 1
A56: 883.4 | B56: 883.34 | C56: -55 | D56: 883.46 | E56: TDOA 55# # # 1 63 -16 # 0 0 1 0 0 0 0 1 # 0 | F56: TDOA | G56: 5.0 | H56: 2 | I56: 256 | J56: 991 | K56: 991 | L56: 1024 | M56: 1 | N56: 1 | O56: -999 | P56: -65 | Q56: 1 | R56: 1
A57: 885.8 | B57: 885.74 | C57: -55 | D57: 885.86 | E57: TDOA 56# # # 1 63 -16 # 0 0 1 0 0 0 0 1 # 0 | F57: TDOA | G57: 5.0 | H57: 2 | I57: 256 | J57: 1003 | K57: 1003 | L57: 1024 | M57: 1 | N57: 1 | O57: -999 | P57: -65 | Q57: 1 | R57: 1
A58: 888.2 | B58: 888.14 | C58: -55 | D58: 888.26 | E58: TDOA 57# # # 1 63 -16 # 0 0 1 0 0 0 0 1 # 0 | F58: TDOA | G58: 5.0 | H58: 2 | I58: 256 | J58: 1015 | K58: 1015 | L58: 1024 | M58: 1 | N58: 1 | O58: -999 | P58: -65 | Q58: 1 | R58: 1
A59: 890.6 | B59: 890.54 | C59: -55 | D59: 890.66 | E59: TDOA 58# # # 1 63 -16 # 0 0 1 0 0 0 0 1 # 0 | F59: TDOA | G59: 5.0 | H59: 2 | I59: 256 | J59: 3 | K59: 3 | L59: 1024 | M59: 1 | N59: 1 | O59: -999 | P59: -65 | Q59: 1 | R59: 1
A60: 893 | B60: 892.94 | C60: -55 | D60: 893.06 | E60: TDOA 59# # # 1 63 -16 # 0 0 1 0 0 0 0 1 # 0 | F60: TDOA | G60: 5.0 | H60: 2 | I60: 256 | J60: 15 | K60: 15 | L60: 1024 | M60: 1 | N60: 1 | O60: -999 | P60: -65 | Q60: 1 | R60: 1
A61: 895.4 | B61: 895.34 | C61: -55 | D61: 895.46 | E61: TDOA 150# # # 1 63 -16 # 0 0 1 0 0 0 0 1 # 0 | F61: TDOA | G61: 5.0 | H61: 2 | I61: 256 | J61: 27 | K61: 27 | L61: 1024 | M61: 1 | N61: 1 | O61: -999 | P61: -65 | Q61: 1 | R61: 1
A62: 897.8 | B62: 897.74 | C62: -55 | D62: 897.86 | E62: TDOA 151# # # 1 63 -16 # 0 0 1 0 0 0 0 1 # 0 | F62: TDOA | G62: 5.0 | H62: 2 | I62: 256 | J62: 39 | K62: 39 | L62: 1024 | M62: 1 | N62: 1 | O62: -999 | P62: -65 | Q62: 1 | R62: 1
A63: 900.2 | B63: 900.14 | C63: -55 | D63: 900.26 | E63: TDOA 152# # # 1 63 -16 # 0 0 1 0 0 0 0 1 # 0 | F63: TDOA | G63: 5.0 | H63: 2 | I63: 256 | J63: 51 | K63: 51 | L63: 1024 | M63: 1 | N63: 1 | O63: -999 | P63: -65 | Q63: 1 | R63: 1
A64: 902.6 | B64: 902.54 | C64: -55 | D64: 902.66 | E64: TDOA 153# # # 1 63 -16 # 0 0 1 0 0 0 0 1 # 0 | F64: TDOA | G64: 5.0 | H64: 2 | I64: 256 | J64: 63 | K64: 63 | L64: 1024 | M64: 1 | N64: 1 | O64: -999 | P64: -65 | Q64: 1 | R64: 1
A65: 905 | B65: 904.94 | C65: -55 | D65: 905.06 | E65: TDOA 154# # # 1 63 -16 # 0 0 1 0 0 0 0 1 # 0 | F65: TDOA | G65: 5.0 | H65: 2 | I65: 256 | J65: 75 | K65: 75 | L65: 1024 | M65: 1 | N65: 1 | O65: -999 | P65: -65 | Q65: 1 | R65: 1
A66: 907.4 | B66: 907.34 | C66: -55 | D66: 907.46 | E66: TDOA 155# # # 1 63 -16 # 0 0 1 0 0 0 0 1 # 0 | F66: TDOA | G66: 5.0 | H66: 2 | I66: 256 | J66: 87 | K66: 87 | L66: 1024 | M66: 1 | N66: 1 | O66: -999 | P66: -65 | Q66: 1 | R66: 1
A67: 909.8 | B67: 909.74 | C67: -55 | D67: 909.86 | E67: TDOA 156# # # 1 63 -16 # 0 0 1 0 0 0 0 1 # 0 | F67: TDOA | G67: 5.0 | H67: 2 | I67: 256 | J67: 99 | K67: 99 | L67: 1024 | M67: 1 | N67: 1 | O67: -999 | P67: -65 | Q67: 1 | R67: 1
A68: 912.2 | B68: 912.14 | C68: -55 | D68: 912.26 | E68: TDOA 157# # # 1 63 -16 # 0 0 1 0 0 0 0 1 # 0 | F68: TDOA | G68: 5.0 | H68: 2 | I68: 256 | J68: 111 | K68: 111 | L68: 1024 | M68: 1 | N68: 1 | O68: -999 | P68: -65 | Q68: 1 | R68: 1
A69: 914.8 | B69: 914.74 | C69: -55 | D69: 914.86 | E69: TDOA 158# # # 1 63 -16 # 0 0 1 0 0 0 0 1 # 0 | F69: TDOA | G69: 5.0 | H69: 2 | I69: 256 | J69: 124 | K69: 124 | L69: 1024 | M69: 1 | N69: 1 | O69: -999 | P69: -65 | Q69: 1 | R69: 1
A73: Test Case 6 - Phase Noise
A74: Signal Generator
A75: RF Power | B75: IF Power | C75: RF Frequency | D75: IF Frequency | E75: Command | F75: Response | G75: Timeout | H75: Attempts | I75: Block Size | J75: RF Channel | K75: IF Channel | L75: # Samples | M75: Averaging | N75: Low Limit | O75: High Limit
A76: -50 | B76: -50 | C76: 876.2 | D76: 70 | E76: TDOA 61# # # 1 63 -16 # 0 0 1 0 0 0 0 1 # 0 | F76: TDOA | G76: 5.0 | H76: 2 | I76: 256 | J76: 955 | L76: 1024 | M76: 8 | N76: 0 | O76: 3
A78: -50 | B78: -50 | C78: 878.6 | D78: 70 | E78: TDOA 62# # # 1 63 -16 # 0 0 1 0 0 0 0 1 # 0 | F78: TDOA | G78: 5.0 | H78: 2 | I78: 256 | J78: 967 | L78: 1024 | M78: 8 | N78: 0 | O78: 3
A79: -50 | B79: -50 | C79: 881 | D79: 70 | E79: TDOA 63# # # 1 63 -16 # 0 0 1 0 0 0 0 1 # 0 | F79: TDOA | G79: 5.0 | H79: 2 | I79: 256 | J79: 979 | L79: 1024 | M79: 8 | N79: 0 | O79: 3
A80: -50 | B80: -50 | C80: 883.4 | D80: 70 | E80: TDOA 64# # # 1 63 -16 # 0 0 1 0 0 0 0 1 # 0 | F80: TDOA | G80: 5.0 | H80: 2 | I80: 256 | J80: 991 | L80: 1024 | M80: 8 | N80: 0 | O80: 3
A81: -50 | B81: -50 | C81: 885.8 | D81: 70 | E81: TDOA 65# # # 1 63 -16 # 0 0 1 0 0 0 0 1 # 0 | F81: TDOA | G81: 5.0 | H81: 2 | I81: 256 | J81: 1003 | L81: 1024 | M81: 8 | N81: 0 | O81: 3
A82: -50 | B82: -50 | C82: 888.2 | D82: 70 | E82: TDOA 66# # # 1 63 -16 # 0 0 1 0 0 0 0 1 # 0 | F82: TDOA | G82: 5.0 | H82: 2 | I82: 256 | J82: 1015 | L82: 1024 | M82: 8 | N82: 0 | O82: 3
A83: -50 | B83: -50 | C83: 890.6 | D83: 70 | E83: TDOA 67# # # 1 63 -16 # 0 0 1 0 0 0 0 1 # 0 | F83: TDOA | G83: 5.0 | H83: 2 | I83: 256 | J83: 3 | L83: 1024 | M83: 8 | N83: 0 | O83: 3
A84: -50 | B84: -50 | C84: 893 | D84: 70 | E84: TDOA 68# # # 1 63 -16 # 0 0 1 0 0 0 0 1 # 0 | F84: TDOA | G84: 5.0 | H84: 2 | I84: 256 | J84: 15 | L84: 1024 | M84: 8 | N84: 0 | O84: 3
A85: -50 | B85: -50 | C85: 895.4 | D85: 70 | E85: TDOA 69# # # 1 63 -16 # 0 0 1 0 0 0 0 1 # 0 | F85: TDOA | G85: 5.0 | H85: 2 | I85: 256 | J85: 27 | L85: 1024 | M85: 8 | N85: 0 | O85: 3
A86: -50 | B86: -50 | C86: 897.8 | D86: 70 | E86: TDOA 60# # # 1 63 -16 # 0 0 1 0 0 0 0 1 # 0 | F86: TDOA | G86: 5.0 | H86: 2 | I86: 256 | J86: 39 | L86: 1024 | M86: 8 | N86: 0 | O86: 3
A87: -50 | B87: -50 | C87: 900.2 | D87: 70 | E87: TDOA 161# # # 1 63 -16 # 0 0 1 0 0 0 0 1 # 0 | F87: TDOA | G87: 5.0 | H87: 2 | I87: 256 | J87: 51 | L87: 1024 | M87: 8 | N87: 0 | O87: 3
A88: -50 | B88: -50 | C88: 902.6 | D88: 70 | E88: TDOA 162# # # 1 63 -16 # 0 0 1 0 0 0 0 1 # 0 | F88: TDOA | G88: 5.0 | H88: 2 | I88: 256 | J88: 63 | L88: 1024 | M88: 8 | N88: 0 | O88: 3
A89: -50 | B89: -50 | C89: 905 | D89: 70 | E89: TDOA 163# # # 1 63 -16 # 0 0 1 0 0 0 0 1 # 0 | F89: TDOA | G89: 5.0 | H89: 2 | I89: 256 | J89: 75 | L89: 1024 | M89: 8 | N89: 0 | O89: 3
A90: -50 | B90: -50 | C90: 907.4 | D90: 70 | E90: TDOA 164# # # 1 63 -16 # 0 0 1 0 0 0 0 1 # 0 | F90: TDOA | G90: 5.0 | H90: 2 | I90: 256 | J90: 87 | L90: 1024 | M90: 8 | N90: 0 | O90: 3
A91: -50 | B91: -50 | C91: 909.8 | D91: 70 | E91: TDOA 165# # # 1 63 -16 # 0 0 1 0 0 0 0 1 # 0 | F91: TDOA | G91: 5.0 | H91: 2 | I91: 256 | J91: 99 | L91: 1024 | M91: 8 | N91: 0 | O91: 3
A92: -50 | B92: -50 | C92: 912.2 | D92: 70 | E92: TDOA 166# # # 1 63 -16 # 0 0 1 0 0 0 0 1 # 0 | F92: TDOA | G92: 5.0 | H92: 2 | I92: 256 | J92: 111 | L92: 1024 | M92: 8 | N92: 0 | O92: 3
A93: -50 | B93: -50 | C93: 914.8 | D93: 70 | E93: TDOA 167# # # 1 63 -16 # 0 0 1 0 0 0 0 1 # 0 | F93: TDOA | G93: 5.0 | H93: 2 | I93: 256 | J93: 124 | L93: 1024 | M93: 8 | N93: 0 | O93: 3
A97: Test Case 7 - Data Integrity
A98: Signal Generator
A99: RF Power | B99: IF Power | C99: RF Frequency | D99: IF Frequency | E99: Command | F99: Response | H99: Timeout | I99: Attempts | J99: Block Size | K99: RF Channel | L99: IF Channel | M99: TTG Channel | N99: # Samples | O99: Cnfg Attn | P99: Averaging | Q99: Low Limit | R99: High Limit
A100: -50 | B100: -50 | C100: 895.5 | D100: 68 | E100: TDOA 71# # # 1 63 -16 # 0 0 1 0 0 0 0 1 # 0 | F100: TDOA | H100: 5.0 | I100: 2 | J100: 256 | K100: 28 | L100: 128 | M100: 383 | N100: 1024 | O100: 6 | P100: 1 | Q100: 37.5 | R100: 9999
A101: -50 | B101: -50 | C101: 895.5 | D101: 68 | E101: TDOA 72# # # 1 63 -16 # 0 0 1 0 0 0 0 1 # 0 | F101: TDOA | H101: 5.0 | I101: 2 | J101: 256 | K101: 28 | L101: 128 | M101: 383 | N101: 1024 | O101: 6 | P101: 1 | Q101: 37.5 | R101: 9999
A102: -50 | B102: -50 | C102: 895.5 | D102: 68 | E102: TDOA 73# # # 1 63 -16 # 0 0 1 0 0 0 0 1 # 0 | F102: TDOA | H102: 5.0 | I102: 2 | J102: 256 | K102: 28 | L102: 128 | M102: 383 | N102: 1024 | O102: 6 | P102: 1 | Q102: 37.5 | R102: 9999
A103: -50 | B103: -50 | C103: 895.5 | D103: 68 | E103: TDOA 74# # # 1 63 -16 # 0 0 1 0 0 0 0 1 # 0 | F103: TDOA | H103: 5.0 | I103: 2 | J103: 256 | K103: 28 | L103: 128 | M103: 383 | N103: 1024 | O103: 6 | P103: 1 | Q103: 37.5 | R103: 9999
A104: -50 | B104: -50 | C104: 895.5 | D104: 68 | E104: TDOA 75# # # 1 63 -16 # 0 0 1 0 0 0 0 1 # 0 | F104: TDOA | H104: 5.0 | I104: 2 | J104: 256 | K104: 28 | L104: 128 | M104: 383 | N104: 1024 | O104: 6 | P104: 1 | Q104: 37.5 | R104: 9999
A108: Test Case 8 - Noise Floor
A109: Signal Generator
A110: RF Power | B110: IF Power | C110: RF Frequency | D110: IF Frequency | E110: Command | F110: Response | H110: Timeout | I110: Attempts | J110: Block Size | K110: RF Channel | L110: IF Channel | M110: # Samples | N110: Cnfg Attn | O110: Averaging | P110: Signal Averaging | Q110: Low Limit | R110: High Limit | S110: Low Limit Gain | T110: High Limit Gain
A111: -55 | C111: 876.2 | D111: 70 | E111: TDOA 81# # # 1 63 -16 # 0 0 1 0 0 0 0 1 # 0 | F111: TDOA | H111: 5.0 | I111: 2 | J111: 256 | K111: 955 | L111: 6 | M111: 1024 | N111: 0 | O111: 8 | P111: 1 | Q111: -174 | R111: -121 | S111: 40 | T111: 46
A113: -55 | C113: 878.6 | D113: 70 | E113: TDOA 82# # # 1 63 -16 # 0 0 1 0 0 0 0 1 # 0 | F113: TDOA | H113: 5.0 | I113: 2 | J113: 256 | K113: 967 | L113: 86 | M113: 1024 | N113: 0 | O113: 8 | P113: 1 | Q113: -174 | R113: -121 | S113: 40 | T113: 46
A114: -55 | C114: 881 | D114: 70 | E114: TDOA 83# # # 1 63 -16 # 0 0 1 0 0 0 0 1 # 0 | F114: TDOA | H114: 5.0 | I114: 2 | J114: 256 | K114: 979 | L114: 33 | M114: 1024 | N114: 0 | O114: 8 | P114: 1 | Q114: -174 | R114: -121 | S114: 40 | T114: 46
A115: -55 | C115: 883.4 | D115: 70 | E115: TDOA 84# # # 1 63 -16 # 0 0 1 0 0 0 0 1 # 0 | F115: TDOA | H115: 5.0 | I115: 2 | J115: 256 | K115: 991 | L115: 116 | M115: 1024 | N115: 0 | O115: 8 | P115: 1 | Q115: -174 | R115: -121 | S115: 40 | T115: 46
A116: -55 | C116: 885.8 | D116: 70 | E116: TDOA 85# # # 1 63 -16 # 0 0 1 0 0 0 0 1 # 0 | F116: TDOA | H116: 5.0 | I116: 2 | J116: 256 | K116: 1003 | L116: 29 | M116: 1024 | N116: 0 | O116: 8 | P116: 1 | Q116: -174 | R116: -121 | S116: 40 | T116: 46
A117: -55 | C117: 888.2 | D117: 70 | E117: TDOA 86# # # 1 63 -16 # 0 0 1 0 0 0 0 1 # 0 | F117: TDOA | H117: 5.0 | I117: 2 | J117: 256 | K117: 1015 | L117: 109 | M117: 1024 | N117: 0 | O117: 8 | P117: 1 | Q117: -174 | R117: -121 | S117: 40 | T117: 46
A118: -55 | C118: 890.6 | D118: 70 | E118: TDOA 87# # # 1 63 -16 # 0 0 1 0 0 0 0 1 # 0 | F118: TDOA | H118: 5.0 | I118: 2 | J118: 256 | K118: 3 | L118: 23 | M118: 1024 | N118: 0 | O118: 8 | P118: 1 | Q118: -174 | R118: -121 | S118: 40 | T118: 46
A119: -55 | C119: 893 | D119: 70 | E119: TDOA 88# # # 1 63 -16 # 0 0 1 0 0 0 0 1 # 0 | F119: TDOA | H119: 5.0 | I119: 2 | J119: 256 | K119: 15 | L119: 103 | M119: 1024 | N119: 0 | O119: 8 | P119: 1 | Q119: -174 | R119: -121 | S119: 40 | T119: 46
A120: -55 | C120: 895.4 | D120: 70 | E120: TDOA 89# # # 1 63 -16 # 0 0 1 0 0 0 0 1 # 0 | F120: TDOA | H120: 5.0 | I120: 2 | J120: 256 | K120: 27 | L120: 183 | M120: 1024 | N120: 0 | O120: 8 | P120: 1 | Q120: -174 | R120: -121 | S120: 40 | T120: 46
A121: -55 | C121: 897.8 | D121: 70 | E121: TDOA 80# # # 1 63 -16 # 0 0 1 0 0 0 0 1 # 0 | F121: TDOA | H121: 5.0 | I121: 2 | J121: 256 | K121: 39 | L121: 263 | M121: 1024 | N121: 0 | O121: 8 | P121: 1 | Q121: -174 | R121: -121 | S121: 40 | T121: 46
A122: -55 | C122: 900.2 | D122: 70 | E122: TDOA 181# # # 1 63 -16 # 0 0 1 0 0 0 0 1 # 0 | F122: TDOA | H122: 5.0 | I122: 2 | J122: 256 | K122: 51 | L122: 343 | M122: 1024 | N122: 0 | O122: 8 | P122: 1 | Q122: -174 | R122: -121 | S122: 40 | T122: 46
A123: -55 | C123: 902.6 | D123: 70 | E123: TDOA 182# # # 1 63 -16 # 0 0 1 0 0 0 0 1 # 0 | F123: TDOA | H123: 5.0 | I123: 2 | J123: 256 | K123: 63 | L123: 423 | M123: 1024 | N123: 0 | O123: 8 | P123: 1 | Q123: -174 | R123: -121 | S123: 40 | T123: 46
A124: -55 | C124: 905 | D124: 70 | E124: TDOA 183# # # 1 63 -16 # 0 0 1 0 0 0 0 1 # 0 | F124: TDOA | H124: 5.0 | I124: 2 | J124: 256 | K124: 75 | L124: 503 | M124: 1024 | N124: 0 | O124: 8 | P124: 1 | Q124: -174 | R124: -121 | S124: 40 | T124: 46
A125: -55 | C125: 907.4 | D125: 70 | E125: TDOA 184# # # 1 63 -16 # 0 0 1 0 0 0 0 1 # 0 | F125: TDOA | H125: 5.0 | I125: 2 | J125: 256 | K125: 87 | L125: 583 | M125: 1024 | N125: 0 | O125: 8 | P125: 1 | Q125: -174 | R125: -121 | S125: 40 | T125: 46
A126: -55 | C126: 909.8 | D126: 70 | E126: TDOA 185# # # 1 63 -16 # 0 0 1 0 0 0 0 1 # 0 | F126: TDOA | H126: 5.0 | I126: 2 | J126: 256 | K126: 99 | L126: 663 | M126: 1024 | N126: 0 | O126: 8 | P126: 1 | Q126: -174 | R126: -121 | S126: 40 | T126: 46
A127: -55 | C127: 912.2 | D127: 70 | E127: TDOA 186# # # 1 63 -16 # 0 0 1 0 0 0 0 1 # 0 | F127: TDOA | H127: 5.0 | I127: 2 | J127: 256 | K127: 111 | L127: 743 | M127: 1024 | N127: 0 | O127: 8 | P127: 1 | Q127: -174 | R127: -121 | S127: 40 | T127: 46
A128: -55 | C128: 914.8 | D128: 70 | E128: TDOA 187# # # 1 63 -16 # 0 0 1 0 0 0 0 1 # 0 | F128: TDOA | H128: 5.0 | I128: 2 | J128: 256 | K128: 124 | L128: 829 | M128: 1024 | N128: 0 | O128: 8 | P128: 1 | Q128: -174 | R128: -121 | S128: 40 | T128: 46
A132: Test Case 9 - DDC Tuning
A133: Signal Generator
A134: RF Power | B134: IF Power | C134: RF Frequency | D134: IF Frequency | E134: Command | F134: Response | H134: Timeout | I134: Attempts | J134: Block Size | K134: RF Channel | L134: IF Channel | M134: # Samples | N134: Averaging | O134: Low Limit | P134: High Limit
A135: -50 | B135: -50 | C135: 876.2 | E135: TDOA 91# # # 1 63 -16 # 0 0 1 0 0 0 0 1 # 0 | F135: TDOA | H135: 5.0 | I135: 2 | J135: 256 | K135: 955 | M135: 1024 | N135: 1 | O135: 37.5 | P135: 9999
A137: -50 | B137: -50 | C137: 878.6 | E137: TDOA 92# # # 1 63 -16 # 0 0 1 0 0 0 0 1 # 0 | F137: TDOA | H137: 5.0 | I137: 2 | J137: 256 | K137: 967 | M137: 1024 | N137: 1 | O137: 37.5 | P137: 9999
A138: -50 | B138: -50 | C138: 881 | E138: TDOA 93# # # 1 63 -16 # 0 0 1 0 0 0 0 1 # 0 | F138: TDOA | H138: 5.0 | I138: 2 | J138: 256 | K138: 979 | M138: 1024 | N138: 1 | O138: 37.5 | P138: 9999
A139: -50 | B139: -50 | C139: 883.4 | E139: TDOA 94# # # 1 63 -16 # 0 0 1 0 0 0 0 1 # 0 | F139: TDOA | H139: 5.0 | I139: 2 | J139: 256 | K139: 991 | M139: 1024 | N139: 1 | O139: 37.5 | P139: 9999
A140: -50 | B140: -50 | C140: 885.8 | E140: TDOA 95# # # 1 63 -16 # 0 0 1 0 0 0 0 1 # 0 | F140: TDOA | H140: 5.0 | I140: 2 | J140: 256 | K140: 1003 | M140: 1024 | N140: 1 | O140: 37.5 | P140: 9999
A141: -50 | B141: -50 | C141: 888.2 | E141: TDOA 96# # # 1 63 -16 # 0 0 1 0 0 0 0 1 # 0 | F141: TDOA | H141: 5.0 | I141: 2 | J141: 256 | K141: 1015 | M141: 1024 | N141: 1 | O141: 37.5 | P141: 9999
A142: -50 | B142: -50 | C142: 890.6 | E142: TDOA 97# # # 1 63 -16 # 0 0 1 0 0 0 0 1 # 0 | F142: TDOA | H142: 5.0 | I142: 2 | J142: 256 | K142: 3 | M142: 1024 | N142: 1 | O142: 37.5 | P142: 9999
A143: -50 | B143: -50 | C143: 893 | E143: TDOA 98# # # 1 63 -16 # 0 0 1 0 0 0 0 1 # 0 | F143: TDOA | H143: 5.0 | I143: 2 | J143: 256 | K143: 15 | M143: 1024 | N143: 1 | O143: 37.5 | P143: 9999
A144: -50 | B144: -50 | C144: 895.4 | E144: TDOA 99# # # 1 63 -16 # 0 0 1 0 0 0 0 1 # 0 | F144: TDOA | H144: 5.0 | I144: 2 | J144: 256 | K144: 27 | M144: 1024 | N144: 1 | O144: 37.5 | P144: 9999
A145: -50 | B145: -50 | C145: 897.8 | E145: TDOA 90# # # 1 63 -16 # 0 0 1 0 0 0 0 1 # 0 | F145: TDOA | H145: 5.0 | I145: 2 | J145: 256 | K145: 39 | M145: 1024 | N145: 1 | O145: 37.5 | P145: 9999
A146: -50 | B146: -50 | C146: 900.2 | E146: TDOA 191# # # 1 63 -16 # 0 0 1 0 0 0 0 1 # 0 | F146: TDOA | H146: 5.0 | I146: 2 | J146: 256 | K146: 51 | M146: 1024 | N146: 1 | O146: 37.5 | P146: 9999
A147: -50 | B147: -50 | C147: 902.6 | E147: TDOA 192# # # 1 63 -16 # 0 0 1 0 0 0 0 1 # 0 | F147: TDOA | H147: 5.0 | I147: 2 | J147: 256 | K147: 63 | M147: 1024 | N147: 1 | O147: 37.5 | P147: 9999
A148: -50 | B148: -50 | C148: 905 | E148: TDOA 193# # # 1 63 -16 # 0 0 1 0 0 0 0 1 # 0 | F148: TDOA | H148: 5.0 | I148: 2 | J148: 256 | K148: 75 | M148: 1024 | N148: 1 | O148: 37.5 | P148: 9999
A149: -50 | B149: -50 | C149: 907.4 | E149: TDOA 194# # # 1 63 -16 # 0 0 1 0 0 0 0 1 # 0 | F149: TDOA | H149: 5.0 | I149: 2 | J149: 256 | K149: 87 | M149: 1024 | N149: 1 | O149: 37.5 | P149: 9999
A150: -50 | B150: -50 | C150: 909.8 | E150: TDOA 195# # # 1 63 -16 # 0 0 1 0 0 0 0 1 # 0 | F150: TDOA | H150: 5.0 | I150: 2 | J150: 256 | K150: 99 | M150: 1024 | N150: 1 | O150: 37.5 | P150: 9999
A151: -50 | B151: -50 | C151: 912.2 | E151: TDOA 196# # # 1 63 -16 # 0 0 1 0 0 0 0 1 # 0 | F151: TDOA | H151: 5.0 | I151: 2 | J151: 256 | K151: 111 | M151: 1024 | N151: 1 | O151: 37.5 | P151: 9999
A152: -50 | B152: -50 | C152: 914.8 | E152: TDOA 197# # # 1 63 -16 # 0 0 1 0 0 0 0 1 # 0 | F152: TDOA | H152: 5.0 | I152: 2 | J152: 256 | K152: 124 | M152: 1024 | N152: 1 | O152: 37.5 | P152: 9999
A156: Test Case 10 - T1
A157: Command Prior to 10 | B157: Response | D157: Timeout | E157: Begin State | F157: End State | G157: Attempts
A158: GoT1Master | D158: 3 | E158: DSHELL | F158: DSHELL | G158: 1
A159: RunLocalT1 500 100 | B159: Bad 0 | D159: 20 | E159: DSHELL | F159: DSHELL | G159: 1
A163: Command | B163: Response | D163: Timeout | E163: Begin State | F163: End State | G163: Attempts
A164: reset | B164: Booted From: | D164: 1000 | E164: DSHELL | F164: BOOT | G164: 1
B165: GPS TIME NOW VALID | D165: 1000 | E165: BOOT | F165: DSHELL | G165: 1
A169: Test Case 11 - Ethernet
A170: Command | B170: Response | D170: Timeout | E170: Begin State | F170: End State | G170: Attempts
A171: ethtest | B171: ethtest | D171: 20 | E171: DSHELL | F171: DSHELL | G171: 1
A174: Test Case 11 - Ethernet
A175: Command | B175: Response | D175: Timeout | E175: Begin State | F175: End State | G175: Attempts
A176: Hal Open the Pod Bay Doors | B176: Hal Open the Pod Bay Doors | D176: 20 | E176: DSHELL | F176: DSHELL | G176: 1
A180: -40 | B180: 824.2 | C180: CommandSequence12B | G180: 256 | H180: 4 | I180: 128 | J180: 1024 | K180: 150 | L180: 0.5 | M180: 5
A181: -40 | B181: 829 | C181: CommandSequence12B | G181: 256 | H181: 4 | I181: 152 | J181: 1024 | K181: 150 | L181: 0.5 | M181: 5
A182: -40 | B182: 834 | C182: CommandSequence12B | G182: 256 | H182: 4 | I182: 177 | J182: 1024 | K182: 150 | L182: 0.5 | M182: 5
A183: -40 | B183: 839 | C183: CommandSequence12B | G183: 256 | H183: 4 | I183: 202 | J183: 1024 | K183: 150 | L183: 0.5 | M183: 5
A184: -40 | B184: 844 | C184: CommandSequence12B | G184: 256 | H184: 4 | I184: 227 | J184: 1024 | K184: 150 | L184: 0.5 | M184: 5
A185: -40 | B185: 848.8 | C185: CommandSequence12B | G185: 256 | H185: 4 | I185: 251 | J185: 1024 | K185: 150 | L185: 0.5 | M185: 5
A186: -40 | B186: 824.04 | C186: CommandSequence12A | G186: 256 | H186: 4 | I186: 991 | J186: 1024 | K186: 150 | L186: 0.5 | M186: 5
A187: -40 | B187: 828.98999999999546 | C187: CommandSequence12A | G187: 256 | H187: 4 | I187: 133 | J187: 1024 | K187: 150 | L187: 0.5 | M187: 5
A188: -40 | B188: 833.99999999999091 | C188: CommandSequence12A | G188: 256 | H188: 4 | I188: 300 | J188: 1024 | K188: 150 | L188: 0.5 | M188: 5
A189: -40 | B189: 839.00999999998635 | C189: CommandSequence12A | G189: 256 | H189: 4 | I189: 467 | J189: 1024 | K189: 150 | L189: 0.5 | M189: 5
A190: -40 | B190: 844.01999999998179 | C190: CommandSequence12A | G190: 256 | H190: 4 | I190: 634 | J190: 1024 | K190: 150 | L190: 0.5 | M190: 5
A191: -40 | B191: 848.96999999997729 | C191: CommandSequence12A | G191: 256 | H191: 4 | I191: 799 | J191: 1024 | K191: 150 | L191: 0.5 | M191: 5
A194: Test Case 13 - Config Attenuator
A195: Signal Generator
A196: RF Power | B196: IF Power | C196: RF Frequency | D196: IF Frequency | E196: Command | F196: Response | H196: Timeout | I196: Attempts | J196: Block Size | K196: RF Channel | L196: IF Channel | M196: TTG Channel | N196: # Samples | O196: Cnfg Attn Setting | P196: Averaging | Q196: Low Limit from previous level (dBm) | R196: High Limit from previous level (dBm)
A197: -50 | B197: -50 | C197: 895.5 | D197: 68 | E197: TDOA 71# # # 1 63 -16 # 0 0 1 0 0 0 0 1 # 0 | F197: TDOA | H197: 5 | I197: 2 | J197: 256 | K197: 28 | L197: 183 | M197: 27 | N197: 1024 | O197: 0 | P197: 1 | Q197: -60 | R197: 0
A198: -50 | B198: -50 | C198: 895.5 | D198: 68 | E198: TDOA 72# # # 1 63 -16 # 0 0 1 0 0 0 0 1 # 0 | F198: TDOA | H198: 5 | I198: 2 | J198: 256 | K198: 28 | L198: 183 | M198: 27 | N198: 1024 | O198: -8 | P198: 1 | Q198: -10 | R198: -6
A199: -50 | B199: -50 | C199: 895.5 | D199: 68 | E199: TDOA 73# # # 1 63 -16 # 0 0 1 0 0 0 0 1 # 0 | F199: TDOA | H199: 5 | I199: 2 | J199: 256 | K199: 28 | L199: 183 | M199: 27 | N199: 1024 | O199: -10 | P199: 1 | Q199: -3.3 | R199: -0.7
A200: -50 | B200: -50 | C200: 895.5 | D200: 68 | E200: TDOA 74# # # 1 63 -16 # 0 0 1 0 0 0 0 1 # 0 | F200: TDOA | H200: 5 | I200: 2 | J200: 256 | K200: 28 | L200: 183 | M200: 27 | N200: 1024 | O200: 6 | P200: 1 | Q200: 13.5 | R200: 18.5
A201: -50 | B201: -50 | C201: 895.5 | D201: 68 | E201: TDOA 75# # # 1 63 -16 # 0 0 1 0 0 0 0 1 # 0 | F201: TDOA | H201: 5 | I201: 2 | J201: 256 | K201: 28 | L201: 183 | M201: 27 | N201: 1024 | O201: 2 | P201: 1 | Q201: -5.5 | R201: -2.5
A202: -50 | B202: -50 | C202: 895.5 | D202: 68 | E202: TDOA 76# # # 1 63 -16 # 0 0 1 0 0 0 0 1 # 0 | F202: TDOA | H202: 5 | I202: 2 | J202: 256 | K202: 28 | L202: 183 | M202: 27 | N202: 1024 | O202: 1 | P202: 1 | Q202: -2 | R202: 0
A207: LO PLL
A208: 756.0 MHz | D208: 766.5 MHz | G208: 778.0 MHz
A209: eng | D209: eng | G209: eng
A210: TEST 2 5 4 3 0x00 0x00 0x50 | D210: TEST 2 5 4 3 0x00 0x00 0xD3 | G210: TEST 2 5 4 3 0x00 0x00 0x50
A211: TEST 2 5 4 3 0x10 0x17 0xA1 | D211: TEST 2 5 4 3 0x00 0x00 0x50 | G211: TEST 2 5 4 3 0x10 0x18 0x51
A212: TEST 2 5 4 3 0x00 0x12 0xD3 | D212: TEST 2 5 4 3 0x10 0x17 0xF5 | G212: TEST 2 5 4 3 0x00 0x12 0xD3
A213: exit | D213: exit | G213: exit
A217: TTG Freq
A218: 836.5 MHZ | B218: Response | D218: Timeout | E218: Begin State | F218: End State | G218: Attempts
A219: eng | D219: 0.5 | E219: DSHELL | F219: ENG | G219: 1
A220: TEST 2 5 4 5 0x00 0x00 0xD3 | D220: 1 | E220: DSHELL | F220: ENG | G220: 1
A221: TEST 2 5 4 5 0x00 0x00 0x50 | D221: 1 | E221: DSHELL | F221: ENG | G221: 1
A222: TEST 2 5 4 5 0x00 0x1B 0xFD | D222: 1 | E222: DSHELL | F222: ENG | G222: 1
A223: exit | D223: 0.5 | E223: ENG | F223: DSHELL | G223: 1
A227: Gain Setup
A228: Setup | B228: Response | D228: Timeout | E228: Begin State | F228: End State | G228: Attempts
A229: gain 1 43 | D229: 0.5 | E229: DSHELL | F229: ENG | G229: 1
A230: gain 2 43 | D230: 0.5 | E230: DSHELL | F230: ENG | G230: 1
A231: gain 3 43 | D231: 0.5 | E231: DSHELL | F231: ENG | G231: 1
A232: gain 4 43 | D232: 0.5 | E232: DSHELL | F232: ENG | G232: 1
A233: gain 5 43 | D233: 0.5 | E233: DSHELL | F233: ENG | G233: 1
A234: gain 6 43 | D234: 0.5 | E234: DSHELL | F234: ENG | G234: 1
A237: Config Atten Setup
A238: Setup | B238: Response | D238: Timeout | E238: Begin State | F238: End State | G238: Attempts
A239: gain 1 35varGain | D239: 0.5 | E239: DSHELL | F239: ENG | G239: 1
A240: gain 2 35varGain | D240: 0.5 | E240: DSHELL | F240: ENG | G240: 1
A241: gain 3 35varGain | D241: 0.5 | E241: DSHELL | F241: ENG | G241: 1
A242: gain 4 35varGain | D242: 0.5 | E242: DSHELL | F242: ENG | G242: 1
A243: gain 5 35varGain | D243: 0.5 | E243: DSHELL | F243: ENG | G243: 1
A244: gain 6 35varGain | D244: 0.5 | E244: DSHELL | F244: ENG | G244: 1
A247: Data Path Settings
A248: Data Path 1 | D248: Timeout | E248: Begin State | F248: End State | G248: Attempts
A249: eng | D249: 0.5 | E249: DSHELL | F249: ENG | G249: 1
A250: Test 1 1 0 0 0 | D250: 0.5 | E250: ENG | F250: ENG | G250: 1
A251: exit | D251: 0.5 | E251: ENG | F251: DSHELL | G251: 1
A254: Data Path 2 | D254: Timeout | E254: Begin State | F254: End State | G254: Attempts
A255: eng | D255: 0.5 | E255: DSHELL | F255: ENG | G255: 1
A256: Test 1 0 1 0 0 | D256: 0.5 | E256: ENG | F256: ENG | G256: 1
A257: exit | D257: 0.5 | E257: ENG | F257: DSHELL | G257: 1
A260: Data Path 3 | D260: Timeout | E260: Begin State | F260: End State | G260: Attempts
A261: eng | D261: 0.5 | E261: DSHELL | F261: ENG | G261: 1
A262: Test 1 0 0 1 0 | D262: 0.5 | E262: ENG | F262: ENG | G262: 1
A263: exit | D263: 0.5 | E263: ENG | F263: DSHELL | G263: 1
A266: Data Path 4 | D266: Timeout | E266: Begin State | F266: End State | G266: Attempts
A267: eng | D267: 0.5 | E267: DSHELL | F267: ENG | G267: 1
A268: Test 1 0 0 0 1 | D268: 0.5 | E268: ENG | F268: ENG | G268: 1
A269: exit | D269: 0.5 | E269: ENG | F269: DSHELL | G269: 1
A272: Data Path 5 | D272: Timeout | E272: Begin State | F272: End State | G272: Attempts
A273: eng | D273: 0.5 | E273: DSHELL | F273: ENG | G273: 1
A274: Test 1 1 1 1 1 | D274: 0.5 | E274: ENG | F274: ENG | G274: 1
A275: exit | D275: 0.5 | E275: ENG | F275: DSHELL | G275: 1
A278: Compensation Settings
A279: Receiver compensated gain | D279: Timeout | E279: Begin State | F279: End State | G279: Attempts
A280: eng | D280: 0.5 | E280: DSHELL | F280: ENG | G280: 1
A281: Test 4 0xA4 0x48 6 | B281: DATA Read: | D281: 1 | E281: ENG | F281: ENG | G281: 1
A282: TEST 4 0xA4 0x1F 1 | B282: DATA Read: 41 | D282: 1 | E282: ENG | F282: ENG | G282: 1
A283: Test 4 0xA4 0x30 6 | B283: DATA Read: | D283: 1 | E283: ENG | F283: ENG | G283: 1
A284: exit | D284: 0.5 | E284: ENG | F284: DSHELL | G284: 1
A287: TTG compensated Level | D287: Timeout | E287: Begin State | F287: End State | G287: Attempts
A288: eng | D288: 0.5 | E288: DSHELL | F288: ENG | G288: 1
A289: Test 4 0xA4 0x42 6 | B289: DATA Read: | D289: 1 | E289: ENG | F289: ENG | G289: 1
A290: TEST 4 0xA4 0x1F 1 | B290: DATA Read: 41 | D290: 1 | E290: ENG | F290: ENG | G290: 1 | H290: Note: | I290: If we get DATA Read: 41, then the software will skip
A291: Test 4 0xA4 0x2A 6 | B291: DATA Read: | D291: 1 | E291: ENG | F291: ENG | G291: 1 | I291: over the next line and go directly to exit
A292: exit | D292: 0.5 | E292: ENG | F292: DSHELL | G292: 1
A295: Receiver Gain Compensation | D295: Timeout | E295: Begin State | F295: End State | G295: Attempts
A296: eng | D296: 0.5 | E296: DSHELL | F296: ENG | G296: 1
A297: TEST 4 0xA4 0x1F 1 | B297: DATA Read: 41 | D297: 0.5 | E297: ENG | F297: ENG | G297: 1
A298: Test 4 0xA4 0x20 6 | B298: DATA Read: | D298: 0.5 | E298: ENG | F298: ENG | G298: 1
A299: exit | D299: 0.5 | E299: ENG | F299: DSHELL | G299: 1
A302: EnableTTG | B302: Response | D302: Timeout | E302: Begin State | F302: End State | G302: Attempts
A303: eng | D303: 0.5 | E303: DSHELL | F303: ENG | G303: 1
A304: TEST 2 3 8 6 8 | D304: 0.5 | E304: ENG | F304: ENG | G304: 1
A305: TEST 2 3 4 4 5 | D305: 0.5 | E305: ENG | F305: ENG | G305: 1
A306: TEST 2 3 4 6 1 | D306: 0.5 | E306: ENG | F306: ENG | G306: 1
A307: exit | D307: 0.5 | E307: ENG | F307: DSHELL | G307: 1
A310: DisableTTG | D310: Timeout | E310: Begin State | F310: End State | G310: Attempts
A311: eng | D311: 0.5 | E311: DSHELL | F311: ENG | G311: 1
A312: TEST 2 3 8 6 5 | D312: 0.5 | E312: ENG | F312: ENG | G312: 1
A313: TEST 2 3 4 4 1 | D313: 0.5 | E313: ENG | F313: ENG | G313: 1
A314: TEST 2 3 4 6 0 | D314: 0.5 | E314: ENG | F314: ENG | G314: 1
A315: exit | D315: 0.5 | E315: ENG | F315: DSHELL | G315: 1
A318: Mute On | D318: Timeout | E318: Begin State | F318: End State | G318: Attempts
A319: eng | D319: 0.5 | E319: DSHELL | F319: ENG | G319: 1
A320: TEST 2 3 8 6 8 | D320: 0.5 | E320: ENG | F320: ENG | G320: 1
A321: exit | D321: 0.5 | E321: ENG | F321: DSHELL | G321: 1
A324: Mute Off | D324: Timeout | E324: Begin State | F324: End State | G324: Attempts
A325: eng | D325: 0.5 | E325: DSHELL | F325: ENG | G325: 1
A326: TEST 2 3 8 6 5 | D326: 0.5 | E326: ENG | F326: ENG | G326: 1
A327: exit | D327: 0.5 | E327: ENG | F327: DSHELL | G327: 1
A330: Change Admin State
A331: Command | B331: Response | D331: Timeout | E331: Begin State | F331: End State | G331: # of retries
A332: etest 15 1 | D332: 2 | E332: DSHELL | F332: DSHELL | G332: 1
A336: Check Alarms
A337: Command | B337: Response | D337: Timeout | E337: Begin State | F337: End State | G337: # of retries
A338: ALARMS | B338: FAULT_GPS_HOLDOVER | D338: 2 | E338: DSHELL | F338: DSHELL | G338: 1
A342: Mini-RLS Command Sequence 12A (AMPS)
A343: Command | B343: Response | D343: Timeout | E343: Begin State | F343: End State | G343: # of retries
A344: ALARMS | B344: FAULT_GPS_HOLDOVER | D344: 2 | E344: DSHELL | F344: DSHELL | G344: 1
A345: TIME | B345: GPS Time: | D345: 2 | E345: DSHELL | F345: DSHELL | G345: 2
A346: SVCR # # 2 # # 0 1 0 0 0 1 1 1 # 0 0 | B346: returnCode 0 | D346: 2 | E346: DSHELL | F346: DSHELL | G346: 1
A347: WAIT | D347: 15 | E347: DSHELL | F347: DSHELL | G347: 1
A348: TDATA # 0 2 # # # -16 0 1 0 0 11 0 63 -16 | B348: TDOA | D348: 15 | E348: DSHELL | F348: DSHELL | G348: 1
A352: Mini-RLS Command Sequence 12B (GSM)
A353: Command | B353: Response | D353: Timeout | E353: Begin State | F353: End State | G353: # of retries
A354: ALARMS | B354: FAULT_GPS_HOLDOVER | D354: 2 | E354: DSHELL | F354: DSHELL | G354: 1
A355: TIME | B355: GPS Time: | D355: 2 | E355: DSHELL | F355: DSHELL | G355: 2
A356: GVCR # 2 # # 0 # 0 # # 17 1 0 0 0 0 0 0 1 1 1 8 0 0 0 0 0 0 0 0 0 0 0 | B356: returnCode 0 | D356: 2 | E356: DSHELL | F356: DSHELL | G356: 1
A357: WAIT | D357: 15 | E357: DSHELL | F357: DSHELL | G357: 1
A358: TDATA # 0 2 # # # -16 0 1 0 0 11 0 63 -16 | B358: TDOA | D358: 15 | E358: DSHELL | F358: DSHELL | G358: 1

Sheet: 06163901
C1: Factors
C2: TTG | D2: 50
C3: Gain | D3: 300
C4: TTG Comp | D4: 100
C5: Gain Comp | D5: 250
F8: Temperature Coefficient | J8: Center Temperature
F10: -3.5000000000000003E-2 | H10: dB/deg | J10: 30 | L10: deg
A15: Test Case 2 - Processor Memory
A16: Command | B16: Response | D16: Timeout | E16: Begin State | F16: End State | G16: Attempts
A17: BIT 4 1 | B17: No Failure | D17: 20 | E17: DSHELL | F17: DSHELL | G17: 1
A18: BIT 4 2 | B18: No Failure | D18: 20 | E18: DSHELL | F18: DSHELL | G18: 1
A19: BIT 4 3 | B19: No Failure | D19: 20 | E19: DSHELL | F19: DSHELL | G19: 1
A20: BIT 4 4 | B20: No Failure | D20: 20 | E20: DSHELL | F20: DSHELL | G20: 1
A24: Test Case 3 - SNR
A25: Signal Generator
A26: RF Power | B26: IF Power | C26: RF Frequency | D26: IF Frequency | E26: Command | F26: Response | H26: Timeout | I26: Attempts | J26: Block Size | K26: RF Channel | L26: IF Channel | M26: TTG Channel | N26: # Samples | O26: Averaging | P26: Low Limit | Q26: High Limit
A27: -40 | B27: -40 | C27: 876.2 | D27: 70 | E27: TDOA 31# # # 1 63 -16 # 0 0 1 0 0 0 0 1 # 0 | F27: TDOA | H27: 5.0 | I27: 2 | J27: 256 | K27: 955 | L27: 6 | N27: 1024 | O27: 1 | P27: 37.5 | Q27: 9999
A29: -40 | B29: -40 | C29: 878.6 | D29: 70 | E29: TDOA 32# # # 1 63 -16 # 0 0 1 0 0 0 0 1 # 0 | F29: TDOA | H29: 5.0 | I29: 2 | J29: 256 | K29: 967 | L29: 86 | N29: 1024 | O29: 1 | P29: 37.5 | Q29: 9999
A30: -40 | B30: -40 | C30: 881 | D30: 70 | E30: TDOA 33# # # 1 63 -16 # 0 0 1 0 0 0 0 1 # 0 | F30: TDOA | H30: 5.0 | I30: 2 | J30: 256 | K30: 979 | L30: 33 | N30: 1024 | O30: 1 | P30: 37.5 | Q30: 9999
A31: -40 | B31: -40 | C31: 883.4 | D31: 70 | E31: TDOA 34# # # 1 63 -16 # 0 0 1 0 0 0 0 1 # 0 | F31: TDOA | H31: 5.0 | I31: 2 | J31: 256 | K31: 991 | L31: 116 | N31: 1024 | O31: 1 | P31: 37.5 | Q31: 9999
A32: -40 | B32: -40 | C32: 885.8 | D32: 70 | E32: TDOA 35# # # 1 63 -16 # 0 0 1 0 0 0 0 1 # 0 | F32: TDOA | H32: 5.0 | I32: 2 | J32: 256 | K32: 1003 | L32: 29 | N32: 1024 | O32: 1 | P32: 37.5 | Q32: 9999
A33: -40 | B33: -40 | C33: 888.2 | D33: 70 | E33: TDOA 36# # # 1 63 -16 # 0 0 1 0 0 0 0 1 # 0 | F33: TDOA | H33: 5.0 | I33: 2 | J33: 256 | K33: 1015 | L33: 109 | N33: 1024 | O33: 1 | P33: 37.5 | Q33: 9999
A34: -40 | B34: -40 | C34: 890.6 | D34: 70 | E34: TDOA 37# # # 1 63 -16 # 0 0 1 0 0 0 0 1 # 0 | F34: TDOA | H34: 5.0 | I34: 2 | J34: 256 | K34: 3 | L34: 23 | N34: 1024 | O34: 1 | P34: 37.5 | Q34: 9999
A35: -40 | B35: -40 | C35: 893 | D35: 70 | E35: TDOA 38# # # 1 63 -16 # 0 0 1 0 0 0 0 1 # 0 | F35: TDOA | H35: 5.0 | I35: 2 | J35: 256 | K35: 15 | L35: 103 | N35: 1024 | O35: 1 | P35: 37.5 | Q35: 9999
A36: -40 | B36: -40 | C36: 895.4 | D36: 70 | E36: TDOA 39# # # 1 63 -16 # 0 0 1 0 0 0 0 1 # 0 | F36: TDOA | H36: 5.0 | I36: 2 | J36: 256 | K36: 27 | L36: 183 | N36: 1024 | O36: 1 | P36: 37.5 | Q36: 9999
A37: -40 | B37: -40 | C37: 897.8 | D37: 70 | E37: TDOA 130# # # 1 63 -16 # 0 0 1 0 0 0 0 1 # 0 | F37: TDOA | H37: 5.0 | I37: 2 | J37: 256 | K37: 39 | L37: 263 | N37: 1024 | O37: 1 | P37: 37.5 | Q37: 9999
A38: -40 | B38: -40 | C38: 900.2 | D38: 70 | E38: TDOA 131# # # 1 63 -16 # 0 0 1 0 0 0 0 1 # 0 | F38: TDOA | H38: 5.0 | I38: 2 | J38: 256 | K38: 51 | L38: 343 | N38: 1024 | O38: 1 | P38: 37.5 | Q38: 9999
A39: -40 | B39: -40 | C39: 902.6 | D39: 70 | E39: TDOA 132# # # 1 63 -16 # 0 0 1 0 0 0 0 1 # 0 | F39: TDOA | H39: 5.0 | I39: 2 | J39: 256 | K39: 63 | L39: 423 | N39: 1024 | O39: 1 | P39: 37.5 | Q39: 9999
A40: -40 | B40: -40 | C40: 905 | D40: 70 | E40: TDOA 133# # # 1 63 -16 # 0 0 1 0 0 0 0 1 # 0 | F40: TDOA | H40: 5.0 | I40: 2 | J40: 256 | K40: 75 | L40: 503 | N40: 1024 | O40: 1 | P40: 37.5 | Q40: 9999
A41: -40 | B41: -40 | C41: 907.4 | D41: 70 | E41: TDOA 134# # # 1 63 -16 # 0 0 1 0 0 0 0 1 # 0 | F41: TDOA | H41: 5.0 | I41: 2 | J41: 256 | K41: 87 | L41: 583 | N41: 1024 | O41: 1 | P41: 37.5 | Q41: 9999
A42: -40 | B42: -40 | C42: 909.8 | D42: 70 | E42: TDOA 135# # # 1 63 -16 # 0 0 1 0 0 0 0 1 # 0 | F42: TDOA | H42: 5.0 | I42: 2 | J42: 256 | K42: 99 | L42: 663 | N42: 1024 | O42: 1 | P42: 37.5 | Q42: 9999
A43: -40 | B43: -40 | C43: 912.2 | D43: 70 | E43: TDOA 136# # # 1 63 -16 # 0 0 1 0 0 0 0 1 # 0 | F43: TDOA | H43: 5.0 | I43: 2 | J43: 256 | K43: 111 | L43: 743 | N43: 1024 | O43: 1 | P43: 37.5 | Q43: 9999
A44: -40 | B44: -40 | C44: 914.8 | D44: 70 | E44: TDOA 137# # # 1 63 -16 # 0 0 1 0 0 0 0 1 # 0 | F44: TDOA | H44: 1 | I44: 2 | J44: 256 | K44: 124 | L44: 829 | N44: 1024 | O44: 1 | P44: 37.5 | Q44: 9999
A48: Test Case 5 - Two-Tone Response
B49: SigGen1 | D49: SigGen2
A50: Center RF Channel | B50: RF Frequency | C50: RF Power | D50: RF Frequency | E50: Command | F50: Response | G50: Timeout | H50: Attempts | I50: Block Size | J50: Lower Channel | K50: Upper Channel | L50: # Samples | M50: Cnfg Attn | N50: Averaging | O50: Low Limit | P50: High Limit | Q50: Lower Channel Delta | R50: Upper Channel Delta
A51: 876.2 | B51: 876.14 | C51: -45 | D51: 876.26 | E51: TDOA 51# # # 1 63 -16 # 0 0 1 0 0 0 0 1 # 0 | F51: TDOA | G51: 5.0 | H51: 2 | I51: 256 | J51: 955 | K51: 955 | L51: 1024 | M51: 1 | N51: 1 | O51: -999 | P51: -65 | Q51: 1 | R51: 1
A53: 878.6 | B53: 878.54 | C53: -45 | D53: 878.66 | E53: TDOA 52# # # 1 63 -16 # 0 0 1 0 0 0 0 1 # 0 | F53: TDOA | G53: 5.0 | H53: 2 | I53: 256 | J53: 967 | K53: 967 | L53: 1024 | M53: 1 | N53: 1 | O53: -999 | P53: -65 | Q53: 1 | R53: 1
A54: 881 | B54: 880.94 | C54: -45 | D54: 881.06 | E54: TDOA 53# # # 1 63 -16 # 0 0 1 0 0 0 0 1 # 0 | F54: TDOA | G54: 5.0 | H54: 2 | I54: 256 | J54: 979 | K54: 979 | L54: 1024 | M54: 1 | N54: 1 | O54: -999 | P54: -65 | Q54: 1 | R54: 1
A55: 883.4 | B55: 883.34 | C55: -45 | D55: 883.46 | E55: TDOA 54# # # 1 63 -16 # 0 0 1 0 0 0 0 1 # 0 | F55: TDOA | G55: 5.0 | H55: 2 | I55: 256 | J55: 991 | K55: 991 | L55: 1024 | M55: 1 | N55: 1 | O55: -999 | P55: -65 | Q55: 1 | R55: 1
A56: 885.8 | B56: 885.74 | C56: -45 | D56: 885.86 | E56: TDOA 55# # # 1 63 -16 # 0 0 1 0 0 0 0 1 # 0 | F56: TDOA | G56: 5.0 | H56: 2 | I56: 256 | J56: 1003 | K56: 1003 | L56: 1024 | M56: 1 | N56: 1 | O56: -999 | P56: -65 | Q56: 1 | R56: 1
A57: 888.2 | B57: 888.14 | C57: -45 | D57: 888.26 | E57: TDOA 56# # # 1 63 -16 # 0 0 1 0 0 0 0 1 # 0 | F57: TDOA | G57: 5.0 | H57: 2 | I57: 256 | J57: 1015 | K57: 1015 | L57: 1024 | M57: 1 | N57: 1 | O57: -999 | P57: -65 | Q57: 1 | R57: 1
A58: 890.6 | B58: 890.54 | C58: -45 | D58: 890.66 | E58: TDOA 57# # # 1 63 -16 # 0 0 1 0 0 0 0 1 # 0 | F58: TDOA | G58: 5.0 | H58: 2 | I58: 256 | J58: 3 | K58: 3 | L58: 1024 | M58: 1 | N58: 1 | O58: -999 | P58: -65 | Q58: 1 | R58: 1
A59: 893 | B59: 892.94 | C59: -45 | D59: 893.06 | E59: TDOA 58# # # 1 63 -16 # 0 0 1 0 0 0 0 1 # 0 | F59: TDOA | G59: 5.0 | H59: 2 | I59: 256 | J59: 15 | K59: 15 | L59: 1024 | M59: 1 | N59: 1 | O59: -999 | P59: -65 | Q59: 1 | R59: 1
A60: 895.4 | B60: 895.34 | C60: -45 | D60: 895.46 | E60: TDOA 59# # # 1 63 -16 # 0 0 1 0 0 0 0 1 # 0 | F60: TDOA | G60: 5.0 | H60: 2 | I60: 256 | J60: 27 | K60: 27 | L60: 1024 | M60: 1 | N60: 1 | O60: -999 | P60: -65 | Q60: 1 | R60: 1
A61: 897.8 | B61: 897.74 | C61: -45 | D61: 897.86 | E61: TDOA 150# # # 1 63 -16 # 0 0 1 0 0 0 0 1 # 0 | F61: TDOA | G61: 5.0 | H61: 2 | I61: 256 | J61: 39 | K61: 39 | L61: 1024 | M61: 1 | N61: 1 | O61: -999 | P61: -65 | Q61: 1 | R61: 1
A62: 900.2 | B62: 900.14 | C62: -45 | D62: 900.26 | E62: TDOA 151# # # 1 63 -16 # 0 0 1 0 0 0 0 1 # 0 | F62: TDOA | G62: 5.0 | H62: 2 | I62: 256 | J62: 51 | K62: 51 | L62: 1024 | M62: 1 | N62: 1 | O62: -999 | P62: -65 | Q62: 1 | R62: 1
A63: 902.6 | B63: 902.54 | C63: -45 | D63: 902.66 | E63: TDOA 152# # # 1 63 -16 # 0 0 1 0 0 0 0 1 # 0 | F63: TDOA | G63: 5.0 | H63: 2 | I63: 256 | J63: 63 | K63: 63 | L63: 1024 | M63: 1 | N63: 1 | O63: -999 | P63: -65 | Q63: 1 | R63: 1
A64: 905 | B64: 904.94 | C64: -45 | D64: 905.06 | E64: TDOA 153# # # 1 63 -16 # 0 0 1 0 0 0 0 1 # 0 | F64: TDOA | G64: 5.0 | H64: 2 | I64: 256 | J64: 75 | K64: 75 | L64: 1024 | M64: 1 | N64: 1 | O64: -999 | P64: -65 | Q64: 1 | R64: 1
A65: 907.4 | B65: 907.34 | C65: -45 | D65: 907.46 | E65: TDOA 154# # # 1 63 -16 # 0 0 1 0 0 0 0 1 # 0 | F65: TDOA | G65: 5.0 | H65: 2 | I65: 256 | J65: 87 | K65: 87 | L65: 1024 | M65: 1 | N65: 1 | O65: -999 | P65: -65 | Q65: 1 | R65: 1
A66: 909.8 | B66: 909.74 | C66: -45 | D66: 909.86 | E66: TDOA 155# # # 1 63 -16 # 0 0 1 0 0 0 0 1 # 0 | F66: TDOA | G66: 5.0 | H66: 2 | I66: 256 | J66: 99 | K66: 99 | L66: 1024 | M66: 1 | N66: 1 | O66: -999 | P66: -65 | Q66: 1 | R66: 1
A67: 912.2 | B67: 912.14 | C67: -45 | D67: 912.26 | E67: TDOA 156# # # 1 63 -16 # 0 0 1 0 0 0 0 1 # 0 | F67: TDOA | G67: 5.0 | H67: 2 | I67: 256 | J67: 111 | K67: 111 | L67: 1024 | M67: 1 | N67: 1 | O67: -999 | P67: -65 | Q67: 1 | R67: 1
A68: 914.8 | B68: 914.74 | C68: -45 | D68: 914.86 | E68: TDOA 157# # # 1 63 -16 # 0 0 1 0 0 0 0 1 # 0 | F68: TDOA | G68: 5.0 | H68: 2 | I68: 256 | J68: 124 | K68: 124 | L68: 1024 | M68: 1 | N68: 1 | O68: -999 | P68: -65 | Q68: 1 | R68: 1
A72: Test Case 6 - Phase Noise
A73: Signal Generator
A74: RF Power | B74: IF Power | C74: RF Frequency | D74: IF Frequency | E74: Command | F74: Response | G74: Timeout | H74: Attempts | I74: Block Size | J74: RF Channel | K74: IF Channel | L74: # Samples | M74: Averaging | N74: Low Limit | O74: High Limit
A75: -40 | B75: -40 | C75: 876.2 | D75: 70 | E75: TDOA 61# # # 1 63 -16 # 0 0 1 0 0 0 0 1 # 0 | F75: TDOA | G75: 5.0 | H75: 2 | I75: 256 | J75: 955 | L75: 1024 | M75: 8 | N75: 0 | O75: 3
A77: -40 | B77: -40 | C77: 878.6 | D77: 70 | E77: TDOA 62# # # 1 63 -16 # 0 0 1 0 0 0 0 1 # 0 | F77: TDOA | G77: 5.0 | H77: 2 | I77: 256 | J77: 967 | L77: 1024 | M77: 8 | N77: 0 | O77: 3
A78: -40 | B78: -40 | C78: 881 | D78: 70 | E78: TDOA 63# # # 1 63 -16 # 0 0 1 0 0 0 0 1 # 0 | F78: TDOA | G78: 5.0 | H78: 2 | I78: 256 | J78: 979 | L78: 1024 | M78: 8 | N78: 0 | O78: 3
A79: -40 | B79: -40 | C79: 883.4 | D79: 70 | E79: TDOA 64# # # 1 63 -16 # 0 0 1 0 0 0 0 1 # 0 | F79: TDOA | G79: 5.0 | H79: 2 | I79: 256 | J79: 991 | L79: 1024 | M79: 8 | N79: 0 | O79: 3
A80: -40 | B80: -40 | C80: 885.8 | D80: 70 | E80: TDOA 65# # # 1 63 -16 # 0 0 1 0 0 0 0 1 # 0 | F80: TDOA | G80: 5.0 | H80: 2 | I80: 256 | J80: 1003 | L80: 1024 | M80: 8 | N80: 0 | O80: 3
A81: -40 | B81: -40 | C81: 888.2 | D81: 70 | E81: TDOA 66# # # 1 63 -16 # 0 0 1 0 0 0 0 1 # 0 | F81: TDOA | G81: 5.0 | H81: 2 | I81: 256 | J81: 1015 | L81: 1024 | M81: 8 | N81: 0 | O81: 3
A82: -40 | B82: -40 | C82: 890.6 | D82: 70 | E82: TDOA 67# # # 1 63 -16 # 0 0 1 0 0 0 0 1 # 0 | F82: TDOA | G82: 5.0 | H82: 2 | I82: 256 | J82: 3 | L82: 1024 | M82: 8 | N82: 0 | O82: 3
A83: -40 | B83: -40 | C83: 893 | D83: 70 | E83: TDOA 68# # # 1 63 -16 # 0 0 1 0 0 0 0 1 # 0 | F83: TDOA | G83: 5.0 | H83: 2 | I83: 256 | J83: 15 | L83: 1024 | M83: 8 | N83: 0 | O83: 3
A84: -40 | B84: -40 | C84: 895.4 | D84: 70 | E84: TDOA 69# # # 1 63 -16 # 0 0 1 0 0 0 0 1 # 0 | F84: TDOA | G84: 5.0 | H84: 2 | I84: 256 | J84: 27 | L84: 1024 | M84: 8 | N84: 0 | O84: 3
A85: -40 | B85: -40 | C85: 897.8 | D85: 70 | E85: TDOA 60# # # 1 63 -16 # 0 0 1 0 0 0 0 1 # 0 | F85: TDOA | G85: 5.0 | H85: 2 | I85: 256 | J85: 39 | L85: 1024 | M85: 8 | N85: 0 | O85: 3
A86: -40 | B86: -40 | C86: 900.2 | D86: 70 | E86: TDOA 161# # # 1 63 -16 # 0 0 1 0 0 0 0 1 # 0 | F86: TDOA | G86: 5.0 | H86: 2 | I86: 256 | J86: 51 | L86: 1024 | M86: 8 | N86: 0 | O86: 3
A87: -40 | B87: -40 | C87: 902.6 | D87: 70 | E87: TDOA 162# # # 1 63 -16 # 0 0 1 0 0 0 0 1 # 0 | F87: TDOA | G87: 5.0 | H87: 2 | I87: 256 | J87: 63 | L87: 1024 | M87: 8 | N87: 0 | O87: 3
A88: -40 | B88: -40 | C88: 905 | D88: 70 | E88: TDOA 163# # # 1 63 -16 # 0 0 1 0 0 0 0 1 # 0 | F88: TDOA | G88: 5.0 | H88: 2 | I88: 256 | J88: 75 | L88: 1024 | M88: 8 | N88: 0 | O88: 3
A89: -40 | B89: -40 | C89: 907.4 | D89: 70 | E89: TDOA 164# # # 1 63 -16 # 0 0 1 0 0 0 0 1 # 0 | F89: TDOA | G89: 5.0 | H89: 2 | I89: 256 | J89: 87 | L89: 1024 | M89: 8 | N89: 0 | O89: 3
A90: -40 | B90: -40 | C90: 909.8 | D90: 70 | E90: TDOA 165# # # 1 63 -16 # 0 0 1 0 0 0 0 1 # 0 | F90: TDOA | G90: 5.0 | H90: 2 | I90: 256 | J90: 99 | L90: 1024 | M90: 8 | N90: 0 | O90: 3
A91: -40 | B91: -40 | C91: 912.2 | D91: 70 | E91: TDOA 166# # # 1 63 -16 # 0 0 1 0 0 0 0 1 # 0 | F91: TDOA | G91: 5.0 | H91: 2 | I91: 256 | J91: 111 | L91: 1024 | M91: 8 | N91: 0 | O91: 3
A92: -40 | B92: -40 | C92: 914.8 | D92: 70 | E92: TDOA 167# # # 1 63 -16 # 0 0 1 0 0 0 0 1 # 0 | F92: TDOA | G92: 5.0 | H92: 2 | I92: 256 | J92: 124 | L92: 1024 | M92: 8 | N92: 0 | O92: 3
A96: Test Case 7 - Data Integrity
A97: Signal Generator
A98: RF Power | B98: IF Power | C98: RF Frequency | D98: IF Frequency | E98: Command | F98: Response | H98: Timeout | I98: Attempts | J98: Block Size | K98: RF Channel | L98: IF Channel | M98: TTG Channel | N98: # Samples | O98: Cnfg Attn | P98: Averaging | Q98: Low Limit | R98: High Limit
A99: -40 | B99: -40 | C99: 895.5 | D99: 68 | E99: TDOA 71# # # 1 63 -16 # 0 0 1 0 0 0 0 1 # 0 | F99: TDOA | H99: 5.0 | I99: 2 | J99: 256 | K99: 28 | L99: 183 | M99: 27 | N99: 1024 | O99: 1 | P99: 1 | Q99: 37.5 | R99: 9999
A100: -40 | B100: -40 | C100: 895.5 | D100: 68 | E100: TDOA 72# # # 1 63 -16 # 0 0 1 0 0 0 0 1 # 0 | F100: TDOA | H100: 5.0 | I100: 2 | J100: 256 | K100: 28 | L100: 183 | M100: 27 | N100: 1024 | O100: 1 | P100: 1 | Q100: 37.5 | R100: 9999
A101: -40 | B101: -40 | C101: 895.5 | D101: 68 | E101: TDOA 73# # # 1 63 -16 # 0 0 1 0 0 0 0 1 # 0 | F101: TDOA | H101: 5.0 | I101: 2 | J101: 256 | K101: 28 | L101: 183 | M101: 27 | N101: 1024 | O101: 1 | P101: 1 | Q101: 37.5 | R101: 9999
A102: -40 | B102: -40 | C102: 895.5 | D102: 68 | E102: TDOA 74# # # 1 63 -16 # 0 0 1 0 0 0 0 1 # 0 | F102: TDOA | H102: 5.0 | I102: 2 | J102: 256 | K102: 28 | L102: 183 | M102: 27 | N102: 1024 | O102: 1 | P102: 1 | Q102: 37.5 | R102: 9999
A103: -40 | B103: -40 | C103: 895.5 | D103: 68 | E103: TDOA 75# # # 1 63 -16 # 0 0 1 0 0 0 0 1 # 0 | F103: TDOA | H103: 5.0 | I103: 2 | J103: 256 | K103: 28 | L103: 183 | M103: 27 | N103: 1024 | O103: 1 | P103: 1 | Q103: 37.5 | R103: 9999
A107: Test Case 8 - Noise Floor
A108: Signal Generator
A109: RF Power | B109: IF Power | C109: RF Frequency | D109: IF Frequency | E109: Command | F109: Response | H109: Timeout | I109: Attempts | J109: Block Size | K109: RF Channel | L109: IF Channel | M109: # Samples | N109: Cnfg Attn | O109: Averaging | P109: Signal Averaging | Q109: Low Limit | R109: High Limit | S109: Low Limit Gain | T109: High Limit Gain
A110: -45 | C110: 876.2 | D110: 70 | E110: TDOA 81# # # 1 63 -16 # 0 0 1 0 0 0 0 1 # 0 | F110: TDOA | H110: 5.0 | I110: 2 | J110: 256 | K110: 955 | L110: 6 | M110: 1024 | N110: 0 | O110: 8 | P110: 1 | Q110: -174 | R110: -131 | S110: 30 | T110: 36
A112: -45 | C112: 878.6 | D112: 70 | E112: TDOA 82# # # 1 63 -16 # 0 0 1 0 0 0 0 1 # 0 | F112: TDOA | H112: 5.0 | I112: 2 | J112: 256 | K112: 967 | L112: 86 | M112: 1024 | N112: 0 | O112: 8 | P112: 1 | Q112: -174 | R112: -131 | S112: 30 | T112: 36
A113: -45 | C113: 881 | D113: 70 | E113: TDOA 83# # # 1 63 -16 # 0 0 1 0 0 0 0 1 # 0 | F113: TDOA | H113: 5.0 | I113: 2 | J113: 256 | K113: 979 | L113: 33 | M113: 1024 | N113: 0 | O113: 8 | P113: 1 | Q113: -174 | R113: -131 | S113: 30 | T113: 36
A114: -45 | C114: 883.4 | D114: 70 | E114: TDOA 84# # # 1 63 -16 # 0 0 1 0 0 0 0 1 # 0 | F114: TDOA | H114: 5.0 | I114: 2 | J114: 256 | K114: 991 | L114: 116 | M114: 1024 | N114: 0 | O114: 8 | P114: 1 | Q114: -174 | R114: -131 | S114: 30 | T114: 36
A115: -45 | C115: 885.8 | D115: 70 | E115: TDOA 85# # # 1 63 -16 # 0 0 1 0 0 0 0 1 # 0 | F115: TDOA | H115: 5.0 | I115: 2 | J115: 256 | K115: 1003 | L115: 29 | M115: 1024 | N115: 0 | O115: 8 | P115: 1 | Q115: -174 | R115: -131 | S115: 30 | T115: 36
A116: -45 | C116: 888.2 | D116: 70 | E116: TDOA 86# # # 1 63 -16 # 0 0 1 0 0 0 0 1 # 0 | F116: TDOA | H116: 5.0 | I116: 2 | J116: 256 | K116: 1015 | L116: 109 | M116: 1024 | N116: 0 | O116: 8 | P116: 1 | Q116: -174 | R116: -131 | S116: 30 | T116: 36
A117: -45 | C117: 890.6 | D117: 70 | E117: TDOA 87# # # 1 63 -16 # 0 0 1 0 0 0 0 1 # 0 | F117: TDOA | H117: 5.0 | I117: 2 | J117: 256 | K117: 3 | L117: 23 | M117: 1024 | N117: 0 | O117: 8 | P117: 1 | Q117: -174 | R117: -131 | S117: 30 | T117: 36
A118: -45 | C118: 893 | D118: 70 | E118: TDOA 88# # # 1 63 -16 # 0 0 1 0 0 0 0 1 # 0 | F118: TDOA | H118: 5.0 | I118: 2 | J118: 256 | K118: 15 | L118: 103 | M118: 1024 | N118: 0 | O118: 8 | P118: 1 | Q118: -174 | R118: -131 | S118: 30 | T118: 36
A119: -45 | C119: 895.4 | D119: 70 | E119: TDOA 89# # # 1 63 -16 # 0 0 1 0 0 0 0 1 # 0 | F119: TDOA | H119: 5.0 | I119: 2 | J119: 256 | K119: 27 | L119: 183 | M119: 1024 | N119: 0 | O119: 8 | P119: 1 | Q119: -174 | R119: -131 | S119: 30 | T119: 36
A120: -45 | C120: 897.8 | D120: 70 | E120: TDOA 80# # # 1 63 -16 # 0 0 1 0 0 0 0 1 # 0 | F120: TDOA | H120: 5.0 | I120: 2 | J120: 256 | K120: 39 | L120: 263 | M120: 1024 | N120: 0 | O120: 8 | P120: 1 | Q120: -174 | R120: -131 | S120: 30 | T120: 36
A121: -45 | C121: 900.2 | D121: 70 | E121: TDOA 181# # # 1 63 -16 # 0 0 1 0 0 0 0 1 # 0 | F121: TDOA | H121: 5.0 | I121: 2 | J121: 256 | K121: 51 | L121: 343 | M121: 1024 | N121: 0 | O121: 8 | P121: 1 | Q121: -174 | R121: -131 | S121: 30 | T121: 36
A122: -45 | C122: 902.6 | D122: 70 | E122: TDOA 182# # # 1 63 -16 # 0 0 1 0 0 0 0 1 # 0 | F122: TDOA | H122: 5.0 | I122: 2 | J122: 256 | K122: 63 | L122: 423 | M122: 1024 | N122: 0 | O122: 8 | P122: 1 | Q122: -174 | R122: -131 | S122: 30 | T122: 36
A123: -45 | C123: 905 | D123: 70 | E123: TDOA 183# # # 1 63 -16 # 0 0 1 0 0 0 0 1 # 0 | F123: TDOA | H123: 5.0 | I123: 2 | J123: 256 | K123: 75 | L123: 503 | M123: 1024 | N123: 0 | O123: 8 | P123: 1 | Q123: -174 | R123: -131 | S123: 30 | T123: 36
A124: -45 | C124: 907.4 | D124: 70 | E124: TDOA 184# # # 1 63 -16 # 0 0 1 0 0 0 0 1 # 0 | F124: TDOA | H124: 5.0 | I124: 2 | J124: 256 | K124: 87 | L124: 583 | M124: 1024 | N124: 0 | O124: 8 | P124: 1 | Q124: -174 | R124: -131 | S124: 30 | T124: 36
A125: -45 | C125: 909.8 | D125: 70 | E125: TDOA 185# # # 1 63 -16 # 0 0 1 0 0 0 0 1 # 0 | F125: TDOA | H125: 5.0 | I125: 2 | J125: 256 | K125: 99 | L125: 663 | M125: 1024 | N125: 0 | O125: 8 | P125: 1 | Q125: -174 | R125: -131 | S125: 30 | T125: 36
A126: -45 | C126: 912.2 | D126: 70 | E126: TDOA 186# # # 1 63 -16 # 0 0 1 0 0 0 0 1 # 0 | F126: TDOA | H126: 5.0 | I126: 2 | J126: 256 | K126: 111 | L126: 743 | M126: 1024 | N126: 0 | O126: 8 | P126: 1 | Q126: -174 | R126: -131 | S126: 30 | T126: 36
A127: -45 | C127: 914.8 | D127: 70 | E127: TDOA 187# # # 1 63 -16 # 0 0 1 0 0 0 0 1 # 0 | F127: TDOA | H127: 5.0 | I127: 2 | J127: 256 | K127: 124 | L127: 829 | M127: 1024 | N127: 0 | O127: 8 | P127: 1 | Q127: -174 | R127: -131 | S127: 30 | T127: 36
A131: Test Case 9 - DDC Tuning
A132: Signal Generator
A133: RF Power | B133: IF Power | C133: RF Frequency | D133: IF Frequency | E133: Command | F133: Response | H133: Timeout | I133: Attempts | J133: Block Size | K133: RF Channel | L133: IF Channel | M133: # Samples | N133: Averaging | O133: Low Limit | P133: High Limit
A134: -40 | B134: -40 | C134: 876.2 | E134: TDOA 91# # # 1 63 -16 # 0 0 1 0 0 0 0 1 # 0 | F134: TDOA | H134: 5.0 | I134: 2 | J134: 256 | K134: 955 | M134: 1024 | N134: 1 | O134: 37.5 | P134: 9999
A136: -40 | B136: -40 | C136: 878.6 | E136: TDOA 92# # # 1 63 -16 # 0 0 1 0 0 0 0 1 # 0 | F136: TDOA | H136: 5.0 | I136: 2 | J136: 256 | K136: 967 | M136: 1024 | N136: 1 | O136: 37.5 | P136: 9999
A137: -40 | B137: -40 | C137: 881 | E137: TDOA 93# # # 1 63 -16 # 0 0 1 0 0 0 0 1 # 0 | F137: TDOA | H137: 5.0 | I137: 2 | J137: 256 | K137: 979 | M137: 1024 | N137: 1 | O137: 37.5 | P137: 9999
A138: -40 | B138: -40 | C138: 883.4 | E138: TDOA 94# # # 1 63 -16 # 0 0 1 0 0 0 0 1 # 0 | F138: TDOA | H138: 5.0 | I138: 2 | J138: 256 | K138: 991 | M138: 1024 | N138: 1 | O138: 37.5 | P138: 9999
A139: -40 | B139: -40 | C139: 885.8 | E139: TDOA 95# # # 1 63 -16 # 0 0 1 0 0 0 0 1 # 0 | F139: TDOA | H139: 5.0 | I139: 2 | J139: 256 | K139: 1003 | M139: 1024 | N139: 1 | O139: 37.5 | P139: 9999
A140: -40 | B140: -40 | C140: 888.2 | E140: TDOA 96# # # 1 63 -16 # 0 0 1 0 0 0 0 1 # 0 | F140: TDOA | H140: 5.0 | I140: 2 | J140: 256 | K140: 1015 | M140: 1024 | N140: 1 | O140: 37.5 | P140: 9999
A141: -40 | B141: -40 | C141: 890.6 | E141: TDOA 97# # # 1 63 -16 # 0 0 1 0 0 0 0 1 # 0 | F141: TDOA | H141: 5.0 | I141: 2 | J141: 256 | K141: 3 | M141: 1024 | N141: 1 | O141: 37.5 | P141: 9999
A142: -40 | B142: -40 | C142: 893 | E142: TDOA 98# # # 1 63 -16 # 0 0 1 0 0 0 0 1 # 0 | F142: TDOA | H142: 5.0 | I142: 2 | J142: 256 | K142: 15 | M142: 1024 | N142: 1 | O142: 37.5 | P142: 9999
A143: -40 | B143: -40 | C143: 895.4 | E143: TDOA 99# # # 1 63 -16 # 0 0 1 0 0 0 0 1 # 0 | F143: TDOA | H143: 5.0 | I143: 2 | J143: 256 | K143: 27 | M143: 1024 | N143: 1 | O143: 37.5 | P143: 9999
A144: -40 | B144: -40 | C144: 897.8 | E144: TDOA 90# # # 1 63 -16 # 0 0 1 0 0 0 0 1 # 0 | F144: TDOA | H144: 5.0 | I144: 2 | J144: 256 | K144: 39 | M144: 1024 | N144: 1 | O144: 37.5 | P144: 9999
A145: -40 | B145: -40 | C145: 900.2 | E145: TDOA 191# # # 1 63 -16 # 0 0 1 0 0 0 0 1 # 0 | F145: TDOA | H145: 5.0 | I145: 2 | J145: 256 | K145: 51 | M145: 1024 | N145: 1 | O145: 37.5 | P145: 9999
A146: -40 | B146: -40 | C146: 902.6 | E146: TDOA 192# # # 1 63 -16 # 0 0 1 0 0 0 0 1 # 0 | F146: TDOA | H146: 5.0 | I146: 2 | J146: 256 | K146: 63 | M146: 1024 | N146: 1 | O146: 37.5 | P146: 9999
A147: -40 | B147: -40 | C147: 905 | E147: TDOA 193# # # 1 63 -16 # 0 0 1 0 0 0 0 1 # 0 | F147: TDOA | H147: 5.0 | I147: 2 | J147: 256 | K147: 75 | M147: 1024 | N147: 1 | O147: 37.5 | P147: 9999
A148: -40 | B148: -40 | C148: 907.4 | E148: TDOA 194# # # 1 63 -16 # 0 0 1 0 0 0 0 1 # 0 | F148: TDOA | H148: 5.0 | I148: 2 | J148: 256 | K148: 87 | M148: 1024 | N148: 1 | O148: 37.5 | P148: 9999
A149: -40 | B149: -40 | C149: 909.8 | E149: TDOA 195# # # 1 63 -16 # 0 0 1 0 0 0 0 1 # 0 | F149: TDOA | H149: 5.0 | I149: 2 | J149: 256 | K149: 99 | M149: 1024 | N149: 1 | O149: 37.5 | P149: 9999
A150: -40 | B150: -40 | C150: 912.2 | E150: TDOA 196# # # 1 63 -16 # 0 0 1 0 0 0 0 1 # 0 | F150: TDOA | H150: 5.0 | I150: 2 | J150: 256 | K150: 111 | M150: 1024 | N150: 1 | O150: 37.5 | P150: 9999
A151: -40 | B151: -40 | C151: 914.8 | E151: TDOA 197# # # 1 63 -16 # 0 0 1 0 0 0 0 1 # 0 | F151: TDOA | H151: 5.0 | I151: 2 | J151: 256 | K151: 124 | M151: 1024 | N151: 1 | O151: 37.5 | P151: 9999
A155: Test Case 10 - T1
A156: Command Prior to 10 | B156: Response | D156: Timeout | E156: Begin State | F156: End State | G156: Attempts
A157: GoT1Master | D157: 3 | E157: DSHELL | F157: DSHELL | G157: 1
A158: RunLocalT1 500 100 | B158: Bad 0 | D158: 20 | E158: DSHELL | F158: DSHELL | G158: 1
A162: Command | B162: Response | D162: Timeout | E162: Begin State | F162: End State | G162: Attempts
A163: GOMASTER | D163: 3 | E163: DSHELL | F163: DSHELL | G163: 1
A164: RUNLOCALLOOP 500 100 | B164: Bad 0 | D164: 20 | E164: DSHELL | F164: DSHELL | G164: 1
A168: Test Case 11 - Ethernet
A169: Command | B169: Response | D169: Timeout | E169: Begin State | F169: End State | G169: Attempts
A170: ethtest | B170: ethtest | D170: 20 | E170: DSHELL | F170: DSHELL | G170: 1
A174: Test Case 12 - Mini-RLS
A175: Signal Generator | C175: LMU Command
A176: RF Power | B176: RF Frequency | C176: Command Set | G176: Block Size | H176: # Blocks | I176: RF Channel | J176: # Samples | K176: |delay| (nsec) | L176: Phase Curvature | M176: Repeat and Average
A177: -40 | B177: 824.2 | C177: CommandSequence12B | G177: 256 | H177: 4 | I177: 128 | J177: 1024 | K177: 150 | L177: 0.5 | M177: 5
A178: -40 | B178: 829 | C178: CommandSequence12B | G178: 256 | H178: 4 | I178: 152 | J178: 1024 | K178: 150 | L178: 0.5 | M178: 5
A179: -40 | B179: 834 | C179: CommandSequence12B | G179: 256 | H179: 4 | I179: 177 | J179: 1024 | K179: 150 | L179: 0.5 | M179: 5
A180: -40 | B180: 839 | C180: CommandSequence12B | G180: 256 | H180: 4 | I180: 202 | J180: 1024 | K180: 150 | L180: 0.5 | M180: 5
A181: -40 | B181: 844 | C181: CommandSequence12B | G181: 256 | H181: 4 | I181: 227 | J181: 1024 | K181: 150 | L181: 0.5 | M181: 5
A182: -40 | B182: 848.8 | C182: CommandSequence12B | G182: 256 | H182: 4 | I182: 251 | J182: 1024 | K182: 150 | L182: 0.5 | M182: 5
A183: -40 | B183: 824.04 | C183: CommandSequence12A | G183: 256 | H183: 4 | I183: 991 | J183: 1024 | K183: 150 | L183: 0.5 | M183: 5
A184: -40 | B184: 828.98999999999546 | C184: CommandSequence12A | G184: 256 | H184: 4 | I184: 133 | J184: 1024 | K184: 150 | L184: 0.5 | M184: 5
A185: -40 | B185: 833.99999999999091 | C185: CommandSequence12A | G185: 256 | H185: 4 | I185: 300 | J185: 1024 | K185: 150 | L185: 0.5 | M185: 5
A186: -40 | B186: 839.00999999998635 | C186: CommandSequence12A | G186: 256 | H186: 4 | I186: 467 | J186: 1024 | K186: 150 | L186: 0.5 | M186: 5
A187: -40 | B187: 844.01999999998179 | C187: CommandSequence12A | G187: 256 | H187: 4 | I187: 634 | J187: 1024 | K187: 150 | L187: 0.5 | M187: 5
A188: -40 | B188: 848.96999999997729 | C188: CommandSequence12A | G188: 256 | H188: 4 | I188: 799 | J188: 1024 | K188: 150 | L188: 0.5 | M188: 5
A191: Test Case 13 - Config Attenuator
A192: Signal Generator
A193: RF Power | B193: IF Power | C193: RF Frequency | D193: IF Frequency | E193: Command | F193: Response | H193: Timeout | I193: Attempts | J193: Block Size | K193: RF Channel | L193: IF Channel | M193: TTG Channel | N193: # Samples | O193: Cnfg Attn Setting | P193: Averaging | Q193: Low Limit from previous level (dBm) | R193: High Limit from previous level (dBm)
A194: -40 | B194: -40 | C194: 895.5 | D194: 68 | E194: TDOA 71# # # 1 63 -16 # 0 0 1 0 0 0 0 1 # 0 | F194: TDOA | H194: 5 | I194: 2 | J194: 256 | K194: 28 | L194: 183 | M194: 27 | N194: 1024 | O194: 0 | P194: 1 | Q194: -60 | R194: 0
A195: -40 | B195: -40 | C195: 895.5 | D195: 68 | E195: TDOA 72# # # 1 63 -16 # 0 0 1 0 0 0 0 1 # 0 | F195: TDOA | H195: 5 | I195: 2 | J195: 256 | K195: 28 | L195: 183 | M195: 27 | N195: 1024 | O195: -8 | P195: 1 | Q195: -10 | R195: -6
A196: -40 | B196: -40 | C196: 895.5 | D196: 68 | E196: TDOA 73# # # 1 63 -16 # 0 0 1 0 0 0 0 1 # 0 | F196: TDOA | H196: 5 | I196: 2 | J196: 256 | K196: 28 | L196: 183 | M196: 27 | N196: 1024 | O196: -10 | P196: 1 | Q196: -3.3 | R196: -0.7
A197: -40 | B197: -40 | C197: 895.5 | D197: 68 | E197: TDOA 74# # # 1 63 -16 # 0 0 1 0 0 0 0 1 # 0 | F197: TDOA | H197: 5 | I197: 2 | J197: 256 | K197: 28 | L197: 183 | M197: 27 | N197: 1024 | O197: 6 | P197: 1 | Q197: 13.5 | R197: 18.5
A198: -40 | B198: -40 | C198: 895.5 | D198: 68 | E198: TDOA 75# # # 1 63 -16 # 0 0 1 0 0 0 0 1 # 0 | F198: TDOA | H198: 5 | I198: 2 | J198: 256 | K198: 28 | L198: 183 | M198: 27 | N198: 1024 | O198: 2 | P198: 1 | Q198: -5.5 | R198: -2.5
A199: -40 | B199: -40 | C199: 895.5 | D199: 68 | E199: TDOA 76# # # 1 63 -16 # 0 0 1 0 0 0 0 1 # 0 | F199: TDOA | H199: 5 | I199: 2 | J199: 256 | K199: 28 | L199: 183 | M199: 27 | N199: 1024 | O199: 1 | P199: 1 | Q199: -2 | R199: 0
A203: LO PLL
A204: 756.0 MHz | D204: 766.5 MHz | G204: 778.0 MHz
A205: eng | D205: eng | G205: eng
A206: TEST 2 5 4 3 0x00 0x00 0x50 | D206: TEST 2 5 4 3 0x00 0x00 0xD3 | G206: TEST 2 5 4 3 0x00 0x00 0x50
A207: TEST 2 5 4 3 0x10 0x17 0xA1 | D207: TEST 2 5 4 3 0x00 0x00 0x50 | G207: TEST 2 5 4 3 0x10 0x18 0x51
A208: TEST 2 5 4 3 0x00 0x12 0xD3 | D208: TEST 2 5 4 3 0x10 0x17 0xF5 | G208: TEST 2 5 4 3 0x00 0x12 0xD3
A209: exit | D209: exit | G209: exit
A213: TTG Freq
A214: 836.5 MHZ | B214: Response | D214: Timeout | E214: Begin State | F214: End State | G214: Attempts
A215: eng | D215: 0.5 | E215: DSHELL | F215: ENG | G215: 1
A216: TEST 2 5 4 5 0x00 0x00 0xD3 | D216: 1 | E216: DSHELL | F216: ENG | G216: 1
A217: TEST 2 5 4 5 0x00 0x00 0x50 | D217: 1 | E217: DSHELL | F217: ENG | G217: 1
A218: TEST 2 5 4 5 0x00 0x1B 0xFD | D218: 1 | E218: DSHELL | F218: ENG | G218: 1
A219: exit | D219: 0.5 | E219: ENG | F219: DSHELL | G219: 1
A223: Gain Setup
A224: Setup | B224: Response | D224: Timeout | E224: Begin State | F224: End State | G224: Attempts
A225: gain 1 33 | D225: 0.5 | E225: DSHELL | F225: ENG | G225: 1
A226: gain 2 33 | D226: 0.5 | E226: DSHELL | F226: ENG | G226: 1
A227: gain 3 33 | D227: 0.5 | E227: DSHELL | F227: ENG | G227: 1
A228: gain 4 33 | D228: 0.5 | E228: DSHELL | F228: ENG | G228: 1
A229: gain 5 33 | D229: 0.5 | E229: DSHELL | F229: ENG | G229: 1
A230: gain 6 33 | D230: 0.5 | E230: DSHELL | F230: ENG | G230: 1
A233: Config Atten Setup
A234: Setup | B234: Response | D234: Timeout | E234: Begin State | F234: End State | G234: Attempts
A235: gain 1 25varGain | D235: 0.5 | E235: DSHELL | F235: ENG | G235: 1
A236: gain 2 25varGain | D236: 0.5 | E236: DSHELL | F236: ENG | G236: 1
A237: gain 3 25varGain | D237: 0.5 | E237: DSHELL | F237: ENG | G237: 1
A238: gain 4 25varGain | D238: 0.5 | E238: DSHELL | F238: ENG | G238: 1
A239: gain 5 25varGain | D239: 0.5 | E239: DSHELL | F239: ENG | G239: 1
A240: gain 6 25varGain | D240: 0.5 | E240: DSHELL | F240: ENG | G240: 1
A243: Data Path Settings
A244: Data Path 1 | D244: Timeout | E244: Begin State | F244: End State | G244: Attempts
A245: eng | D245: 0.5 | E245: DSHELL | F245: ENG | G245: 1
A246: Test 1 1 0 0 0 | D246: 0.5 | E246: ENG | F246: ENG | G246: 1
A247: exit | D247: 0.5 | E247: ENG | F247: DSHELL | G247: 1
A250: Data Path 2 | D250: Timeout | E250: Begin State | F250: End State | G250: Attempts
A251: eng | D251: 0.5 | E251: DSHELL | F251: ENG | G251: 1
A252: Test 1 0 1 0 0 | D252: 0.5 | E252: ENG | F252: ENG | G252: 1
A253: exit | D253: 0.5 | E253: ENG | F253: DSHELL | G253: 1
A256: Data Path 3 | D256: Timeout | E256: Begin State | F256: End State | G256: Attempts
A257: eng | D257: 0.5 | E257: DSHELL | F257: ENG | G257: 1
A258: Test 1 0 0 1 0 | D258: 0.5 | E258: ENG | F258: ENG | G258: 1
A259: exit | D259: 0.5 | E259: ENG | F259: DSHELL | G259: 1
A262: Data Path 4 | D262: Timeout | E262: Begin State | F262: End State | G262: Attempts
A263: eng | D263: 0.5 | E263: DSHELL | F263: ENG | G263: 1
A264: Test 1 0 0 0 1 | D264: 0.5 | E264: ENG | F264: ENG | G264: 1
A265: exit | D265: 0.5 | E265: ENG | F265: DSHELL | G265: 1
A268: Data Path 5 | D268: Timeout | E268: Begin State | F268: End State | G268: Attempts
A269: eng | D269: 0.5 | E269: DSHELL | F269: ENG | G269: 1
A270: Test 1 1 1 1 1 | D270: 0.5 | E270: ENG | F270: ENG | G270: 1
A271: exit | D271: 0.5 | E271: ENG | F271: DSHELL | G271: 1
A274: Compensation Settings
A275: Receiver compensated gain | D275: Timeout | E275: Begin State | F275: End State | G275: Attempts
A276: eng | D276: 0.5 | E276: DSHELL | F276: ENG | G276: 1
A277: Test 4 0xA4 0x48 6 | B277: DATA Read: | D277: 1 | E277: ENG | F277: ENG | G277: 1
A278: TEST 4 0xA4 0x1F 1 | B278: DATA Read: 41 | D278: 1 | E278: ENG | F278: ENG | G278: 1
A279: Test 4 0xA4 0x30 6 | B279: DATA Read: | D279: 1 | E279: ENG | F279: ENG | G279: 1
A280: exit | D280: 0.5 | E280: ENG | F280: DSHELL | G280: 1
A283: TTG compensated Level | D283: Timeout | E283: Begin State | F283: End State | G283: Attempts
A284: eng | D284: 0.5 | E284: DSHELL | F284: ENG | G284: 1
A285: Test 4 0xA4 0x42 6 | B285: DATA Read: | D285: 1 | E285: ENG | F285: ENG | G285: 1
A286: TEST 4 0xA4 0x1F 1 | B286: DATA Read: 41 | D286: 1 | E286: ENG | F286: ENG | G286: 1 | H286: Note: | I286: If we get DATA Read: 41, then the software will skip
A287: Test 4 0xA4 0x2A 6 | B287: DATA Read: | D287: 1 | E287: ENG | F287: ENG | G287: 1 | I287: over the next line and go directly to exit
A288: exit | D288: 0.5 | E288: ENG | F288: DSHELL | G288: 1
A291: Receiver Gain Compensation | D291: Timeout | E291: Begin State | F291: End State | G291: Attempts
A292: eng | D292: 0.5 | E292: DSHELL | F292: ENG | G292: 1
A293: TEST 4 0xA4 0x1F 1 | B293: DATA Read: 41 | D293: 0.5 | E293: ENG | F293: ENG | G293: 1
A294: Test 4 0xA4 0x20 6 | B294: DATA Read: | D294: 0.5 | E294: ENG | F294: ENG | G294: 1
A295: exit | D295: 0.5 | E295: ENG | F295: DSHELL | G295: 1
A298: EnableTTG | B298: Response | D298: Timeout | E298: Begin State | F298: End State | G298: Attempts
A299: eng | D299: 0.5 | E299: DSHELL | F299: ENG | G299: 1
A300: TEST 2 3 8 6 8 | D300: 0.5 | E300: ENG | F300: ENG | G300: 1
A301: TEST 2 3 4 4 5 | D301: 0.5 | E301: ENG | F301: ENG | G301: 1
A302: TEST 2 3 4 6 1 | D302: 0.5 | E302: ENG | F302: ENG | G302: 1
A303: exit | D303: 0.5 | E303: ENG | F303: DSHELL | G303: 1
A306: DisableTTG | D306: Timeout | E306: Begin State | F306: End State | G306: Attempts
A307: eng | D307: 0.5 | E307: DSHELL | F307: ENG | G307: 1
A308: TEST 2 3 8 6 5 | D308: 0.5 | E308: ENG | F308: ENG | G308: 1
A309: TEST 2 3 4 4 1 | D309: 0.5 | E309: ENG | F309: ENG | G309: 1
A310: TEST 2 3 4 6 0 | D310: 0.5 | E310: ENG | F310: ENG | G310: 1
A311: exit | D311: 0.5 | E311: ENG | F311: DSHELL | G311: 1
A314: Mute On | D314: Timeout | E314: Begin State | F314: End State | G314: Attempts
A315: eng | D315: 0.5 | E315: DSHELL | F315: ENG | G315: 1
A316: TEST 2 3 8 6 8 | D316: 0.5 | E316: ENG | F316: ENG | G316: 1
A317: exit | D317: 0.5 | E317: ENG | F317: DSHELL | G317: 1
A320: Mute Off | D320: Timeout | E320: Begin State | F320: End State | G320: Attempts
A321: eng | D321: 0.5 | E321: DSHELL | F321: ENG | G321: 1
A322: TEST 2 3 8 6 5 | D322: 0.5 | E322: ENG | F322: ENG | G322: 1
A323: exit | D323: 0.5 | E323: ENG | F323: DSHELL | G323: 1
A326: Change Admin State
A327: Command | B327: Response | D327: Timeout | E327: Begin State | F327: End State | G327: # of retries
A328: etest 15 1 | D328: 2 | E328: DSHELL | F328: DSHELL | G328: 1
A332: Check Alarms
A333: Command | B333: Response | D333: Timeout | E333: Begin State | F333: End State | G333: # of retries
A334: ALARMS | B334: FAULT_GPS_HOLDOVER | D334: 2 | E334: DSHELL | F334: DSHELL | G334: 1
A338: Mini-RLS Command Sequence 12A (AMPS)
A339: Command | B339: Response | D339: Timeout | E339: Begin State | F339: End State | G339: # of retries
A340: ALARMS | B340: FAULT_GPS_HOLDOVER | D340: 2 | E340: DSHELL | F340: DSHELL | G340: 1
A341: TIME | B341: GPS Time: | D341: 2 | E341: DSHELL | F341: DSHELL | G341: 2
A342: SVCR # # 2 # # 0 1 0 0 0 1 1 1 # 0 0 | B342: returnCode 0 | D342: 2 | E342: DSHELL | F342: DSHELL | G342: 1
A343: WAIT | D343: 15 | E343: DSHELL | F343: DSHELL | G343: 1
A344: TDATA # 0 2 # # # -16 0 1 0 0 11 0 63 -16 | B344: TDOA | D344: 15 | E344: DSHELL | F344: DSHELL | G344: 1
A348: Mini-RLS Command Sequence 12B (GSM)
A349: Command | B349: Response | D349: Timeout | E349: Begin State | F349: End State | G349: # of retries
A350: ALARMS | B350: FAULT_GPS_HOLDOVER | D350: 2 | E350: DSHELL | F350: DSHELL | G350: 1
A351: TIME | B351: GPS Time: | D351: 2 | E351: DSHELL | F351: DSHELL | G351: 2
A352: GVCR # 2 # # 0 # 0 # # 17 1 0 0 0 0 0 0 1 1 1 8 0 0 0 0 0 0 0 0 0 0 0 | B352: returnCode 0 | D352: 2 | E352: DSHELL | F352: DSHELL | G352: 1
A353: WAIT | D353: 15 | E353: DSHELL | F353: DSHELL | G353: 1
A354: TDATA # 0 2 # # # -16 0 1 0 0 11 0 63 -16 | B354: TDOA | D354: 15 | E354: DSHELL | F354: DSHELL | G354: 1

Sheet: Matching
B3: UUT HW Configuration | C3: Compatible Golden HW Configuration
B4: 160400 | C4: 160400 160401 160900 160901 162300 162301 164200 164201
B5: 160401 | C5: 160400 160401 160900 160901 162300 162301 164200 164201
B6: 160500 | C6: 160500 160501 162700 162701 163600 163601
B7: 160501 | C7: 160500 160501 162700 162701 163600 163601
B8: 160900 | C8: 160900 160400 160401 162300 164200
B9: 160901 | C9: 160901 160400 160401 162301 164201
B10: 162300 | C10: 162300 160400 160401 160900 164200
B11: 162301 | C11: 162301 160400 160401 160901 164201
B12: 162700 | C12: 162700 160500 160501 163600
B13: 162701 | C13: 162701 160500 160501 163601
B14: 163600 | C14: 163600 160500 160501 162700
B15: 163601 | C15: 163601 160500 160501 162701
B16: 163900 | C16: 163900
B17: 163901 | C17: 163901
B18: 164000 | C18: 164000
B19: 164001 | C19: 164001